{"title": "Medicina nuclear general", "author": "Radiological Society; American College", "url": "https://www.radiologyinfo.org/es/info/gennuclear", "hostname": "radiologyinfo.org", "description": "Informaci\u00f3n precisa y actualizada para pacientes sobre medicina nuclear general. Averig\u00fce qu\u00e9 puede sentir, c\u00f3mo prepararse para el examen, cu\u00e1les son los beneficios y los riesgos, y m\u00e1s.", "sitename": "Radiologyinfo.org", "date": "2022-07-06", "id": null, "license": null, "body": null, "comments": "", "commentsbody": null, "raw_text": null, "text": "Medicina nuclear general\n[\u00bfEn qu\u00e9 consiste la medicina nuclear general?](#599311674b6043f7b0e5bc45edfa2cef) [\u00bfCu\u00e1les son algunos de los usos comunes de este procedimiento?](#d97e3ed542c04f69a74378eb239bf01e) [\u00bfC\u00f3mo debo prepararme?](#5b79716527b94cbeb6a4c05f31854146) [\u00bfC\u00f3mo es el equipo?](#e9645fc05e314b6999472560043add82) [\u00bfC\u00f3mo es el procedimiento?](#fdade9aa7d6248bbb5c91fe77ddb760b) [\u00bfC\u00f3mo se lleva?](#33b9d51a78ee403c9bce9abb5c11bad0) [\u00bfQu\u00e9 experimentar\u00e9 durante y despu\u00e9s del procedimiento?](#5af96917b48b423f8d4ae5ffaac8c2f3) [\u00bfQui\u00e9n interpreta los resultados y c\u00f3mo los obtengo?](#3b79d142bb854064ae4b325fd206ae87) [\u00bfCu\u00e1les son los beneficios y los riesgos?](#297312d5a8494dc7ab272da9ee34c6ce) [\u00bfCu\u00e1les son las limitaciones de la medicina nuclear general?](#8638f2bf6500470b80baa09121e85dfe)\n\u00bfEn qu\u00e9 consiste la medicina nuclear general?\nLa medicina nuclear utiliza peque\u00f1as cantidades de material\n[radioactivo](https://www.radiologyinfo.org/glossary?modal=1&id=ezY5NUNDRDA0LTg5MUUtNDg5MS1CRDlFLUQ4QTRGN0NFNEIzRn0=) combinado con una mol\u00e9cula transportadora. Este compuesto se denomina [radiosonda](https://www.radiologyinfo.org/glossary?modal=1&id=e0UwNzg5NTYzLUI1MTctNEEyRi04MDhDLTlCREZCMEIxQThFMX0=) o [radiof\u00e1rmaco](https://www.radiologyinfo.org/glossary?modal=1&id=ezRFRDg4NERGLTg1Q0UtNEUyQS1CMEVBLUU3NzgzMkU2OUJGNX0=). Los m\u00e9dicos utilizan los ex\u00e1menes de medicina nuclear para diagnosticar, evaluar y tratar varias enfermedades. Estas enfermedades incluyen c\u00e1ncer, enfermedades del coraz\u00f3n, [gastrointestinales](https://www.radiologyinfo.org/glossary?modal=1&id=e0VCMTE2MDk3LUY3MUMtNDc4Ri1BODM4LTM2NzJGNkEzN0MwMX0=), [endocrinas](https://www.radiologyinfo.org/glossary?modal=1&id=ezU2NkM5MENGLUM4NzUtNEE0OS1COEVFLTBFRkE0NzhENDVBNn0=), o [neurol\u00f3gicas](https://www.radiologyinfo.org/glossary?modal=1&id=e0VBNTMxNUQzLTk0QzEtNDMxNC1CMUFGLTIzMTAzRjVFNzVCM30=).\nLa medicina nuclear determina como el cuerpo est\u00e1 funcionando a nivel celular. Puede:\n- encontrar enfermedades en sus etapas tempranas\n- aplicar un tratamiento a c\u00e9lulas espec\u00edficas\n- monitorear la respuesta a un tratamiento\nDiagn\u00f3stico\nLos ex\u00e1menes por medicina nuclear utilizan una peque\u00f1a cantidad de\n[material radioactivo](https://www.radiologyinfo.org/glossary?modal=1&id=ezM5RUZDRTg0LTkwQUQtNDMzOS1BQjhDLTVFRDZBNDEyNTRGMH0=) combinado con una mol\u00e9cula transportadora. Este compuesto de denomina radiosonda. Estos ex\u00e1menes ayudan a diagnosticar y evaluar condiciones m\u00e9dicas. No son invasivos y, por lo general, no causan dolor.\nCuando la radiosonda es inyectada en el cuerpo se acumula en ciertas \u00e1reas del cuerpo. Las radiosondas van al \u00e1rea del cuerpo que necesita ser examinada, como por ejemplo un tumor canceroso o un \u00e1rea inflamada. Tambi\u00e9n se puede unir a ciertas prote\u00ednas en el cuerpo.\nLas radiosondas m\u00e1s comunes son la 18F-fluoro-2-deoxi-d-glucosa (FDG). Es simplemente una de las tantas radiosondas en uso o en desarrollo. La FDG es un compuesto similar a la\n[glucosa](https://www.radiologyinfo.org/glossary?modal=1&id=e0M2M0Q4QzRBLUMzRDYtNEQwNy04MjE3LUFGRUZCMTkxN0IzM30=), o az\u00facar. Las c\u00e9lulas cancerosas altamente activas necesitan m\u00e1s energ\u00eda que las c\u00e9lulas normales. Como resultado, absorben m\u00e1s glucosa. Un aparato para tomar im\u00e1genes que detecta la energ\u00eda entregada por la FDG crea im\u00e1genes que muestran la ubicaci\u00f3n de la radiosonda en el cuerpo.\nLas radiosondas se administran generalmente v\u00eda inyecci\u00f3n, pero tambi\u00e9n pueden ser tragadas o inhaladas.\nTerapia\nLa terapia con medicina nuclear utiliza una peque\u00f1a cantidad de material radioactivo combinado con una mol\u00e9cula transportadora. Esta se denomina radiof\u00e1rmaco. Las terapias con medicina nuclear se usan para tratar el c\u00e1ncer y otras condiciones. Los radiof\u00e1rmacos se unen a c\u00e9lulas espec\u00edficas y luego emiten altas dosis de radiaci\u00f3n, destruyendo as\u00ed las c\u00e9lulas.\n\u00bfCu\u00e1les son algunos de los usos comunes de este procedimiento?\nIm\u00e1genes\nLos m\u00e9dicos utilizan los procedimientos de medicina nuclear para ver qu\u00e9 es lo que est\u00e1 sucediendo a nivel celular y para entender mejor c\u00f3mo funciona el cuerpo.\nEn adultos, los m\u00e9dicos utilizan la medicina nuclear para:\nCoraz\u00f3n\n- ver el flujo y la funci\u00f3n sangu\u00ednea (tales como el\n[estudio de perfusi\u00f3n mioc\u00e1rdica](https://www.radiologyinfo.org/glossary?modal=1&id=ezM1OEFFMDk3LTM5MUMtNDAzMi05Q0VGLTIzRkQ0MkQ1ODQ2Nn0=))\n- detectar\n[enfermedades del coraz\u00f3n](https://www.radiologyinfo.org/glossary?modal=1&id=ezQyNEYzNjZBLTQ1RkItNDI4Ri05N0QyLUJGNjkyRDAzQzc4Nn0=)y la extensi\u00f3n de la [estenosis](https://www.radiologyinfo.org/glossary?modal=1&id=e0ZCNUMxNzdFLUYxQkUtNENFRC1BQjQzLTg4NzcwMzlENjVDMX0=)\n- evaluar el da\u00f1o en el coraz\u00f3n luego de un ataque card\u00edaco\n- evaluar opciones de tratamiento tales como la cirug\u00eda de baip\u00e1s card\u00edaco y la\n[angioplastia](https://www.radiologyinfo.org/glossary?modal=1&id=ezIwRjg0QThDLUUzRjgtNDg5Ri05NTMwLTRBOTkyOEQ4MzUyRn0=)\n- evaluar los resultados de los procedimientos de revascularizaci\u00f3n\n- evaluar la presencia de rechazo luego de un trasplante\n- evaluar la funci\u00f3n del coraz\u00f3n antes y despu\u00e9s de la quimioterapia (MUGA)\nPulmones\n- evaluar problemas de respiraci\u00f3n y del flujo sangu\u00edneo\n- evaluar la funci\u00f3n de los pulmones luego de la cirug\u00eda\n- evaluar la presencia de rechazo del trasplante de pulm\u00f3n\nHuesos\n- evaluar la presencia de fracturas, artritis, e infecci\u00f3n en los huesos\n- evaluar la met\u00e1stasis en los huesos, las articulaciones prost\u00e9ticas, y los tumores en el hueso\n- visualizar los sitios de\n[biopsia](https://www.radiologyinfo.org/glossary?modal=1&id=ezREMDYyQkU2LTNDNDItNDMzNS05NjdELURDQkZGODNFRUEwRn0=)\nCerebro\n- investigar anormalidades en pacientes con convulsiones, perdida de la memoria, y problemas con el flujo sangu\u00edneo.\n- detectar de forma temprana las enfermedades\n[neurol\u00f3gicas](https://www.radiologyinfo.org/glossary?modal=1&id=e0VBNTMxNUQzLTk0QzEtNDMxNC1CMUFGLTIzMTAzRjVFNzVCM30=)tales como la [enfermedad de Alzheimer](https://www.radiologyinfo.org/es/info/alzheimers)\n- asistir en el planeamiento de cirug\u00eda y radiaci\u00f3n\n- identificar \u00e1reas del cerebro que podr\u00edan causar convulsiones\n- evaluar anormalidades en pacientes de los que se sospecha tienen enfermedad de Parkinson u otras enfermedades que afectan el movimiento\n- evaluar la presencia de un tumor recurrente\n- encontrar sitios para biopsias\nOtros sistemas del cuerpo\n- buscar inflamaci\u00f3n o funci\u00f3n anormal de la vejiga\n- buscar sangrado en el\n[intestino](https://www.radiologyinfo.org/glossary?modal=1&id=e0Y0MkFBNTBFLUM2NjYtNEEyNS1CQkVCLTQ1OTU0RTQ3NUE5N30=)\n- evaluar complicaciones luego de la cirug\u00eda de vejiga\n- evaluar la hinchaz\u00f3n causada por la acumulaci\u00f3n de l\u00edquido linf\u00e1tico (linfedema)\n- encontrar la causa de una fiebre sin explicaci\u00f3n\n- encontrar una infecci\u00f3n\n- medir la funci\u00f3n tiroidea\n- ayudar a diagnosticar trastornos de la sangre\n- evaluar c\u00f3mo se vac\u00eda el estomago\n- evaluar el flujo del l\u00edquido cefalorraqu\u00eddeo para encontrar p\u00e9rdidas\nEn los adultos y en los ni\u00f1os, la medicina nuclear se usa para:\nC\u00e1ncer\n- determinar el estadio del c\u00e1ncer\n- ver si el c\u00e1ncer se ha diseminado\n- encontrar el ganglio linf\u00e1tico m\u00e1s cercano a un tumor (centinela)\n- planear un tratamiento\n- evaluar c\u00f3mo est\u00e1 respondiendo el c\u00e1ncer a la terapia\n- evaluar la presencia de c\u00e1ncer recurrente\n- detectar tumores raros del p\u00e1ncreas y de las gl\u00e1ndulas adrenales\nRi\u00f1ones\n- analizar el flujo sangu\u00edneo y la funci\u00f3n de los ri\u00f1ones\n- detectar bloqueos en el tracto\n[urinario](https://www.radiologyinfo.org/glossary?modal=1&id=ezQ4MkI1RkZBLUJDMkQtNEJGMy1BNURGLUQ5MTE0ODhENDVDQX0=)\n- evaluar la presi\u00f3n arterial alta (hipertensi\u00f3n) en las arterias de los ri\u00f1ones\n- buscar una infecci\u00f3n en el ri\u00f1\u00f3n\n- evaluar el flujo anormal de la oarina (reflujo)\nEn los ni\u00f1os la medina nuclear tambi\u00e9n se usa para:\n- investigar anormalidades en el\n[es\u00f3fago](https://www.radiologyinfo.org/glossary?modal=1&id=ezRBOUE5NzYzLTFENzYtNEE0Qi04NTkwLUMyMjRGQjRFOEE4NX0=)\n- evaluar fisuras en ductos\n- evaluar derivaciones en el cerebro\n- evaluar el flujo sangu\u00edneo en pacientes con enfermedad cong\u00e9nita del coraz\u00f3n\nTerapia\nLos m\u00e9dicos utilizan la medicina nuclear para administrar peque\u00f1as cantidades de material radioactivo a \u00e1reas espec\u00edficas del cuerpo. Los m\u00e9dicos utilizan la medicina para tratar el c\u00e1ncer u otras condiciones incluyendo:\n- linfoma de c\u00e9lulas B Non-Hodgkin\u2019s, c\u00e1ncer de h\u00edgado y enfermedad metast\u00e1tica predominante del h\u00edgado\n- c\u00e1ncer de tiroides e\n[hipertiroidismo](https://www.radiologyinfo.org/glossary?modal=1&id=ezIwQUIwMzM2LTdENDgtNDU4Ni05NDBELTVFRUYyRkQ1MTZBRH0=)\n- tumores neuroendocrinos, incluyendo paragangliomas y feocromocitomas\n- tumores neuroendocrinos avanzados que afectan el tracto digestivo (GEP-NETs)\n[met\u00e1stasis en los huesos](https://www.radiologyinfo.org/glossary?modal=1&id=e0MyMTRENEZBLTRFNUUtNDdDNS04NjBDLTA4MTc3NEM0QUZDM30=)que causan dolor\n- neuroblastoma en ni\u00f1os\nLos tratamientos de medicina nuclear (tambi\u00e9n denominados terapias de radion\u00faclidos) incluyen:\n- Terapia con\n[iodo radioactivo (I-131)](https://www.radiologyinfo.org/glossary?modal=1&id=ezJCQkFDMjg5LUIxNTAtNENEOS04MzE3LTc3NkI1OTY0RkZBNH0=)para tratar el c\u00e1ncer de tiroides y el hipertiroidismo\n- I-131 MIBG (meta-iodo-bencil-guanidina marcada con iodo radioactivo) para tartar tumores neuroendocrinos, incluyendo paragangliomas y feocromocitomas, y neuroblastoma en ni\u00f1os.\n- Lu-177 dotatate (Lutathera\u00ae) para tratar pacientes adultos con tumores neuroendocrinos avanzados que afectan el tracto digestivo, conocidos como GEP-NETs. Tambi\u00e9n denominada terapia con p\u00e9ptido receptor radion\u00faclido (PRRT).\n- Dicloruro de radio-223, samario-153 lexidronam, y cloruro de estroncio-89 para tratar met\u00e1stasis en los huesos.\n- Radioimmunotherapia (RIT). En la RIT, se produce en el laboratorio un anticuerpo monoclonal que puede reconocer y unirse a las c\u00e9lulas cancerosas.\n- El itrio-90 Ibritumomab Tiuxetan (\n[Zevalin](https://www.radiologyinfo.org/glossary?modal=1&id=ezRCRkExRjhBLTBERDUtNEY5RS05MENDLUFDQzE1NkVGRkQ2OX0=)\u00ae) trata el [l](/glossary?modal=1&id=ezE3NzRDRDM4LTY5MDMtNDgzRS1CMzgxLUFEQjFCMDQ3NzBDOH0=) [infoma de c\u00e9lulas B non-Hodgkin](https://www.radiologyinfo.org/glossary?modal=1&id=ezE3NzRDRDM4LTY5MDMtNDgzRS1CMzgxLUFEQjFCMDQ3NzBDOH0=)(NHL) en pacientes diagnosticados por primera vez y en pacientes que no han respondido a la quimioterapia o al tratamiento con el anticuerpo monoclonal [Rituximab](https://www.radiologyinfo.org/glossary?modal=1&id=ezY0RkZDNTQ1LUI1MDUtNENDQi05MUJFLTIwNzU4MjQ2QkY4Q30=)\u00ae y otros subtipos de [lymphoma](https://www.radiologyinfo.org/glossary?modal=1&id=ezMzMkE0QTc3LTI2MTMtNDUyMS1CMjVCLTAyMTIyQkU2RUFCMn0=). Varios agentes nuevos de radio inmunoterapia se encuentran en desarrollo o en estudios cl\u00ednicos. Vea la p\u00e1gina de [radio inmunoterapia (RIT)](https://www.radiologyinfo.org/es/info/radio-immuno)para m\u00e1s informaci\u00f3n.\n- El itrio-90 Ibritumomab Tiuxetan (\n\u00bfC\u00f3mo debo prepararme?\nIm\u00e1genes\nPodr\u00eda tener que ponerse una bata, o el tecn\u00f3logo podr\u00eda dejarle llevar puesta su ropa durante el examen.\nLas mujeres siempre deber\u00edan decirle al m\u00e9dico y al tecn\u00f3logo si est\u00e1n embarazadas o amamantando. Vea la p\u00e1gina sobre\n[Seguridad de la radiaci\u00f3n](https://www.radiologyinfo.org/es/info/safety-radiation#843487c12b3e453f9bf021f34e5a90b0) para m\u00e1s informaci\u00f3n sobre embarazo y amamantamiento en relaci\u00f3n con la toma de im\u00e1genes de medicina nuclear.\nHable con su m\u00e9dico y su tecn\u00f3logo sobre cualquier medicamento que este tomando, incluyendo vitaminas y suplementos de hierbas. Haga una lista de las alergias, enfermedades recientes, y otras condiciones m\u00e9dicas.\nDeje joyas y accesorios en su casa, o qu\u00edteselos antes del examen. Estos objetos pueden interferir con el procedimiento.\nSu m\u00e9dico le indicar\u00e1 como prepararse para su examen espec\u00edfico.\nEn algunas instancias, ciertos medicamentos o procedimientos podr\u00edan interferir con los ex\u00e1menes ordenados. Vea la p\u00e1gina sobre\n[terapia con iodo radioactivo (I-131)](https://www.radiologyinfo.org/es/info/radioiodine) para instrucciones sobre c\u00f3mo prepararse para el procedimiento.\n\u00bfC\u00f3mo es el equipo?\nIm\u00e1genes\nSu m\u00e9dico utilizar\u00e1 uno de estos aparatos de toma de im\u00e1genes para su examen de medicina nuclear.\nC\u00e1mara gamma\nLa c\u00e1mara gamma detecta la energ\u00eda de la radiosonda en su cuerpo y la convierte en una imagen. La c\u00e1mara gamma en s\u00ed misma no emite radiaci\u00f3n. Tiene detectores de radiaci\u00f3n denominados cabezas de c\u00e1mara gamma. Generalmente tienen la forma de una caja y, unido, tienen un gantry con forma de anillo. El paciente yace sobre la camilla de examen que se desliza entre las dos cabezas de la c\u00e1mara gamma que se encuentra por encima y por debajo del paciente. Algunas veces, el m\u00e9dico colocar\u00e1 las cabezas de la c\u00e1mara gamma en un \u00e1ngulo de 90 grados sobre el cuerpo del paciente.\nSPECT\nEn la SPECT, las cabezas de la c\u00e1mara gamma rotan alrededor del cuerpo del paciente para producir im\u00e1genes altamente detalladas en 3D.\nPET\nUn explorador PET es una m\u00e1quina grande con un agujero en forma de anillo en el medio. Parece una unidad de TC o una de RMN. Varios anillos adentro de la m\u00e1quina detectan la energ\u00eda de la radiosonda en su cuerpo. Una computadora convierte esos datos en im\u00e1genes.\nFusi\u00f3n de im\u00e1genes\nMuchos centros de im\u00e1genes combinan las im\u00e1genes de medicina nuclear con la\n[tomograf\u00eda computarizada (TC)](https://www.radiologyinfo.org/glossary?modal=1&id=e0M0NUEzQkE5LTlEREUtNEFEOS1BODg2LUM4NzFFODUyQzlENH0=) o la [resonancia magn\u00e9tica nuclear (RMN)](https://www.radiologyinfo.org/glossary?modal=1&id=e0RCRUZCRjZGLTA5RkEtNDE3NC1BMjgyLTg0REU3RDczMTNBRX0=) para crear vistas especiales. Los m\u00e9dicos denominan esto fusi\u00f3n de im\u00e1genes o co-registraci\u00f3n. La fusi\u00f3n de im\u00e1genes le permite a los m\u00e9dicos ver la informaci\u00f3n de dos ex\u00e1menes diferentes en una imagen. Esto lleva a una informaci\u00f3n m\u00e1s precisa y a un diagn\u00f3stico m\u00e1s exacto. Las unidades de tomograf\u00eda por emisi\u00f3n de fot\u00f3n simple (SPECT/CT) y la de emisi\u00f3n de positrones (PET/CT) pueden hacer ambas, la toma de im\u00e1genes por TC y ex\u00e1menes de medicina nuclear al mismo tiempo. La PET/MRI es una tecnolog\u00eda emergente se encuentra disponible solamente en algunos centros.\n\u00bfC\u00f3mo es el procedimiento?\nIm\u00e1genes\nLa medicina nuclear introduce una radiosonda adentro del cuerpo. Las radiosondas se acumulan en \u00f3rganos espec\u00edficos o se unen a ciertas c\u00e9lulas en el cuerpo.\nSu m\u00e9dico, por lo general, inyectar\u00e1 la radiosonda adentro de su torrente sangu\u00edneo. Tambi\u00e9n podr\u00eda tragarlo o inhalarlo en forma de gas. La radiosonda se acumula en el \u00e1rea bajo examinaci\u00f3n, entregando energ\u00eda. Aparatos de toma de im\u00e1genes, tales como la\n[c\u00e1mara gamma](https://www.radiologyinfo.org/glossary?modal=1&id=ezZBRTcyOTNDLTVGMTctNDRBRC1BNjIyLUE3MThDNEM4OTUzOX0=), el [SPECT](https://www.radiologyinfo.org/glossary?modal=1&id=e0VBODQ4MTA4LUEwQkMtNDAxMi05RDQ2LTI3MTY1QjAzNEYwMX0=), y la [PET](https://www.radiologyinfo.org/glossary?modal=1&id=e0Q3ODhFRThFLTg4RjUtNDAxRi1CN0QxLTIwODk5NjA2OEU2Mn0=), detectan esta energ\u00eda y, con la ayuda de una computadora, crean im\u00e1genes. Estas im\u00e1genes muestran como sus \u00f3rganos y tejidos est\u00e1n funcionando a nivel celular.\nLa medicina nuclear se focaliza en procesos internos del cuerpo, tales como el metabolismo. Las radiosondas se concentran en \u00e1reas espec\u00edficas del cuerpo denominadas \u201cpuntos calientes\u201d. Los puntos calientes se forman adonde existen muchas substancias qu\u00edmicas o actividad metab\u00f3lica. Los \u201cpuntos fr\u00edos\u201d indican una concentraci\u00f3n m\u00e1s peque\u00f1a de radiosonda y menos actividad.\nTerapia\nUna peque\u00f1a cantidad de material radioactivo se une a una mol\u00e9cula que tiene la capacidad de unirse a una c\u00e9lula. Este compuesto se denomina radiof\u00e1rmaco. Usted se tragar\u00e1, o le inyectar\u00e1n, el radiof\u00e1rmaco. El radiof\u00e1rmaco viaja a las c\u00e9lulas del \u00e1rea o \u00e1reas blanco del tratamiento. Las c\u00e9lulas blanco reciben una alta dosis de radiaci\u00f3n que las destruye.\n\u00bfC\u00f3mo se lleva?\nIm\u00e1genes\nLos ex\u00e1menes de medicina nuclear se hacen de forma ambulatoria. Tambi\u00e9n le podr\u00edan hacer un examen mientras se encuentra internado.\nYacer\u00e1 en la camilla de examinaci\u00f3n. Un enfermero o un tecn\u00f3logo le insertar\u00e1 un cat\u00e9ter intravenoso (IV) adentro de una vena en su brazo o mano.\nLe dar\u00e1n una inyecci\u00f3n de la radiosonda. O podr\u00eda tener que tragarla o inhalarla en forma de gas.\nLa radiosonda viajar\u00e1 a trav\u00e9s de su cuerpo y se acumular\u00e1 en el \u00e1rea de su cuerpo que est\u00e1 siendo estudiada. Esto podr\u00eda llevar desde varios segundos hasta varios d\u00edas. Su m\u00e9dico le dir\u00e1 cu\u00e1ndo comenzar\u00e1 la toma de im\u00e1genes y cu\u00e1nto tiempo llevar\u00e1 el procedimiento.\nCuando la toma de im\u00e1genes comience, la c\u00e1mara o el esc\u00e1ner tomar\u00e1 una serie de im\u00e1genes. La c\u00e1mara podr\u00eda rotar alrededor suyo o permanecer en una posici\u00f3n. Usted podr\u00eda tener que cambiar de posici\u00f3n durante el examen. Tendr\u00e1 que quedarse inm\u00f3vil durante cortos periodos. En algunos casos, la c\u00e1mara podr\u00eda moverse muy cerca de su cuerpo. Esto es necesario para obtener im\u00e1genes de la mejor calidad. Hable con su tecn\u00f3logo si a usted le dan miedo a los espacios confinados.\nPodr\u00edan hacerle ex\u00e1menes para medir los niveles de radioactividad en su sangre, orina, o aliento. Un tecn\u00f3logo podr\u00eda pasar sobre su cuerpo una peque\u00f1a sonda de mano.\nEl tiempo que lleva la toma de im\u00e1genes de medicina nuclear puede variar. La toma de im\u00e1genes en si misma varia desde 20 minutos hasta varias horas. Sus ex\u00e1menes podr\u00edan hacerse durante un periodo de varios d\u00edas.\nLos ni\u00f1os peque\u00f1os podr\u00edan tener que ser envueltos levemente o sedados para que se mantengan inm\u00f3viles. Si se usa sedaci\u00f3n durante el examen, le dir\u00e1n si puede darle de comer a su ni\u00f1o el d\u00eda del examen. Un m\u00e9dico o un enfermero especializado en anestesia pedi\u00e1trica se encargar\u00e1 de la seguridad de su ni\u00f1o durante la sedaci\u00f3n. Cuando pida un turno para un ni\u00f1o joven, pregunte si habr\u00e1 un especialista en ni\u00f1os disponible. El especialista en ni\u00f1os est\u00e1 entrenado para hacer que su ni\u00f1o se sienta c\u00f3modo y menos ansioso sin sedaci\u00f3n. Este especialista tambi\u00e9n ayudar\u00e1 a su ni\u00f1o a permanecer inm\u00f3vil durante el examen.\nLuego del examen, podr\u00eda tener que esperar para asegurarse de que no se necesiten m\u00e1s im\u00e1genes.\nSi le instalan una l\u00ednea intravenosa (IV) para el procedimiento, su tecn\u00f3logo se la quitar\u00e1. Si usted tiene un turno para otro procedimiento ese mismo d\u00eda, le dejar\u00e1n la IV colocada.\nTerapia\n[Terapia de iodo radioactivo (I-131) para el hipertiroidismo](https://www.radiologyinfo.org/es/info/radioiodine)\nEl iodo radioactivo I-131 se traga en una sola capsula o en una dosis l\u00edquida y es absorbido r\u00e1pidamente hacia el flujo sangu\u00edneo en el tracto gastrointestinal (GI). Se concentra en la gl\u00e1ndula tiroides, adonde comienza a destruir las c\u00e9lulas de la gl\u00e1ndula. La radioactividad en la tiroides se reducir\u00e1 gradualmente durante los siguientes d\u00edas. Usted obtendr\u00e1 el beneficio m\u00e1ximo de este tratamiento entre los tres a seis meses luego del tratamiento. Generalmente, una sola dosis es suficiente para un tratamiento exitosos del hipertiroidismo. Un segundo y un tercer tratamiento podr\u00edan ser necesarios, pero es muy raro.\n[Terapia con iodo radioactivo (I-131) para el c\u00e1ncer de tiroides](https://www.radiologyinfo.org/es/info/thyroid-cancer-treatment)\nLa mayor\u00eda de los c\u00e1nceres de la tiroides se tratan mediante la extirpaci\u00f3n quir\u00fargica de la gl\u00e1ndula tiroides. La terapia con iodo radioactivo se utiliza generalmente luego de la cirug\u00eda para destruir cualquier resto de la tiroides, incluyendo tejido sano y c\u00e9lulas cancerosas. Usted se tragar\u00e1 una capsula o pastilla que contiene el iodo radioactivo (I-131). Tanto las c\u00e9lulas sanas como las cancerosas de la tiroides absorben el I-131, que las destruye. Este tratamiento generalmente se hace en un hospital. Usted podr\u00eda tener que pasar la noche internado en el hospital. Usted irradiar\u00e1 radiaci\u00f3n durante el tratamiento y durante un corto periodo luego del tratamiento. Su m\u00e9dico le indicar\u00e1 como proteger a su familia, amigos, y mascotas en su casa.\n[Radioinmunoterapia (RIT)](https://www.radiologyinfo.org/es/info/radio-immuno) /Itrium-90 Tiuxetan ( [Zevalin](https://www.radiologyinfo.org/glossary?modal=1&id=ezRCRkExRjhBLTBERDUtNEY5RS05MENDLUFDQzE1NkVGRkQ2OX0=)\u00ae)\nLa RIT se realiza generalmente de forma ambulatoria. Incluye varias consultas en el centro de tratamiento.\nEn la primera consulta, le dar\u00e1n una dosis de un anticuerpo monoclonal (sin material radioactivo) a trav\u00e9s de una infusi\u00f3n intravenosa (IV). El anticuerpo monoclonal se unir\u00e1 a las\n[c\u00e9lulas B](https://www.radiologyinfo.org/glossary?modal=1&id=ezNDRTlDODVBLTAxOEUtNEUzMC1BRjMxLTdGRUEyM0E1QzQyMH0=) no cancerosas en su cuerpo para protegerlas de la radiaci\u00f3n. Esta infusi\u00f3n IV podr\u00eda llevar hasta cinco horas.\nUsted regresar\u00e1 al hospital durante la siguiente semana para que le den otra inyecci\u00f3n IV de anticuerpo monoclonal no radioactivo. Una vez que esto se haya completado, le inyectar\u00e1n el anticuerpo monoclonal radioactivo. Esta inyecci\u00f3n llevar\u00e1 una hora.\nTerapia I-131 MIBG\nLe administrar\u00e1n la terapia I-131 MIBG a trav\u00e9s de un peque\u00f1o tubo (c\u00e1nula) insertado adentro de un vaso sangu\u00edneo en la parte trasera de su mano. La terapia incluye una infusi\u00f3n IV, que podr\u00eda durar desde 90 minutos hasta cuatro horas. Permanecer\u00e1 en el hospital entre cinco a siete d\u00edas mientras la radiaci\u00f3n es eliminada de su cuerpo, principalmente a trav\u00e9s de la orina. Se hacen arreglos especiales para permitirle a los padres de pacientes j\u00f3venes que puedan ayudar con el cuidado de sus ni\u00f1os mientras se les est\u00e1 aplicando la terapia.\nTerapia Lu-177 dotatate (Lutathera\u00ae).\nUn p\u00e9ptido que se une a la superficie del GET-NETs es combinado o \u201cmarcado\u201d con el radion\u00faclido Lu-177. Usted recibir\u00e1 este radiof\u00e1rmaco en forma de infusi\u00f3n intravenosa (IV). Es probable que le hagan cuatro tratamientos, cada uno separado del otro por ocho semanas. Las sesiones de tratamiento duran casi todo el d\u00eda. Durante el tratamiento, le har\u00e1n una exploraci\u00f3n por medicina nuclear para identificar la ubicaci\u00f3n del Lu-177 en su cuerpo.\nTerapias con radion\u00faclidos para los huesos\n- Dicloruro de radio 223 (Xofigo\u00ae)\n- Cloruro de estronio 89 (Metastron\u00ae)\n- Samario 153 (Quadramet\u00ae)\nLe administrar\u00e1n estas terapias en forma de infusi\u00f3n intravenosa(IV) un curso t\u00edpico de terapia incluye varios sesiones de tratamiento separadas por un periodo de semanas.\n\u00bfQu\u00e9 experimentar\u00e9 durante y despu\u00e9s del procedimiento?\nIm\u00e1genes\nCon la excepci\u00f3n de las inyecciones intravenosas, la mayor\u00eda de los procedimientos por medicina nuclear no causan dolor. Malestar considerable y los efectos secundarios son raros.\nSentir\u00e1 un peque\u00f1o pinchazo cuando el tecn\u00f3logo le inserte la aguja adentro de la vena a trav\u00e9s de la l\u00ednea intravenosa. Podr\u00eda sentir una sensaci\u00f3n de fr\u00edo que le sube por el brazo durante la inyecci\u00f3n de la radiosonda. Por lo general, no existen otros efectos secundarios.\nLas radiosondas tienen poco o nada de sabor. Inhalar una radiosonda no se siente diferente en nada a respirar el aire que lo rodea.\nPara el caso de algunos procedimientos, el tecn\u00f3logo podr\u00eda colocar un\n[cat\u00e9ter](https://www.radiologyinfo.org/glossary?modal=1&id=ezM5NkE5N0U4LUUzN0EtNEVBRi1CNDg2LUVERDhBOEU1OEU3Qn0=) adentro de su vejiga. Esto podr\u00eda le causar un malestar temporario.\nEs importante permanecer inm\u00f3vil durante el examen. Las im\u00e1genes nucleares no causan dolor. Sin embargo, el tener que permanecer inm\u00f3vil o en una posici\u00f3n por un periodo largo podr\u00eda ser inc\u00f3modo. A menos que su m\u00e9dico le indique lo contrario, podr\u00e1 resumir sus actividades normales luego de su examen.\nCuando est\u00e9 listo para irse, un tecn\u00f3logo, un enfermero, o un m\u00e9dico le dar\u00e1 todas las instrucciones especiales necesarias.\nLa peque\u00f1a cantidad de radiosonda en su cuerpo perder\u00e1 su radioactividad a lo largo del tiempo a trav\u00e9s de un proceso natural de decaimiento radiactivo. La mayor parte saldr\u00e1 del cuerpo a trav\u00e9s de la orina o las heces durante las primeras horas y d\u00edas luego de su examen. Beba mucha agua para ayudar a eliminar la radiosonda de su cuerpo. Necesitar\u00e1 seguir precauciones de seguridad para evitar exponer a otras personas a la radiaci\u00f3n. Vea la p\u00e1gina de\n[seguridad de la radiaci\u00f3n](https://www.radiologyinfo.org/es/info/safety-radiation#843487c12b3e453f9bf021f34e5a90b0) para m\u00e1s informaci\u00f3n.\nSu m\u00e9dico le dir\u00e1 cu\u00e1n seguido y cuando necesitar\u00e1 volver para que le hagan otros procedimientos.\nTerapia\nCon la excepci\u00f3n de las inyecciones intravenosas, la mayor\u00eda de los procedimientos de medicina nuclear son indoloros. El malestar considerable y los efectos secundarios son raros.\nSentir\u00e1 un peque\u00f1o pinchazo cuando el tecn\u00f3logo inserte la aguja adentro de una vena a trav\u00e9s de la l\u00ednea intravenosa.\nLuego de la terapia con radion\u00faclido y el tratamiento con iodo radioactivo I-131, el tecn\u00f3logo o el enfermero le dar\u00e1n instrucciones espec\u00edficas sobre cuestiones de seguridad que deber\u00e1 seguir cuando vuelva a su casa.\nLas terapias con radion\u00faclidos causan efectos secundarios que incluyen:\n- Lu-177: v\u00f3mitos, nausea, valores bajos en el conteo de c\u00e9lulas sangu\u00edneas, valores elevados de las enzimas hep\u00e1ticas, disminuci\u00f3n de los niveles de potasio sangu\u00edneo y aumento de la glucosa en el torrente sangu\u00edneo.\n- MIBG: presi\u00f3n sangu\u00ednea alta, sensaci\u00f3n de estar enfermo, y una ca\u00edda en los niveles de plaquetas en su cuerpo.\n- Itrio-90: nausea, dolor de est\u00f3mago, diarrea, fiebre, tos, nariz taponada, garganta irritada, dolor en los senos nasales, debilidad, cansancio.\n- Radio 223: Diarrea y enfermedad, niveles bajos de c\u00e9lulas sangu\u00edneas.\n- Estronio 89: materia fecal negra, sangre en la orina o en la materia fecal, tos o vos carrasposa, fiebre o escalofr\u00edos, dolor de cintura o en el costado, micci\u00f3n dolorosa o dif\u00edcil, puntos rojos en la piel, sangrado inusual, o moretones.\n- Samario 153: disminuci\u00f3n de la funci\u00f3n de la m\u00e9dula \u00f3sea, disminuci\u00f3n en la cantidad de plaquetas sangu\u00edneas, niveles bajos de c\u00e9lulas blancas de la sangre, n\u00e1usea, y v\u00f3mitos.\n\u00bfQui\u00e9n interpreta los resultados y c\u00f3mo los obtengo?\nUn radi\u00f3logo o un especialista en medicina nuclear interpretar\u00e1 las im\u00e1genes y enviar\u00e1 un informe al m\u00e9dico de cabecera.\n\u00bfCu\u00e1les son los beneficios y los riesgos?\nBeneficios\n- Los ex\u00e1menes por medicina nuclear brindan informaci\u00f3n \u00fanica que generalmente no se puede obtener utilizando otros procedimientos por im\u00e1genes. Esta informaci\u00f3n podr\u00eda incluir detalles de la funci\u00f3n y anatom\u00eda de las estructuras del cuerpo.\n- La medicina nuclear Brinda el diagn\u00f3stico o la informaci\u00f3n de tratamiento m\u00e1s \u00fatil para muchas enfermedades\n- Una exploraci\u00f3n por medicina nuclear es m\u00e1s barata y puede brindar informaci\u00f3n m\u00e1s precisa que la cirug\u00eda exploratoria.\n- La medicina nuclear ofrece la posibilidad de identificar enfermedades en sus etapas tempranas, generalmente antes de que otros estudios de diagn\u00f3stico puedan detectar s\u00edntomas o anormalidades.\n- Mediante la detecci\u00f3n de lesiones que sean probablemente\n[benignas](https://www.radiologyinfo.org/glossary?modal=1&id=ezNBOEI5OTMxLUFCQ0YtNDM0OC04MDY2LTQwQ0MzQUM3RDQzNX0=)o [malignas](https://www.radiologyinfo.org/glossary?modal=1&id=ezBCMkUyQTM5LUQxMkQtNDI2Ni1CMDRELTYyREM4RENBOEFFNn0=), las exploraciones por PET pueden eliminar la necesidad de biopsias quir\u00fargicas o identificar el mejor lugar para la biopsia.\n- Las exploraciones por PET pueden brindar informaci\u00f3n para el planeamiento de la radioterapia.\n- Las terapias con radionucleidos hacen blanco en las c\u00e9lulas cancerosas al mismo tiempo que limitan la exposici\u00f3n a la radiaci\u00f3n del tejido sano. Generalmente, se las tolera bien.\n- Los periodos de tratamiento podr\u00edan ser m\u00e1s cortos que los de otros tratamientos para el c\u00e1ncer y con menos efectos secundarios.\nRiesgos\n- Los ex\u00e1menes por medicina nuclear utilizan solamente una peque\u00f1a dosis de radiosonda aceptable para los ex\u00e1menes de diagn\u00f3stico. Los posibles beneficios de un examen superan ampliamente el peque\u00f1o riesgo de la radiaci\u00f3n.\n- Los m\u00e9dicos han estado utilizando los procedimientos de diagn\u00f3stico por medicina nuclear por m\u00e1s de seis d\u00e9cadas. No existen efectos adversos a largo plazo conocidos derivados de la exposici\u00f3n a dosis bajas de radiaci\u00f3n.\n- Su m\u00e9dico siempre pone en la balanza los beneficios del tratamiento con medicina nuclear y cualquier riesgo. Su m\u00e9dico le explicar\u00e1 los riesgos importantes antes del tratamiento y le dar\u00e1 la oportunidad de hacer preguntas.\n- Las reacciones al\u00e9rgicas a la radiosonda son extremadamente raras y generalmente moderadas. Siempre habl\u00e9 con el personal de medicina nuclear sobre cualquier alergia que pudiera tener. Describa cualquier problema que usted haya tenido durante previos ex\u00e1menes por medicina nuclear.\n- La inyecci\u00f3n de la radiosonda puede causar un peque\u00f1o dolor y enrojecimiento. Esto deber\u00eda desaparecer r\u00e1pidamente.\n- Las mujeres siempre deben hablar con sus m\u00e9dicos y el tecn\u00f3logo de radiolog\u00eda si existe cualquier posibilidad de que est\u00e9n embarazadas, o de que est\u00e9n amamantando. Ve a la p\u00e1gina de\n[seguridad de la radiaci\u00f3n](https://www.radiologyinfo.org/es/info/safety-radiation#843487c12b3e453f9bf021f34e5a90b0)para m\u00e1s informaci\u00f3n sobre el embarazo, el amamantamiento y los ex\u00e1menes de medicina nuclear.\n- Los aparatos de seguridad para la detecci\u00f3n de radiaci\u00f3n podr\u00edan ser sensibles a la radiaci\u00f3n presente en los pacientes a los que se les ha hecho recientemente una terapia con radionucleidos.\n\u00bfCu\u00e1les son las limitaciones de la medicina nuclear general?\nLos procedimientos de medicina nuclear pueden llevar su tiempo. Puede llevar desde varias horas hasta d\u00edas para que la radiosonda se acumule en el \u00e1rea de inter\u00e9s. Adem\u00e1s, la toma de im\u00e1genes podr\u00eda llevar varias horas. En algunos casos, los equipos nuevos podr\u00edan acortar sustancialmente el tiempo del procedimiento.\nLa resoluci\u00f3n de las im\u00e1genes de medicina nuclear podr\u00eda no ser tan alta como la de la TC o la RMN.\nEsta p\u00e1gina fue repasada en 2022-07-06", "language": null, "image": null, "pagetype": "Article", "links": ["#main", "/es", "https://www.radiologyinfo.org/es", "https://www.radiologyinfo.org/es/test-treatment", "https://www.radiologyinfo.org/es/pediatric", "https://www.radiologyinfo.org/es/screening", "https://www.radiologyinfo.org/es/disease-condition", "https://www.radiologyinfo.org/es/patient-safety", "https://www.radiologyinfo.org/en/info/gennuclear", "https://www.facebook.com/sharer/sharer.php?u=https://www.radiologyinfo.org/es/info/gennuclear", "https://twitter.com/intent/tweet?original_referer=https://www.radiologyinfo.org/es/info/gennuclear?ref_src=twsrc%5Etfw&text=Medicina+nuclear+general&tw_p=tweetbutton&url=https://www.radiologyinfo.org/es/info/gennuclear", "https://www.radiologyinfo.org/es/info/gennuclear?PdfExport=1", "#599311674b6043f7b0e5bc45edfa2cef", "#d97e3ed542c04f69a74378eb239bf01e", "#5b79716527b94cbeb6a4c05f31854146", "#e9645fc05e314b6999472560043add82", "#fdade9aa7d6248bbb5c91fe77ddb760b", "#33b9d51a78ee403c9bce9abb5c11bad0", "#5af96917b48b423f8d4ae5ffaac8c2f3", "#3b79d142bb854064ae4b325fd206ae87", "#297312d5a8494dc7ab272da9ee34c6ce", "#8638f2bf6500470b80baa09121e85dfe", "https://www.radiologyinfo.org/glossary?modal=1&id=ezY5NUNDRDA0LTg5MUUtNDg5MS1CRDlFLUQ4QTRGN0NFNEIzRn0=", "https://www.radiologyinfo.org/glossary?modal=1&id=e0UwNzg5NTYzLUI1MTctNEEyRi04MDhDLTlCREZCMEIxQThFMX0=", "https://www.radiologyinfo.org/glossary?modal=1&id=ezRFRDg4NERGLTg1Q0UtNEUyQS1CMEVBLUU3NzgzMkU2OUJGNX0=", "https://www.radiologyinfo.org/glossary?modal=1&id=e0VCMTE2MDk3LUY3MUMtNDc4Ri1BODM4LTM2NzJGNkEzN0MwMX0=", "https://www.radiologyinfo.org/glossary?modal=1&id=ezU2NkM5MENGLUM4NzUtNEE0OS1COEVFLTBFRkE0NzhENDVBNn0=", "https://www.radiologyinfo.org/glossary?modal=1&id=e0VBNTMxNUQzLTk0QzEtNDMxNC1CMUFGLTIzMTAzRjVFNzVCM30=", "https://www.radiologyinfo.org/glossary?modal=1&id=ezM5RUZDRTg0LTkwQUQtNDMzOS1BQjhDLTVFRDZBNDEyNTRGMH0=", "https://www.radiologyinfo.org/glossary?modal=1&id=e0M2M0Q4QzRBLUMzRDYtNEQwNy04MjE3LUFGRUZCMTkxN0IzM30=", "#top", "https://www.radiologyinfo.org/glossary?modal=1&id=ezM1OEFFMDk3LTM5MUMtNDAzMi05Q0VGLTIzRkQ0MkQ1ODQ2Nn0=", "https://www.radiologyinfo.org/glossary?modal=1&id=ezQyNEYzNjZBLTQ1RkItNDI4Ri05N0QyLUJGNjkyRDAzQzc4Nn0=", "https://www.radiologyinfo.org/glossary?modal=1&id=e0ZCNUMxNzdFLUYxQkUtNENFRC1BQjQzLTg4NzcwMzlENjVDMX0=", "https://www.radiologyinfo.org/glossary?modal=1&id=ezIwRjg0QThDLUUzRjgtNDg5Ri05NTMwLTRBOTkyOEQ4MzUyRn0=", "https://www.radiologyinfo.org/glossary?modal=1&id=ezREMDYyQkU2LTNDNDItNDMzNS05NjdELURDQkZGODNFRUEwRn0=", "https://www.radiologyinfo.org/glossary?modal=1&id=e0VBNTMxNUQzLTk0QzEtNDMxNC1CMUFGLTIzMTAzRjVFNzVCM30=", "https://www.radiologyinfo.org/es/info/alzheimers", "https://www.radiologyinfo.org/glossary?modal=1&id=e0Y0MkFBNTBFLUM2NjYtNEEyNS1CQkVCLTQ1OTU0RTQ3NUE5N30=", "https://www.radiologyinfo.org/glossary?modal=1&id=ezQ4MkI1RkZBLUJDMkQtNEJGMy1BNURGLUQ5MTE0ODhENDVDQX0=", "https://www.radiologyinfo.org/glossary?modal=1&id=ezRBOUE5NzYzLTFENzYtNEE0Qi04NTkwLUMyMjRGQjRFOEE4NX0=", "https://www.radiologyinfo.org/glossary?modal=1&id=ezIwQUIwMzM2LTdENDgtNDU4Ni05NDBELTVFRUYyRkQ1MTZBRH0=", "https://www.radiologyinfo.org/glossary?modal=1&id=e0MyMTRENEZBLTRFNUUtNDdDNS04NjBDLTA4MTc3NEM0QUZDM30=", "https://www.radiologyinfo.org/glossary?modal=1&id=ezJCQkFDMjg5LUIxNTAtNENEOS04MzE3LTc3NkI1OTY0RkZBNH0=", "https://www.radiologyinfo.org/glossary?modal=1&id=ezRCRkExRjhBLTBERDUtNEY5RS05MENDLUFDQzE1NkVGRkQ2OX0=", "/glossary?modal=1&id=ezE3NzRDRDM4LTY5MDMtNDgzRS1CMzgxLUFEQjFCMDQ3NzBDOH0=", "https://www.radiologyinfo.org/glossary?modal=1&id=ezE3NzRDRDM4LTY5MDMtNDgzRS1CMzgxLUFEQjFCMDQ3NzBDOH0=", "https://www.radiologyinfo.org/glossary?modal=1&id=ezY0RkZDNTQ1LUI1MDUtNENDQi05MUJFLTIwNzU4MjQ2QkY4Q30=", "https://www.radiologyinfo.org/glossary?modal=1&id=ezMzMkE0QTc3LTI2MTMtNDUyMS1CMjVCLTAyMTIyQkU2RUFCMn0=", "https://www.radiologyinfo.org/es/info/radio-immuno", "#top", "https://www.radiologyinfo.org/es/info/safety-radiation#843487c12b3e453f9bf021f34e5a90b0", "https://www.radiologyinfo.org/es/info/radioiodine", "#top", "https://www.radiologyinfo.org/glossary?modal=1&id=e0M0NUEzQkE5LTlEREUtNEFEOS1BODg2LUM4NzFFODUyQzlENH0=", "https://www.radiologyinfo.org/glossary?modal=1&id=e0RCRUZCRjZGLTA5RkEtNDE3NC1BMjgyLTg0REU3RDczMTNBRX0=", "#top", "https://www.radiologyinfo.org/glossary?modal=1&id=ezZBRTcyOTNDLTVGMTctNDRBRC1BNjIyLUE3MThDNEM4OTUzOX0=", "https://www.radiologyinfo.org/glossary?modal=1&id=e0VBODQ4MTA4LUEwQkMtNDAxMi05RDQ2LTI3MTY1QjAzNEYwMX0=", "https://www.radiologyinfo.org/glossary?modal=1&id=e0Q3ODhFRThFLTg4RjUtNDAxRi1CN0QxLTIwODk5NjA2OEU2Mn0=", "#top", "https://www.radiologyinfo.org/es/info/radioiodine", "https://www.radiologyinfo.org/es/info/thyroid-cancer-treatment", "https://www.radiologyinfo.org/es/info/radio-immuno", "https://www.radiologyinfo.org/glossary?modal=1&id=ezRCRkExRjhBLTBERDUtNEY5RS05MENDLUFDQzE1NkVGRkQ2OX0=", "https://www.radiologyinfo.org/glossary?modal=1&id=ezNDRTlDODVBLTAxOEUtNEUzMC1BRjMxLTdGRUEyM0E1QzQyMH0=", "#top", "https://www.radiologyinfo.org/glossary?modal=1&id=ezM5NkE5N0U4LUUzN0EtNEVBRi1CNDg2LUVERDhBOEU1OEU3Qn0=", "https://www.radiologyinfo.org/es/info/safety-radiation#843487c12b3e453f9bf021f34e5a90b0", "#top", "#top", "https://www.radiologyinfo.org/glossary?modal=1&id=ezNBOEI5OTMxLUFCQ0YtNDM0OC04MDY2LTQwQ0MzQUM3RDQzNX0=", "https://www.radiologyinfo.org/glossary?modal=1&id=ezBCMkUyQTM5LUQxMkQtNDI2Ni1CMDRELTYyREM4RENBOEFFNn0=", "https://www.radiologyinfo.org/es/info/safety-radiation#843487c12b3e453f9bf021f34e5a90b0", "#top", "#top", "#", "https://www.radiologyinfo.org/es/info/alzheimers", "https://www.radiologyinfo.org/es/info/angioplasty", "https://www.radiologyinfo.org/es/info/biopgen", "https://www.radiologyinfo.org/es/info/bodyct", "https://www.radiologyinfo.org/es/info/bodymr", "https://www.radiologyinfo.org/es/info/nuclear-pdi", "https://www.radiologyinfo.org/es/info/pet", "https://www.radiologyinfo.org/es/info/radio-immuno", "https://www.radiologyinfo.org/es/info/radioiodine", "https://www.radiologyinfo.org/es/info/safety-radiation", "https://www.radiologyinfo.org/es/search?usableOn=cd2b9950de894da2a49865e4ba7f58ae&type=2", "https://www.radiologyinfo.org/es/search?usableOn=cd2b9950de894da2a49865e4ba7f58ae&type=3", "https://www.radiologyinfo.org/es/info/about-rsna", "https://www.radiologyinfo.org/es/info/about-acr", "http://www.acraccreditation.org/accredited-facility-search", "https://www.radiologyinfo.org/es/about-us", "https://www.radiologyinfo.org/es/contact-us", "https://www.radiologyinfo.org/es/faq", "https://www.radiologyinfo.org/es/glossary-index", "https://www.radiologyinfo.org/es/professions", "https://www.radiologyinfo.org/es/sitemap", "https://www.radiologyinfo.org/es/info/about-privacy", "https://www.radiologyinfo.org/es/info/about-terms-of-use", "https://www.facebook.com/radiologyinfo?ref=sgm", "https://twitter.com/radiologyinfo_", "https://www.instagram.com/radinfo4patients/"]}