{"title": "Hongos medicinales", "author": null, "url": "https://www.cancer.gov/espanol/cancer/tratamiento/mca/paciente/hongos-pdq", "hostname": "cancer.gov", "description": "Resumen de informaci\u00f3n revisada por expertos sobre el uso de los hongos medicinales como tratamiento para las personas con c\u00e1ncer.", "sitename": "Instituto Nacional del C\u00e1ncer", "date": "2017-09-08", "id": null, "license": null, "body": null, "comments": "", "commentsbody": null, "raw_text": null, "text": "Hongos medicinales (PDQ\u00ae)\u2013Versi\u00f3n para pacientes\nIntroducci\u00f3n\nLos hongos medicinales son hongos que se usan como\n[medicamentos](/Common/PopUps/popDefinition.aspx?id=348921&version=patient&language=Spanish&dictionary=Cancer.gov). Los hongos se han utilizado por cientos de a\u00f1os, sobre todo en los pa\u00edses asi\u00e1ticos, para tratar [infecciones](/Common/PopUps/popDefinition.aspx?id=45364&version=patient&language=Spanish&dictionary=Cancer.gov). Hoy en d\u00eda, tambi\u00e9n se emplean para tratar [enfermedades pulmonares](/Common/PopUps/popDefinition.aspx?id=270740&version=patient&language=Spanish&dictionary=Cancer.gov) y el [c\u00e1ncer](/Common/PopUps/popDefinition.aspx?id=45333&version=patient&language=Spanish&dictionary=Cancer.gov). En Jap\u00f3n y China, hace m\u00e1s de 30 a\u00f1os que se aprob\u00f3 el uso de los hongos medicinales como complemento de los tratamientos [est\u00e1ndar](/Common/PopUps/popDefinition.aspx?id=44930&version=patient&language=Spanish&dictionary=Cancer.gov) contra el c\u00e1ncer. En estos pa\u00edses, los hongos se han utilizado sin peligro por mucho tiempo, solos o en combinaci\u00f3n con la [radioterapia](/Common/PopUps/popDefinition.aspx?id=44295&version=patient&language=Spanish&dictionary=Cancer.gov) o la [quimioterapia](/Common/PopUps/popDefinition.aspx?id=45214&version=patient&language=Spanish&dictionary=Cancer.gov).\nEn Asia, hay m\u00e1s de 100 tipos de hongos para tratar el c\u00e1ncer. Algunos de los m\u00e1s comunes son los siguientes: Ganoderma lucidum (reishi), Trametes versicolor o Coriolus versicolor (cola de pavo), Lentinus edodes (shiitake) y Grifola frondosa (maitake).\nSe estudian los hongos para averiguar la forma en que afectan el\n[sistema inmunitario](/Common/PopUps/popDefinition.aspx?id=46356&version=patient&language=Spanish&dictionary=Cancer.gov) y saber si ayudan a detener o retrasar el crecimiento de los [tumores](/Common/PopUps/popDefinition.aspx?id=46634&version=patient&language=Spanish&dictionary=Cancer.gov), o destruir las [c\u00e9lulas](/Common/PopUps/popDefinition.aspx?id=46476&version=patient&language=Spanish&dictionary=Cancer.gov) tumorales. Se piensa que [compuestos](/Common/PopUps/popDefinition.aspx?id=422394&version=patient&language=Spanish&dictionary=Cancer.gov) [qu\u00edmicos](/Common/PopUps/popDefinition.aspx?id=643008&version=patient&language=Spanish&dictionary=Cancer.gov), como los [polisac\u00e1ridos](/Common/PopUps/popDefinition.aspx?id=44162&version=patient&language=Spanish&dictionary=Cancer.gov) ( [beta-glucanos](/Common/PopUps/popDefinition.aspx?id=44147&version=patient&language=Spanish&dictionary=Cancer.gov)) en los hongos del tipo cola de pavo, fortalecen el sistema inmunitario para combatir el c\u00e1ncer.\nEn este sumario de informaci\u00f3n sobre el c\u00e1ncer del\n[PDQ](/Common/PopUps/popDefinition.aspx?id=44271&version=patient&language=Spanish&dictionary=Cancer.gov) se ofrece una descripci\u00f3n general del uso de los hongos para tratar el c\u00e1ncer. Se ofrece la siguiente informaci\u00f3n sobre Trametes versicolor, que tambi\u00e9n se llama Coriolus versicolor (cola de pavo), y Ganoderma lucidum (reishi):\n- Forma en que se administra o se consume.\n- Revisi\u00f3n de\n[estudios con animales](/Common/PopUps/popDefinition.aspx?id=454774&version=patient&language=Spanish&dictionary=Cancer.gov)y de [laboratorio](/Common/PopUps/popDefinition.aspx?id=44512&version=patient&language=Spanish&dictionary=Cancer.gov).\n- Resultados de\n[ensayos cl\u00ednicos](/Common/PopUps/popDefinition.aspx?id=45961&version=patient&language=Spanish&dictionary=Cancer.gov)(estudios en seres humanos). [Efectos secundarios](/Common/PopUps/popDefinition.aspx?id=46580&version=patient&language=Spanish&dictionary=Cancer.gov).\n- Informaci\u00f3n de la\n[Administraci\u00f3n de Alimentos y Medicamentos](/Common/PopUps/popDefinition.aspx?id=454785&version=patient&language=Spanish&dictionary=Cancer.gov)(FDA).\nPreguntas y respuestas sobre la cola de pavo y el polisac\u00e1rido-K\n- \u00bfQu\u00e9 es la cola de pavo?\nLa cola de pavo es un hongo que crece en troncos muertos en todo el mundo. Se llama cola de pavo debido a sus aros conc\u00e9ntricos de color marr\u00f3n oscuro y claro que se parecen a las plumas de la cola del pavo. El nombre\n[cient\u00edfico](/Common/PopUps/popDefinition.aspx?id=44724&version=patient&language=Spanish&dictionary=Cancer.gov)es Trametes versicolor o Coriolus versicolor. En la [medicina tradicional china](/Common/PopUps/popDefinition.aspx?id=449722&version=patient&language=Spanish&dictionary=Cancer.gov), se conoce como yun zhi. En Jap\u00f3n, se conoce como kawaratake ( [hongo](/Common/PopUps/popDefinition.aspx?id=44571&version=patient&language=Spanish&dictionary=Cancer.gov)tejado). Hay muchos otros tipos de hongos Trametes. Algunos tipos de Trametes son dif\u00edciles de distinguir de la cola de pavo sin el uso de pruebas especiales.\nLa cola de pavo se ha utilizado en la medicina tradicional china para tratar enfermedades del\n[pulm\u00f3n](/Common/PopUps/popDefinition.aspx?id=270740&version=patient&language=Spanish&dictionary=Cancer.gov)durante muchos a\u00f1os. En Jap\u00f3n, la cola de pavo se ha utilizado para fortalecer el [sistema inmunitario](/Common/PopUps/popDefinition.aspx?id=46356&version=patient&language=Spanish&dictionary=Cancer.gov)en combinaci\u00f3n con el tratamiento [est\u00e1ndar](/Common/PopUps/popDefinition.aspx?id=44930&version=patient&language=Spanish&dictionary=Cancer.gov)del [c\u00e1ncer](/Common/PopUps/popDefinition.aspx?id=45333&version=patient&language=Spanish&dictionary=Cancer.gov).\n- \u00bfQu\u00e9 es el PSK?\nEl\n[polisac\u00e1rido](/Common/PopUps/popDefinition.aspx?id=44162&version=patient&language=Spanish&dictionary=Cancer.gov)-K (PSK) es el [compuesto](/Common/PopUps/popDefinition.aspx?id=422394&version=patient&language=Spanish&dictionary=Cancer.gov)activo m\u00e1s conocido de los hongos cola de pavo. En Jap\u00f3n, el PSK es un producto de hongos aprobado para el tratamiento del c\u00e1ncer.\n- \u00bfC\u00f3mo se administra o consume el PSK?\nEl PSK se toma en t\u00e9 o en\n[c\u00e1psulas](/Common/PopUps/popDefinition.aspx?id=455334&version=patient&language=Spanish&dictionary=Cancer.gov).\n- \u00bfSe ha llevado a cabo alg\u00fan estudio de laboratorio o con animales en el que se use el PSK?\nEn los\n[estudios de laboratorio](/Common/PopUps/popDefinition.aspx?id=44512&version=patient&language=Spanish&dictionary=Cancer.gov)se utilizan [c\u00e9lulas](/Common/PopUps/popDefinition.aspx?id=46476&version=patient&language=Spanish&dictionary=Cancer.gov) [tumorales](/Common/PopUps/popDefinition.aspx?id=46634&version=patient&language=Spanish&dictionary=Cancer.gov)para probar sustancias y averiguar sus efectos anticancerosos. En los [estudios con animales](/Common/PopUps/popDefinition.aspx?id=454774&version=patient&language=Spanish&dictionary=Cancer.gov), se hacen pruebas para saber si un [medicamento](/Common/PopUps/popDefinition.aspx?id=348921&version=patient&language=Spanish&dictionary=Cancer.gov), procedimiento o tratamiento nuevo es seguro y eficaz en los animales. Los estudios de laboratorio y con animales se hacen antes de probar una sustancia en los seres humanos.\nEn los estudios de laboratorio y con animales se probaron los efectos del PSK en el sistema inmunitario, incluso en las c\u00e9lulas inmunitarias que se llaman\n[linfocitos citol\u00edticos naturales](/Common/PopUps/popDefinition.aspx?id=44062&version=patient&language=Spanish&dictionary=Cancer.gov)y [c\u00e9lulas T](/Common/PopUps/popDefinition.aspx?id=44928&version=patient&language=Spanish&dictionary=Cancer.gov). Para obtener m\u00e1s informaci\u00f3n sobre estudios de laboratorio y con animales en los que se utiliz\u00f3 el PSK, consulte la secci\u00f3n [Estudios precl\u00ednicos de laboratorio o con animales](/espanol/cancer/tratamiento/mca/pro/hongos-pdq#_138)de la versi\u00f3n para profesionales de la salud del sumario Hongos medicinales.\n- \u00bfSe ha llevado a cabo alg\u00fan estudio del PSK en seres humanos?\nHay estudios sobre el uso del PSK para tratar pacientes con\n[c\u00e1ncer de est\u00f3mago](/Common/PopUps/popDefinition.aspx?id=445087&version=patient&language=Spanish&dictionary=Cancer.gov), [c\u00e1ncer de mama](/Common/PopUps/popDefinition.aspx?id=444971&version=patient&language=Spanish&dictionary=Cancer.gov), [c\u00e1ncer colorrectal](/Common/PopUps/popDefinition.aspx?id=444983&version=patient&language=Spanish&dictionary=Cancer.gov)y [c\u00e1ncer de pulm\u00f3n](/Common/PopUps/popDefinition.aspx?id=445043&version=patient&language=Spanish&dictionary=Cancer.gov). El PSK se ha utilizado como [terapia adyuvante](/Common/PopUps/popDefinition.aspx?id=45587&version=patient&language=Spanish&dictionary=Cancer.gov)del c\u00e1ncer en miles de pacientes desde mediados de la d\u00e9cada de 1970. En Jap\u00f3n, se ha empleado sin peligro durante mucho tiempo y con pocos [efectos secundarios](/Common/PopUps/popDefinition.aspx?id=46580&version=patient&language=Spanish&dictionary=Cancer.gov)notificados.\nC\u00e1ncer de est\u00f3mago\nEn los estudios se observa que el uso del PSK como terapia adyuvante en pacientes con c\u00e1ncer de est\u00f3mago quiz\u00e1s ayude a reparar el da\u00f1o inmunitario que causa la\n[quimioterapia](/Common/PopUps/popDefinition.aspx?id=45214&version=patient&language=Spanish&dictionary=Cancer.gov)y fortalecer el sistema inmunitario.\nLos estudios sobre el uso del PSK como terapia adyuvante del c\u00e1ncer de est\u00f3mago incluyen los siguientes:\n- Entre 1978 y 1981, se realiz\u00f3 un\n[ensayo cl\u00ednico aleatorizado](/Common/PopUps/popDefinition.aspx?id=45858&version=patient&language=Spanish&dictionary=Cancer.gov)en Jap\u00f3n con 751 pacientes sometidos a [cirug\u00eda](/Common/PopUps/popDefinition.aspx?id=45570&version=patient&language=Spanish&dictionary=Cancer.gov)por c\u00e1ncer de est\u00f3mago. Despu\u00e9s de la cirug\u00eda, los pacientes recibieron quimioterapia adyuvante con PSK o sin este. En promedio, los pacientes que recibieron quimioterapia con PSK vivieron m\u00e1s tiempo que quienes recibieron quimioterapia sola. Los investigadores creen que se podr\u00eda predecir qui\u00e9nes se beneficiar\u00edan m\u00e1s del PSK seg\u00fan el n\u00famero de [granulocitos](/Common/PopUps/popDefinition.aspx?id=46374&version=patient&language=Spanish&dictionary=Cancer.gov)y [linfocitos](/Common/PopUps/popDefinition.aspx?id=45765&version=patient&language=Spanish&dictionary=Cancer.gov)que se detecten en la [sangre](/Common/PopUps/popDefinition.aspx?id=270735&version=patient&language=Spanish&dictionary=Cancer.gov)del paciente.\n- En 1994, en un estudio en Jap\u00f3n se control\u00f3 a 262 pacientes de c\u00e1ncer sometidos a cirug\u00eda por c\u00e1ncer de est\u00f3mago y que recibieron quimioterapia con PSK o sin este. Fue menos probable que los pacientes que recibieron quimioterapia con PSK tuvieran\n[c\u00e1ncer recidivante](/Common/PopUps/popDefinition.aspx?id=45862&version=patient&language=Spanish&dictionary=Cancer.gov); adem\u00e1s, vivieron m\u00e1s tiempo que quienes no recibieron PSK. El tratamiento con PSK caus\u00f3 pocos efectos secundarios. Seg\u00fan los investigadores, en el estudio se demostr\u00f3 que se deb\u00eda a\u00f1adir el PSK a la quimioterapia posterior a una cirug\u00eda para extirpar el c\u00e1ncer de est\u00f3mago.\n- En 2007, se public\u00f3 una revisi\u00f3n de los resultados combinados de ocho\n[ensayos controlados](/Common/PopUps/popDefinition.aspx?id=44014&version=patient&language=Spanish&dictionary=Cancer.gov)aleatorizados con 8009 pacientes sometidos a cirug\u00eda para extirpar tumores de est\u00f3mago. Despu\u00e9s de la cirug\u00eda, los pacientes en los ensayos cl\u00ednicos recibieron quimioterapia con PSK o sin este. Los resultados indican que la quimioterapia con PSK ayud\u00f3 a que los pacientes vivieran m\u00e1s tiempo despu\u00e9s de la cirug\u00eda.\nC\u00e1ncer de mama\nHasta la fecha, los estudios sobre el PSK en pacientes con c\u00e1ncer de mama se han centrado en los cambios que ocurren en el sistema inmunitario (concentraciones de c\u00e9lulas T y\n[c\u00e9lulas B](/Common/PopUps/popDefinition.aspx?id=45611&version=patient&language=Spanish&dictionary=Cancer.gov)en la sangre) en lugar de los resultados [cl\u00ednicos](/Common/PopUps/popDefinition.aspx?id=44168&version=patient&language=Spanish&dictionary=Cancer.gov)(supervivencia del paciente, [s\u00edntomas](/Common/PopUps/popDefinition.aspx?id=45022&version=patient&language=Spanish&dictionary=Cancer.gov), efectos secundarios y [calidad de vida](/Common/PopUps/popDefinition.aspx?id=45417&version=patient&language=Spanish&dictionary=Cancer.gov)).\nC\u00e1ncer colorrectal\nLos estudios sobre el uso del PSK como terapia adyuvante del c\u00e1ncer colorrectal incluyen los siguientes:\n- Se estudi\u00f3 el uso del PSK en un ensayo cl\u00ednico aleatorizado para determinar su efecto en el sistema inmunitario de pacientes de\n[c\u00e1ncer de recto en estadio II](/Common/PopUps/popDefinition.aspx?id=45891&version=patient&language=Spanish&dictionary=Cancer.gov)o [estadio III](/Common/PopUps/popDefinition.aspx?id=45892&version=patient&language=Spanish&dictionary=Cancer.gov). Los pacientes recibieron quimioterapia y radioterapia, con PSK y sin este. En este estudio, se hall\u00f3 que el PSK aument\u00f3 el n\u00famero de c\u00e9lulas inmunitarias anticancerosas y que tuvo efectos contra el c\u00e1ncer en el [tejido](/Common/PopUps/popDefinition.aspx?id=46683&version=patient&language=Spanish&dictionary=Cancer.gov)que recibi\u00f3 radioterapia.\n- En una revisi\u00f3n en la que se combinaron los resultados de tres estudios en los que participaron 1094 pacientes de c\u00e1ncer colorrectal, se hall\u00f3 que quienes recibieron PSK tuvieron menos probabilidad de c\u00e1ncer recidivante y sobrevivieron m\u00e1s tiempo que los pacientes que no recibieron PSK.\nC\u00e1ncer de pulm\u00f3n\nEntre los estudios sobre el uso del PSK como terapia adyuvante para pacientes de c\u00e1ncer de pulm\u00f3n se encuentran los siguientes:\n- En cinco\n[ensayos cl\u00ednicos no aleatorizados](/Common/PopUps/popDefinition.aspx?id=44160&version=patient&language=Spanish&dictionary=Cancer.gov), se notific\u00f3 que los pacientes tratados con PSK y radioterapia, con quimioterapia o sin esta, vivieron m\u00e1s tiempo.\n- En seis ensayos cl\u00ednicos aleatorizados de pacientes con c\u00e1ncer de pulm\u00f3n se estudi\u00f3 el uso de la quimioterapia con PSK o sin este. En los estudios se observ\u00f3 que los pacientes que recibieron PSK mejoraron en uno o varios aspectos, incluso el\n[funcionamiento inmunitario](/Common/PopUps/popDefinition.aspx?id=45721&version=patient&language=Spanish&dictionary=Cancer.gov), el peso corporal, el bienestar, los [s\u00edntomas](/Common/PopUps/popDefinition.aspx?id=45022&version=patient&language=Spanish&dictionary=Cancer.gov)relacionados con el tumor y la supervivencia.\n- Entre 1978 y 1981, se realiz\u00f3 un\n- \u00bfSe notificaron efectos secundarios o riesgos relacionados con el uso de la cola de pavo o PSK?\nSe notificaron pocos efectos secundarios en los estudios del PSK en Jap\u00f3n.\n- \u00bfLa Administraci\u00f3n de Alimentos y Medicamentos de los Estados Unidos (FDA) aprob\u00f3 el uso de la cola de pavo o el PSK para el tratamiento del c\u00e1ncer en los Estados Unidos?\nLa\n[Administraci\u00f3n de Alimentos y Medicamentos de los Estados Unidos](/Common/PopUps/popDefinition.aspx?id=454785&version=patient&language=Spanish&dictionary=Cancer.gov)(FDA) no ha aprobado el uso de la cola de pavo ni de su compuesto activo, el PSK, como tratamiento del c\u00e1ncer o de cualquier otra [afecci\u00f3n](/Common/PopUps/popDefinition.aspx?id=651193&version=patient&language=Spanish&dictionary=Cancer.gov).\nLa FDA no aprueba los\n[suplementos alimentarios](/Common/PopUps/popDefinition.aspx?id=373932&version=patient&language=Spanish&dictionary=Cancer.gov)ni determina la inocuidad o eficacia de los mismos. El fabricante se responsabiliza por asegurarse de que el producto no sea peligroso y que las etiquetas incluyan informaci\u00f3n real que no sea enga\u00f1osa para el consumidor. Debido a que la FDA no reglamenta la elaboraci\u00f3n de los suplementos, es probable que haya diferencias entre los lotes y las marcas de suplementos de hongos.\nPreguntas y respuestas sobre el reishi\n- \u00bfQu\u00e9 es el reishi?\nEl reishi es un hongo que crece en los \u00e1rboles vivos. Los\n[cient\u00edficos](/Common/PopUps/popDefinition.aspx?id=44724&version=patient&language=Spanish&dictionary=Cancer.gov)lo llaman Ganoderma lucidum o Ganoderma sinense. En la [medicina tradicional china](/Common/PopUps/popDefinition.aspx?id=449722&version=patient&language=Spanish&dictionary=Cancer.gov), este grupo de hongos se conoce como ling zhi. En Jap\u00f3n, se llama reishi. En China, el G. lucidum se llama chizhi, y el G. sinense se llama zizhi.\nHay muchos otros hongos del tipo Ganoderma y es dif\u00edcil distinguir los hongos medicinales de los que no lo son.\nEl reishi se ha utilizado en la\n[medicina](/Common/PopUps/popDefinition.aspx?id=482419&version=patient&language=Spanish&dictionary=Cancer.gov)durante mucho tiempo en Asia Oriental. Se pensaba que prolongaba la vida, preven\u00eda el envejecimiento y aumentaba la energ\u00eda. En China, se emplea para fortalecer el [sistema inmunitario](/Common/PopUps/popDefinition.aspx?id=46356&version=patient&language=Spanish&dictionary=Cancer.gov)de los pacientes de [c\u00e1ncer](/Common/PopUps/popDefinition.aspx?id=45333&version=patient&language=Spanish&dictionary=Cancer.gov)que reciben [quimioterapia](/Common/PopUps/popDefinition.aspx?id=45214&version=patient&language=Spanish&dictionary=Cancer.gov)o [radioterapia](/Common/PopUps/popDefinition.aspx?id=44971&version=patient&language=Spanish&dictionary=Cancer.gov).\n- \u00bfC\u00f3mo se administra o consume el reishi?\nPor lo habitual, el reishi se seca y se consume como\n[extracto](/Common/PopUps/popDefinition.aspx?id=407760&version=patient&language=Spanish&dictionary=Cancer.gov)l\u00edquido, en [c\u00e1psulas](/Common/PopUps/popDefinition.aspx?id=455334&version=patient&language=Spanish&dictionary=Cancer.gov)o en polvo.\n- \u00bfSe ha llevado a cabo alg\u00fan estudio de laboratorio o con animales en el que se use el reishi?\nEn los\n[estudios de laboratorio](/Common/PopUps/popDefinition.aspx?id=44512&version=patient&language=Spanish&dictionary=Cancer.gov)se utilizan [c\u00e9lulas](/Common/PopUps/popDefinition.aspx?id=46476&version=patient&language=Spanish&dictionary=Cancer.gov) [tumorales](/Common/PopUps/popDefinition.aspx?id=46634&version=patient&language=Spanish&dictionary=Cancer.gov)para probar sustancias y averiguar sus efectos anticancerosos. En los [estudios con animales](/Common/PopUps/popDefinition.aspx?id=454774&version=patient&language=Spanish&dictionary=Cancer.gov), se hacen pruebas para saber si un [medicamento](/Common/PopUps/popDefinition.aspx?id=348921&version=patient&language=Spanish&dictionary=Cancer.gov), procedimiento o tratamiento nuevo es seguro y eficaz en los animales. Los estudios de laboratorio y con animales se hacen antes de probar una sustancia en los seres humanos.\nEn los estudios de laboratorio y con animales se probaron los efectos de los ingredientes activos de los hongos reishi (triterpenoides y\n[polisac\u00e1ridos](/Common/PopUps/popDefinition.aspx?id=44162&version=patient&language=Spanish&dictionary=Cancer.gov)) en los tumores, incluso el [c\u00e1ncer de pulm\u00f3n](/Common/PopUps/popDefinition.aspx?id=445043&version=patient&language=Spanish&dictionary=Cancer.gov). Para obtener informaci\u00f3n sobre estudios de laboratorio y con animales en los que se utiliz\u00f3 el reishi, consulte la secci\u00f3n [Estudios precl\u00ednicos de laboratorio o con animales](/espanol/cancer/tratamiento/mca/pro/hongos-pdq#_138)de la versi\u00f3n para profesionales de la salud del sumario Hongos medicinales.\n- \u00bfSe ha llevado a cabo alg\u00fan estudio sobre los hongos reishi en seres humanos?\nSe han estudiado productos elaborados con reishi en China y Jap\u00f3n.\nC\u00e1ncer de pulm\u00f3n\nEn los estudios se indica que es posible que la\n[terapia adyuvante](/Common/PopUps/popDefinition.aspx?id=45587&version=patient&language=Spanish&dictionary=Cancer.gov)con productos de reishi ayude a fortalecer el sistema inmunitario en los pacientes con c\u00e1ncer de pulm\u00f3n.\nEntre otros, los estudios sobre c\u00e1ncer pulm\u00f3n son los siguientes:\n- En un\n[estudio sin anonimato](/Common/PopUps/popDefinition.aspx?id=285990&version=patient&language=Spanish&dictionary=Cancer.gov)realizado en China, 36 pacientes de c\u00e1ncer de pulm\u00f3n en estadio [avanzado](/Common/PopUps/popDefinition.aspx?id=478743&version=patient&language=Spanish&dictionary=Cancer.gov)recibieron un producto de reishi [de venta libre](/Common/PopUps/popDefinition.aspx?id=44696&version=patient&language=Spanish&dictionary=Cancer.gov)llamado Ganopoly. Se trat\u00f3 a los pacientes con quimioterapia o radioterapia, junto con otras [terapias complementarias](/Common/PopUps/popDefinition.aspx?id=44951&version=patient&language=Spanish&dictionary=Cancer.gov). En algunos pacientes se observaron cambios notables en la [respuesta inmunitaria](/Common/PopUps/popDefinition.aspx?id=45722&version=patient&language=Spanish&dictionary=Cancer.gov), como el n\u00famero [linfocitos](/Common/PopUps/popDefinition.aspx?id=45765&version=patient&language=Spanish&dictionary=Cancer.gov)y la actividad de los [linfocitos citol\u00edticos naturales](/Common/PopUps/popDefinition.aspx?id=44062&version=patient&language=Spanish&dictionary=Cancer.gov); en otros pacientes, no hubo cambios en la respuesta inmunitaria.\n- En China, se llev\u00f3 a cabo un estudio de 12 pacientes con c\u00e1ncer de pulm\u00f3n. Se analiz\u00f3 la\n[sangre](/Common/PopUps/popDefinition.aspx?id=270735&version=patient&language=Spanish&dictionary=Cancer.gov)de los pacientes para verificar si consumir un producto hecho con reishi podr\u00eda ayudar a mejorar la respuesta inmunitaria. En el estudio se encontr\u00f3 que los polisac\u00e1ridos en los hongos reishi tal vez ayuden a mantener activas las c\u00e9lulas inmunitarias llamadas linfocitos que luchan contra el c\u00e1ncer.\nC\u00e1ncer colorrectal\nSe estudi\u00f3 el uso del reishi para la\n[prevenci\u00f3n](/Common/PopUps/popDefinition.aspx?id=439419&version=patient&language=Spanish&dictionary=Cancer.gov)del c\u00e1ncer colorrectal:\n- En Jap\u00f3n, se estudi\u00f3 a 225 pacientes con tumores colorrectales\n[benignos](/Common/PopUps/popDefinition.aspx?id=45614&version=patient&language=Spanish&dictionary=Cancer.gov). Durante 12 meses, 123 pacientes recibieron un extracto de cultivo de micelios de G. lucidum (MAK), mientras que 102 pacientes no recibieron tratamiento con MAK. A los 12 meses, se someti\u00f3 a todos los pacientes a una [colonoscopia](/Common/PopUps/popDefinition.aspx?id=45648&version=patient&language=Spanish&dictionary=Cancer.gov)de [seguimiento](/Common/PopUps/popDefinition.aspx?id=44671&version=patient&language=Spanish&dictionary=Cancer.gov). El n\u00famero y el tama\u00f1o de los tumores disminuy\u00f3 en el grupo que recibi\u00f3 MAK, pero no en el grupo que no recibi\u00f3 MAK. Los investigadores indican que es posible que MAK ayude a impedir que se formen tumores colorrectales benignos.\n- En un\n- \u00bfLa Administraci\u00f3n de Alimentos y Medicamentos de los Estados Unidos (FDA) aprob\u00f3 el uso del reishi para el tratamiento del c\u00e1ncer?\nLa\n[Administraci\u00f3n de Alimentos y Medicamentos de los Estados Unidos](/Common/PopUps/popDefinition.aspx?id=454785&version=patient&language=Spanish&dictionary=Cancer.gov)(FDA) no aprob\u00f3 el uso del reishi como tratamiento del c\u00e1ncer o de ninguna otra [afecci\u00f3n](/Common/PopUps/popDefinition.aspx?id=651193&version=patient&language=Spanish&dictionary=Cancer.gov).\nLa FDA no aprueba los\n[suplementos alimentarios](/Common/PopUps/popDefinition.aspx?id=373932&version=patient&language=Spanish&dictionary=Cancer.gov)ni determina la inocuidad o eficacia de los mismos. El fabricante se responsabiliza por asegurarse de que el producto no sea peligroso y de que las etiquetas incluyan informaci\u00f3n real que no sea enga\u00f1osa para el consumidor. Debido a que la FDA no reglamenta la elaboraci\u00f3n de los suplementos, es probable que haya diferencias entre los lotes y las marcas de suplementos de hongos.\nInformaci\u00f3n sobre este sumario del PDQ\nInformaci\u00f3n sobre el PDQ\nEl Physician Data Query (PDQ) es la base de datos integral del Instituto Nacional del C\u00e1ncer (NCI). La base de datos del PDQ contiene sumarios de la \u00faltima informaci\u00f3n publicada sobre prevenci\u00f3n, detecci\u00f3n, gen\u00e9tica, tratamiento, cuidados m\u00e9dicos de apoyo, y medicina complementaria y alternativa relacionada con el c\u00e1ncer. La mayor\u00eda de los sumarios se redactan en dos versiones. En las versiones para profesionales de la salud se ofrece informaci\u00f3n detallada en lenguaje t\u00e9cnico. Las versiones para pacientes se presentan en un lenguaje f\u00e1cil de comprender, que no es t\u00e9cnico. Ambas versiones contienen informaci\u00f3n sobre el c\u00e1ncer que es exacta y actualizada. Tambi\u00e9n es posible consultar estos sumarios en\n[ingl\u00e9s](https://www.cancer.gov/publications/pdq).\nEl PDQ es uno de los servicios del NCI. El NCI pertenece a los Institutos Nacionales de la Salud (NIH). Los NIH son el centro de investigaci\u00f3n biom\u00e9dica del gobierno federal. Los sumarios del PDQ se basan en un an\u00e1lisis independiente de las publicaciones m\u00e9dicas. No constituyen declaraciones de la pol\u00edtica del NCI ni de los NIH.\nProp\u00f3sito de este sumario\nEste sumario del PDQ sobre el c\u00e1ncer contiene informaci\u00f3n actualizada sobre el uso de los hongos medicinales como tratamiento para las personas con c\u00e1ncer. El prop\u00f3sito es informar y ayudar a los pacientes, las familias y las personas encargadas de cuidar a los pacientes. No provee pautas ni recomendaciones formales para tomar decisiones relacionadas con la atenci\u00f3n de la salud.\nRevisores y actualizaciones\nLos Consejos editoriales redactan los sumarios de informaci\u00f3n sobre el c\u00e1ncer del PDQ y los actualizan. Estos Consejos est\u00e1n integrados por expertos en el tratamiento del c\u00e1ncer y otras especialidades relacionadas con esta enfermedad. Los sumarios se revisan con regularidad y se modifican si surge informaci\u00f3n nueva. La fecha de actualizaci\u00f3n al pie de cada sumario indica cu\u00e1ndo se hizo el cambio m\u00e1s reciente.\nLa informaci\u00f3n en este sumario para pacientes se basa en la versi\u00f3n para profesionales de la salud, que el\n[Consejo editorial del PDQ\u00ae sobre las terapias integrales, alternativas y complementarias](https://www.cancer.gov/espanol/publicaciones/pdq/consejos-editoriales/medicina-complementaria-alternativa) revisa con regularidad y actualiza en caso necesario.\nInformaci\u00f3n sobre ensayos cl\u00ednicos\nUn ensayo cl\u00ednico es un estudio para responder a una pregunta cient\u00edfica; por ejemplo, si un tratamiento es mejor que otro. Los ensayos se basan en estudios anteriores y lo que se aprendi\u00f3 en el laboratorio. Cada ensayo responde a ciertas preguntas cient\u00edficas dirigidas a encontrar formas nuevas y mejores de ayudar a los pacientes de c\u00e1ncer. Durante los ensayos cl\u00ednicos de tratamiento, se recopila informaci\u00f3n sobre los efectos de un tratamiento nuevo y su eficacia. Si un ensayo cl\u00ednico indica que un tratamiento nuevo es mejor que el tratamiento est\u00e1ndar, el tratamiento nuevo se puede convertir en \"est\u00e1ndar\". Los pacientes podr\u00edan considerar la participaci\u00f3n en un ensayo cl\u00ednico. Algunos ensayos cl\u00ednicos solo aceptan a pacientes que a\u00fan no comenzaron un tratamiento.\nLa lista en ingl\u00e9s de ensayos cl\u00ednicos est\u00e1 disponible en el\n[portal de Internet del NCI](https://www.cancer.gov/espanol/cancer/tratamiento/estudios-clinicos). Para obtener m\u00e1s informaci\u00f3n, llamar al [Servicio de Informaci\u00f3n de C\u00e1ncer](https://www.cancer.gov/espanol/contactenos/centro-de-contacto) (CIS), centro de contacto del NCI, al 1-800-422-6237 (1-800-4-CANCER).\nPermisos para el uso de este sumario\nPDQ (Physician Data Query) es una marca registrada. Se autoriza el libre uso del texto de los documentos del PDQ. Sin embargo, no se podr\u00e1 identificar como un sumario de informaci\u00f3n sobre c\u00e1ncer del PDQ del NCI, salvo que se reproduzca en su totalidad y se actualice con regularidad. Por otra parte, se permitir\u00e1 que un autor escriba una oraci\u00f3n como \u201cEn el sumario del PDQ del NCI de informaci\u00f3n sobre la prevenci\u00f3n del c\u00e1ncer de mama se describen, en breve, los siguientes riesgos: [incluir fragmento del sumario]\u201d.\nSe sugiere citar la referencia bibliogr\u00e1fica de este sumario del PDQ de la siguiente forma:\nPDQ\u00ae . PDQ Hongos medicinales. Bethesda, MD: National Cancer Institute. Actualizaci\u00f3n: <MM/DD/YYYY>. Disponible en:\n[https://www.cancer.gov/espanol/cancer/tratamiento/mca/paciente/hongos-pdq](https://www.cancer.gov/espanol/cancer/tratamiento/mca/paciente/hongos-pdq). Fecha de acceso: <MM/DD/YYYY>.\nLas im\u00e1genes en este sumario se reproducen con el permiso del autor, el artista o la editorial para uso exclusivo en los sumarios del PDQ. La utilizaci\u00f3n de las im\u00e1genes fuera del PDQ requiere la autorizaci\u00f3n del propietario, que el Instituto Nacional del C\u00e1ncer no puede otorgar. Para obtener m\u00e1s informaci\u00f3n sobre el uso de las ilustraciones de este sumario o de otras im\u00e1genes relacionadas con el c\u00e1ncer, consultar\n[Visuals Online](https://visualsonline.cancer.gov/), una colecci\u00f3n de m\u00e1s de 3000 im\u00e1genes cient\u00edficas.\nCl\u00e1usula sobre el descargo de responsabilidad\nLa informaci\u00f3n en estos sumarios no debe fundamentar ninguna decisi\u00f3n sobre reintegros de seguros. Para obtener m\u00e1s informaci\u00f3n sobre cobertura de seguros, consultar la p\u00e1gina\n[Manejo de la atenci\u00f3n del c\u00e1ncer](https://www.cancer.gov/espanol/cancer/manejo-del-cancer) disponible en Cancer.gov/espanol.\nPara obtener m\u00e1s informaci\u00f3n\nEn Cancer.gov/espanol, se ofrece m\u00e1s informaci\u00f3n sobre c\u00f3mo comunicarse o recibir ayuda en\n[\u00bfEn qu\u00e9 podemos ayudarle?](https://www.cancer.gov/espanol/contactenos). Tambi\u00e9n puede enviar un mensaje de correo electr\u00f3nico mediante el [formulario de comunicaci\u00f3n](https://www.cancer.gov/espanol/contactenos/correo-electronico).\nInformaci\u00f3n general sobre medicina complementaria y alternativa\nLa medicina complementaria y alternativa (MCA), que tambi\u00e9n se llama medicina integral, comprende una gran variedad de filosof\u00edas, enfoques y tratamientos de sanaci\u00f3n. En general, se dice que una terapia es complementaria cuando se a\u00f1ade a un tratamiento convencional; se llama alternativa cuando lo remplaza. (Los tratamientos convencionales son aquellos que la comunidad m\u00e9dica establecida acepta y practica). Las terapias se consideran complementarias o alternativas, seg\u00fan la forma en que se utilicen. El prop\u00f3sito de las terapias complementarias o alternativas es prevenir enfermedades, reducir la tensi\u00f3n, evitar o disminuir los efectos secundarios y los s\u00edntomas, y controlar o curar enfermedades.\nA diferencia de los tratamientos convencionales para el c\u00e1ncer, es com\u00fan que las compa\u00f1\u00edas de seguro no ofrezcan cobertura para las terapias complementarias y alternativas. Los pacientes deben confirmar si su seguro m\u00e9dico cubre estas terapias.\nLos pacientes de c\u00e1ncer que piensen en utilizar terapias complementarias o alternativas, deben hablar sobre esta decisi\u00f3n con su m\u00e9dico, enfermero o farmac\u00e9utico del mismo modo que lo har\u00edan con cualquier otro tratamiento. Algunas terapias interfieren en el tratamiento est\u00e1ndar o causan da\u00f1o cuando se usan al mismo tiempo.\nEvaluaci\u00f3n de los tratamientos de medicina complementaria y alternativa\nEs importante que los tratamientos de MCA se sometan a los mismos m\u00e9todos cient\u00edficos que se emplean para poner a prueba los tratamientos convencionales. El Instituto Nacional del C\u00e1ncer (NCI) y el Centro Nacional de Salud Complementaria e Integral (NCCIH) patrocinan varios ensayos cl\u00ednicos (estudios de investigaci\u00f3n) en centros m\u00e9dicos para probar el uso de los tratamientos de MCA para el c\u00e1ncer.\nEn general, se estudian la inocuidad y eficacia de los abordajes convencionales para tratar el c\u00e1ncer mediante un proceso cient\u00edfico que incluye ensayos cl\u00ednicos con un gran n\u00famero de pacientes. Se sabe menos acerca de la inocuidad y la eficacia de los m\u00e9todos complementarios y alternativos. Muy pocas terapias de MCA se han examinado con m\u00e9todos cient\u00edficos rigurosos. En ciertos casos, las terapias de MCA que antes solo se consideraban alternativas se est\u00e1n incorporando poco a poco en el tratamiento del c\u00e1ncer: no como curas, sino como terapias complementarias que tal vez ayuden a los pacientes a sentirse mejor y recuperarse m\u00e1s pronto. Un ejemplo de esto es la acupuntura. En noviembre de 1997, un grupo de expertos de los Institutos Nacionales de la Salud (NIH), anunci\u00f3 que se hab\u00eda comprobado que la acupuntura ayuda a controlar las n\u00e1useas y los v\u00f3mitos provocados por la quimioterapia, y el dolor relacionado con la cirug\u00eda. Por otra parte, en el caso de otros abordajes, como el uso del laetrilo, se hall\u00f3 que no surten efecto e incluso podr\u00edan causar da\u00f1o.\n[The NCI Best Case Series Program](https://cam.cancer.gov/indentifying_novel_cam_therapies/best_case_series_program.htm) (disponible solo en ingl\u00e9s), se estableci\u00f3 en 1991, y es un proceso para estudiar los abordajes de MCA que se encuentran en pr\u00e1ctica. La Oficina de Medicina Complementaria y Alternativa para el C\u00e1ncer (OCCAM) del NCI supervisa este programa. Mediante este proceso, los profesionales de la salud que emplean terapias alternativas en el tratamiento del c\u00e1ncer env\u00edan a la OCCAM los antecedentes m\u00e9dicos de sus pacientes y otros materiales relacionados. La OCCAM hace una revisi\u00f3n minuciosa de los materiales y decide si hay terapias que merecen m\u00e1s investigaci\u00f3n.\nPreguntas para su proveedor de salud sobre la medicina complementaria y alternativa\nCuando los pacientes est\u00e1n tomando en cuenta los tratamientos complementarios y alternativos, deben hacer las siguientes preguntas a su proveedor de atenci\u00f3n de la salud:\n- \u00bfQu\u00e9 efectos secundarios se pueden esperar?\n- \u00bfCu\u00e1les son los riesgos relacionados con este tratamiento?\n- \u00bfLos beneficios son mayores que los riesgos?\n- \u00bfQu\u00e9 beneficios se deben esperar de este tratamiento?\n- \u00bfEl tratamiento puede interferir con el tratamiento convencional?\n- \u00bfEste tratamiento es parte de un ensayo cl\u00ednico?\n- De ser as\u00ed, \u00bfqui\u00e9n patrocina este ensayo?\n- \u00bfMi seguro cubre este tratamiento?\nInformaci\u00f3n adicional\nCentro Nacional de Salud Complementaria e Integral\nEl Centro Nacional de Salud Complementaria e Integral (NCCIH) de los Institutos Nacionales de la Salud (NIH) facilita la investigaci\u00f3n y evaluaci\u00f3n de las pr\u00e1cticas complementarias y alternativas y ofrece informaci\u00f3n acerca de una variedad de enfoques para los profesionales de la salud y el p\u00fablico en general.\n- Centro de Informaci\u00f3n del NCCIH\n- Post Office Box 7923 Gaithersburg, MD 20898-7923\n- Tel\u00e9fono: 1-888-644-6226 (l\u00ednea gratuita)\n- TTY (para personas sordas o con dificultades auditivas): 1-866-464-3615\n- E-mail: info@nccih.nih.gov\n- Portal de Internet:\n[https://nccih.nih.gov/health/espanol](https://nccih.nih.gov/health/espanol?lang=es)\nMedicina complementaria y alternativa en PubMed\nEl NCCIH y la Biblioteca Nacional de Medicina (NLM) de los NIH crearon juntos\n[CAM on PubMed](https://nccih.nih.gov/research/camonpubmed) (disponible en ingl\u00e9s), una herramienta de b\u00fasqueda gratuita y f\u00e1cil de usar para encontrar citas de revistas cient\u00edficas sobre medicina complementaria y alternativa. CAM on PubMed es un subgrupo de la base de datos bibliogr\u00e1ficos PubMed de la NLM que cuenta con m\u00e1s de 230 000 referencias y res\u00famenes de art\u00edculos sobre medicina complementaria y alternativa publicados en revistas cient\u00edficas. Esta base de datos tambi\u00e9n tiene enlaces a las p\u00e1ginas de Internet de m\u00e1s de 1800 revistas, lo que ofrece a los usuarios acceso a los art\u00edculos completos. (Es posible que deba pagar una suscripci\u00f3n u otro cargo para leer los art\u00edculos completos).\nOficina de Medicina Complementaria y Alternativa para el C\u00e1ncer\nLa Oficina de Medicina Complementaria y Alternativa para el C\u00e1ncer (OCCAM) del NCI coordina las actividades del NCI en el \u00e1rea de la medicina complementaria y alternativa (MCA). La OCCAM fomenta la investigaci\u00f3n sobre la MCA para el c\u00e1ncer y ofrece informaci\u00f3n a los profesionales de la salud y al p\u00fablico en general en el\n[portal de Internet del NCI](https://www.cancer.gov/espanol).\nServicio de Informaci\u00f3n de C\u00e1ncer del Instituto Nacional del C\u00e1ncer\nEn los Estados Unidos, llame a la l\u00ednea gratuita del\n[Servicio de Informaci\u00f3n de C\u00e1ncer](https://www.cancer.gov/espanol/contactenos/centro-de-contacto) (CIS), centro de contacto del Instituto Nacional del C\u00e1ncer (NCI): 1-800-422-6237 (1-800-4-CANCER) de lunes a viernes, de 9:00 a. m. a 9:00 p. m. Un especialista capacitado en informaci\u00f3n sobre el c\u00e1ncer estar\u00e1 disponible para contestar sus preguntas.\nAdministraci\u00f3n de Alimentos y Medicamentos de los Estados Unidos\nLa Administraci\u00f3n de Alimentos y Medicamentos de los Estados Unidos (FDA) reglamenta los medicamentos y los dispositivos m\u00e9dicos para asegurar que sean inocuos y eficaces.\n- Food and Drug Administration\n- 10903 New Hampshire Avenue\n- Silver Spring, MD 20993\n- Tel\u00e9fono: 1-888-463-6332 (l\u00ednea gratuita)\n- Portal de Internet:\n[http://www.fda.gov](https://www.fda.gov/aboutfda/enespanol/default.htm)\nComisi\u00f3n Federal de Comercio\nLa Comisi\u00f3n Federal de Comercio (FTC) hace cumplir las leyes de protecci\u00f3n al consumidor. Las siguientes son algunas de las publicaciones disponibles de este organismo:\n- Cuidando su Salud: Fuentes de Informaci\u00f3n sobre Productos y Servicios para la Salud\n- Fraudulent Health Claims: Don\u2019t Be Fooled\n- Consumer Response Center\n- Federal Trade Commission\n- 600 Pennsylvania Avenue, NW\n- Washington, DC 20580\n- Tel\u00e9fono: 1-877-382-4357 (1-877-FTC-HELP) (l\u00ednea gratuita)\n- TTY (para personas sordas o con dificultades auditivas): 202-326-2502\n- Portal de Internet:\n[http://www.ftc.gov/es](https://www.ftc.gov/es)", "language": null, "image": null, "pagetype": "Website", "links": ["#main-content", "/about-cancer/treatment/cam/patient/mushrooms-pdq", "/espanol", "/espanol/cancer", "/espanol/tipos", "/espanol/investigacion", "/espanol/subvenciones-capacitacion", "/espanol/noticias", "/espanol/instituto", "/espanol", "/espanol/cancer", "/espanol/cancer/tratamiento", "/espanol/cancer/tratamiento/mca", "/espanol/cancer/tratamiento/mca/paciente", "mailto:?subject=Informaci\u00f3n del portal de Internet del Instituto Nacional del C\u00e1ncer &body=Encontr\u00e9 esta informaci\u00f3n en cancer.gov/espanol y quiero compartirla contigo: https://www.cancer.gov/espanol/cancer/tratamiento/mca/paciente/hongos-pdq %0D%0A%0D%0A El sitio web del Instituto Nacional del C\u00e1ncer (NCI), www.cancer.gov/espanol, provee informaci\u00f3n precisa, al d\u00eda y completa de la dependencia principal del gobierno de EE. UU. sobre investigaci\u00f3n de c\u00e1ncer. Si tiene preguntas o necesita m\u00e1s informaci\u00f3n, le invitamos a que se comunique en espa\u00f1ol con el servicio de mensajer\u00eda instant\u00e1nea LiveHelp del NCI en https://livehelp-es.cancer.gov, o llame el Centro de Contacto del NCI al 1-800-422-6237 (1-800-4-CANCER) sin cargos en los Estados Unidos.", "/espanol/cancer/tratamiento", "/espanol/cancer/tratamiento/tipos", "/espanol/cancer/tratamiento/efectos-secundarios", "/espanol/cancer/tratamiento/estudios-clinicos", "/espanol/cancer/tratamiento/medicamentos", "/espanol/cancer/tratamiento/mca", "/espanol/cancer/tratamiento/mca/paciente", "/espanol/cancer/tratamiento/mca/pro", "/espanol/cancer/tratamiento/preguntas", "/espanol/cancer/tratamiento/investigacion", "#_1", "#_3", "#_51", "#_AboutThis_1", "#_AboutIACT_2", "#_AboutIACT_6", "#_QandA_2", "#_ToLearnMore_2", "/espanol/cancer/tratamiento/mca/pro/hongos-pdq", "/Common/PopUps/popDefinition.aspx?id=348921&version=patient&language=Spanish&dictionary=Cancer.gov", "/Common/PopUps/popDefinition.aspx?id=45364&version=patient&language=Spanish&dictionary=Cancer.gov", "/Common/PopUps/popDefinition.aspx?id=270740&version=patient&language=Spanish&dictionary=Cancer.gov", "/Common/PopUps/popDefinition.aspx?id=45333&version=patient&language=Spanish&dictionary=Cancer.gov", "/Common/PopUps/popDefinition.aspx?id=44930&version=patient&language=Spanish&dictionary=Cancer.gov", "/Common/PopUps/popDefinition.aspx?id=44295&version=patient&language=Spanish&dictionary=Cancer.gov", "/Common/PopUps/popDefinition.aspx?id=45214&version=patient&language=Spanish&dictionary=Cancer.gov", "/Common/PopUps/popDefinition.aspx?id=46356&version=patient&language=Spanish&dictionary=Cancer.gov", "/Common/PopUps/popDefinition.aspx?id=46634&version=patient&language=Spanish&dictionary=Cancer.gov", "/Common/PopUps/popDefinition.aspx?id=46476&version=patient&language=Spanish&dictionary=Cancer.gov", "/Common/PopUps/popDefinition.aspx?id=422394&version=patient&language=Spanish&dictionary=Cancer.gov", "/Common/PopUps/popDefinition.aspx?id=643008&version=patient&language=Spanish&dictionary=Cancer.gov", "/Common/PopUps/popDefinition.aspx?id=44162&version=patient&language=Spanish&dictionary=Cancer.gov", "/Common/PopUps/popDefinition.aspx?id=44147&version=patient&language=Spanish&dictionary=Cancer.gov", "/Common/PopUps/popDefinition.aspx?id=44271&version=patient&language=Spanish&dictionary=Cancer.gov", "/Common/PopUps/popDefinition.aspx?id=454774&version=patient&language=Spanish&dictionary=Cancer.gov", "/Common/PopUps/popDefinition.aspx?id=44512&version=patient&language=Spanish&dictionary=Cancer.gov", "/Common/PopUps/popDefinition.aspx?id=45961&version=patient&language=Spanish&dictionary=Cancer.gov", "/Common/PopUps/popDefinition.aspx?id=46580&version=patient&language=Spanish&dictionary=Cancer.gov", "/Common/PopUps/popDefinition.aspx?id=454785&version=patient&language=Spanish&dictionary=Cancer.gov", "/Common/PopUps/popDefinition.aspx?id=44724&version=patient&language=Spanish&dictionary=Cancer.gov", "/Common/PopUps/popDefinition.aspx?id=449722&version=patient&language=Spanish&dictionary=Cancer.gov", "/Common/PopUps/popDefinition.aspx?id=44571&version=patient&language=Spanish&dictionary=Cancer.gov", "/Common/PopUps/popDefinition.aspx?id=270740&version=patient&language=Spanish&dictionary=Cancer.gov", "/Common/PopUps/popDefinition.aspx?id=46356&version=patient&language=Spanish&dictionary=Cancer.gov", "/Common/PopUps/popDefinition.aspx?id=44930&version=patient&language=Spanish&dictionary=Cancer.gov", "/Common/PopUps/popDefinition.aspx?id=45333&version=patient&language=Spanish&dictionary=Cancer.gov", "/Common/PopUps/popDefinition.aspx?id=44162&version=patient&language=Spanish&dictionary=Cancer.gov", "/Common/PopUps/popDefinition.aspx?id=422394&version=patient&language=Spanish&dictionary=Cancer.gov", "/Common/PopUps/popDefinition.aspx?id=455334&version=patient&language=Spanish&dictionary=Cancer.gov", "/Common/PopUps/popDefinition.aspx?id=44512&version=patient&language=Spanish&dictionary=Cancer.gov", "/Common/PopUps/popDefinition.aspx?id=46476&version=patient&language=Spanish&dictionary=Cancer.gov", "/Common/PopUps/popDefinition.aspx?id=46634&version=patient&language=Spanish&dictionary=Cancer.gov", "/Common/PopUps/popDefinition.aspx?id=454774&version=patient&language=Spanish&dictionary=Cancer.gov", "/Common/PopUps/popDefinition.aspx?id=348921&version=patient&language=Spanish&dictionary=Cancer.gov", "/Common/PopUps/popDefinition.aspx?id=44062&version=patient&language=Spanish&dictionary=Cancer.gov", "/Common/PopUps/popDefinition.aspx?id=44928&version=patient&language=Spanish&dictionary=Cancer.gov", "/espanol/cancer/tratamiento/mca/pro/hongos-pdq#_138", "/Common/PopUps/popDefinition.aspx?id=445087&version=patient&language=Spanish&dictionary=Cancer.gov", "/Common/PopUps/popDefinition.aspx?id=444971&version=patient&language=Spanish&dictionary=Cancer.gov", "/Common/PopUps/popDefinition.aspx?id=444983&version=patient&language=Spanish&dictionary=Cancer.gov", "/Common/PopUps/popDefinition.aspx?id=445043&version=patient&language=Spanish&dictionary=Cancer.gov", "/Common/PopUps/popDefinition.aspx?id=45587&version=patient&language=Spanish&dictionary=Cancer.gov", "/Common/PopUps/popDefinition.aspx?id=46580&version=patient&language=Spanish&dictionary=Cancer.gov", "/Common/PopUps/popDefinition.aspx?id=45214&version=patient&language=Spanish&dictionary=Cancer.gov", "/Common/PopUps/popDefinition.aspx?id=45858&version=patient&language=Spanish&dictionary=Cancer.gov", "/Common/PopUps/popDefinition.aspx?id=45570&version=patient&language=Spanish&dictionary=Cancer.gov", "/Common/PopUps/popDefinition.aspx?id=46374&version=patient&language=Spanish&dictionary=Cancer.gov", "/Common/PopUps/popDefinition.aspx?id=45765&version=patient&language=Spanish&dictionary=Cancer.gov", "/Common/PopUps/popDefinition.aspx?id=270735&version=patient&language=Spanish&dictionary=Cancer.gov", "/Common/PopUps/popDefinition.aspx?id=45862&version=patient&language=Spanish&dictionary=Cancer.gov", "/Common/PopUps/popDefinition.aspx?id=44014&version=patient&language=Spanish&dictionary=Cancer.gov", "/Common/PopUps/popDefinition.aspx?id=45611&version=patient&language=Spanish&dictionary=Cancer.gov", "/Common/PopUps/popDefinition.aspx?id=44168&version=patient&language=Spanish&dictionary=Cancer.gov", "/Common/PopUps/popDefinition.aspx?id=45022&version=patient&language=Spanish&dictionary=Cancer.gov", "/Common/PopUps/popDefinition.aspx?id=45417&version=patient&language=Spanish&dictionary=Cancer.gov", "/Common/PopUps/popDefinition.aspx?id=45891&version=patient&language=Spanish&dictionary=Cancer.gov", "/Common/PopUps/popDefinition.aspx?id=45892&version=patient&language=Spanish&dictionary=Cancer.gov", "/Common/PopUps/popDefinition.aspx?id=46683&version=patient&language=Spanish&dictionary=Cancer.gov", "/Common/PopUps/popDefinition.aspx?id=44160&version=patient&language=Spanish&dictionary=Cancer.gov", "/Common/PopUps/popDefinition.aspx?id=45721&version=patient&language=Spanish&dictionary=Cancer.gov", "/Common/PopUps/popDefinition.aspx?id=45022&version=patient&language=Spanish&dictionary=Cancer.gov", "/Common/PopUps/popDefinition.aspx?id=454785&version=patient&language=Spanish&dictionary=Cancer.gov", "/Common/PopUps/popDefinition.aspx?id=651193&version=patient&language=Spanish&dictionary=Cancer.gov", "/Common/PopUps/popDefinition.aspx?id=373932&version=patient&language=Spanish&dictionary=Cancer.gov", "/Common/PopUps/popDefinition.aspx?id=44724&version=patient&language=Spanish&dictionary=Cancer.gov", "/Common/PopUps/popDefinition.aspx?id=449722&version=patient&language=Spanish&dictionary=Cancer.gov", "/Common/PopUps/popDefinition.aspx?id=482419&version=patient&language=Spanish&dictionary=Cancer.gov", "/Common/PopUps/popDefinition.aspx?id=46356&version=patient&language=Spanish&dictionary=Cancer.gov", "/Common/PopUps/popDefinition.aspx?id=45333&version=patient&language=Spanish&dictionary=Cancer.gov", "/Common/PopUps/popDefinition.aspx?id=45214&version=patient&language=Spanish&dictionary=Cancer.gov", "/Common/PopUps/popDefinition.aspx?id=44971&version=patient&language=Spanish&dictionary=Cancer.gov", "/Common/PopUps/popDefinition.aspx?id=407760&version=patient&language=Spanish&dictionary=Cancer.gov", "/Common/PopUps/popDefinition.aspx?id=455334&version=patient&language=Spanish&dictionary=Cancer.gov", "/Common/PopUps/popDefinition.aspx?id=44512&version=patient&language=Spanish&dictionary=Cancer.gov", "/Common/PopUps/popDefinition.aspx?id=46476&version=patient&language=Spanish&dictionary=Cancer.gov", "/Common/PopUps/popDefinition.aspx?id=46634&version=patient&language=Spanish&dictionary=Cancer.gov", "/Common/PopUps/popDefinition.aspx?id=454774&version=patient&language=Spanish&dictionary=Cancer.gov", "/Common/PopUps/popDefinition.aspx?id=348921&version=patient&language=Spanish&dictionary=Cancer.gov", "/Common/PopUps/popDefinition.aspx?id=44162&version=patient&language=Spanish&dictionary=Cancer.gov", "/Common/PopUps/popDefinition.aspx?id=445043&version=patient&language=Spanish&dictionary=Cancer.gov", "/espanol/cancer/tratamiento/mca/pro/hongos-pdq#_138", "/Common/PopUps/popDefinition.aspx?id=45587&version=patient&language=Spanish&dictionary=Cancer.gov", "/Common/PopUps/popDefinition.aspx?id=285990&version=patient&language=Spanish&dictionary=Cancer.gov", "/Common/PopUps/popDefinition.aspx?id=478743&version=patient&language=Spanish&dictionary=Cancer.gov", "/Common/PopUps/popDefinition.aspx?id=44696&version=patient&language=Spanish&dictionary=Cancer.gov", "/Common/PopUps/popDefinition.aspx?id=44951&version=patient&language=Spanish&dictionary=Cancer.gov", "/Common/PopUps/popDefinition.aspx?id=45722&version=patient&language=Spanish&dictionary=Cancer.gov", "/Common/PopUps/popDefinition.aspx?id=45765&version=patient&language=Spanish&dictionary=Cancer.gov", "/Common/PopUps/popDefinition.aspx?id=44062&version=patient&language=Spanish&dictionary=Cancer.gov", "/Common/PopUps/popDefinition.aspx?id=270735&version=patient&language=Spanish&dictionary=Cancer.gov", "/Common/PopUps/popDefinition.aspx?id=439419&version=patient&language=Spanish&dictionary=Cancer.gov", "/Common/PopUps/popDefinition.aspx?id=45614&version=patient&language=Spanish&dictionary=Cancer.gov", "/Common/PopUps/popDefinition.aspx?id=45648&version=patient&language=Spanish&dictionary=Cancer.gov", "/Common/PopUps/popDefinition.aspx?id=44671&version=patient&language=Spanish&dictionary=Cancer.gov", "/Common/PopUps/popDefinition.aspx?id=454785&version=patient&language=Spanish&dictionary=Cancer.gov", "/Common/PopUps/popDefinition.aspx?id=651193&version=patient&language=Spanish&dictionary=Cancer.gov", "/Common/PopUps/popDefinition.aspx?id=373932&version=patient&language=Spanish&dictionary=Cancer.gov", "https://www.cancer.gov/publications/pdq", "https://www.cancer.gov/espanol/publicaciones/pdq/consejos-editoriales/medicina-complementaria-alternativa", "https://www.cancer.gov/espanol/cancer/tratamiento/estudios-clinicos", "https://www.cancer.gov/espanol/contactenos/centro-de-contacto", "https://www.cancer.gov/espanol/cancer/tratamiento/mca/paciente/hongos-pdq", "https://visualsonline.cancer.gov/", "https://www.cancer.gov/espanol/cancer/manejo-del-cancer", "https://www.cancer.gov/espanol/contactenos", "https://www.cancer.gov/espanol/contactenos/correo-electronico", "https://cam.cancer.gov/indentifying_novel_cam_therapies/best_case_series_program.htm", "https://nccih.nih.gov/health/espanol?lang=es", "https://nccih.nih.gov/research/camonpubmed", "https://www.cancer.gov/espanol", "https://www.cancer.gov/espanol/contactenos/centro-de-contacto", "https://www.fda.gov/aboutfda/enespanol/default.htm", "https://www.ftc.gov/es", "/espanol/politicas/derechos-de-autor-y-uso", "/espanol/sindicacion", "mailto:?subject=Informaci\u00f3n del portal de Internet del Instituto Nacional del C\u00e1ncer &body=Encontr\u00e9 esta informaci\u00f3n en cancer.gov/espanol y quiero compartirla contigo: https://www.cancer.gov/espanol/cancer/tratamiento/mca/paciente/hongos-pdq %0D%0A%0D%0A El sitio web del Instituto Nacional del C\u00e1ncer (NCI), www.cancer.gov/espanol, provee informaci\u00f3n precisa, al d\u00eda y completa de la dependencia principal del gobierno de EE. UU. sobre investigaci\u00f3n de c\u00e1ncer. Si tiene preguntas o necesita m\u00e1s informaci\u00f3n, le invitamos a que se comunique en espa\u00f1ol con el servicio de mensajer\u00eda instant\u00e1nea LiveHelp del NCI en https://livehelp-es.cancer.gov, o llame el Centro de Contacto del NCI al 1-800-422-6237 (1-800-4-CANCER) sin cargos en los Estados Unidos.", "#top", "/espanol/acerca-sitio", "/", "/espanol/politicas/derechos-de-autor-y-uso", "/espanol/redes-sociales", "/espanol/contactenos", "/espanol/publicaciones", "/espanol/publicaciones/diccionarios/diccionario-cancer", "/espanol/politicas/accesibilidad", "/espanol/politicas/foia", "/espanol/politicas/confidencialidad-seguridad", "/espanol/politicas/exoneracion", "https://www.hhs.gov/es/vulnerability-disclosure-policy/index.html", "https://livehelp-es.cancer.gov/", "tel:1-800-422-6237", "mailto:NCIinfo@nih.gov", "https://www.facebook.com/cancer.govEspanol", "https://twitter.com/NCIespanol", "https://www.youtube.com/playlist?list=PLYKy4VbxNln7Cy6K2hZvwHLIZAElio5ai", "https://www.hhs.gov/", "https://salud.nih.gov/", "https://www.cancer.gov/espanol", "https://www.usa.gov/espanol/"]}