{"title": "Vitamina C intravenosa", "author": null, "url": "https://www.cancer.gov/espanol/cancer/tratamiento/mca/paciente/vitamina-c-pdq", "hostname": "cancer.gov", "description": "Resumen de informaci\u00f3n revisada por expertos sobre el uso de vitamina C intravenosa como tratamiento para personas con c\u00e1ncer.", "sitename": "Instituto Nacional del C\u00e1ncer", "date": "2015-07-01", "id": null, "license": null, "body": null, "comments": "", "commentsbody": null, "raw_text": null, "text": "Vitamina C intravenosa (PDQ\u00ae)\u2013Versi\u00f3n para pacientes\nAspectos generales\n- La\n[vitamina C](/Common/PopUps/popDefinition.aspx?id=439435&version=patient&language=Spanish&dictionary=Cancer.gov)es un [nutriente](/Common/PopUps/popDefinition.aspx?id=44697&version=patient&language=Spanish&dictionary=Cancer.gov)que se encuentra en los alimentos y en los [suplementos alimentarios](/Common/PopUps/popDefinition.aspx?id=373932&version=patient&language=Spanish&dictionary=Cancer.gov). Es un [antioxidante](/Common/PopUps/popDefinition.aspx?id=43997&version=patient&language=Spanish&dictionary=Cancer.gov)que tambi\u00e9n cumple una funci\u00f3n importante en la elaboraci\u00f3n del [col\u00e1geno](/Common/PopUps/popDefinition.aspx?id=44196&version=patient&language=Spanish&dictionary=Cancer.gov)(vea la [Pregunta 1](/espanol/cancer/tratamiento/mca/paciente/vitamina-c-pdq#_5)).\n- La vitamina C se administra por boca o por\n[infusi\u00f3n intravenosa](/Common/PopUps/popDefinition.aspx?id=520363&version=patient&language=Spanish&dictionary=Cancer.gov)(IV). Cuando se administra por infusi\u00f3n intravenosa, la vitamina C alcanza concentraciones m\u00e1s altas en la [sangre](/Common/PopUps/popDefinition.aspx?id=270735&version=patient&language=Spanish&dictionary=Cancer.gov)que la misma cantidad tomada por la boca (vea la [Pregunta 2](/espanol/cancer/tratamiento/mca/paciente/vitamina-c-pdq#_17)).\n- En algunos estudios, se observ\u00f3 que el uso de la vitamina C intravenosa en personas con c\u00e1ncer mejor\u00f3 la\n[calidad de vida](/Common/PopUps/popDefinition.aspx?id=45417&version=patient&language=Spanish&dictionary=Cancer.gov)y disminuy\u00f3 los [efectos secundarios](/Common/PopUps/popDefinition.aspx?id=46580&version=patient&language=Spanish&dictionary=Cancer.gov)relacionados con el c\u00e1ncer (vea la [Pregunta 4](/espanol/cancer/tratamiento/mca/paciente/vitamina-c-pdq#_19)).\n- En general, la vitamina C administrada por infusi\u00f3n intravenosa caus\u00f3 muy pocos efectos secundarios en los\n[ensayos cl\u00ednicos](/Common/PopUps/popDefinition.aspx?id=45961&version=patient&language=Spanish&dictionary=Cancer.gov). Sin embargo, es posible que la vitamina C intravenosa cause efectos secundarios graves en personas con enfermedad del [ri\u00f1\u00f3n](/Common/PopUps/popDefinition.aspx?id=46325&version=patient&language=Spanish&dictionary=Cancer.gov), [deficiencia de G6PD](/Common/PopUps/popDefinition.aspx?id=748115&version=patient&language=Spanish&dictionary=Cancer.gov)o [hemocromatosis](/Common/PopUps/popDefinition.aspx?id=446804&version=patient&language=Spanish&dictionary=Cancer.gov)(vea la [Pregunta 5](/espanol/cancer/tratamiento/mca/paciente/vitamina-c-pdq#_20)).\n- La\n[Administraci\u00f3n de Alimentos y Medicamentos](/Common/PopUps/popDefinition.aspx?id=454785&version=patient&language=Spanish&dictionary=Cancer.gov)(FDA) de los Estados Unidos no ha aprobado el uso de vitamina C intravenosa como tratamiento del c\u00e1ncer (vea la [Pregunta 7](/espanol/cancer/tratamiento/mca/paciente/vitamina-c-pdq#_21)).\nPreguntas y respuestas sobre la vitamina C intravenosa\n- \u00bfQu\u00e9 es la vitamina C?\nLa\n[vitamina C](/Common/PopUps/popDefinition.aspx?id=439435&version=patient&language=Spanish&dictionary=Cancer.gov)es un [nutriente](/Common/PopUps/popDefinition.aspx?id=44697&version=patient&language=Spanish&dictionary=Cancer.gov)que se encuentra en los alimentos, como las naranjas, los pomelos (toronjas), los kiwis, los pimientos y el br\u00f3coli, y en los [suplementos alimentarios](/Common/PopUps/popDefinition.aspx?id=373932&version=patient&language=Spanish&dictionary=Cancer.gov). La vitamina C es un [antioxidante](/Common/PopUps/popDefinition.aspx?id=43997&version=patient&language=Spanish&dictionary=Cancer.gov)que ayuda a [prevenir](/Common/PopUps/popDefinition.aspx?id=439419&version=patient&language=Spanish&dictionary=Cancer.gov)el da\u00f1o a las [c\u00e9lulas](/Common/PopUps/popDefinition.aspx?id=46476&version=patient&language=Spanish&dictionary=Cancer.gov)que causan los [radicales libres](/Common/PopUps/popDefinition.aspx?id=44030&version=patient&language=Spanish&dictionary=Cancer.gov). Adem\u00e1s, act\u00faa sobre las [enzimas](/Common/PopUps/popDefinition.aspx?id=46081&version=patient&language=Spanish&dictionary=Cancer.gov)que desempe\u00f1an una funci\u00f3n clave en la elaboraci\u00f3n del [col\u00e1geno](/Common/PopUps/popDefinition.aspx?id=44196&version=patient&language=Spanish&dictionary=Cancer.gov). La vitamina C tambi\u00e9n se llama \u00e1cido asc\u00f3rbico, \u00e1cido L-asc\u00f3rbico o ascorbato.\n- \u00bfC\u00f3mo se administra la vitamina C?\nLa vitamina C se administra por infusi\u00f3n intravenosa (IV) o por boca. Cuando se administra por infusi\u00f3n IV, la concentraci\u00f3n de vitamina C en la\n[sangre](/Common/PopUps/popDefinition.aspx?id=270735&version=patient&language=Spanish&dictionary=Cancer.gov)es mucho m\u00e1s alta que cuando se toma por boca.\n- \u00bfSe ha realizado alg\u00fan estudio de laboratorio o con animales sobre la vitamina C intravenosa?\nEn los estudios de laboratorio, se usan c\u00e9lulas\n[tumorales](/Common/PopUps/popDefinition.aspx?id=46634&version=patient&language=Spanish&dictionary=Cancer.gov)para probar una sustancia y averiguar si es probable que tenga efectos contra el c\u00e1ncer. En los [estudios con animales](/Common/PopUps/popDefinition.aspx?id=454774&version=patient&language=Spanish&dictionary=Cancer.gov), se hacen pruebas para verificar si un [medicamento](/Common/PopUps/popDefinition.aspx?id=463717&version=patient&language=Spanish&dictionary=Cancer.gov), procedimiento o tratamiento es seguro y eficaz. Los estudios de laboratorio y con animales se llevan a cabo antes de que una sustancia se pruebe en seres humanos.\nSe han realizado estudios de laboratorio y con animales sobre los efectos de la vitamina C intravenosa. Seg\u00fan se indica en los estudios de laboratorio, es posible que las concentraciones altas de vitamina C destruyan las c\u00e9lulas\n[cancerosas](/Common/PopUps/popDefinition.aspx?id=45333&version=patient&language=Spanish&dictionary=Cancer.gov). Para obtener m\u00e1s informaci\u00f3n sobre estudios de laboratorio y con animales en los que se usa vitamina C intravenosa, consulte la secci\u00f3n [Estudios precl\u00ednicos de laboratorio o con animales](/espanol/cancer/tratamiento/mca/pro/vitamina-c-pdq#_14)del sumario para profesionales de la salud Vitamina C intravenosa.\n- \u00bfSe ha llevado a cabo alg\u00fan estudio con vitamina C intravenosa en personas con c\u00e1ncer?\nLos estudios con vitamina C intravenosa, sola o en combinaci\u00f3n con otros medicamentos, en personas con c\u00e1ncer son los siguientes:\nEstudios de vitamina C intravenosa sola\n- En un estudio se encontr\u00f3 que las personas con c\u00e1ncer que recibieron vitamina C intravenosa tuvieron mejor\n[calidad de vida](/Common/PopUps/popDefinition.aspx?id=45417&version=patient&language=Spanish&dictionary=Cancer.gov)y menos [efectos secundarios](/Common/PopUps/popDefinition.aspx?id=46580&version=patient&language=Spanish&dictionary=Cancer.gov)relacionados con el c\u00e1ncer que quienes no la recibieron.\n- En un\n[estudio piloto](/Common/PopUps/popDefinition.aspx?id=45838&version=patient&language=Spanish&dictionary=Cancer.gov)de un solo grupo con personas de [c\u00e1ncer de pr\u00f3stata resistente a la castraci\u00f3n](/Common/PopUps/popDefinition.aspx?id=753525&version=patient&language=Spanish&dictionary=Cancer.gov), la vitamina C intravenosa no disminuy\u00f3 la concentraci\u00f3n del [ant\u00edgeno prost\u00e1tico espec\u00edfico](/Common/PopUps/popDefinition.aspx?id=46540&version=patient&language=Spanish&dictionary=Cancer.gov)ni interrumpi\u00f3 el crecimiento de los tumores.\n- En un estudio de voluntarios sanos y personas con c\u00e1ncer, se observ\u00f3 que la vitamina C fue segura en dosis de hasta 1,5 g/kg para las personas que no tienen c\u00e1lculos en el\n[ri\u00f1\u00f3n](/Common/PopUps/popDefinition.aspx?id=46325&version=patient&language=Spanish&dictionary=Cancer.gov), otras enfermedades del ri\u00f1\u00f3n o [deficiencia de G6PD](/Common/PopUps/popDefinition.aspx?id=748115&version=patient&language=Spanish&dictionary=Cancer.gov). En los estudios tambi\u00e9n se observ\u00f3 que las concentraciones de vitamina C en la sangre son m\u00e1s altas cuando se administra por v\u00eda intravenosa que cuando se toma por boca, y que duran m\u00e1s de 4 horas.\nEstudios de vitamina C intravenosa combinada con otros medicamentos\nEn los estudios de vitamina C intravenosa administrada con otros medicamentos se han observado resultados contradictorios.\n- En un estudio peque\u00f1o de 14 personas con c\u00e1ncer de p\u00e1ncreas\n[avanzado](/Common/PopUps/popDefinition.aspx?id=478743&version=patient&language=Spanish&dictionary=Cancer.gov), se administr\u00f3 vitamina C intravenosa con [quimioterapia](/Common/PopUps/popDefinition.aspx?id=45214&version=patient&language=Spanish&dictionary=Cancer.gov)y [terapia dirigida](/Common/PopUps/popDefinition.aspx?id=270742&version=patient&language=Spanish&dictionary=Cancer.gov)( [erlotinib](/Common/PopUps/popDefinition.aspx?id=508929&version=patient&language=Spanish&dictionary=Cancer.gov)). De las personas que participaron en el estudio, 5 no completaron el tratamiento porque el tumor sigui\u00f3 creciendo. Las 9 personas que completaron el tratamiento presentaron una [enfermedad estable](/Common/PopUps/popDefinition.aspx?id=45884&version=patient&language=Spanish&dictionary=Cancer.gov)seg\u00fan se observ\u00f3 en los estudios por [im\u00e1genes](/Common/PopUps/popDefinition.aspx?id=689578&version=patient&language=Spanish&dictionary=Cancer.gov). Se notificaron muy pocos efectos secundarios por el tratamiento con vitamina C.\n- En un estudio de personas con c\u00e1ncer de p\u00e1ncreas reci\u00e9n diagnosticado, la vitamina C intravenosa no interfiri\u00f3 con la\n[gemcitabina](/Common/PopUps/popDefinition.aspx?id=508951&version=patient&language=Spanish&dictionary=Cancer.gov).\n- En otro estudio peque\u00f1o con 9 personas con c\u00e1ncer de p\u00e1ncreas avanzado, se administr\u00f3 quimioterapia semanal durante 3 semanas junto con vitamina C intravenosa, 2 veces a la semana, durante 4 semanas en cada\n[ciclo de tratamiento](/Common/PopUps/popDefinition.aspx?id=688840&version=patient&language=Spanish&dictionary=Cancer.gov). El c\u00e1ncer de estos pacientes no [progres\u00f3](/Common/PopUps/popDefinition.aspx?id=45850&version=patient&language=Spanish&dictionary=Cancer.gov)durante un promedio de 6 meses. No se notificaron efectos secundarios graves con el tratamiento combinado.\n- En un estudio realizado con 27 personas con\n[c\u00e1ncer de ovario](/Common/PopUps/popDefinition.aspx?id=445074&version=patient&language=Spanish&dictionary=Cancer.gov)en estadio avanzado, se compar\u00f3 el tratamiento con quimioterapia sola y quimioterapia con vitamina C intravenosa. La vitamina C intravenosa se administr\u00f3 durante la quimioterapia y durante 6 meses despu\u00e9s de la quimioterapia. Aquellas que recibieron vitamina C intravenosa presentaron menos efectos secundarios de la quimioterapia.\n- En otros estudios se trataron a personas con\n[c\u00e1ncer colorrectal](/Common/PopUps/popDefinition.aspx?id=444983&version=patient&language=Spanish&dictionary=Cancer.gov) [metast\u00e1sico](/Common/PopUps/popDefinition.aspx?id=44058&version=patient&language=Spanish&dictionary=Cancer.gov) [resistente al tratamiento](/Common/PopUps/popDefinition.aspx?id=350245&version=patient&language=Spanish&dictionary=Cancer.gov)o [melanoma](/Common/PopUps/popDefinition.aspx?id=45135&version=patient&language=Spanish&dictionary=Cancer.gov)metast\u00e1sico con vitamina C intravenosa administrada junto con [tri\u00f3xido de ars\u00e9nico](/Common/PopUps/popDefinition.aspx?id=46018&version=patient&language=Spanish&dictionary=Cancer.gov)y otros medicamentos. El tratamiento no tuvo efecto contra el c\u00e1ncer, el tumor sigui\u00f3 creciendo durante el tratamiento y los pacientes presentaron efectos secundarios graves. Debido a que estos estudios no incluyeron un grupo de control, no queda claro cu\u00e1nto influy\u00f3 la administraci\u00f3n de vitamina C intravenosa en los efectos secundarios.\n- En 2\n[estudios piloto](/Common/PopUps/popDefinition.aspx?id=45838&version=patient&language=Spanish&dictionary=Cancer.gov)se administr\u00f3 un [tratamiento est\u00e1ndar](/Common/PopUps/popDefinition.aspx?id=44930&version=patient&language=Spanish&dictionary=Cancer.gov)con vitamina C intravenosa a personas que ten\u00edan [c\u00e1ncer de pulm\u00f3n de c\u00e9lulas no peque\u00f1as](/Common/PopUps/popDefinition.aspx?id=45323&version=patient&language=Spanish&dictionary=Cancer.gov)o [glioblastoma multiforme](/Common/PopUps/popDefinition.aspx?id=45699&version=patient&language=Spanish&dictionary=Cancer.gov). Aquellas que recibieron un tratamiento est\u00e1ndar junto con vitamina C intravenosa tuvieron una mejor [supervivencia general](/Common/PopUps/popDefinition.aspx?id=655245&version=patient&language=Spanish&dictionary=Cancer.gov)y menos efectos secundarios que los [grupos de control](/Common/PopUps/popDefinition.aspx?id=44149&version=patient&language=Spanish&dictionary=Cancer.gov).\nHay m\u00e1s estudios en curso sobre la combinaci\u00f3n de vitamina C intravenosa con otros medicamentos. Estos incluyen un n\u00famero de\n[ensayos cl\u00ednicos](/Common/PopUps/popDefinition.aspx?id=45961&version=patient&language=Spanish&dictionary=Cancer.gov)que combinan la vitamina C intravenosa con el tri\u00f3xido de ars\u00e9nico, que muestran resultados contradictorios.\n- En un estudio se encontr\u00f3 que las personas con c\u00e1ncer que recibieron vitamina C intravenosa tuvieron mejor\n- \u00bfSe ha informado sobre alg\u00fan efecto secundario o riesgo de la vitamina C intravenosa?\nLa vitamina C intravenosa caus\u00f3 muy pocos efectos secundarios en los\n[ensayos cl\u00ednicos](/Common/PopUps/popDefinition.aspx?id=45961&version=patient&language=Spanish&dictionary=Cancer.gov). No obstante, la vitamina C intravenosa a veces perjudica a las personas con ciertos [factores de riesgo](/Common/PopUps/popDefinition.aspx?id=45873&version=patient&language=Spanish&dictionary=Cancer.gov).\n- En las personas con\n[antecedentes](/Common/PopUps/popDefinition.aspx?id=642021&version=patient&language=Spanish&dictionary=Cancer.gov)de enfermedad del ri\u00f1\u00f3n, se ha informado sobre [insuficiencia renal](/Common/PopUps/popDefinition.aspx?id=462925&version=patient&language=Spanish&dictionary=Cancer.gov)despu\u00e9s del tratamiento con vitamina C intravenosa. Las personas con probabilidad de tener c\u00e1lculos renales no se deben tratar con vitamina C intravenosa.\n- En un estudio, se notific\u00f3 demasiado l\u00edquido en el cuerpo (sobrecarga h\u00eddrica) relacionado con la vitamina C intravenosa. Es posible que la causa fuera el m\u00e9todo de administraci\u00f3n intravenoso y no la vitamina C.\n- En\n[informes de casos](/Common/PopUps/popDefinition.aspx?id=44007&version=patient&language=Spanish&dictionary=Cancer.gov)se observ\u00f3 que las personas con una afecci\u00f3n [hereditaria](/Common/PopUps/popDefinition.aspx?id=45983&version=patient&language=Spanish&dictionary=Cancer.gov)conocida como deficiencia de G6PD no deben recibir dosis altas de vitamina C ya que tal vez esta produzca [hem\u00f3lisis](/Common/PopUps/popDefinition.aspx?id=687883&version=patient&language=Spanish&dictionary=Cancer.gov).\n- Debido a que la vitamina C a veces hace que el cuerpo absorba y use m\u00e1s f\u00e1cil el\n[hierro](/Common/PopUps/popDefinition.aspx?id=446805&version=patient&language=Spanish&dictionary=Cancer.gov), no se recomiendan las dosis altas de vitamina C para las personas con [hemocromatosis](/Common/PopUps/popDefinition.aspx?id=446804&version=patient&language=Spanish&dictionary=Cancer.gov)(afecci\u00f3n en la que el cuerpo capta y almacena m\u00e1s hierro del que necesita).\n- En las personas con\n- \u00bfSe ha informado de alguna interacci\u00f3n de medicamentos por a\u00f1adir vitamina C intravenosa al tratamiento con medicamentos contra el c\u00e1ncer?\nUna\n[interacci\u00f3n de medicamentos](/Common/PopUps/popDefinition.aspx?id=454754&version=patient&language=Spanish&dictionary=Cancer.gov)es un cambio en la forma en que un [medicamento](/Common/PopUps/popDefinition.aspx?id=463717&version=patient&language=Spanish&dictionary=Cancer.gov)act\u00faa en el cuerpo cuando se administra con otros medicamentos determinados. Es posible que algunos medicamentos contra el c\u00e1ncer no sean tan eficaces cuando se combinan con vitamina C intravenosa. Hasta el momento, estos efectos solo se han observado en algunos estudios de laboratorio y con animales. Para obtener informaci\u00f3n sobre la interacci\u00f3n de medicamentos mientras se usa vitamina C intravenosa, consulte la secci\u00f3n [Efectos adversos](/espanol/cancer/tratamiento/mca/pro/vitamina-c-pdq#_18)del sumario para profesionales de la salud Vitamina C intravenosa.\n- \u00bfLa Administraci\u00f3n de Alimentos y Medicamentos aprob\u00f3 el uso de la vitamina C intravenosa para el tratamiento del c\u00e1ncer en los Estados Unidos?\nLa\n[Administraci\u00f3n de Alimentos y Medicamentos](/Common/PopUps/popDefinition.aspx?id=454785&version=patient&language=Spanish&dictionary=Cancer.gov)(FDA) de los Estados Unidos no ha aprobado el uso de la vitamina C intravenosa para el tratamiento del c\u00e1ncer.\nLa FDA no aprueba los suplementos alimentarios ni determina la inocuidad o eficacia de estos. El fabricante de dichos productos se responsabiliza por asegurar que no sean peligrosos y que las etiquetas incluyan informaci\u00f3n correcta y veraz para el consumidor. Debido a que la FDA no reglamenta la elaboraci\u00f3n de los suplementos, es probable que haya diferencias entre los lotes y las marcas de vitamina C intravenosa.\nInformaci\u00f3n sobre este sumario del PDQ\nInformaci\u00f3n sobre el PDQ\nEl Physician Data Query (PDQ) es la base de datos integral del Instituto Nacional del C\u00e1ncer (NCI). La base de datos del PDQ contiene sumarios de la \u00faltima informaci\u00f3n publicada sobre prevenci\u00f3n, detecci\u00f3n, gen\u00e9tica, tratamiento, cuidados m\u00e9dicos de apoyo, y medicina complementaria y alternativa relacionada con el c\u00e1ncer. La mayor\u00eda de los sumarios se redactan en dos versiones. En las versiones para profesionales de la salud se ofrece informaci\u00f3n detallada en lenguaje t\u00e9cnico. Las versiones para pacientes se presentan en un lenguaje f\u00e1cil de comprender, que no es t\u00e9cnico. Ambas versiones contienen informaci\u00f3n sobre el c\u00e1ncer que es exacta y actualizada. Tambi\u00e9n es posible consultar estos sumarios en\n[ingl\u00e9s](https://www.cancer.gov/publications/pdq).\nEl PDQ es uno de los servicios del NCI. El NCI pertenece a los Institutos Nacionales de la Salud (NIH). Los NIH son el centro de investigaci\u00f3n biom\u00e9dica del gobierno federal. Los sumarios del PDQ se basan en un an\u00e1lisis independiente de las publicaciones m\u00e9dicas. No constituyen declaraciones de la pol\u00edtica del NCI ni de los NIH.\nProp\u00f3sito de este sumario\nEste sumario del PDQ sobre el c\u00e1ncer contiene informaci\u00f3n actualizada sobre el uso de vitamina C intravenosa en el tratamiento de personas con c\u00e1ncer. El prop\u00f3sito es informar y ayudar a los pacientes, las familias y las personas encargadas de cuidar a los pacientes. No provee pautas ni recomendaciones formales para tomar decisiones relacionadas con la atenci\u00f3n de la salud.\nRevisores y actualizaciones\nLos Consejos editoriales redactan los sumarios de informaci\u00f3n sobre el c\u00e1ncer del PDQ y los actualizan. Estos Consejos est\u00e1n integrados por expertos en el tratamiento del c\u00e1ncer y otras especialidades relacionadas con esta enfermedad. Los sumarios se revisan con regularidad y se modifican si surge informaci\u00f3n nueva. La fecha de actualizaci\u00f3n al pie de cada sumario indica cu\u00e1ndo se hizo el cambio m\u00e1s reciente.\nLa informaci\u00f3n en este sumario para pacientes se basa en la versi\u00f3n para profesionales de la salud, que el\n[Consejo editorial del PDQ\u00ae sobre las terapias integrales, alternativas y complementarias](https://www.cancer.gov/espanol/publicaciones/pdq/consejos-editoriales/medicina-complementaria-alternativa) revisa con regularidad y actualiza en caso necesario.\nInformaci\u00f3n sobre ensayos cl\u00ednicos\nUn ensayo cl\u00ednico es un estudio para responder a una pregunta cient\u00edfica; por ejemplo, si un tratamiento es mejor que otro. Los ensayos se basan en estudios anteriores y lo que se aprendi\u00f3 en el laboratorio. Cada ensayo responde a ciertas preguntas cient\u00edficas dirigidas a encontrar formas nuevas y mejores de ayudar a los pacientes de c\u00e1ncer. Durante los ensayos cl\u00ednicos de tratamiento, se recopila informaci\u00f3n sobre los efectos de un tratamiento nuevo y su eficacia. Si un ensayo cl\u00ednico indica que un tratamiento nuevo es mejor que el tratamiento est\u00e1ndar, el tratamiento nuevo se puede convertir en \"est\u00e1ndar\". Los pacientes podr\u00edan considerar la participaci\u00f3n en un ensayo cl\u00ednico. Algunos ensayos cl\u00ednicos solo aceptan a pacientes que a\u00fan no comenzaron un tratamiento.\nLa lista en ingl\u00e9s de ensayos cl\u00ednicos est\u00e1 disponible en el\n[portal de Internet del NCI](https://www.cancer.gov/espanol/cancer/tratamiento/estudios-clinicos). Para obtener m\u00e1s informaci\u00f3n, llamar al [Servicio de Informaci\u00f3n de C\u00e1ncer](https://www.cancer.gov/espanol/contactenos/centro-de-contacto) (CIS), centro de contacto del NCI, al 1-800-422-6237 (1-800-4-CANCER).\nPermisos para el uso de este sumario\nPDQ (Physician Data Query) es una marca registrada. Se autoriza el libre uso del texto de los documentos del PDQ. Sin embargo, no se podr\u00e1 identificar como un sumario de informaci\u00f3n sobre c\u00e1ncer del PDQ del NCI, salvo que se reproduzca en su totalidad y se actualice con regularidad. Por otra parte, se permitir\u00e1 que un autor escriba una oraci\u00f3n como \u201cEn el sumario del PDQ del NCI de informaci\u00f3n sobre la prevenci\u00f3n del c\u00e1ncer de mama se describen, en breve, los siguientes riesgos: [incluir fragmento del sumario]\u201d.\nSe sugiere citar la referencia bibliogr\u00e1fica de este sumario del PDQ de la siguiente forma:\nPDQ\u00ae . PDQ Vitamina C intravenosa. Bethesda, MD: National Cancer Institute. Actualizaci\u00f3n: <MM/DD/YYYY>. Disponible en:\n[https://www.cancer.gov/espanol/cancer/tratamiento/mca/paciente/vitamina-c-pdq](https://www.cancer.gov/espanol/cancer/tratamiento/mca/paciente/vitamina-c-pdq). Fecha de acceso: <MM/DD/YYYY>.\nLas im\u00e1genes en este sumario se reproducen con el permiso del autor, el artista o la editorial para uso exclusivo en los sumarios del PDQ. La utilizaci\u00f3n de las im\u00e1genes fuera del PDQ requiere la autorizaci\u00f3n del propietario, que el Instituto Nacional del C\u00e1ncer no puede otorgar. Para obtener m\u00e1s informaci\u00f3n sobre el uso de las ilustraciones de este sumario o de otras im\u00e1genes relacionadas con el c\u00e1ncer, consultar\n[Visuals Online](https://visualsonline.cancer.gov/), una colecci\u00f3n de m\u00e1s de 3000 im\u00e1genes cient\u00edficas.\nCl\u00e1usula sobre el descargo de responsabilidad\nLa informaci\u00f3n en estos sumarios no debe fundamentar ninguna decisi\u00f3n sobre reintegros de seguros. Para obtener m\u00e1s informaci\u00f3n sobre cobertura de seguros, consultar la p\u00e1gina\n[Manejo de la atenci\u00f3n del c\u00e1ncer](https://www.cancer.gov/espanol/cancer/manejo-del-cancer) disponible en Cancer.gov/espanol.\nPara obtener m\u00e1s informaci\u00f3n\nEn Cancer.gov/espanol, se ofrece m\u00e1s informaci\u00f3n sobre c\u00f3mo comunicarse o recibir ayuda en\n[\u00bfEn qu\u00e9 podemos ayudarle?](https://www.cancer.gov/espanol/contactenos). Tambi\u00e9n puede enviar un mensaje de correo electr\u00f3nico mediante el [formulario de comunicaci\u00f3n](https://www.cancer.gov/espanol/contactenos/correo-electronico).\nInformaci\u00f3n general sobre medicina complementaria y alternativa\nLa medicina complementaria y alternativa (MCA), que tambi\u00e9n se llama medicina integral, comprende una gran variedad de filosof\u00edas, enfoques y tratamientos de sanaci\u00f3n. En general, se dice que una terapia es complementaria cuando se a\u00f1ade a un tratamiento convencional; se llama alternativa cuando lo remplaza. (Los tratamientos convencionales son aquellos que la comunidad m\u00e9dica establecida acepta y practica). Las terapias se consideran complementarias o alternativas, seg\u00fan la forma en que se utilicen. El prop\u00f3sito de las terapias complementarias o alternativas es prevenir enfermedades, reducir la tensi\u00f3n, evitar o disminuir los efectos secundarios y los s\u00edntomas, y controlar o curar enfermedades.\nA diferencia de los tratamientos convencionales para el c\u00e1ncer, es com\u00fan que las compa\u00f1\u00edas de seguro no ofrezcan cobertura para las terapias complementarias y alternativas. Los pacientes deben confirmar si su seguro m\u00e9dico cubre estas terapias.\nLos pacientes de c\u00e1ncer que piensen en utilizar terapias complementarias o alternativas, deben hablar sobre esta decisi\u00f3n con su m\u00e9dico, enfermero o farmac\u00e9utico del mismo modo que lo har\u00edan con cualquier otro tratamiento. Algunas terapias interfieren en el tratamiento est\u00e1ndar o causan da\u00f1o cuando se usan al mismo tiempo.\nEvaluaci\u00f3n de los tratamientos de medicina complementaria y alternativa\nEs importante que los tratamientos de MCA se sometan a los mismos m\u00e9todos cient\u00edficos que se emplean para poner a prueba los tratamientos convencionales. El Instituto Nacional del C\u00e1ncer (NCI) y el Centro Nacional de Salud Complementaria e Integral (NCCIH) patrocinan varios ensayos cl\u00ednicos (estudios de investigaci\u00f3n) en centros m\u00e9dicos para probar el uso de los tratamientos de MCA para el c\u00e1ncer.\nEn general, se estudian la inocuidad y eficacia de los abordajes convencionales para tratar el c\u00e1ncer mediante un proceso cient\u00edfico que incluye ensayos cl\u00ednicos con un gran n\u00famero de pacientes. Se sabe menos acerca de la inocuidad y la eficacia de los m\u00e9todos complementarios y alternativos. Muy pocas terapias de MCA se han examinado con m\u00e9todos cient\u00edficos rigurosos. En ciertos casos, las terapias de MCA que antes solo se consideraban alternativas se est\u00e1n incorporando poco a poco en el tratamiento del c\u00e1ncer: no como curas, sino como terapias complementarias que tal vez ayuden a los pacientes a sentirse mejor y recuperarse m\u00e1s pronto. Un ejemplo de esto es la acupuntura. En noviembre de 1997, un grupo de expertos de los Institutos Nacionales de la Salud (NIH), anunci\u00f3 que se hab\u00eda comprobado que la acupuntura ayuda a controlar las n\u00e1useas y los v\u00f3mitos provocados por la quimioterapia, y el dolor relacionado con la cirug\u00eda. Por otra parte, en el caso de otros abordajes, como el uso del laetrilo, se hall\u00f3 que no surten efecto e incluso podr\u00edan causar da\u00f1o.\n[The NCI Best Case Series Program](https://cam.cancer.gov/indentifying_novel_cam_therapies/best_case_series_program.htm) (disponible solo en ingl\u00e9s), se estableci\u00f3 en 1991, y es un proceso para estudiar los abordajes de MCA que se encuentran en pr\u00e1ctica. La Oficina de Medicina Complementaria y Alternativa para el C\u00e1ncer (OCCAM) del NCI supervisa este programa. Mediante este proceso, los profesionales de la salud que emplean terapias alternativas en el tratamiento del c\u00e1ncer env\u00edan a la OCCAM los antecedentes m\u00e9dicos de sus pacientes y otros materiales relacionados. La OCCAM hace una revisi\u00f3n minuciosa de los materiales y decide si hay terapias que merecen m\u00e1s investigaci\u00f3n.\nPreguntas para su proveedor de salud sobre la medicina complementaria y alternativa\nCuando los pacientes est\u00e1n tomando en cuenta los tratamientos complementarios y alternativos, deben hacer las siguientes preguntas a su proveedor de atenci\u00f3n de la salud:\n- \u00bfQu\u00e9 efectos secundarios se pueden esperar?\n- \u00bfCu\u00e1les son los riesgos relacionados con este tratamiento?\n- \u00bfLos beneficios son mayores que los riesgos?\n- \u00bfQu\u00e9 beneficios se deben esperar de este tratamiento?\n- \u00bfEl tratamiento puede interferir con el tratamiento convencional?\n- \u00bfEste tratamiento es parte de un ensayo cl\u00ednico?\n- De ser as\u00ed, \u00bfqui\u00e9n patrocina este ensayo?\n- \u00bfMi seguro cubre este tratamiento?\nInformaci\u00f3n adicional\nCentro Nacional de Salud Complementaria e Integral\nEl Centro Nacional de Salud Complementaria e Integral (NCCIH) de los Institutos Nacionales de la Salud (NIH) facilita la investigaci\u00f3n y evaluaci\u00f3n de las pr\u00e1cticas complementarias y alternativas y ofrece informaci\u00f3n acerca de una variedad de enfoques para los profesionales de la salud y el p\u00fablico en general.\n- Centro de Informaci\u00f3n del NCCIH\n- Post Office Box 7923 Gaithersburg, MD 20898-7923\n- Tel\u00e9fono: 1-888-644-6226 (l\u00ednea gratuita)\n- TTY (para personas sordas o con dificultades auditivas): 1-866-464-3615\n- E-mail: info@nccih.nih.gov\n- Portal de Internet:\n[https://nccih.nih.gov/health/espanol](https://nccih.nih.gov/health/espanol?lang=es)\nMedicina complementaria y alternativa en PubMed\nEl NCCIH y la Biblioteca Nacional de Medicina (NLM) de los NIH crearon juntos\n[CAM on PubMed](https://nccih.nih.gov/research/camonpubmed) (disponible en ingl\u00e9s), una herramienta de b\u00fasqueda gratuita y f\u00e1cil de usar para encontrar citas de revistas cient\u00edficas sobre medicina complementaria y alternativa. CAM on PubMed es un subgrupo de la base de datos bibliogr\u00e1ficos PubMed de la NLM que cuenta con m\u00e1s de 230 000 referencias y res\u00famenes de art\u00edculos sobre medicina complementaria y alternativa publicados en revistas cient\u00edficas. Esta base de datos tambi\u00e9n tiene enlaces a las p\u00e1ginas de Internet de m\u00e1s de 1800 revistas, lo que ofrece a los usuarios acceso a los art\u00edculos completos. (Es posible que deba pagar una suscripci\u00f3n u otro cargo para leer los art\u00edculos completos).\nOficina de Medicina Complementaria y Alternativa para el C\u00e1ncer\nLa Oficina de Medicina Complementaria y Alternativa para el C\u00e1ncer (OCCAM) del NCI coordina las actividades del NCI en el \u00e1rea de la medicina complementaria y alternativa (MCA). La OCCAM fomenta la investigaci\u00f3n sobre la MCA para el c\u00e1ncer y ofrece informaci\u00f3n a los profesionales de la salud y al p\u00fablico en general en el\n[portal de Internet del NCI](https://www.cancer.gov/espanol).\nServicio de Informaci\u00f3n de C\u00e1ncer del Instituto Nacional del C\u00e1ncer\nEn los Estados Unidos, llame a la l\u00ednea gratuita del\n[Servicio de Informaci\u00f3n de C\u00e1ncer](https://www.cancer.gov/espanol/contactenos/centro-de-contacto) (CIS), centro de contacto del Instituto Nacional del C\u00e1ncer (NCI): 1-800-422-6237 (1-800-4-CANCER) de lunes a viernes, de 9:00 a. m. a 9:00 p. m. Un especialista capacitado en informaci\u00f3n sobre el c\u00e1ncer estar\u00e1 disponible para contestar sus preguntas.\nAdministraci\u00f3n de Alimentos y Medicamentos de los Estados Unidos\nLa Administraci\u00f3n de Alimentos y Medicamentos de los Estados Unidos (FDA) reglamenta los medicamentos y los dispositivos m\u00e9dicos para asegurar que sean inocuos y eficaces.\n- Food and Drug Administration\n- 10903 New Hampshire Avenue\n- Silver Spring, MD 20993\n- Tel\u00e9fono: 1-888-463-6332 (l\u00ednea gratuita)\n- Portal de Internet:\n[http://www.fda.gov](https://www.fda.gov/aboutfda/enespanol/default.htm)\nComisi\u00f3n Federal de Comercio\nLa Comisi\u00f3n Federal de Comercio (FTC) hace cumplir las leyes de protecci\u00f3n al consumidor. Las siguientes son algunas de las publicaciones disponibles de este organismo:\n- Cuidando su Salud: Fuentes de Informaci\u00f3n sobre Productos y Servicios para la Salud\n- Fraudulent Health Claims: Don\u2019t Be Fooled\n- Consumer Response Center\n- Federal Trade Commission\n- 600 Pennsylvania Avenue, NW\n- Washington, DC 20580\n- Tel\u00e9fono: 1-877-382-4357 (1-877-FTC-HELP) (l\u00ednea gratuita)\n- TTY (para personas sordas o con dificultades auditivas): 202-326-2502\n- Portal de Internet:\n[http://www.ftc.gov/es](https://www.ftc.gov/es)", "language": null, "image": null, "pagetype": "Website", "links": ["#main-content", "/about-cancer/treatment/cam/patient/vitamin-c-pdq", "/espanol", "/espanol/cancer", "/espanol/tipos", "/espanol/investigacion", "/espanol/subvenciones-capacitacion", "/espanol/noticias", "/espanol/instituto", "/espanol", "/espanol/cancer", "/espanol/cancer/tratamiento", "/espanol/cancer/tratamiento/mca", "/espanol/cancer/tratamiento/mca/paciente", "mailto:?subject=Informaci\u00f3n del portal de Internet del Instituto Nacional del C\u00e1ncer &body=Encontr\u00e9 esta informaci\u00f3n en cancer.gov/espanol y quiero compartirla contigo: https://www.cancer.gov/espanol/cancer/tratamiento/mca/paciente/vitamina-c-pdq %0D%0A%0D%0A El sitio web del Instituto Nacional del C\u00e1ncer (NCI), www.cancer.gov/espanol, provee informaci\u00f3n precisa, al d\u00eda y completa de la dependencia principal del gobierno de EE. UU. sobre investigaci\u00f3n de c\u00e1ncer. Si tiene preguntas o necesita m\u00e1s informaci\u00f3n, le invitamos a que se comunique en espa\u00f1ol con el servicio de mensajer\u00eda instant\u00e1nea LiveHelp del NCI en https://livehelp-es.cancer.gov, o llame el Centro de Contacto del NCI al 1-800-422-6237 (1-800-4-CANCER) sin cargos en los Estados Unidos.", "/espanol/cancer/tratamiento", "/espanol/cancer/tratamiento/tipos", "/espanol/cancer/tratamiento/efectos-secundarios", "/espanol/cancer/tratamiento/estudios-clinicos", "/espanol/cancer/tratamiento/medicamentos", "/espanol/cancer/tratamiento/mca", "/espanol/cancer/tratamiento/mca/paciente", "/espanol/cancer/tratamiento/mca/pro", "/espanol/cancer/tratamiento/preguntas", "/espanol/cancer/tratamiento/investigacion", "#_1", "#_3", "#_AboutThis_1", "#_AboutIACT_2", "#_AboutIACT_6", "#_QandA_2", "#_ToLearnMore_2", "/espanol/cancer/tratamiento/mca/pro/vitamina-c-pdq", "/Common/PopUps/popDefinition.aspx?id=439435&version=patient&language=Spanish&dictionary=Cancer.gov", "/Common/PopUps/popDefinition.aspx?id=44697&version=patient&language=Spanish&dictionary=Cancer.gov", "/Common/PopUps/popDefinition.aspx?id=373932&version=patient&language=Spanish&dictionary=Cancer.gov", "/Common/PopUps/popDefinition.aspx?id=43997&version=patient&language=Spanish&dictionary=Cancer.gov", "/Common/PopUps/popDefinition.aspx?id=44196&version=patient&language=Spanish&dictionary=Cancer.gov", "/espanol/cancer/tratamiento/mca/paciente/vitamina-c-pdq#_5", "/Common/PopUps/popDefinition.aspx?id=520363&version=patient&language=Spanish&dictionary=Cancer.gov", "/Common/PopUps/popDefinition.aspx?id=270735&version=patient&language=Spanish&dictionary=Cancer.gov", "/espanol/cancer/tratamiento/mca/paciente/vitamina-c-pdq#_17", "/Common/PopUps/popDefinition.aspx?id=45417&version=patient&language=Spanish&dictionary=Cancer.gov", "/Common/PopUps/popDefinition.aspx?id=46580&version=patient&language=Spanish&dictionary=Cancer.gov", "/espanol/cancer/tratamiento/mca/paciente/vitamina-c-pdq#_19", "/Common/PopUps/popDefinition.aspx?id=45961&version=patient&language=Spanish&dictionary=Cancer.gov", "/Common/PopUps/popDefinition.aspx?id=46325&version=patient&language=Spanish&dictionary=Cancer.gov", "/Common/PopUps/popDefinition.aspx?id=748115&version=patient&language=Spanish&dictionary=Cancer.gov", "/Common/PopUps/popDefinition.aspx?id=446804&version=patient&language=Spanish&dictionary=Cancer.gov", "/espanol/cancer/tratamiento/mca/paciente/vitamina-c-pdq#_20", "/Common/PopUps/popDefinition.aspx?id=454785&version=patient&language=Spanish&dictionary=Cancer.gov", "/espanol/cancer/tratamiento/mca/paciente/vitamina-c-pdq#_21", "/Common/PopUps/popDefinition.aspx?id=439435&version=patient&language=Spanish&dictionary=Cancer.gov", "/Common/PopUps/popDefinition.aspx?id=44697&version=patient&language=Spanish&dictionary=Cancer.gov", "/Common/PopUps/popDefinition.aspx?id=373932&version=patient&language=Spanish&dictionary=Cancer.gov", "/Common/PopUps/popDefinition.aspx?id=43997&version=patient&language=Spanish&dictionary=Cancer.gov", "/Common/PopUps/popDefinition.aspx?id=439419&version=patient&language=Spanish&dictionary=Cancer.gov", "/Common/PopUps/popDefinition.aspx?id=46476&version=patient&language=Spanish&dictionary=Cancer.gov", "/Common/PopUps/popDefinition.aspx?id=44030&version=patient&language=Spanish&dictionary=Cancer.gov", "/Common/PopUps/popDefinition.aspx?id=46081&version=patient&language=Spanish&dictionary=Cancer.gov", "/Common/PopUps/popDefinition.aspx?id=44196&version=patient&language=Spanish&dictionary=Cancer.gov", "/Common/PopUps/popDefinition.aspx?id=270735&version=patient&language=Spanish&dictionary=Cancer.gov", "/Common/PopUps/popDefinition.aspx?id=46634&version=patient&language=Spanish&dictionary=Cancer.gov", "/Common/PopUps/popDefinition.aspx?id=454774&version=patient&language=Spanish&dictionary=Cancer.gov", "/Common/PopUps/popDefinition.aspx?id=463717&version=patient&language=Spanish&dictionary=Cancer.gov", "/Common/PopUps/popDefinition.aspx?id=45333&version=patient&language=Spanish&dictionary=Cancer.gov", "/espanol/cancer/tratamiento/mca/pro/vitamina-c-pdq#_14", "/Common/PopUps/popDefinition.aspx?id=45417&version=patient&language=Spanish&dictionary=Cancer.gov", "/Common/PopUps/popDefinition.aspx?id=46580&version=patient&language=Spanish&dictionary=Cancer.gov", "/Common/PopUps/popDefinition.aspx?id=45838&version=patient&language=Spanish&dictionary=Cancer.gov", "/Common/PopUps/popDefinition.aspx?id=753525&version=patient&language=Spanish&dictionary=Cancer.gov", "/Common/PopUps/popDefinition.aspx?id=46540&version=patient&language=Spanish&dictionary=Cancer.gov", "/Common/PopUps/popDefinition.aspx?id=46325&version=patient&language=Spanish&dictionary=Cancer.gov", "/Common/PopUps/popDefinition.aspx?id=748115&version=patient&language=Spanish&dictionary=Cancer.gov", "/Common/PopUps/popDefinition.aspx?id=478743&version=patient&language=Spanish&dictionary=Cancer.gov", "/Common/PopUps/popDefinition.aspx?id=45214&version=patient&language=Spanish&dictionary=Cancer.gov", "/Common/PopUps/popDefinition.aspx?id=270742&version=patient&language=Spanish&dictionary=Cancer.gov", "/Common/PopUps/popDefinition.aspx?id=508929&version=patient&language=Spanish&dictionary=Cancer.gov", "/Common/PopUps/popDefinition.aspx?id=45884&version=patient&language=Spanish&dictionary=Cancer.gov", "/Common/PopUps/popDefinition.aspx?id=689578&version=patient&language=Spanish&dictionary=Cancer.gov", "/Common/PopUps/popDefinition.aspx?id=508951&version=patient&language=Spanish&dictionary=Cancer.gov", "/Common/PopUps/popDefinition.aspx?id=688840&version=patient&language=Spanish&dictionary=Cancer.gov", "/Common/PopUps/popDefinition.aspx?id=45850&version=patient&language=Spanish&dictionary=Cancer.gov", "/Common/PopUps/popDefinition.aspx?id=445074&version=patient&language=Spanish&dictionary=Cancer.gov", "/Common/PopUps/popDefinition.aspx?id=444983&version=patient&language=Spanish&dictionary=Cancer.gov", "/Common/PopUps/popDefinition.aspx?id=44058&version=patient&language=Spanish&dictionary=Cancer.gov", "/Common/PopUps/popDefinition.aspx?id=350245&version=patient&language=Spanish&dictionary=Cancer.gov", "/Common/PopUps/popDefinition.aspx?id=45135&version=patient&language=Spanish&dictionary=Cancer.gov", "/Common/PopUps/popDefinition.aspx?id=46018&version=patient&language=Spanish&dictionary=Cancer.gov", "/Common/PopUps/popDefinition.aspx?id=45838&version=patient&language=Spanish&dictionary=Cancer.gov", "/Common/PopUps/popDefinition.aspx?id=44930&version=patient&language=Spanish&dictionary=Cancer.gov", "/Common/PopUps/popDefinition.aspx?id=45323&version=patient&language=Spanish&dictionary=Cancer.gov", "/Common/PopUps/popDefinition.aspx?id=45699&version=patient&language=Spanish&dictionary=Cancer.gov", "/Common/PopUps/popDefinition.aspx?id=655245&version=patient&language=Spanish&dictionary=Cancer.gov", "/Common/PopUps/popDefinition.aspx?id=44149&version=patient&language=Spanish&dictionary=Cancer.gov", "/Common/PopUps/popDefinition.aspx?id=45961&version=patient&language=Spanish&dictionary=Cancer.gov", "/Common/PopUps/popDefinition.aspx?id=45961&version=patient&language=Spanish&dictionary=Cancer.gov", "/Common/PopUps/popDefinition.aspx?id=45873&version=patient&language=Spanish&dictionary=Cancer.gov", "/Common/PopUps/popDefinition.aspx?id=642021&version=patient&language=Spanish&dictionary=Cancer.gov", "/Common/PopUps/popDefinition.aspx?id=462925&version=patient&language=Spanish&dictionary=Cancer.gov", "/Common/PopUps/popDefinition.aspx?id=44007&version=patient&language=Spanish&dictionary=Cancer.gov", "/Common/PopUps/popDefinition.aspx?id=45983&version=patient&language=Spanish&dictionary=Cancer.gov", "/Common/PopUps/popDefinition.aspx?id=687883&version=patient&language=Spanish&dictionary=Cancer.gov", "/Common/PopUps/popDefinition.aspx?id=446805&version=patient&language=Spanish&dictionary=Cancer.gov", "/Common/PopUps/popDefinition.aspx?id=446804&version=patient&language=Spanish&dictionary=Cancer.gov", "/Common/PopUps/popDefinition.aspx?id=454754&version=patient&language=Spanish&dictionary=Cancer.gov", "/Common/PopUps/popDefinition.aspx?id=463717&version=patient&language=Spanish&dictionary=Cancer.gov", "/espanol/cancer/tratamiento/mca/pro/vitamina-c-pdq#_18", "/Common/PopUps/popDefinition.aspx?id=454785&version=patient&language=Spanish&dictionary=Cancer.gov", "https://www.cancer.gov/publications/pdq", "https://www.cancer.gov/espanol/publicaciones/pdq/consejos-editoriales/medicina-complementaria-alternativa", "https://www.cancer.gov/espanol/cancer/tratamiento/estudios-clinicos", "https://www.cancer.gov/espanol/contactenos/centro-de-contacto", "https://www.cancer.gov/espanol/cancer/tratamiento/mca/paciente/vitamina-c-pdq", "https://visualsonline.cancer.gov/", "https://www.cancer.gov/espanol/cancer/manejo-del-cancer", "https://www.cancer.gov/espanol/contactenos", "https://www.cancer.gov/espanol/contactenos/correo-electronico", "https://cam.cancer.gov/indentifying_novel_cam_therapies/best_case_series_program.htm", "https://nccih.nih.gov/health/espanol?lang=es", "https://nccih.nih.gov/research/camonpubmed", "https://www.cancer.gov/espanol", "https://www.cancer.gov/espanol/contactenos/centro-de-contacto", "https://www.fda.gov/aboutfda/enespanol/default.htm", "https://www.ftc.gov/es", "/espanol/politicas/derechos-de-autor-y-uso", "/espanol/sindicacion", "mailto:?subject=Informaci\u00f3n del portal de Internet del Instituto Nacional del C\u00e1ncer &body=Encontr\u00e9 esta informaci\u00f3n en cancer.gov/espanol y quiero compartirla contigo: https://www.cancer.gov/espanol/cancer/tratamiento/mca/paciente/vitamina-c-pdq %0D%0A%0D%0A El sitio web del Instituto Nacional del C\u00e1ncer (NCI), www.cancer.gov/espanol, provee informaci\u00f3n precisa, al d\u00eda y completa de la dependencia principal del gobierno de EE. UU. sobre investigaci\u00f3n de c\u00e1ncer. Si tiene preguntas o necesita m\u00e1s informaci\u00f3n, le invitamos a que se comunique en espa\u00f1ol con el servicio de mensajer\u00eda instant\u00e1nea LiveHelp del NCI en https://livehelp-es.cancer.gov, o llame el Centro de Contacto del NCI al 1-800-422-6237 (1-800-4-CANCER) sin cargos en los Estados Unidos.", "#top", "/espanol/acerca-sitio", "/", "/espanol/politicas/derechos-de-autor-y-uso", "/espanol/redes-sociales", "/espanol/contactenos", "/espanol/publicaciones", "/espanol/publicaciones/diccionarios/diccionario-cancer", "/espanol/politicas/accesibilidad", "/espanol/politicas/foia", "/espanol/politicas/confidencialidad-seguridad", "/espanol/politicas/exoneracion", "https://www.hhs.gov/es/vulnerability-disclosure-policy/index.html", "https://livehelp-es.cancer.gov/", "tel:1-800-422-6237", "mailto:NCIinfo@nih.gov", "https://www.facebook.com/cancer.govEspanol", "https://twitter.com/NCIespanol", "https://www.youtube.com/playlist?list=PLYKy4VbxNln7Cy6K2hZvwHLIZAElio5ai", "https://www.hhs.gov/", "https://salud.nih.gov/", "https://www.cancer.gov/espanol", "https://www.usa.gov/espanol/"]}