{"title": "El ayuno y sus efectos sobre el organismo (p\u00e1gina 2)", "author": "Bego Orive Tudela", "url": "https://www.monografias.com/trabajos82/ayuno-efectos-organismo/ayuno-efectos-organismo2", "hostname": "monografias.com", "description": null, "sitename": "Monografias.com", "date": "2021-03-12", "id": null, "license": null, "body": null, "comments": "", "commentsbody": null, "raw_text": null, "text": "El ayuno y sus efectos sobre el organismo (p\u00e1gina 2)\nEnviado por\n[Bego Orive Tudela](/usuario/perfiles/bego)\nAlfred\nVogel[3]natur\u00f3pata del siglo XX, nos lo\ndefine como el\n[m\u00e9todo](/trabajos11/metods/metods.shtml) m\u00e1s natural que existe para\nllevar al organismo de nuevo a la normalidad.\nLa\n[Medicina](/trabajos29/especialistas-medicos/especialistas-medicos.shtml) [China](/trabajos13/cultchin/cultchin.shtml) Tradicional, nos lo\ndefine como la \u00fanica forma posible que tiene el organismo\npara purgarse totalmente de los residuos t\u00f3xicos que se\nencuentran incrustados en el intestino; por lo que se produce una\npurificaci\u00f3n de la\n[sangre](/trabajos/sangre/sangre.shtml) y de todos los \u00f3rganos\ninternos y gl\u00e1ndulas, produciendo una regeneraci\u00f3n\ny crecimiento de los\n[tejidos](/trabajos5/lacel/lacel.shtml) de todo el cuerpo y prolongando de\neste modo la vida de la totalidad del organismo de forma\nsignificativa. Consistir\u00eda en vivir de las energ\u00edas\nacumuladas por el organismo y proyectar de esta forma las fuerzas\ninteriores hacia el exterior.\nR\u00fcdiger Dahlke, natur\u00f3pata,\ndesde su\n[libro](/trabajos13/librylec/librylec.shtml) \"El ayuno consciente\"(, considera que el ayuno es\nun negar, realizado de forma consciente, de los deseos y\nnecesidades del cuerpo f\u00edsico, subrayando la\nprimac\u00eda de la\n[conciencia](/trabajos11/estacon/estacon.shtml) sobre la [materia](/trabajos10/lamateri/lamateri.shtml).\nTras leer todas estas definiciones podemos\ndarnos cuenta que todas tienen una cosa es com\u00fan y es el\nhecho de que en cuanto a la definici\u00f3n de lo que significa\nel ayuno f\u00edsicamente, con\n[car\u00e1cter](/trabajos34/el-caracter/el-caracter.shtml)\nterap\u00e9utico, son bastante similares, pero cuando ya se\ntrata de hacer una aproximaci\u00f3n a lo espiritual, religioso\n\u2026 difieren mucho las unas de las otras ya que dependen del\n[grupo](/trabajos14/dinamica-grupos/dinamica-grupos.shtml), colectivo que la ha realizado.\nDestacar tambi\u00e9n el hecho que en\ntodas ellas posee un car\u00e1cter voluntario que depende de\ncada\n[individuo](/trabajos28/aceptacion-individuo/aceptacion-individuo.shtml). Se trata de una decisi\u00f3n\npropia.\nOtto Buchinger, nos expon\u00eda que\nayunar pod\u00eda ser definido como una situaci\u00f3n no de\npasar hambre, sino que era la renuncia que se hac\u00eda de\nforma voluntaria, libre y consciente de tomar\n[alimentos](/trabajos7/alim/alim.shtml) durante\nun per\u00edodo de\n[tiempo](/trabajos901/evolucion-historica-concepciones-tiempo/evolucion-historica-concepciones-tiempo.shtml) determinado, y que se trataba como\ntal de una experiencia de la vida.\nPodr\u00edamos intentar encontrar una\ndefinici\u00f3n m\u00e1s o menos gen\u00e9rica, y entonces\ndir\u00edamos que el ayuno es un m\u00e9todo que intenta\nsacar todo lo venenoso, la podredumbre, las vibraciones astrales\ninferiores, energ\u00edas negativas \u2026 que posee el\ncuerpo, entendido como una dualidad (cuerpo-mente) Y que se\nproducir\u00e1 una salida a fuera, al exterior por medio de la\n[fuerza](/trabajos12/eleynewt/eleynewt.shtml) vital que posee dicho organismo. Con lo que se\nconseguir\u00e1 un cuerpo mucho m\u00e1s sano y purificado y\ndebido a esta mejor\u00eda el ser se torna m\u00e1s claro y\nprofundo, m\u00e1s sensitivo.\nTras una breve, pero no menos concienzuda\nreflexi\u00f3n, podemos darnos cuenta que los prop\u00f3sitos\nde realizar un ayuno pueden ser varios. Desde la\n[salud](/Salud), la\n[higiene](/trabajos12/higie/higie.shtml), por el nivel an\u00edmico, por convicciones sociales o\npor convicciones espirituales (el m\u00e1s utilizado en la\nantig\u00fcedad)\u2026\nAl adentrarnos en el car\u00e1cter\nm\u00e1s espiritual del ayuno, topamos con las diferentes\n[religiones](/Religion) que pueblan el mundo. \u00c9stas en mayor o menor\nmedida hacen uso del ayuno, pero cada una lo practica y lo\ndispone de un modo diferente y con unos prop\u00f3sitos que\ntambi\u00e9n difieren de unas a otras. Pero lo que es inherente\na todas ellas es el hecho de que se trata de un ejercicio\nreligioso.\nPor poner ejemplos, tenemos que la\n[Iglesia](/trabajos2/inicristiabas/inicristiabas.shtml)\ncristiana, realizaba, y en menor medida realiza, ayunos antes de\ncualquier evento de caracter\u00edsticas espirituales. Para\nayudar a dominar los deseos y pasiones y tambi\u00e9n como\nreparaci\u00f3n de los pecados.\nPor su parte la\n[religi\u00f3n](/Religion)\nisl\u00e1mica, reserva todo un mes al a\u00f1o, el\nRamad\u00e1n, para el ayuno.\nLos\n[jud\u00edos](/trabajos28/judios-y-jerusalem/judios-y-jerusalem.shtml) realizan el ayuno el\nd\u00eda que ellos llaman de Yom Kippur y que va desde el ocaso\nal anochecer del d\u00eda siguiente. Para\n[poder](/trabajos35/el-poder/el-poder.shtml) llevar a cabo\nla expiaci\u00f3n y la reconciliaci\u00f3n.\nEl realizar un ayuno o someterse a\nayunoterapia, comprende una serie de pasos que en este\n[trabajo](/trabajos34/el-trabajo/el-trabajo.shtml) no\ndesarrollaremos pues nos desviar\u00eda de nuestro principal\n[objetivo](/trabajos16/objetivos-educacion/objetivos-educacion.shtml), el ayuno como [filosof\u00eda](/trabajos910/en-torno-filosofia/en-torno-filosofia.shtml). Pero si comentar que\nlos ayunos m\u00e1s comunes pueden ser de\n[agua](/trabajos14/problemadelagua/problemadelagua.shtml), de infusiones,\nde zumos o de infusiones y zumos. Aunque en nuestros d\u00edas\nhan surgido\n[productos](/trabajos12/elproduc/elproduc.shtml) como el sirope de arce o alg\u00fan tipo\nde monodietas que tambi\u00e9n son considerados\nayuno.\nLo que nunca tenemos que perder de vista es\nque cuando se considera el ayuno bajo lo filos\u00f3fico, lo\nespiritual\u2026 \u00e9ste es un medio de conversi\u00f3n y\nno un fin en s\u00ed mismo. Es la manera de llegar a \u2026\nPues ayunar no es otra cosa que \"desprenderse de\nalgo\".\nEl ayuno nos hace m\u00e1s consciente,\nnos sensibiliza\n[f\u00edsica](/Fisica) y ps\u00edquicamente y al mismo\ntiempo como ya hemos comentado anteriormente, nos conduce a una\nlimpieza del cuerpo, junto con lo que podr\u00edamos llamar una\npurificaci\u00f3n del\n[alma](/trabajos37/evolucion-alma/evolucion-alma.shtml), por lo que incluso seg\u00fan\nciertos autores puede llegar a producirse cambios en las personas\nque lo realizan, al nivel de caracteres. Como podr\u00eda ser\nel hecho de que una\n[persona](/trabajos7/perde/perde.shtml) materialista, pueda llegar a cambiar\nsus\n[objetivos](/trabajos16/objetivos-educacion/objetivos-educacion.shtml) iniciales y llegue a profundizar en los lugares\nm\u00e1s rec\u00f3nditos de su alma. Debido al hecho de que\nla persona tiene la oportunidad de llegar a niveles m\u00e1s\nprofundos, propiciados por la tendencia natural al recogimiento\ndurante ese periodo.\nExisten otros estudios que nos afirman que\nlos ayunos ayudan en los grandes trabajos\n[intelectuales](/trabajos31/rol-intelectuales/rol-intelectuales.shtml), pues\nhacen los pensamientos mucho m\u00e1s claros y ayudan a la\ncomprensi\u00f3n de los conceptos de forma m\u00e1s precisa y\ncorrecta.\nEntrar\u00edamos en este punto en lo que\npodr\u00edamos llamar los beneficios espirituales,\nfilos\u00f3ficos que aporta el realizar un ayuno. Entre otros\npodemos encontrar que aumenta la fuerza de voluntad (por el hecho\nde ser una decisi\u00f3n libre, consciente y voluntaria); un\naumento de la estabilidad psicol\u00f3gica y de la auto\nconfianza; nos aporta una visi\u00f3n interior mucho m\u00e1s\naguda y profunda \u2026 y si nos atenemos a consideraciones\nreligiosas tambi\u00e9n podr\u00edamos a\u00f1adir que nos\nhace m\u00e1s humildes, nos proporciona una vis\u00f3n\nm\u00e1s directa con el dios, al tiempo que nos clarifica\nnuestra visi\u00f3n interior, nos aporta un camino para llegar\nal gozo espiritual o \u00e9xtasis \u2026\nDentro de este punto que acabamos de\nexplicar, hacer menci\u00f3n a lo que Ghandi (gran ayunador)\nnos expon\u00eda sobre el ayuno.\nSeg\u00fan \u00e9l, el ayuno nos\npurificaba cuerpo, mente y alma y tambi\u00e9n era un acto\nespiritual que constitu\u00eda una intensa plegaria o\npreparaci\u00f3n para la misma.\nBajo t\u00e9rminos homeop\u00e1ticos,\nseg\u00fan Thomas Dethleften, ayunar ser\u00eda como una\n[muerte](/trabajos15/tanatologia/tanatologia.shtml) diluida / potenciada y, de la misma forma que toda muerte\nabre la puerta de un renacer, la persona que ayuna est\u00e1\nengendrando una nueva vida, una nueva sanci\u00f3n.\nSiguiendo con las analog\u00edas\ntambi\u00e9n podr\u00edamos exponer la de R\u00fcdiger\nDahlke, autor mencionado anteriormente, que nos afirma que se\npodr\u00eda establecer entre ayuno y el\n[proceso](/trabajos14/administ-procesos/administ-procesos.shtml#PROCE) de alquimia una\nrelaci\u00f3n. Ya que con el primero se llega a una cierta\ndisoluci\u00f3n de la cadena que une cuerpo y alma, y ambas se\ntiene que someter a una limpieza profunda, juntos o por\nseparado.\nTambi\u00e9n dicho autor nos expone que\nel ayuno y la\n[psicoterapia](/trabajos28/escenarios-psicoterapeuticos/escenarios-psicoterapeuticos.shtml) tienen muchos puntos en com\u00fan,\npor ser\n[m\u00e9todos](/trabajos11/metods/metods.shtml) que ayudan al autoconocimiento.\nEl ayuno, puede as\u00ed contarse entre\nlas formas m\u00e1s naturales de curaci\u00f3n, siendo un\nremedio eficaz para todos los\n[animales](/trabajos10/cani/cani.shtml) y personas que se\nencuentran pr\u00f3ximos a la\n[naturaleza](/trabajos36/naturaleza/naturaleza.shtml). [Enfoque]\nactual\nactual\nActualmente el ayuno, o ser\u00eda mejor\nexpresarlo como ayunoterapia, ha perdido el car\u00e1cter\nespiritual, filos\u00f3fico\u2026 que pose\u00eda en sus\nor\u00edgenes. En estos momentos tiene un car\u00e1cter de\ntratamiento, sobretodo en relaci\u00f3n con el exceso de peso,\ncon la\n[obesidad](/trabajos15/obesidad/obesidad.shtml) \u2026 se trata de un medio para poder llegar a\nun objetivo determinado y no un objetivo en s\u00ed mismo. Un\nejemplo lo podemos encontrar en la cl\u00ednica Buchinger,\nubicada en tierras andaluzas, exactamente en Marbella,\nd\u00f3nde las personas con cierto nivel econ\u00f3mico,\nmayoritariamente, pagan una suma de\n[dinero](/trabajos16/marx-y-dinero/marx-y-dinero.shtml) determinada para poder\nequilibrar, reajustar, bajar el exceso de peso \u2026 debido al\nritmo de vida que llevan durante la mayor parte del tiempo y el\ncual no es el adecuado para tener un\n[estilo de vida](/trabajos27/estilo-vida/estilo-vida.shtml) saludable, ni\npara gozar de buena salud.\nSe ve reflejado con este ejemplo el hecho\nde tratar al ayuno como un medio f\u00edsico, sin ning\u00fan\no casi ning\u00fan beneficio espiritual. Y me pregunto \u00bf\nqu\u00e9 pensar\u00eda Otto Buchinger, si viviera?\nSiempre sin perder de vista que fue su hija\nla que hace 33 a\u00f1os fund\u00f3 la cl\u00ednica con\neste fin y no con el fin que promulgaba su padre, que no era otro\nque como tratamiento de vital importancia frente a multitud de\n[enfermedades](/Salud/Enfermedades/).\nPor otro lado cuando el ayuno se encuentra\nrelacionado con lo religioso, en la actualidad tambi\u00e9n se\nha perdido ese car\u00e1cter sagrado, espiritual que\npose\u00eda. En la antig\u00fcedad desempe\u00f1aba un papel\nde ritual en todas las grandes\n[religiones](/trabajos28/religiones/religiones.shtml) y como ha sucedido en\notros muchos\n[valores](/trabajos14/nuevmicro/nuevmicro.shtml), ha perdido pr\u00e1cticamente su\nimportancia o por el contrario se ha producido una\ntransformaci\u00f3n o reforma total de su sentido. Debido a la\ndecadencia que las religiones han sufrido, se ha llegado al fin\nde la tradici\u00f3n del ayuno religioso. S\u00f3lo un\nn\u00famero bastante reducido de aquellos creyentes\nac\u00e9rrimos lo siguen llevando a la\npr\u00e1ctica.\nEn la actualidad la ayunoterapia, es una de\nlas terapias m\u00e1s utilizadas en naturopat\u00eda para\ntratar algunos males y acelerar la recuperaci\u00f3n de nuestro\norganismo despu\u00e9s de determinadas enfermedades.\nTambi\u00e9n existe en la actualidad una\nparte de los cient\u00edficos que est\u00e1n en contra del\nayuno porque dicen que debido a que el organismo se encuentra muy\nintoxicado, con gran acumulaci\u00f3n de\n[metales](/trabajos10/coma/coma.shtml) pesados,\ntoxinas, etc, \u00e9ste puede llegar a producir consecuencias\nnefastas para el organismo. Aunque no existen unas bases\ncient\u00edficas que lo lleguen a corroborar.\n[Conclusiones]\nAl realizar este trabajo, en un principio\nten\u00eda la idea que no me ser\u00eda dif\u00edcil\nencontrar\n[bibliograf\u00eda](/apa.shtml) relacionada con el tema. Una vez de\nme puse a ello de forma activa me di cuenta que la\nbibliograf\u00eda que iba encontrando estaba muy relacionada\ncon el ayuno, pero bajo su aspecto terap\u00e9utico. Es decir,\nque me explicaban como se realizaba un ayuno, qui\u00e9n\npod\u00eda realizarlo y qui\u00e9n no, los efectos\nbeneficiosos que ten\u00eda para la salud \u2026 pero la\nfilosof\u00eda, la\n[historia](/Historia), los or\u00edgenes \u2026 no\neran\n[tratados](/trabajos11/dertrat/dertrat.shtml) en la gran mayor\u00eda de dichos\n[libros](/trabajos16/contabilidad-mercantil/contabilidad-mercantil.shtml#libros).\nLa misma dificultad la ver\u00eda\nreflejada cuando me puse a hacer una b\u00fasqueda exhaustiva\npor\n[Internet](/Computacion/Internet/).\nDebido a todo lo comentado en el punto\nanterior,\n[el trabajo](/trabajos/fintrabajo/fintrabajo.shtml) ha resultado costoso de realizar por la poca\nbase escrita existente que he podido consultar y al mismo tiempo\npor no poseer un criterio para poder discriminar que\n[informaci\u00f3n](/trabajos7/sisinf/sisinf.shtml) podr\u00eda ser considerada como\nv\u00e1lida y cual no.\nLa bibliograf\u00eda que aporto en el\ntrabajo la tuve que buscar en librer\u00edas especializadas, ya\nque al nivel de\n[bibliotecas](/trabajos10/ponency/ponency.shtml) existe muy poco o nulo fondo\nbibliogr\u00e1fico.\nEl trabajo me ha ayudado a darme cuenta de\nlo dif\u00edcil que puede llegar a ser la b\u00fasqueda\nbibliogr\u00e1fica de un tema como el ayuno. Que puede parecer\ntan cercano a nosotros y que por otro lado es tan\ndesconocido.\nAunque a simple vista pueda parecer que lo\n\u00fanico que se est\u00e1 exponiendo son quejas en\nrelaci\u00f3n con el tema del trabajo, la realidad es que el\nhecho de realizarlo me ha ayudado a descubrir ciertos aspectos\nreligiosos de nuestra historia que me eran desconocidos, como\npodr\u00eda ser el hecho de no comer carne el Viernes Santo\n(dentro del\n[cristianismo](/trabajos2/inicristiabas/inicristiabas.shtml)) o el sentido que tiene el\nRamad\u00e1n para los creyentes isl\u00e1micos \u2026 que\nsi bien es cierto que conoc\u00eda, no sab\u00eda muy bien el\nporque, la justificaci\u00f3n de realizarlo de esta manera y no\nde otra totalmente diferente. Y todo esto me ha llevado a\nadquirir una visi\u00f3n mucho m\u00e1s amplia del ayuno,\nm\u00e1s all\u00e1 de ser un medio para poder conseguir\nciertos objetivos terap\u00e9uticos.\nAs\u00ed pues, ha ampliado mis\nconocimientos culturales que ten\u00eda en relaci\u00f3n con\nel tema de estudio.\nA partir de realizar esta revisi\u00f3n\nbibliogr\u00e1fica y m\u00e1s tard\u00edamente el trabajo,\nhe podido llegar a la conclusi\u00f3n, reflexionar:\n\u2013 El ayuno o ayunoterapia, es una terapia\nque puede tener unos beneficios org\u00e1nicos / f\u00edsicos\ny tambi\u00e9n unos beneficios que podr\u00edamos llamar\nespirituales / filos\u00f3ficos. Y que tanto unos como los\notros no son excluyentes si no que forman parte de un todo. Al\nescribirlo me ha venido a la mente el hecho de que podr\u00eda\nconsiderarse una terapia hol\u00edstica, tan en consonancia con\nlo que son las terapias naturales.\n\u2013 Se trata de una terapia que se remonta a\na\u00f1os y a\u00f1os de antig\u00fcedad, pero que no fue\nconsiderada como tal, como la conocemos actualmente, hasta los\nprimeros a\u00f1os del reciente siglo XX.\nY por \u00faltimo y no por eso menos\nimportante, que se trata de una terapia que tiene vigencia en\nnuestros d\u00edas; con un marcado car\u00e1cter\nf\u00edsico, de beneficio para el cuerpo que deja un poco\nm\u00e1s de lado los beneficios que para la mente/alma,\npueda llegar a aportar.\n[Art\u00edculos]\nArticulo 1\n\u00bfPor qu\u00e9 practicar el\nayuno?\nEst\u00e1 muy relacionado con la\nfilosof\u00eda y creencias personales. Algunas manifiestan que\nes bueno para el cuerpo, un tiempo de reposo de los\n\u00f3rganos que contribuyen a depurar el organismo y que deja\nun espacio para realizar otras actividades placenteras e\nintelectuales.\nOtras personas con creencias religiosas\nmenciona que es un medio excelente para evitar los abusos, las\nmalas costumbres, las falsas necesidades; que la comida y la\nbebida pueden llegar a convertirse en\n[drogas](/trabajos13/ladrogcc/ladrogcc.shtml) y que nada hay\nm\u00e1s degradante que no poder prescindir del\n[caf\u00e9](/trabajos3/histocafe/histocafe.shtml), el\n[alcohol](/trabajos/alcoholismo/alcoholismo.shtml) o el queso. Sugieren que practicar el ayuno es\nrejuvenecedor, que son las vacaciones ben\u00e9ficas de\nnuestros \u00f3rganos\u2026\nAyuno total o parcial\nEn el ayuno total se elimina toda ingesta\nde alimentos y bebidas, salvo un poco de agua fresca, aunque\nalgunas personas sugieren que los primeros d\u00edas es\npreferible tomar al menos bebidas e infusiones calientes y\nazucaradas. El ayuno total puede durar de una semana, si bien lo\nm\u00e1s adecuado es que no supere los 7 d\u00edas y suele\npracticarse unas dos veces al a\u00f1o. Siempre que se trate de\nun ayuno superior a dos d\u00edas, se ha de tener en cuneta que\ndebe ser bajo vigilancia de una persona competente y\nrestringiendo el nivel de actividad, es decir, requiere\nreposo.\nEn cuanto al ayuno parcial, hay\nvariantes:\n* ayuno parcial en el que se omiten una o\ndos comidas del d\u00eda. Quienes lo llevan a cabo sugieren\nque, practicando una vez por semana, supone una forma excelente\npar el cuerpo a la que resulta f\u00e1cil acostumbrase, casi\nsin esfuerzo. El momento de la comida se sustituye por\nactividades l\u00fadicas (paseos, tiempo para\nrelajaci\u00f3n\u2026) y suele denominarlo \"el domingo de los\n\u00f3rganos\", ya que supone un periodo de reposo\ndigestivo.\n*ayuno parcial en el que suprime\ntemporalmente un tipo de alimento o se lleva a cabo una dieta\nespecial; se puede estar varios d\u00edas sin carne o sin\n[l\u00e1cteos](/trabajos6/lacte/lacte.shtml), etc. Anta\u00f1o se hablaba asimismo de dieta\nvegetal, la cual consist\u00eda en comer solamente vegetales o\nfrutas. Otras formas de ayuno parcial de este tipo es la dieta\ndel gel de trigo, que se lleva a cabo aproximadamente durante\nsiete d\u00edas. Los seguidores de dieta vegetal y de esta\nmodalidad advierten del peligro de ser empleadas sin vigilancia o\n[control](/trabajos14/control/control.shtml) m\u00e9dico y recomiendan una realimentaci\u00f3n\nprogresiva: bebidas con\n[az\u00facar](/trabajos15/cana-azucar/cana-azucar.shtml), luego papillas, verduras y\nfinalmente carne.\n\u00bfQu\u00e9 es la semidieta o\nsemiayuno?\nEs una variedad del ayuno que suele\npracticarse dos veces al a\u00f1o, en oto\u00f1o y en\nprimavera, a la entrada y a la salida del invierno; \"una limpieza\ninterna de nuestro cuerpo\". Suele practicarse entre uno y diez\nd\u00edas. Los dos primeros d\u00edas, la\n[alimentaci\u00f3n](/Salud/Nutricion/)\nes semil\u00edquida: infusiones de tomillo, romero, t\u00e9\nligero, tomados a las 7-11-18 y 22 horas, que se pueden\nacompa\u00f1ar de miel y una rodaja de lim\u00f3n. Al\nmediod\u00eda se suele tomar fruta o papilla de trigo elaborada\ncon agua, harina,\n[aceite](/trabajos35/obtencion-aceite/obtencion-aceite.shtml), miel y frutos secos: 2 vol\u00famenes\nde agua por uno de trigo, 1 cucharadita de aceite de oliva\nvirgen, miel y nueces o almendras\u2026 Siempre que se lleve a cabo\nm\u00e1s de dos d\u00edas, se ha de tener en cuenta que debe\nser bajo vigilancia de una persona competente y restringiendo el\nnivel de actividad.\n\u00bfEs realmente necesario o\nbeneficioso?\nQuienes padecen alteraciones de la salud o\nest\u00e1n enfermos y las personas cuyas necesidades nutritivas\nest\u00e1n aumentadas (\n[ni\u00f1os](/trabajos16/espacio-tiempo/espacio-tiempo.shtml) y [adolescentes](/trabajos15/adolescencia-crisis/adolescencia-crisis.shtml), embarazadas\ny madres lactantes), deben abstenerse de practicar cualquiera de\nestas modalidades.\nRespecto de las personas sanas adultas, que\npor su filosof\u00eda o creencias ponen en pr\u00e1ctica el\nayuno o la semidieta, aunque no les ocasione ning\u00fan efecto\nnocivo, tampoco les va a reportar a corto o largo plazo beneficio\nalguno para la salud. Es decir, que en lo que se refiere a la\n[poblaci\u00f3n](/trabajos/explodemo/explodemo.shtml) en general, ni es necesario ni se ha de\nrecomendar poner en pr\u00e1ctica el ayuno, ya que lo\nverdaderamente importante es llevar a cabo una dieta sana,\ncompleta y equilibrada y un estilo de visa saludable y\nactivo.\n[http](/trabajos11/wind/wind2.shtml)://www.consumer.es/ [web](/trabajos5/laweb/laweb.shtml)/es/alimentacion/salud_y_alimentcion/alimentacion_alternativa/2003/05/23/61635.php\nComentario:\nEste primer art\u00edculo nos hace una\nrevisi\u00f3n del porque se deber\u00eda realizar un ayuno,\nde los tipos de ayunos que existen y de los beneficios que puede\nllegar a aportar el realizarlo.\nEl primer punto del art\u00edculo nos\nexplica lo que significa realizar un ayuno, en cuanto a\nbeneficios f\u00edsicos y ps\u00edquicos. Los dos siguientes\nnos describen y definen los tipos de ayunos que existen en la\nactualidad; el \u00faltimo punto de dicho art\u00edculo nos\nhace una reflexi\u00f3n de si resulta o no beneficioso el hecho\nde realizar un ayuno.\nTodo el art\u00edculo est\u00e1\nrealizado bajo una visi\u00f3n que se encuentra fuera de la\nmayor\u00eda de tendencias naturales, trata al ayuno como una\nespecie de \"capricho\" de la persona que lo realiza. No le da\nning\u00fan\n[valor](/trabajos14/nuevmicro/nuevmicro.shtml) terap\u00e9utico y no lo aconseja en el\ncaso de que la persona pueda padecer alguna dolencia o\nalteraci\u00f3n de la salud, niega su efecto\nterap\u00e9utico. Y tampoco lo recomienda cuando las personas\nse encuentra en \u00e9pocas de necesidades alimentar\u00edas\naumentadas. Este \u00faltimo punto se encuentra en acuerdo con\nlos c\u00e1nones m\u00e9dicos de tendencia\nnaturista.\nLa verdad es que se trata de un\nart\u00edculo que tampoco da pie a realizar una\nvaloraci\u00f3n mucho m\u00e1s extensa de la realizada, por\nel hecho de que se trata m\u00e1s de una\n[descripci\u00f3n](https://monografias.com/trabajos10/anali/anali.shtml) que\nde un\n[posicionamiento](/trabajos7/posic/posic.shtml) rotundo a favor o en contra.\nArt\u00edculo 2\n10 puntos por un d\u00eda entero de\nayuno\nLa\n[Comunidad](/trabajos910/comunidades-de-hombres/comunidades-de-hombres.shtml) de [Madrid](/trabajos901/historia-madrid/historia-madrid.shtml) denuncia en los\njuzgados un concurso en Internet que fomenta la\n[anorexia](/trabajos/anorexia2/anorexia2.shtml).\nEFE \u2013 Madrid \u2013\n06/01/2007\nLa Consejer\u00eda de Sanidad de la\nComunidad de Madrid ha denunciado en los Juzgados de la Plaza de\nCastilla la convocatoria, a trav\u00e9s de una p\u00e1gina\nweb, de un concurso para perder peso mediante el fomento de los\ntrastornos de la alimentaci\u00f3n. El concurso se llama La\nGran\n[Competencia](/trabajos7/compro/compro.shtml) Ana y alojado en una micro web de la\np\u00e1gina www.princesasdeporcelana.es.kz. Dura 14 d\u00edas\ny ganan las tres personas que m\u00e1s peso pierdan.\nAdem\u00e1s incluye un\n[sistema](/trabajos11/teosis/teosis.shtml) de puntos en el que el\nm\u00e1ximo, 10, se consigue con un ayuno de 24\nhoras.\nTras ser informada de la existencia de este\nconcurso por la Polic\u00eda Municipal, Sanidad ha puesto los\nhechos en\n[conocimiento](/trabajos/epistemologia2/epistemologia2.shtml) del juzgado por si pudieran ser\nconstitutivos de un\n[delito](/trabajos10/delipen/delipen.shtml) penal y procediese a la\n[adopci\u00f3n](/trabajos11/adopca/adopca.shtml) de [medidas cautelares](/trabajos36/medidas-cautelares/medidas-cautelares.shtml), se\u00f1ala en un\ncomunicado.\nLa Consejer\u00eda considera que dicho\nconcurso constituye un grave\n[riesgo](/trabajos13/ripa/ripa.shtml) de [salud p\u00fablica](/trabajos12/ensfin/ensfin.shtml#EFECTOS) para\nlas j\u00f3venes que pueden acceder a \u00e9l y \"sobre todo\npara las que ya padecen de trastorno de la\n[conducta](/trabajos/conducta/conducta.shtml) alimentaria\"\npor lo que solicita su paralizaci\u00f3n inmediata.\nSeg\u00fan el\n[informe](/trabajos12/guiainf/guiainf.shtml) presentado en el\njuzgado, el concurso no excluye la participaci\u00f3n de\nning\u00fan colectivo de poblaci\u00f3n especialmente menores\nde edad, adolescente o personas que padecen trastornos del\n[comportamiento](/trabajos16/comportamiento-humano/comportamiento-humano.shtml) alimentario como la anorexia o la [bulimia](/trabajos16/patologia-alimentaria/patologia-alimentaria.shtml#bulimia).\nAsimismo, las bases de la competici\u00f3n establecen un baremo\nde criterios y puntuaciones, con una serie de\n[dietas](/trabajos57/dietas-adelgazantes/dietas-adelgazantes.shtml) que se\nsit\u00faan \"por debajo de lo normalmente aceptable, es decir,\nincompatibles con la salud, ya que causar\u00edan una\nsituaci\u00f3n de\n[desnutrici\u00f3n](/trabajos15/desnutricion/desnutricion.shtml) en una [mujer](/trabajos11/lamujer/lamujer.shtml)\nnormal\".\nEn le caso de personas que ya padezcan un\ntrastorno de la conducta alimentaria, Salud se\u00f1ala que el\nseguimiento de las dietas que figuran en las bases de esta\nconvocatoria \"ser\u00eda a\u00fan m\u00e1s grave para su\n[estado](/trabajos12/elorigest/elorigest.shtml) de vida\". Seg\u00fan figura en la web, el concurso tiene\nuna duraci\u00f3n de 14 d\u00edas, del 13 de enero al 27 de\nenero. Para participar se pide un\n[registro](/trabajos7/regi/regi.shtml) previo en un subforo,\nen el que se deben indicar \"nick, edad, altura, peso actual y\npeso ideal\". \"Las tres personas que m\u00e1s peso pierdan (\u2026)\nocupar\u00e1n los tres primeros puestos del podio de honor en\nla micro web \"La Gran Competencia Ana\", agrega. La web ofrece\nadem\u00e1s de un sistema de puntuaci\u00f3n para que las\nparticipantes apunten en el\n[foro](/guias/foros/) \"lo obtenido cada\nd\u00eda\".\nEsta puntuaci\u00f3n \"depende de las\n[calor](/trabajos15/transf-calor/transf-calor.shtml)\u00edas consumidas, el ejercicio realizado y varios\nextras\". As\u00ed, si se consumen entre 751 a 850\ncalor\u00edas / d\u00eda se obtienen dos puntos, que aumentan\nprogresivamente hasta nueve si el n\u00famero de\ncalor\u00edas se reduce a las 50-150/d\u00eda. LA\npuntuaci\u00f3n se eleva a 10 puntos cuando ha habido un ayuno\nde 24 horas. Los puntos tambi\u00e9n se obtiene, seg\u00fan\nestablece el concurso, haciendo ejercicio (corre 10 minutos vale\nun punto), bebiendo agua (por cada medio litro se obtiene un\npunto) o tomando \"tus pastillas o\n[vitaminas](/trabajos11/lasvitam/lasvitam.shtml)\" (dos\npuntos)\nEl informe de la\n[direcci\u00f3n](/trabajos15/direccion/direccion.shtml) General\nde Salud P\u00fablica advierte de que este tipo de concursos\npropician la\n[inducci\u00f3n](/trabajos6/elme/elme.shtml#induccion) artificial de s\u00edntomas de\nanorexia. Adem\u00e1s, indica, \"la difusi\u00f3n de\ns\u00edntomas anor\u00e9xicos que conlleva esta\ncompetici\u00f3n supone tambi\u00e9n un grave riesgo para\ncualquier joven, ya que fomenta la aparici\u00f3n del trastorno\npor mimetismo de las personas que entran en contacto\". La web\nprincesasdeporcelana trata \"sobre trastornos de la Conducta\nAlimentaria\" pero \"desde un punto de vista totalmente\n[personal](/trabajos11/fuper/fuper.shtml)\",\nseg\u00fan se afirma en la propia p\u00e1gina, en la que se\na\u00f1ade que ella \"se encuentra informaci\u00f3n\" que se\naconseja \"no seguir\".\nhttp://www.elpais.com/articulo/espana/puntos/dia/entero/ayuno/elpeusp/200070106elpepunac_5/tes\nComentario:\nEste segundo art\u00edculo es una noticia\nextra\u00edda del diario El Pa\u00eds , en su versi\u00f3n\n[electr\u00f3nica](/trabajos5/electro/electro.shtml). Se trata de una denuncia interpuesta por la\nConserjer\u00eda de Sanidad de la Comunidad de Madrid, contra\nuna web que seg\u00fan afirma realiza apolog\u00eda de los\ntrastornos de la conducta alimentaria, por medio de la\nparticipaci\u00f3n en un concurso para perder peso.\nTiene relaci\u00f3n con el tema, por el\nhecho que se hace menci\u00f3n a la terapia de ayuno, pero como\nuna obtenci\u00f3n de puntos para ganar el mencionado\nconcurso.\nObservamos en dicho art\u00edculo la\nmanipulaci\u00f3n que se realiza a trav\u00e9s de Internet de\nlas dietas, el ayuno y el fin de reducir peso. Se realiza toda\nuna utilizaci\u00f3n no correcta de terap\u00e9uticas que son\nbeneficiosas si son empleadas de forma adecuada.\nPodemos darnos cuenta que como todo en este\nmundo, posee su parte buena y su parte no tan buena, dependiendo\nen las manos en las que se encuentre y los objetivos que la\npersona o personas pretendan conseguir.\nEn este art\u00edculo el ayuno es tratado\ncomo un fin para llegar a conseguir unos puntos que sumados\npueden hacer que las personas que lo realice sean ganadoras de un\nconcurso, y no como en realidad es un m\u00e9todo\nterap\u00e9utico.\n[Bibliograf\u00eda]\nRaichur, Patrima. Ayurveda: Las mejores\n[t\u00e9cnicas](/trabajos6/juti/juti.shtml) para conseguir una belleza verdadera. Editorial\nAmat. 3era.\n[edici\u00f3n](/trabajos901/nuevas-tecnologias-edicion-montaje/nuevas-tecnologias-edicion-montaje.shtml). Barcelona, 2006.\nReid Daniel. Medicina Tradicional China.\nEditorial Urano. Barcelona, 1990. Pp. 101-114.\nHopfenzitz, Petra y Dr. L\u00fctzer,\nHellmut. Ayuno y meditaci\u00f3n. Editorial Integral.\nBarcelona, 1990.\nVogel, Alfred. El peque\u00f1o doctor.\nConsejos \u00fatiles para mejorar la salud. Ars Medica\nEditorial. Barcelona, 1986. Pp. 92, 130, 171, 277, 281, 283, 285,\n296, 315, 321, 322, 328, 329, 416, 497, 564, 566, 755, 761, 762,\n763.\nVogel, Alfred.\n[Normas](/trabajos4/leyes/leyes.shtml) de vida. Serie de\nnuevos art\u00edculos de Alfred Vogel. Ars Medica Editorial.\nBarcelona, marzo de 1995.\nSvododa, Robert. Ayurveda. Editorial\nKair\u00f3s.\n[Biblioteca](/trabajos10/ponency/ponency.shtml) de la salud. Pp. 94-161.\nEhret, Arnaldo. Ayuno racional. Para el\nrejuvenecimiento f\u00edsico, mental y espiritual. Editorial\nKier.\n[Buenos Aires](/trabajos5/cron/cron.shtml), Argentina, 2004.\nDahlke, R\u00fcdiger. El ayuno consciente.\nEdiciones Obelisco. Barcelona, 1996. 3era\nedici\u00f3n.\nArt\u00edculos y escritos\nextra\u00eddos de diversas webs de Internet relacionadas con el\ntema de estudio.\nAutor:\nBego Orive Tudel\n[1] Avicena: M\u00e9dico y fil\u00f3sofo,\nconsiderado como la personalidad m\u00e1s importante de la\nmedicina \u00e1rabe en la Edad Media. Public\u00f3 el\n\u201cCanon de la Medicina\u201d.\n[2] Paracelso: Religioso de vocaci\u00f3n y\nestudioso de las realidades f\u00edsicas y superiores, que\nbas\u00f3 su medicina en el m\u00e9dico interior o\n\u201carchus\u201d.\n[3] Alfred Vogel: Persona autodidacta, sin\nestudios universitarios, precursor del ayuno y gran estudioso\nen el campo de la fitoterapia. Cuya obra m\u00e1s conocida es\n\u201cEl peque\u00f1o doctor\u201d.\n| |", "language": null, "image": null, "pagetype": "article", "links": ["https://www.monografias.com/plus", "#", "/ayuda/ayuda", "https://www.monografias.com/pt/", "/dashboard", "https://www.monografias.com/", "/", "/new", "https://blogs.monografias.com/", "https://foros.monografias.com/", "https://www.monografias.com/", "https://www.monografias.com/", "/", "/new", "https://blogs.monografias.com/", "https://foros.monografias.com/", "/plus", "#", "/ayuda/ayuda", "https://www.monografias.com/pt/", "https://www.monografias.com/dashboard", "https://www.monografias.com", "https://www.monografias.com/trabajos82/ayuno-efectos-organismo/ayuno-efectos-organismo.zip", "javascript:window.print();", "#Comentarios", "#Relacionados", "/usuario/perfiles/bego", "ayuno-efectos-organismo.shtml", "ayuno-efectos-organismo2.shtml", "/trabajos11/metods/metods.shtml", "/trabajos29/especialistas-medicos/especialistas-medicos.shtml", "/trabajos13/cultchin/cultchin.shtml", "/trabajos/sangre/sangre.shtml", "/trabajos5/lacel/lacel.shtml", "/trabajos13/librylec/librylec.shtml", "/trabajos11/estacon/estacon.shtml", "/trabajos10/lamateri/lamateri.shtml", "/trabajos34/el-caracter/el-caracter.shtml", "/trabajos14/dinamica-grupos/dinamica-grupos.shtml", "/trabajos28/aceptacion-individuo/aceptacion-individuo.shtml", "/trabajos7/alim/alim.shtml", "/trabajos901/evolucion-historica-concepciones-tiempo/evolucion-historica-concepciones-tiempo.shtml", "/trabajos12/eleynewt/eleynewt.shtml", "/Salud", "/trabajos12/higie/higie.shtml", "/Religion", "/trabajos2/inicristiabas/inicristiabas.shtml", "/Religion", "/trabajos28/judios-y-jerusalem/judios-y-jerusalem.shtml", "/trabajos35/el-poder/el-poder.shtml", "/trabajos34/el-trabajo/el-trabajo.shtml", "/trabajos16/objetivos-educacion/objetivos-educacion.shtml", "/trabajos910/en-torno-filosofia/en-torno-filosofia.shtml", "/trabajos14/problemadelagua/problemadelagua.shtml", "/trabajos12/elproduc/elproduc.shtml", "/Fisica", "/trabajos37/evolucion-alma/evolucion-alma.shtml", "/trabajos7/perde/perde.shtml", "/trabajos16/objetivos-educacion/objetivos-educacion.shtml", "/trabajos31/rol-intelectuales/rol-intelectuales.shtml", "/trabajos15/tanatologia/tanatologia.shtml", "/trabajos14/administ-procesos/administ-procesos.shtml#PROCE", "/trabajos28/escenarios-psicoterapeuticos/escenarios-psicoterapeuticos.shtml", "/trabajos11/metods/metods.shtml", "/trabajos10/cani/cani.shtml", "/trabajos36/naturaleza/naturaleza.shtml", null, "/trabajos15/obesidad/obesidad.shtml", "/trabajos16/marx-y-dinero/marx-y-dinero.shtml", "/trabajos27/estilo-vida/estilo-vida.shtml", "/Salud/Enfermedades/", "/trabajos28/religiones/religiones.shtml", "/trabajos14/nuevmicro/nuevmicro.shtml", "/trabajos10/coma/coma.shtml", null, "/apa.shtml", "/Historia", "/trabajos11/dertrat/dertrat.shtml", "/trabajos16/contabilidad-mercantil/contabilidad-mercantil.shtml#libros", "/Computacion/Internet/", "/trabajos/fintrabajo/fintrabajo.shtml", "/trabajos7/sisinf/sisinf.shtml", "/trabajos10/ponency/ponency.shtml", "/trabajos2/inicristiabas/inicristiabas.shtml", null, "/trabajos13/ladrogcc/ladrogcc.shtml", "/trabajos3/histocafe/histocafe.shtml", "/trabajos/alcoholismo/alcoholismo.shtml", "/trabajos6/lacte/lacte.shtml", "/trabajos14/control/control.shtml", "/trabajos15/cana-azucar/cana-azucar.shtml", "/Salud/Nutricion/", "/trabajos35/obtencion-aceite/obtencion-aceite.shtml", "/trabajos16/espacio-tiempo/espacio-tiempo.shtml", "/trabajos15/adolescencia-crisis/adolescencia-crisis.shtml", "/trabajos/explodemo/explodemo.shtml", "/trabajos11/wind/wind2.shtml", "/trabajos5/laweb/laweb.shtml", "/trabajos14/nuevmicro/nuevmicro.shtml", "https://monografias.com/trabajos10/anali/anali.shtml", "/trabajos7/posic/posic.shtml", "/trabajos910/comunidades-de-hombres/comunidades-de-hombres.shtml", "/trabajos901/historia-madrid/historia-madrid.shtml", "/trabajos/anorexia2/anorexia2.shtml", "/trabajos7/compro/compro.shtml", "/trabajos11/teosis/teosis.shtml", "/trabajos/epistemologia2/epistemologia2.shtml", "/trabajos10/delipen/delipen.shtml", "/trabajos11/adopca/adopca.shtml", "/trabajos36/medidas-cautelares/medidas-cautelares.shtml", "/trabajos13/ripa/ripa.shtml", "/trabajos12/ensfin/ensfin.shtml#EFECTOS", "/trabajos/conducta/conducta.shtml", "/trabajos12/guiainf/guiainf.shtml", "/trabajos16/comportamiento-humano/comportamiento-humano.shtml", "/trabajos16/patologia-alimentaria/patologia-alimentaria.shtml#bulimia", "/trabajos57/dietas-adelgazantes/dietas-adelgazantes.shtml", "/trabajos15/desnutricion/desnutricion.shtml", "/trabajos11/lamujer/lamujer.shtml", "/trabajos12/elorigest/elorigest.shtml", "/trabajos7/regi/regi.shtml", "/guias/foros/", "/trabajos15/transf-calor/transf-calor.shtml", "/trabajos11/lasvitam/lasvitam.shtml", "/trabajos15/direccion/direccion.shtml", "/trabajos6/elme/elme.shtml#induccion", "/trabajos11/fuper/fuper.shtml", "/trabajos5/electro/electro.shtml", null, "/trabajos6/juti/juti.shtml", "/trabajos901/nuevas-tecnologias-edicion-montaje/nuevas-tecnologias-edicion-montaje.shtml", "/trabajos4/leyes/leyes.shtml", "/trabajos10/ponency/ponency.shtml", "/trabajos5/cron/cron.shtml", "ayuno-efectos-organismo.shtml", "ayuno-efectos-organismo2.shtml", "ayuno-efectos-organismo.shtml", "ayuno-efectos-organismo.shtml", "ayuno-efectos-organismo.shtml", "https://www.monografias.com/administracion-y-finanzas", "https://www.monografias.com/agricultura-y-ganaderia", "https://www.monografias.com/anatomia", "https://www.monografias.com/antropologia", "https://www.monografias.com/arquitectura-y-diseno", "https://www.monografias.com/arte-y-cultura", "https://www.monografias.com/biografias", "https://www.monografias.com/biologia", "https://www.monografias.com/computacion", "https://www.monografias.com/derecho", "https://www.monografias.com/ecologia", "https://www.monografias.com/economia", "https://www.monografias.com/educacion", "https://www.monografias.com/epistemologia", "https://www.monografias.com/estudio-social", "https://www.monografias.com/etica", "https://www.monografias.com/filosofia", "https://www.monografias.com/fisica", "https://www.monografias.com/geografia", "https://www.monografias.com/historia", "https://www.monografias.com/ingenieria", "https://www.monografias.com/lengua-y-literatura", "https://www.monografias.com/links", "https://www.monografias.com/matematicas", "https://www.monografias.com/otros", "https://www.monografias.com/paleontologia", "https://www.monografias.com/periodismo", "https://www.monografias.com/politica", "https://www.monografias.com/psicologia", "https://www.monografias.com/quimica", "https://www.monografias.com/religion", "https://www.monografias.com/salud", "https://www.monografias.com/tecnologia", "https://www.monografias.com/turismo", "https://www.monografias.com/zoologia", "/about-us/privacy", "/about-us/terms", "/about-us/contact", "/about-us/contact", "https://blogs.monografias.com/instituional", null]}