{"title": "Respuesta de USCIS al COVID-19", "author": null, "url": "https://www.uscis.gov/es/archivo/respuesta-de-uscis-al-covid-19", "hostname": "uscis.gov", "description": "Citas y Reprogramaciones de Citas en Oficinas Locales Debido al aumento en la propagaci\u00f3n de la variante Omicr", "sitename": "USCIS", "date": "2023-03-06", "id": null, "license": null, "body": null, "comments": "", "commentsbody": null, "raw_text": null, "text": "Respuesta de USCIS al COVID-19\nCitas y Reprogramaciones de Citas en Oficinas Locales\nDebido al aumento en la propagaci\u00f3n de la variante Omicron de COVID-19, es posible que las oficinas locales de USCIS tengan que reprogramar las citas seg\u00fan las condiciones locales. Enviaremos notificaciones a los solicitantes y peticionarios con citas para entrevistas y ceremonias de naturalizaci\u00f3n programadas previamente si necesitamos reprogramar. Quienes asistan a las citas deben seguir las gu\u00edas de seguridad que se describen a continuaci\u00f3n.\nSi necesita ayuda con servicios de emergencia relacionados con documentos (como sellos ADIT o permiso adelantado), trabajamos para programar esas citas lo antes posible. Es posible que experimente tiempos de espera ligeramente m\u00e1s prolongados a medida que reanudamos los servicios en persona de manera gradual y segura. Si necesita programar un servicio de emergencia relacionado con un documentos , puede comunicarse con el\n[Centro de Contacto de USCIS](/es/acerca-de-nosotros/contactenos/centro-de-contacto-de-uscis) para programar una cita.\nVerifique si la oficina respectiva ha sido reabierta en nuestra p\u00e1gina de\n[Estatus de Nuestras Oficinas](/es/acerca-de-nosotros/estatus-de-nuestras-oficinas) antes de llamar al Centro de Contacto.\nLos visitantes se limitan al solicitante, un abogado o representante autorizado y una persona que brinda asistencia por discapacidad (que puede ser un miembro de la familia). Los abogados y / o representantes autorizados pueden acompa\u00f1ar a los solicitantes a la entrevista o participar telef\u00f3nicamente. Si un representante elige participar telef\u00f3nicamente, el solicitante debe notificar al oficial en el momento de la entrevista, quien luego se comunicar\u00e1 con el representante a trav\u00e9s del n\u00famero de tel\u00e9fono escrito en el Formulario G-28, Notificaci\u00f3n de Comparecencia como Abogado o Representante Autorizado.\nA menos que USCIS solicite que el int\u00e9rprete est\u00e9 f\u00edsicamente presente en la oficina para la entrevista, el int\u00e9rprete debe planear estar disponible por tel\u00e9fono. El int\u00e9rprete debe proporcionar al solicitante un n\u00famero de tel\u00e9fono v\u00e1lido donde USCIS pueda comunicarse con \u00e9l al momento de la entrevista. Si se determina que un int\u00e9rprete debe estar f\u00edsicamente presente en la entrevista y no est\u00e1 disponible en ese momento, la entrevista puede reprogramarse.\nSi un solicitante necesita un int\u00e9rprete de lenguaje de se\u00f1as o un int\u00e9rprete de lenguaje de se\u00f1as certificado, debe comunicarse con el\n[Centro de Contacto de USCIS](/es/acerca-de-nosotros/contactenos/centro-de-contacto-de-uscis) en l\u00ednea o llamar al 1-800-375-5283 lo antes posible despu\u00e9s de recibir la notificaci\u00f3n de entrevista.\nCitas y Reprogramaciones de Citas en Centros de Asistencia en Solicitudes (ASC)\nPor favor, antes de venir a su cita, verifique la p\u00e1gina de\n[estatus de nuestras oficinas](/es/acerca-de-nosotros/estatus-de-nuestras-oficinas) para verificar si su ASC.\nDebido a mayores medidas de seguridad en nuestros centros de servicio al cliente (ASC) debido al COVID 19, usted podr\u00eda experimentar:\n- Un periodo de espera m\u00e1s largo para recibir su notificaci\u00f3n de cita de datos biom\u00e9tricos;\n- Restricciones que limitan el acceso a los ASC;\n- Un periodo m\u00e1s largo para la toma de datos biom\u00e9tricos.\nLos solicitantes solo pueden estar acompa\u00f1ados de un int\u00e9rprete, abogado, padre o tutor legal de un menor, o persona que proporciona asistencia a una persona con discapacidad.\nReprogramaci\u00f3n de Citas Canceladas en ASC\nUSCIS programar\u00e1 autom\u00e1ticamente cualquier cita ASC necesario que estaba cancelado debido al cierre de oficina temporal, o enviar notificaciones de citas biom\u00e9tricas a personas elegibles.\nLas personas que tienen que asistir personalmente a una cita en una ASC recibir\u00e1 una nueva notificaci\u00f3n de cita por correo postal.\nAviso: USCIS no puede reprogramar citas autom\u00e1ticamente para solicitantes de visa que son canadienses o de Reino Unido.\n- Solicitantes de Visas de Canad\u00e1: visite el sitio web de\n[Inmigraci\u00f3n, Refugiados y Ciudadan\u00eda de Canad\u00e1](https://www.canada.ca/en/immigration-refugees-citizenship.html)para obtener informaci\u00f3n actualizada.\n- Solicitantes de Visas de Reino Unido: visite el sitio web de\n[Visas e Inmigraci\u00f3n de Reino Unido](https://www.gov.uk/government/organisations/uk-visas-and-immigration)para obtener informaci\u00f3n actualizada.\nCitas de Asilo\nLas oficinas de asilo est\u00e1n abiertas con precauciones adicionales para evitar la propagaci\u00f3n del virus COVID-19. Siga la\n[Pol\u00edtica de Visitantes](/es/archivo/politica-de-visitantes-de-uscis) de USCIS cuando asista a una cita.\nSi se siente enfermo, por favor no venga a nuestra oficina. Siga las instrucciones en su notificaci\u00f3n de cita para reprogramar su cita. Puede solicitar reprogramar su cita debido a una enfermedad o riesgo de infecci\u00f3n por COVID-19, y la demora no se le imputar\u00e1.\nSi asiste a una cita, siga las pautas de seguridad de los Centros para el Control y la Prevenci\u00f3n de Enfermedades (CDC) para el estado y el condado donde se encuentra su oficina de asilo\n[https://egov.uscis.gov/office-locator/#/asy](https://egov.uscis.gov/office-locator/#/asy).\nEn \u00e1reas de transmisi\u00f3n alta o sustancial seg\u00fan la p\u00e1gina web COVID-19 por condado de CDC\n[https://www.cdc.gov/coronavirus/2019-ncov/your-health/covid-by-county.html](https://www.cdc.gov/coronavirus/2019-ncov/your-health/covid-by-county.html), todos los empleados federales, contratistas, y los visitantes deben usar cubierta facial o m\u00e1scarilla dentro de los edificios federales. En los espacios controlados por el DHS, como las oficinas de asilo de USCIS, esta gu\u00eda reemplaza las reglas estatales, locales, tribales o territoriales con respecto a las cubiertas faciales.\nEs posible que las oficinas de asilo de USCIS deban reprogramar las citas seg\u00fan las condiciones locales. Si ya tiene una cita programada para una entrevista, le enviaremos un notificaci\u00f3n si necesitamos reprogramarla.\nSeg\u00fan las condiciones locales, es posible que lo entrevisten en persona o mediante una entrevista facilitada por video.\nEn una entrevista en persona, estar\u00e1 en la misma habitaci\u00f3n con el oficial entrevistador separado por una barrera de plexigl\u00e1s.\nEn una entrevista facilitada por video, usted estar\u00e1 en una habitaci\u00f3n y el oficial de entrevistas en una habitaci\u00f3n diferente.\nLos solicitantes de asilo deben traer a todos los familiares inmediatos que figuran como dependientes en la solicitud de asilo. Cada solicitante de asilo, o solicitante NACARA 203, tambi\u00e9n puede traer un representante legal, testigos, un asistente de una persona discapacitada, un padre, tutor o \"adulto de confianza\" si el solicitante es menor de edad.\nTenga en cuenta las Instrucciones Especiales sobre Int\u00e9rpretes para Entrevistas de Asilo a continuaci\u00f3n. Los solicitantes de NACARA 203 deben traer sus propios int\u00e9rpretes a la entrevista.\nEn el caso de personas no detenidas que tengan entrevistas de temor cre\u00edble y temor razonable, \u00e9stas pueden traer a cualquier familiar listado en la notificaci\u00f3n de entrevista. Los representantes o consultores legales pueden asistir a entrevistas de temor cre\u00edble y temor razonable, pero se les exhorta a participar por tel\u00e9fono. USCIS proporcionar\u00e1 int\u00e9rpretes profesionales contratados para las entrevistas de temor cre\u00edble y temor razonable. La siguiente informaci\u00f3n sobre int\u00e9rpretes para entrevistas de asilo no se aplica a entrevistas de miedo cre\u00edble o razonable no detenido.\nInstrucciones Especiales sobre Int\u00e9rpretes para Entrevistas de Asilo\nEstas instrucciones aplican a usted si no habla ingl\u00e9s y necesita un int\u00e9rprete para su entrevista de asilo.\nSi habla con fluidez uno de los idiomas que se indican a continuaci\u00f3n, no puede traer su propio int\u00e9rprete y debe usar un int\u00e9rprete contratado por USCIS en su entrevista de asilo, , a menos que USCIS le informe que traiga su propio int\u00e9rprete a la entrevista de asilo (consulte a continuaci\u00f3n para obtener m\u00e1s informaci\u00f3n sobre esta excepci\u00f3n)\n- Akan\n- Alban\u00e9s\n- Am\u00e1rico\n- \u00c1rabe\n- Armenio\n- Azerbaiyano\n- Bengal\u00ed\n- Birmano\n- Canton\u00e9s\n- Criollo / Criollo Haitiano\n- Farsi-Afgano / Dari\n- Farsi-iran\u00ed\n- Foo Chow / Fuzhou\n- Franc\u00e9s\n- Georgiano\n- Gujarati\n- Hindi\n- Hmong\n- H\u00fangaro\n- Indon\u00e9s / Bahasa\n- Kanjobal\n- Coreano\n- Kurdo\n- Lingala\n- Mam\n- Mandar\u00edn\n- Nepal\u00ed\n- Pashto / Pushtu\n- Portugu\u00e9s\n- Punjabi\n- Quiche / K'iche\n- Rumano\n- Ruso\n- Serbio\n- Cingaleses\n- Somal\u00ed\n- Espa\u00f1ol\n- Swahili\n- Tagalo\n- Tamil\n- Tigrinya\n- Turco\n- Twi\n- Ucraniano\n- Urdu\n- Uzbeko\n- Vietnamita\nUSCIS proporcionar\u00e1 este int\u00e9rprete sin costo para usted.\nSi usted no habla ninguno de los idiomas mencionados anteriormente, debe proporcionar un int\u00e9rprete competente que hable con fluidez el ingl\u00e9s y su idioma nativo o cualquier otro idioma que usted hable con fluidez. Su int\u00e9rprete:\n- Debe tener 18 a\u00f1os o m\u00e1s;\n- No debe ser su abogado o representante\n- No debe ser un testigo para usted durante su entrevista de asilo;\n- No debe ser un representante o empleado de su pa\u00eds de nacionalidad (o de su pa\u00eds de \u00faltima residencia habitual, si es ap\u00e1trida);\n- No debe tener una solicitud de asilo pendiente\nSi no puede proporcionar dicho int\u00e9rprete, puede proporcionar un int\u00e9rprete que hable con fluidez tanto su idioma como alguno que est\u00e9 en la lista anterior. USCIS proporcionar\u00e1 un int\u00e9rprete de interpretaci\u00f3n indirecta para interpretar entre el idioma mencionado anteriormente y el ingl\u00e9s.\nEn circunstancias limitadas, si un int\u00e9rprete de USCIS no est\u00e1 disponible, USCIS reprogramar\u00e1 la entrevista y atribuir\u00e1 la demora de la entrevista a USCIS para fines de autorizaci\u00f3n de empleo seg\u00fan 8 CFR 208.7 o, a nuestra discreci\u00f3n, le permitir\u00e1 proporcionar un int\u00e9rprete. Si le notificamos que un int\u00e9rprete contratado por USCIS no estar\u00e1 disponible para su entrevista programada y que estamos ejerciendo nuestra discreci\u00f3n para permitirle traer un int\u00e9rprete a su entrevista, y no puede encontrar un int\u00e9rprete competente, reprogramaremos su entrevista y el retraso ser\u00e1 atribuido a USCIS.\nUSCIS reconoce que si usted es un residente permanente legal (LPR) que viaj\u00f3 fuera de Estados Unidos y est\u00e1 o estuvo sujeto a restricciones de viaje relacionadas con COVID-19, es posible que tenga inquietudes sobre el efecto de una ausencia prolongada de Estados Unidos.\nSi tuvo un retraso en su regreso de un viaje fuera de Estados Unidos debido a circunstancias imprevistas, como restricciones de viaje relacionadas con el COVID-19, por lo general, el viaje retiene su car\u00e1cter temporal y no consideraremos que abandon\u00f3 su estatus de LPR siempre que haya la intenci\u00f3n de regresar tan pronto como se completara el prop\u00f3sito original de la visita. Para m\u00e1s informaci\u00f3n, vea el\n[Manual de Pol\u00edticas de USCIS, Volumen 12, Parte D, Requisitos Generales de Naturalizaci\u00f3n, Cap\u00edtulo 2, Admisi\u00f3n de Residencia Permanente Legal para Naturalizaci\u00f3n](/policy-manual/volume-12-part-d-chapter-2).\nDocumentos Requeridos\nPor lo general, si usted es un LPR que desea regresar a Estados Unidos luego de un viaje temporal al extranjero de menos de un a\u00f1o de duraci\u00f3n, puede usar su tarjeta de residente v\u00e1lida (tambi\u00e9n conocida como una Tarjeta Verde o Green Card) como documento de viaje. Si desea regresar a Estados Unidos despu\u00e9s de un viaje al extranjero de 1 a\u00f1o o m\u00e1s de duraci\u00f3n, debe presentar un Formulario I-327, Permiso para Reingresar (tambi\u00e9n conocido como permiso de reingreso) o una visa de inmigrante de Residente que Retorna (SB-1). Si usted ha estado fuera de Estados Unidos por 1 a\u00f1o o m\u00e1s sin un permiso de reingreso o permaneci\u00f3 m\u00e1s all\u00e1 de la validez de su permiso de reingreso, deber\u00eda considerar comunicarse con la embajada o consulado estadounidense m\u00e1s cercano para discutir su situaci\u00f3n. Para m\u00e1s informaci\u00f3n, visite el sitio web del\n[Departamento de Estado](https://travel.state.gov/content/travel/en/us-visas/immigrate/returning-resident.html).\nSi usted es un solicitante de naturalizaci\u00f3n, por lo general, debe haber residido continuamente en Estados Unidos despu\u00e9s de su admisi\u00f3n como residente permanente legal (LPR) durante al menos 5 a\u00f1os antes de presentar su solicitud de naturalizaci\u00f3n y hasta el momento de su naturalizaci\u00f3n. Tambi\u00e9n, debe demostrar que ha residido en el estado o distrito de servicio que tiene jurisdicci\u00f3n sobre su solicitud durante un periodo de 3 meses antes de presentar la solicitud de naturalizaci\u00f3n.\nAdem\u00e1s, por lo general, se le requiere haber estado f\u00edsicamente presente en Estados Unidos durante al menos la mitad del tiempo que se le requiera de residencia continua.\nPor ejemplo, si usted tiene que demostrar 5 a\u00f1os de residencia continua, tambi\u00e9n debe demostrar presencia f\u00edsica continua durante al menos 30 meses (por lo menos 913 d\u00edas) antes de presentar la solicitud de naturalizaci\u00f3n.\nA\u00fan por circunstancias imprevistas, como por ejemplo restricciones de viajes relacionadas con el COVID-19, estar ausente de Estados Unidos por un periodo continuo de un a\u00f1o o m\u00e1s (365 d\u00edas o m\u00e1s) durante el periodo para el que se requiere residencia continua interrumpir\u00e1 autom\u00e1ticamente la continuidad de la residencia (Vea\n[INA 316(b)](https://uscode.house.gov/view.xhtml?req=granuleid%3AUSC-prelim-title8-section1427&num=0&edition=prelim)). Esto aplica si la ausencia ocurre antes o despu\u00e9s de que usted presente su solicitud de naturalizaci\u00f3n.\nA menos que tenga un\n[Formulario N-470, Solicitud para Preservar la Residencia para Prop\u00f3sitos de Naturalizaci\u00f3n](/es/n-470), aprobado, USCIS debe denegar una solicitud de naturalizaci\u00f3n por incumplimiento del requisito de residencia continua si ha estado ausente continuamente por un per\u00edodo de 1 a\u00f1o o m\u00e1s durante el per\u00edodo legal. El Formulario N-470 preserva la residencia de los LPR que participan en empleos cualificados en el extranjero con el gobierno de Estados Unidos, una instituci\u00f3n estadounidense de investigaci\u00f3n, una empresa o corporaci\u00f3n estadounidense, una organizaci\u00f3n internacional p\u00fablica de la cual Estados Unidos es miembro, o una denominaci\u00f3n religiosa u organizaci\u00f3n misionera interdenominacional.\nPara obtener m\u00e1s informaci\u00f3n, consulte el Manual de Pol\u00edticas de USCIS Volumen 12, Parte D, Requisitos Generales de Naturalizaci\u00f3n\n[Cap\u00edtulo 3, Residencia Continua](https://www.uscis.gov/policy-manual/volume-12-part-d-chapter-3), [Cap\u00edtulo 4, Presencia F\u00edsica](https://www.uscis.gov/policy-manual/volume-12-part-d-chapter-4) y [Cap\u00edtulo 5, Modificaciones y Excepciones a la Residencia Continua y Presencia F\u00edsica](https://www.uscis.gov/policy-manual/volume-12-part-d-chapter-5).\nCeremonias de Juramento de Naturalizaci\u00f3n\nUSCIS enviar\u00e1 notificaciones a los solicitantes para reprogramar una ceremonia de naturalizaci\u00f3n que haya sido pospuesta. Puede que las ceremonias sean m\u00e1s breves para limitar la exposici\u00f3n de los asistentes. En lugar de reproducir v\u00eddeos en las ceremonias de naturalizaci\u00f3n, se les dar\u00e1n folletos a los participantes con informaci\u00f3n y enlaces que los dirigir\u00e1n a los videos en el\n[sitio web de USCIS](/es/ciudadania/aprenda-sobre-ciudadania/ceremonias-de-naturalizacion). Bajo este formato breve, todas las porciones de la ceremonia requeridas por ley se llevar\u00e1n a cabo. La asistencia estar\u00e1 limitada al candidato de naturalizaci\u00f3n y a las personas que asisten con los acomodos por discapacidad.\nA medida que USCIS reinicia los servicios en persona de manera segura, algunas ceremonias de naturalizaci\u00f3n pueden llevarse a cabo distinto a como se hac\u00edan en el pasado. Puede que usted reciba informaci\u00f3n suplementaria de parte de USCIS que le proporcione instrucciones detalladas para su ceremonia. Por favor, preste mucha atenci\u00f3n a esta informaci\u00f3n para garantizar que su experiencia en la ceremonia sea segura y agradable.\nPlazos para Ciertas Solicitudes, Notificaciones y Apelaciones\nConsideraremos una respuesta recibida dentro de los 60 d\u00edas calendario posteriores a la fecha de vencimiento establecida en las siguientes solicitudes o notificaciones antes de tomar cualquier medida, si emitimos la solicitud o notificaci\u00f3n en cualquier momento desde el 1 de marzo de 2020 hasta el 23 de marzo de 2023, fechas inclusive:\n- Solicitudes de Evidencia;\n- Continuaciones de Solicitudes de Evidencia (N-14);\n- Notificaciones de Intenci\u00f3n de Denegaci\u00f3n;\n- Notificaciones de Intenci\u00f3n de Revocaci\u00f3n;\n- Notificaciones de Intenci\u00f3n de Rescindir;\n- Notificaciones de Intenci\u00f3n de Terminaci\u00f3n de Centros Regionales, y\n- Mociones para Reabrir un N-400 de Conformidad con 8 CFR 335.5, Recibo de Informaci\u00f3n Negativa Despu\u00e9s de la Concesi\u00f3n.\nAdem\u00e1s, USCIS considerar\u00e1 un Formulario I-290B, Notificaci\u00f3n de Apelaci\u00f3n o Moci\u00f3n, o el Formulario N-336, Solicitud de Audiencia sobre una Decisi\u00f3n en Procedimientos de Naturalizaci\u00f3n (Bajo la Secci\u00f3n 336 de la INA), si:\n- El formulario se present\u00f3 hasta 90 d\u00edas calendario a partir de la emisi\u00f3n de una decisi\u00f3n que hayamos tomado, y\n- Tomamos esa decisi\u00f3n en cualquier momento desde el 1 de noviembre de 2021 hasta el 23 de marzo de 2023, fechas inclusive.\nPor favor, vea la\n[alerta](/es/noticias/alertas/uscis-extiende-flexibilidades-relacionadas-con-covid-19-1) para m\u00e1s informaci\u00f3n.\nRequisitos de Visas H-2A Durante la Emergencia de Salud P\u00fablica Causada por COVID-19\nEl 18 de diciembre de 2020, el Servicio de Ciudadan\u00eda e Inmigraci\u00f3n de Estados Unidos public\u00f3 una\n[nueva regla final provisional](https://www.federalregister.gov/documents/2020/12/18/2020-27661/temporary-changes-to-requirements-affecting-h-2a-nonimmigrants-due-to-the-covid-19-national) que extiende parcialmente la [regla final provisional](https://www.federalregister.gov/documents/2020/04/20/2020-08356/temporary-changes-to-requirements-affecting-h-2a-nonimmigrants-due-to-the-covid-19-national) del 20 de agosto que enmienda ciertos requisitos de visas H-2A para ayudar a los empleadores agr\u00edcolas estadounidenses a evitar interrupciones en el empleo legal relacionado con la agricultura, proteger la cadena de suministro de alimentos de la naci\u00f3n, y reducir el impacto de la emergencia de salud p\u00fablica causada por el COVID-19.\nDebido a las restricciones en los viajes y las limitaciones de procesamientos de visas como resultado de las acciones tomadas para mitigar la propagaci\u00f3n del COVID-19, as\u00ed como a la posibilidad de que algunos trabajadores H-2A no est\u00e9n disponibles debido a una enfermedad relacionada con el COVID-19, los empleadores estadounidenses que tienen peticiones H-2A aprobadas o que presentar\u00e1n peticiones H-2A puede que no reciban todos los trabajadores solicitados para llenar las posiciones temporales, y de igual manera, los empleadores que actualmente emplean trabajadores H-2A puede que pierdan los servicios de trabajadores debido a una enfermedad relacionada con el COVID-19.\nBajo esta regla final provisional del 18 de diciembre, todos los peticionarios H-2A que tengan una certificaci\u00f3n de condici\u00f3n laboral temporal (TLC) pueden emplear a ciertos trabajadores extranjeros que est\u00e1n actualmente en Estados Unidos en un estatus H-2A inmediatamente despu\u00e9s de que USCIS reciba la petici\u00f3n H-2A, pero no antes de la fecha de comienzo en el empleo indicada en esa petici\u00f3n. Adem\u00e1s, la regla final provisional del 18 de diciembre extiende la capacidad de los trabajadores H-2A para cambiar de empleadores y comenzar a trabajar antes de que USCIS apruebe la nueva petici\u00f3n H-2A. DHS aplicar\u00e1 esta regla final temporal a las peticiones H-2A que solicitan una extensi\u00f3n de estad\u00eda, si fueron recibidas en o despu\u00e9s del 18 de diciembre de 2020 hasta el 16 de junio de 2021.\nLa regla final provisional entr\u00f3 en efecto el 18 de diciembre de 2020 y finalizar\u00e1 el 18 de diciembre de 2023. Si se aprueba la nueva petici\u00f3n, el trabajador H-2A podr\u00e1 permanecer en Estados Unidos durante un plazo que no exceder\u00e1 el periodo de validez de la TLC. DHS publicar\u00e1 una nueva regla final provisional en el Registro Federal para enmendar la fecha de vencimiento en el caso que DHS determine que las circunstancias demuestran que a\u00fan existe la necesidad de los cambios provisionales a las regulaciones H-2A.\nEs importante notificar al p\u00fablico que esa regla final provisional no enmienda las regulaciones del Departamento del Trabajo (DOL, por sus siglas en ingl\u00e9s) que rigen las pruebas del mercado laboral y las contrataciones de trabajadores estadounidenses relacionadas para el proceso H-2A. Antes de presentar una petici\u00f3n H-2A con DHS, el peticionario H-2A debe haber obtenido un TLC v\u00e1lido de parte de DOL para la oportunidad laboral que el empleador desea llenar con un trabajador o trabajadores H-2A. Esta regla final no es una regla conjunta con DOL y USCIS no propone cambios al proceso de TLC de DOL para H-2A o sus regulaciones.\nLa pandemia de COVID-19 ha afectado la capacidad del Departamento de Estado para proporcionar servicios de rutina a los nacionales extranjeros. Muchas embajadas y consulados estadounidenses no pueden tomar ADN a nombre de USCIS. Si usted busca obtener una toma de ADN para responder a una Solicitud de Evidencia (RFE) expedida por USCIS en la adjudicaci\u00f3n de su Formulario I-130 y su beneficiario vive en el extranjero, su caso podr\u00eda verse afectado. Para m\u00e1s informaci\u00f3n acerca de la respuesta ante el COVID-19 y la programaci\u00f3n de priorizaci\u00f3n de servicios consulares del Departamento de Estado vea la p\u00e1gina\n[Estatus de Operaciones de Servicios de Visas del Departamento de Estado](https://travel.state.gov/content/travel/en/News/visas-news/visa-services-operating-status-update.html).\nSi usted no tiene otra evidencia para demostrar o verificar una relaci\u00f3n reclamada con un beneficiario del Formulario I-130 que est\u00e1 en el extranjero, puede presentar resultados de ADN para respaldar su reclamo. Anteriormente, USCIS ha expedido RFE donde sugiere una toma de ADN con instrucciones sobre el proceso. Si usted opta por la toma de ADN, es responsable de iniciar y costear el proceso a trav\u00e9s de un\n[laboratorio acreditado por AABB](https://www.aabb.org/standards-accreditation/accreditation/accredited-facilities/aabb-accredited-relationship-testing-facilities). Antes de las restricciones relacionadas con el COVID-19, el Departamento de Estado (a trav\u00e9s de sus embajadas y consulados) supervisaban la toma de ADN para los beneficiarios que est\u00e1n en el extranjero y enviaban los resultados al laboratorio AABB para su an\u00e1lisis.\nUSCIS procede con la adjudicaci\u00f3n del I-130 una vez recibe el informe de ADN de parte del laboratorio AABB. Si usted no responde a una RFE que le sugiere la toma de ADN antes de la fecha l\u00edmite, USCIS podr\u00eda adjudicar, seg\u00fan cada caso, su Formulario I-130 sin los resultados de ADN.\nCuando las embajadas y consulados estadounidenses regresen a sus operaciones normales, el Departamento de Estado reiniciar\u00e1 los procedimientos de tomas de ADN para los beneficiarios que viven en el extranjero. Hasta que el Departamento de Estado reinicie las operaciones normales para tomas ADN, USCIS:\n- No incluir\u00e1 sugerencias o instrucciones sobre ADN en las RFE;\n- Aceptar\u00e1 resultados de ADN completados como evidencia;\n- Podr\u00eda detener el procesamiento del Formulario I-130, seg\u00fan descrito en las gu\u00edas de Plazos para Algunas Peticiones, Notificaciones y Apelaciones, si usted se le comunica a USCIS su intenci\u00f3n de continuar con la prueba de ADN.\nCambios Temporales de Pol\u00edticas para Ciertos Extranjeros Graduados de Medicina Durante la Emergencia Nacional de COVID-19\nDurante y en respuesta a la emergencia de salud p\u00fablica causada por el COVID-19, USCIS toma medidas para proteger a los trabajadores estadounidenses mientras tambi\u00e9n provee los recursos necesarios para combatir la propagaci\u00f3n de COVID-19.\nUSCIS\n[proporciona gu\u00edas (PDF, 340.75 KB)](https://www.uscis.gov/sites/default/files/document/memos/PM-602-0178_-COVID19MedicalGraduatesMemo_Final_CLEAN.pdf) (en ingl\u00e9s) a oficiales con relaci\u00f3n a antiguos extranjeros graduados de medicina con visas J-1 que recibieron una exenci\u00f3n del requisito de dos a\u00f1os de residencia extranjera bajo la secci\u00f3n 212(e) de la Ley de Inmigraci\u00f3n y Nacionalidad.\nEstos extranjeros graduados de medicina son antiguos visitantes de intercambio J-1 que actualmente practican la medicina en Estados Unidos en calidad de m\u00e9dicos no inmigrantes H-1B a base del inter\u00e9s de una agencia del gobierno o a trav\u00e9s del programa\n[Conrad 30 Estatal](/es/trabajar-en-estados-unidos/estudiantes-y-visitantes-de-intercambio/programa-de-exenciones-conrad-30) creado por el Congreso.\nUSCIS proporciona flexibilidades para estos extranjeros graduados de medicina que actualmente asisten en la lucha contra el COVID-19 salvando vidas, reduciendo la tensi\u00f3n en los trabajadores de hospitales que tienen exceso de trabajo, y mejorando el acceso al cuidado m\u00e9dico necesario. Estas flexibilidades incluyen:\n- Telesalud. USCIS permitir\u00e1 que estos m\u00e9dicos proporcionen servicios de telesalud durante la emergencia nacional de salud p\u00fablica por COVID-19, siempre que los m\u00e9dicos contin\u00faen con sus servicios a la poblaci\u00f3n a su poblaci\u00f3n prevista. USCIS recalca que si un empleador le ofrece a estos extranjeros graduados de medicina la flexibilidad para teletrabajar desde sus casas, debe ofrecer esas mismas flexibilidades a los trabajadores estadounidenses empleados de manera similar.\n- Exenci\u00f3n de ciertas consecuencias de inmigraci\u00f3n por incumplir con el requisito de trabajo a tiempo completo. USCIS no considerar\u00e1 que estos m\u00e9dicos han violado sus contratos con sus empleadores si temporalmente no pueden trabajar a tiempo complete debido a una enfermedad, reducci\u00f3n de horas en las instalaciones m\u00e9dicas, u otra situaci\u00f3n causada por la pandemia de COVID-19. Esta es una flexibilidad limitada y solo se relaciona con la elegibilidad del extranjero graduado de medicina a futuros beneficios de inmigraci\u00f3n que podr\u00edan estar afectados por la reimposici\u00f3n del requisito de dos a\u00f1os de residencia extranjera como resultado de una violaci\u00f3n al contrato. Esto no afecta de manera alguna a las responsabilidades del empleador peticionario bajo las disposiciones y reglamentos relacionados con los no inmigrantes H-1B.\nRetrasos en Extensiones de Estad\u00eda y Cambios de Estatus Causados por Circunstancias Extraordinarias Relacionadas con COVID-19\nPor lo general, los no inmigrantes deben salir de Estados Unidos antes de que venza su periodo de admisi\u00f3n autorizado. Sin embargo, reconocemos que los no inmigrantes pueden permanecer en Estados Unidos inesperadamente por encima de su periodo de admisi\u00f3n autorizado deben solicitar una exenci\u00f3n o cambio de estatus con antelaci\u00f3n. En estos casos, los no inmigrantes deben hacer lo siguiente:\nSolicitar una Extensi\u00f3n de Estad\u00eda. La mayor\u00eda de no inmigrantes puede mitigar las consecuencias migratorias de COVID-19 al presentar una solicitud de extensi\u00f3n de estad\u00eda (EOS, por sus siglas en ingl\u00e9s) o un cambio de estatus (COS, por sus siglas en ingl\u00e9s) de manera oportuna. El Servicio de Ciudadan\u00eda e Inmigraci\u00f3n (USCIS, por sus siglas en ingl\u00e9s) acepta y procesa solicitudes y peticiones en este momento, y muchos de nuestros formularios est\u00e1n disponibles para presentaci\u00f3n en l\u00ednea.\nSi Presenta su Solicitud de Manera Oportuna. Por lo general, los no inmigrantes no acumulan presencia ilegal mientras la solicitud EOS o COS fundamentada y presentada de manera oportuna est\u00e1 en tr\u00e1mite. En los casos que corresponda, se extender\u00e1 autom\u00e1ticamente la autorizaci\u00f3n de empleo con el mismo empleador, sujeta a los mismos t\u00e9rminos y condiciones de la aprobaci\u00f3n anterior hasta 240 d\u00edas despu\u00e9s del vencimiento del I-94, cuando se presente una petici\u00f3n de extensi\u00f3n de estad\u00eda a tiempo.\nFlexibilidad en los Casos de Solicitudes Tard\u00edas. USCIS podr\u00eda excusar que un no inmigrante no presente una petici\u00f3n de extensi\u00f3n o cambio de estad\u00eda a tiempo si dicha demora fue por motivos de circunstancias extraordinarias. Bajo las regulaciones vigentes y seg\u00fan lo indicado en la p\u00e1gina de\n[ Situaciones Especiales](/es/noticias/alivio-de-inmigracion-en-circunstancias-imprevistas), si un peticionario o solicitante presenta una petici\u00f3n de estad\u00eda o de cambio de estatus (en los formularios I-129 o I-539) despu\u00e9s de que venza el periodo de admisi\u00f3n autorizado, USCIS, a discreci\u00f3n propia, podr\u00eda excusar el no haber presentado la petici\u00f3n a tiempo si se debi\u00f3 a circunstancias extraordinarias fuera de su control como, por ejemplo, aquellas que puedan ser causadas por COVID-19. La duraci\u00f3n de la demora debe ser acorde con las circunstancias. El peticionario o solicitante debe presentar evidencia cre\u00edble para apoyar su petici\u00f3n, que USCIS evaluar\u00e1 seg\u00fan cada caso individual. Dichas situaciones especiales han sido utilizadas en varias ocasiones en el pasado, incluso durante desastres naturales y crisis similares.\nFlexibilidad para Participantes del Programa de Exenci\u00f3n de Visa. Los participantes del Programa de Exenci\u00f3n de Visas (VWP, por sus siglas en ingl\u00e9s), por lo general, no son elegibles para extender su estad\u00eda o cambiar su estatus. Sin embargo, bajo las regulaciones vigentes, si una emergencia (como COVID-19) impide la salida de un participante de VWP, USCIS, a discreci\u00f3n, podr\u00eda otorgarle un periodo de salida satisfactoria de hasta 30 d\u00edas. Por favor, vea\n[8 CFR 217.3(a)](https://gov.ecfr.io/cgi-bin/text-idx?SID=901e4ad05296c429813bb87515374f0c&mc=true&node=pt8.1.217&rgn=div5#se8.1.217_13). A aquellos participantes VWP a quienes se les concedi\u00f3 la salida satisfactoria y no pueden salir dentro del periodo de 30 d\u00edas debido al COVID-19, USCIS tiene la autoridad de proporcionarles periodos de 30 d\u00edas adicionales para salida satisfactoria. Para solicitar que USCIS le otorgue la salida satisfactoria, un participante de VWP debe llamar al [Centro de Contacto de USCIS](/es/acerca-de-nosotros/contactenos/centro-de-contacto-de-uscis).\nPara m\u00e1s Informaci\u00f3n. Por favor, vea\n[8 CFR 214.1(c)(4)](https://gov.ecfr.io/cgi-bin/text-idx?SID=e8a48798164c40ba7b4edad22b804d75&mc=true&node=se8.1.214_11&rgn=div8) y [8 CFR 248.1(c)](https://gov.ecfr.io/cgi-bin/text-idx?SID=9c1e0e4a888655a63aa42646bb660c03&mc=true&node=se8.1.248_11&rgn=div8) para informaci\u00f3n adicional acerca de peticiones tard\u00edas de extensi\u00f3n de estad\u00eda o cambios de estatus. Adem\u00e1s, vea las p\u00e1ginas de nuestros formularios [I-129](/es/i-129) e [I-539](/es/i-539) para requisitos de presentaci\u00f3n espec\u00edficos para extensiones de estad\u00eda y cambios de estatus.\n-\nUSCIS reconoce que los posibles padres adoptivos (PAP) tienen preocupaciones acerca de demoras posibles al completar ciertos requisitos para permitir la adjudicaci\u00f3n de sus solicitudes de adopci\u00f3n o peticiones debido a restricciones y cierres por COVID-19.\nDeterminaciones de Idoneidad\n- En estos momentos, no hay cambios acerca de los requisitos de elegibilidad para solicitudes y peticiones de adopci\u00f3n, lo que incluye las determinaciones de idoneidad.\n- USCIS est\u00e1 obligado a revisar solicitudes de determinaciones de idoneidad presentadas por los PAP y determinar si permanecen elegibles para la adopci\u00f3n entre pa\u00edses. Por lo tanto, USCIS no extender\u00e1 el periodo de validez de determinaciones de idoneidad aprobadas sin hacer una evaluaci\u00f3n de idoneidad actualizada.\n- Como recordatorio:\n- Una\n[evaluaci\u00f3n de idoneidad aprobada](/es/adopciones/despues-de-la-aprobacion-del-huerfano-y-de-la-solicitud-de-la-haya/extension-y-periodos-de-validez)es v\u00e1lida por 18 meses para el [proceso de adopci\u00f3n de ni\u00f1os hu\u00e9rfanos](/es/adopciones/inmigracion-por-medio-de-la-adopcion/proceso-de-adopcion-de-ninos-huerfanos)(Formulario I-600A) y 15 meses para el [proceso de la Convenci\u00f3n de La Haya](/es/adopciones/inmigracion-por-medio-de-la-adopcion/proceso-de-la-haya)( [Formulario I-800A](/es/i-800a)). USCIS permite una extensi\u00f3n por una sola vez para la evaluaci\u00f3n de idoneidad aprobada y para extensiones ilimitadas de la aprobaci\u00f3n de idoneidad del Formulario I-800A (con tarifa de presentaci\u00f3n).\n- Cuando un PAP presenta el Formulario I-600 o Formulario I-800, no necesita continuar extender su aprobaci\u00f3n de idoneidad o presentar un nuevo Formulario I-600A o I-800A. Para el proceso de hu\u00e9rfano, los PAP puede elegir no presentar el Formulario I-600A y, en su lugar, presentar toda la evidencia requerida y solicitar una determinaci\u00f3n de idoneidad con el Formulario I-600 de su hijo (tambi\u00e9n conocido como presentaci\u00f3n concurrente).\n- Por favor vea la p\u00e1gina web de USCIS de\n[Extensi\u00f3n y Periodos de Validez](/es/adopciones/despues-de-la-aprobacion-del-huerfano-y-de-la-solicitud-de-la-haya/extension-y-periodos-de-validez)para obtener m\u00e1s informaci\u00f3n, lo que incluye extensiones de idoneidad aprobabas o nuevas peticiones en caso de que un PAP todav\u00eda no haya presentado su Formulario I-600 o Formulario I-800 y su extensi\u00f3n por \u00fanica vez caducar\u00e1.\n- Una\n- Aunque no podemos poner una exenci\u00f3n para el requisito de un estudio del hogar actualizado, ciertos requisitos para un\n[estudio del hogar](/es/adopciones/informacion-sobre-el-estudio-del-hogar)tienen algunas flexibilidades:\n- A menos que una familia se haya mudado o de otra manera sea requerido, una actualizaci\u00f3n de estudio del hogar no requiere que el preparador del estudio haga otra visita del hogar o entrevista en persona. En su lugar, el preparador del estudio del hogar puede hacer una actualizaci\u00f3n por Skype, FaceTime, tel\u00e9fono, correo electr\u00f3nico, etc.\n- Entendemos que los PAP pueden experimentar cambios debido al COVID-19. USCIS no requiere que los PPA notifiquen a USCIS o a su preparador del estudio del hogar acerca de alg\u00fan cambio a menos que haya un\n[cambio significativo](/es/adopciones/despues-de-la-aprobacion-del-huerfano-y-de-la-solicitud-de-la-haya/actualizacion-de-los-estudios-del-hogar-y-cambios-significativos). Para m\u00e1s informaci\u00f3n, vea nuestra [Gu\u00eda para Determinar la Idoneidad de Posibles Padres Adoptivos para la Adopci\u00f3n Entre Pa\u00edses (PDF, 886.91 KB)](https://www.uscis.gov/sites/default/files/document/memos/2018-11-09-PM-602-0165-Suitability-of-Prospective-Adoptive-Parents-for-Intercountry-Adoption.pdf)(en ingl\u00e9s).\n- Si ocurre un cambio significativo en el hogar del PAP, deben proporcionar una notificaci\u00f3n y presentar un estudio del hogar actualizado en el que se refleja el cambio significativo. El plazo en dicha notificaci\u00f3n depende del tipo de cambio significativo y en cu\u00e1l parte del proceso ocurre el cambio significativo.\n- Para la mayor\u00eda de los cambios significativos, los PAP pueden, por lo general, esperar hasta la pr\u00f3xima determinaci\u00f3n de idoneidad para proporcionar la notificaci\u00f3n, si a\u00fan no han pasado 30 d\u00edas desde que ocurri\u00f3 el cambio significativo.\n- Sin embargo, los PAP necesitan proporcionar una notificaci\u00f3n de manera inmediata ante USCIS y su proveedor del estudio del hogar si el cambio significativo es:\n- Relacionado abuso, delitos, o historial de abuso de alcohol, abuso sexual de ni\u00f1os, violencia familiar, o cualquiera otro historial delictivo criminal; o\n- cualquier otro cambio significativo que ocurra despu\u00e9s de la aprobaci\u00f3n de un Formulario I-600 o Formulario I-800, pero antes de que el hijo inmigre a Estados Unidos.\nEl Permiso Humanitario (Parole)\n- Algunos padres preguntan acerca del uso del permiso de entrada para que hijos pueden entrar al pa\u00eds. En pocas circunstancias, USCIS aprueba solicitudes de permiso para casos relacionados con la adopci\u00f3n, porque el permiso no proporciona las mismas protecciones para los hijos prospectivos para la adopci\u00f3n, PAP, y los padres biol\u00f3gicos que existen a trav\u00e9s de las v\u00edas normales de adopci\u00f3n basada en la inmigraci\u00f3n, tales como las determinaciones de si un hijo es hu\u00e9rfano o elegible para una adopci\u00f3n entre pa\u00edses.\n- Adem\u00e1s, el permiso de entrada no proporciona a los hijos las protecciones de inmigraci\u00f3n a Estados Unidos que proporciona una adopci\u00f3n normal basada en las v\u00edas normales de inmigraci\u00f3n. Por ejemplo, un hijo que tiene el permiso de entrada no ha sido admitido en Estados Unidos con prop\u00f3sitos de la ley de inmigraci\u00f3n y tendr\u00e1 que tomar pasos adicionales para convertirse en residente permanente legal (LPR) y ciudadano estadounidense. El hijo no ser\u00e1 admitido como LPR y no tendr\u00e1 la ciudadan\u00eda estadounidense de manera autom\u00e1tica como la obtienen muchos hijos que entran basados en la adopci\u00f3n.\n- Para m\u00e1s informaci\u00f3n acerca del permiso, visite nuestra p\u00e1gina web de\n[Gu\u00edas para Ciertos Tipos de Peticiones de Permanencia Temporal.](/es/programas-humanitarios/permiso-humanitario-o-de-beneficio-publico-significativo-para-personas-que-estan-fuera-de-estados/guias-sobre-evidencia-para-ciertos-tipos-de-peticiones-de-permiso-humanitario-o-de-beneficios)\nInformaci\u00f3n de Contacto\n- USCIS tiene un equipo dedicado para ayudarlo con sus preguntas sobre adopci\u00f3n. Para m\u00e1s informaci\u00f3n, visite nuestra p\u00e1gina de\n[Informaci\u00f3n de Contacto para Adopciones de USCIS](/es/adopciones/informacion-de-contacto-de-uscis-para-adopciones).\n- Para cualquier asunto en tr\u00e1mite con el Departamento de Estado (DOS), incluso asuntos relacionados con la emisi\u00f3n de visas, por favor vea la informaci\u00f3n m\u00e1s reciente en la p\u00e1gina web de\n[DOS de Adopciones Entre Pa\u00edses](https://travel.state.gov/content/travel/en/Intercountry-Adoption.html).\nNo Inmigrantes K-1 y K-2\nLa Ley de Inmigraci\u00f3n y Nacionalidad requiere a un no inmigrante K-1 contraer matrimonio valido con su prometido estadounidense dentro de 90 d\u00edas luego de haber sido admitido en Estados Unidos bajo el estatus K-1. Los no inmigrantes K-2 son admitidos como los hijos menores de padres K-1. El estatus de no inmigrante K-1 expira despu\u00e9s de 90 d\u00edas y no puede ser extendido.\nSin embargo, como se indica en nuestra p\u00e1gina web de\n[Visas para Prometido(as) de Ciudadanos Estadounidenses](https://www.uscis.gov/es/familia/familiares-de-ciudadanos-estadounidenses/visas-para-prometidosas-de-ciudadanos-estadounidenses), si el matrimonio entre un no inmigrante K-1 y su prometido estadounidense lleva a cabo despu\u00e9s del plazo de 90 d\u00edas, el c\u00f3nyuge ciudadano estadounidense puede presentar el [Formulario I-130, Petici\u00f3n de Familiar Extranjero](https://www.uscis.gov/es/i-130), a nombre de quien haya sido el prometido, basado en el matrimonio. El c\u00f3nyuge ciudadano estadounidense tambi\u00e9n puede presentar el Formulario I-130 para el hijastro K-2 siempre y cuando cumpla con la definici\u00f3n de un hijastro bajo 101(b)(1)(B) de la INA. Para obtener m\u00e1s informaci\u00f3n vea nuestra p\u00e1gina web [C\u00f3mo Traer a su C\u00f3nyuge a Vivir en Estados Unidos como Residente Permanente](https://www.uscis.gov/es/familia/familiares-de-ciudadanos-estadounidenses/como-traer-a-su-conyuge-a-vivir-en-estados-unidos-como-residente-permanente).\nExtensi\u00f3n del Tiempo Establecido para la Reunificaci\u00f3n Familiar de No Inmigrantes K-2\nComo hijo menor de un no inmigrante K-1 que desea reunirse con su padre K-1 en Estados Unidos en una fecha posterior (lo que se conoce como \u201creunificaci\u00f3n familiar\u201d o \u201cfollowing to join\u201d) puede ser elegible para una visa K-2 hasta un a\u00f1o despu\u00e9s de que el\n[Departamento de Estado](https://fam.state.gov/FAM/09FAM/09FAM050207.html#M502_7_3_B) emita la visa al solicitante principal K-1. El hijo K-2 puede reunirse incluso despu\u00e9s de que el solicitante principal K-1 se case con su prometido ciudadano estadounidense y obtenga el estatus de residente permanente legal (LPR).\nMientras la pandemia del COVID-19 contin\u00faa sus efectos en los servicios consulares y viajes al nivel mundial, el Departamento de Estado puede extender el plazo de un a\u00f1o para reunificaci\u00f3n familiar por 180 d\u00edas adicionales, si el hijo demuestra la raz\u00f3n que no obten\u00eda una visa dentro de un a\u00f1o luego de que el solicitante principal haya recibido su visa o su viaje a Estados Unidos en una visa K-2 emitido anteriormente fue resultado directo de:\n- La suspensi\u00f3n de los servicios de visas a nivel mundial;\n- Restricciones de viaje debido al COVID-19; u\n- Otros factores relacionados con COVID-19 por razones fuera de su control.\nEste alivio no afecta las reglas relacionadas a las tarifas o el cobro de tarifas, u otros factores de elegibilidad para el estatus de K-2, o la elegibilidad para ajuste de estatus de no inmigrante K-2.\nSituaciones Especiales\nConozca las medidas disponibles para ayudarlo en situaciones extremas en nuestra p\u00e1gina de\n[Situaciones Especiales](/es/noticias/alivio-de-inmigracion-en-circunstancias-imprevistas).\nVisite nuestra p\u00e1gina\n[Recursos Multiling\u00fces](/es/herramientas/centro-de-recursos-multilingues) y en la seccione el tema COVID-19 para obtener dicha informaci\u00f3n en distintos idiomas.\nQu\u00e9 Est\u00e1 Haciendo el Gobierno Estadounidense\n[CDC.gov/COVID-19](https://www.cdc.gov/coronavirus): Sitio web principal del gobierno federal para informaci\u00f3n general I\n- DHS.gov/\n[Coronavirus](https://www.dhs.gov/coronavirus): Informaci\u00f3n del Departamento de Seguridad Nacional\n- Respuesta del Gobierno Estadounidense | USA.gov:\n[Cat\u00e1logo de las actividades que realiza el gobierno federal](https://www.vaccines.gov/) [Encuentre una Vacuna | Vacunas.gov](https://www.vaccines.gov/es/): sitio principal del gobierno estadounidense sobre localidades de vacunas contra COVID-19", "language": null, "image": "https://www.uscis.gov/sites/default/files/images/social-media/COVID19_GeneralGraphic_FB_1200x627.png", "pagetype": "article", "links": ["#main-content", "#", "/archive/uscis-response-to-covid-19", "/es/herramientas/centro-de-recursos-multilingues", "/es", "https://my.uscis.gov/authenticate/saml/sign_up", "https://my.uscis.gov/authenticate/saml/sign_up", "https://my.uscis.gov/authenticate/saml/init", "https://my.uscis.gov/authenticate/saml/sign_up", "/es/temas", "/es/formularios/formularios", "/es/noticias", "/es/ciudadania", "/es/residencia-permanente-tarjeta-verde", "/es/leyes-y-politicas", "/es/herramientas", "/es/acerca-de-nosotros/contactenos", "/es/herramientas/centro-de-recursos-multilingues", "#main-content", "/es/archivo", "#", "/es/archivo/pautas-para-el-estudio-del-hogar-para-ninos-huerfanos", "/es", "/es/archivo", "/es/acerca-de-nosotros/contactenos/centro-de-contacto-de-uscis", "/es/acerca-de-nosotros/estatus-de-nuestras-oficinas", "/es/acerca-de-nosotros/contactenos/centro-de-contacto-de-uscis", "/es/acerca-de-nosotros/estatus-de-nuestras-oficinas", "https://www.canada.ca/en/immigration-refugees-citizenship.html", "https://www.gov.uk/government/organisations/uk-visas-and-immigration", "/es/archivo/politica-de-visitantes-de-uscis", "https://egov.uscis.gov/office-locator/#/asy", "https://www.cdc.gov/coronavirus/2019-ncov/your-health/covid-by-county.html", "/policy-manual/volume-12-part-d-chapter-2", "https://travel.state.gov/content/travel/en/us-visas/immigrate/returning-resident.html", "https://uscode.house.gov/view.xhtml?req=granuleid%3AUSC-prelim-title8-section1427&num=0&edition=prelim", "/es/n-470", "https://www.uscis.gov/policy-manual/volume-12-part-d-chapter-3", "https://www.uscis.gov/policy-manual/volume-12-part-d-chapter-4", "https://www.uscis.gov/policy-manual/volume-12-part-d-chapter-5", "/es/ciudadania/aprenda-sobre-ciudadania/ceremonias-de-naturalizacion", "/es/noticias/alertas/uscis-extiende-flexibilidades-relacionadas-con-covid-19-1", "https://www.federalregister.gov/documents/2020/12/18/2020-27661/temporary-changes-to-requirements-affecting-h-2a-nonimmigrants-due-to-the-covid-19-national", "https://www.federalregister.gov/documents/2020/08/20/2020-18283/temporary-changes-to-requirements-affecting-h-2a-nonimmigrants-due-to-the-covid-19-national", "https://www.federalregister.gov/documents/2020/12/18/2020-27661/temporary-changes-to-requirements-affecting-h-2a-nonimmigrants-due-to-the-covid-19-national", "https://www.federalregister.gov/documents/2020/04/20/2020-08356/temporary-changes-to-requirements-affecting-h-2a-nonimmigrants-due-to-the-covid-19-national", "https://travel.state.gov/content/travel/en/News/visas-news/visa-services-operating-status-update.html", "https://www.aabb.org/standards-accreditation/accreditation/accredited-facilities/aabb-accredited-relationship-testing-facilities", "https://www.uscis.gov/sites/default/files/document/memos/PM-602-0178_-COVID19MedicalGraduatesMemo_Final_CLEAN.pdf", "/es/trabajar-en-estados-unidos/estudiantes-y-visitantes-de-intercambio/programa-de-exenciones-conrad-30", "/es/noticias/alivio-de-inmigracion-en-circunstancias-imprevistas", "https://gov.ecfr.io/cgi-bin/text-idx?SID=901e4ad05296c429813bb87515374f0c&mc=true&node=pt8.1.217&rgn=div5#se8.1.217_13", "/es/acerca-de-nosotros/contactenos/centro-de-contacto-de-uscis", "https://gov.ecfr.io/cgi-bin/text-idx?SID=e8a48798164c40ba7b4edad22b804d75&mc=true&node=se8.1.214_11&rgn=div8", "https://gov.ecfr.io/cgi-bin/text-idx?SID=9c1e0e4a888655a63aa42646bb660c03&mc=true&node=se8.1.248_11&rgn=div8", "/es/i-129", "/es/i-539", "/es/adopciones/despues-de-la-aprobacion-del-huerfano-y-de-la-solicitud-de-la-haya/extension-y-periodos-de-validez", "/es/adopciones/inmigracion-por-medio-de-la-adopcion/proceso-de-adopcion-de-ninos-huerfanos", "/es/adopciones/inmigracion-por-medio-de-la-adopcion/proceso-de-la-haya", "/es/i-800a", "/es/adopciones/despues-de-la-aprobacion-del-huerfano-y-de-la-solicitud-de-la-haya/extension-y-periodos-de-validez", "/es/adopciones/informacion-sobre-el-estudio-del-hogar", "/es/adopciones/despues-de-la-aprobacion-del-huerfano-y-de-la-solicitud-de-la-haya/actualizacion-de-los-estudios-del-hogar-y-cambios-significativos", "https://www.uscis.gov/sites/default/files/document/memos/2018-11-09-PM-602-0165-Suitability-of-Prospective-Adoptive-Parents-for-Intercountry-Adoption.pdf", "/es/programas-humanitarios/permiso-humanitario-o-de-beneficio-publico-significativo-para-personas-que-estan-fuera-de-estados/guias-sobre-evidencia-para-ciertos-tipos-de-peticiones-de-permiso-humanitario-o-de-beneficios", "/es/adopciones/informacion-de-contacto-de-uscis-para-adopciones", "https://travel.state.gov/content/travel/en/Intercountry-Adoption.html", "https://www.uscis.gov/es/familia/familiares-de-ciudadanos-estadounidenses/visas-para-prometidosas-de-ciudadanos-estadounidenses", "https://www.uscis.gov/es/i-130", "https://www.uscis.gov/es/familia/familiares-de-ciudadanos-estadounidenses/como-traer-a-su-conyuge-a-vivir-en-estados-unidos-como-residente-permanente", "https://fam.state.gov/FAM/09FAM/09FAM050207.html#M502_7_3_B", "/es/noticias/alivio-de-inmigracion-en-circunstancias-imprevistas", "/es/herramientas/centro-de-recursos-multilingues", "https://www.cdc.gov/coronavirus", "https://www.dhs.gov/coronavirus", "https://www.vaccines.gov/", "https://www.vaccines.gov/es/", "/es/politicas-del-sitio-web/privacidad-y-descargo-de-responsabilidad-legal", "#", "/es/temas", "/es/formularios/formularios", "/es/noticias", "/es/ciudadania", "/es/residencia-permanente-tarjeta-verde", "/es/leyes-y-politicas", "/es/herramientas", "https://www.facebook.com/uscis.es", "https://www.twitter.com/uscis_es", "https://www.youtube.com/uscis", "https://www.instagram.com/uscis", "https://www.linkedin.com/company/uscis", "https://public.govdelivery.com/accounts/USDHSCISESP/subscriber/new", "/es/acerca-de-nosotros/contactenos", "https://www.dhs.gov", "https://www.dhs.gov", "/es/acerca-de-nosotros", "/es/politicas-del-sitio-web/accesibilidad", "/es/acerca-de-nosotros/presupuesto-planificacion-y-rendimiento", "/es/politicas-del-sitio-web/sitios-web-de-los-componentes-de-dhs", "/es/registros/solicitar-expedientes-a-traves-de-la-ley-de-libertad-de-informacion-y-la-ley-de-privacidad", "/es/acerca-de-nosotros/plan-de-accion-afirmativa-para-la-seleccion-contratacion-promocion-y-retencion-de-personas-con/datos-sobre-igualdad-de-oportunidades-en-el-empleo-publicados-de-acuerdo-a-la-ley-federal-no-fear", "/es/politicas-del-sitio-web/privacidad-y-descargo-de-responsabilidad-legal", "/es/mapa-del-sitio", "https://www.oig.dhs.gov/", "https://www.whitehouse.gov/es", "https://www.usa.gov/espanol", "https://www.usa.gov/"]}