{"title": "La Red Hispana", "author": "La Red Hispana", "url": "https://laredhispana.org/", "hostname": "laredhispana.org", "description": "Recursos e informaci\u00f3n en espa\u00f1ol sobre inmigraci\u00f3n, salud y el medio ambiente.", "sitename": "La Red Hispana", "date": "2017-04-05", "id": null, "license": null, "body": null, "comments": "", "commentsbody": null, "raw_text": null, "text": "Aqu\u00ed te brindaremos algunos consejos para tratar tu fobia o bien ayudar a alguien que la padece.\n[\nLeer m\u00e1s >>\n](https://laredhispana.org/salud/salud-mental/que-son-y-como-superar-fobias)\n\u00daltimos contenidos\nAqu\u00ed te brindaremos algunos consejos para tratar tu fobia o bien ayudar a alguien que la padece.\nA continuaci\u00f3n te brindaremos una lista con 10 objetos personales que no debes compartir por ning\u00fan motivo.\n[\nLeer m\u00e1s >>\n](https://laredhispana.org/salud/10-objetos-que-no-debes-compartir)\nJos\u00e9 L\u00f3pez Zamorano estaba frente a la Casa Blanca hablando con estudiantes y l\u00edderes comunitarios. Tendremos una actualizaci\u00f3n completa pronto y en nuestro programa de radio, Bienvenidos a Am\u00e9rica.\n[\nLeer m\u00e1s >>\n](https://laredhispana.org/inmigracion/el-presidente-trump-termina-daca)\nel perd\u00f3n presidencial a Joe Arpaio confirma que el presidente Trump decidi\u00f3 continuar siendo un factor de divisi\u00f3n y polarizaci\u00f3n nacional, y con en el factor de unidad y reconciliaci\u00f3n que los Estados Unidos necesitan para sanar las heridas raciales que rasgan el tejido social.\n[\nLeer m\u00e1s >>\n](https://laredhispana.org/la-columna/el-perdon-imperdonable)\nAdvirtieron sobre los riesgos que podr\u00edan representar frutas como la guan\u00e1bana, hojas de c\u00edtricas, el mango, la parcha, el an\u00f3n, los jobos y el coraz\u00f3n, o el traslado de insectos, cactus, algod\u00f3n, caracoles, y ca\u00f1a de az\u00facar.\n[\nLeer m\u00e1s >>\n](https://laredhispana.org/planeta/vida-verde/usda-pide-apoyo-de-viajeros-en-puerto-rico-para-evitar-plagas)\nLuego de casi perder a su madre a causa del c\u00e1ncer de mama, el joven mexicano Juli\u00e1n R\u00edos, de tan solo 16 a\u00f1os decidi\u00f3 crear una alternativa tecnol\u00f3gica que ayude a la prevenci\u00f3n de esta enfermedad.\n[\nLeer m\u00e1s >>\n](https://laredhispana.org/salud/joven-mexicano-busca-vencer-el-cncer-de-mama-con-un-innovador-invento)\nPese al endurecimiento de las pol\u00edticas migratorias en Estados Unidos, Jorge Campos es ejemplo de trabajo duro y esfuerzo. \u00c9l fue admitido recientemente en la prestigiosa Universidad de Harvard.\n[\nLeer m\u00e1s >>\n](https://laredhispana.org/informate/nuestra-comunidad/jorge-camps-harvard)\nEl orden, m\u00e1s all\u00e1 de lo que significa en t\u00e9rminos de limpieza y armon\u00eda para el hogar, tambi\u00e9n tiene un significado muy relevante para nuestra mente y esp\u00edritu.\n[\nLeer m\u00e1s >>\n](https://laredhispana.org/lifestyle/hogar/ordena-el-desorden)\nLos caprichos son comunes en los m\u00e1s peque\u00f1os, pero la responsabilidad de permitirlos es de los padres. \u00bfC\u00f3mo lidiar con los tan temidos caprichos y las situaciones inc\u00f3modas que estos generan?\n[\nLeer m\u00e1s >>\n](https://laredhispana.org/familia/tips-de-crianza/tecnicas-nios-caprichosos)\nM\u00e1s de dos terceras partes de los votantes en tres de los estados que gan\u00f3 Trump: Michigan, Pensilvania y Wisconsin, se sienten avergonzados por su comandante en jefe.\n[\nLeer m\u00e1s >>\n](https://laredhispana.org/la-columna/dandole-espalda)\nAqu\u00ed te contamos algunos secretos para blanquear tus dientes de manera muy sencilla y r\u00e1pida.\n[\nLeer m\u00e1s >>\n](https://laredhispana.org/lifestyle/bienestar/tratamientos-naturales-y-economicos-para-blanquear-tus-dientes)\nSe cumple esta semana el quinto aniversario del Programa de Acci\u00f3n Diferida para Llegados en la Infancia (DACA), lo que deber\u00eda ser ocasi\u00f3n para celebrar el ejemplo de dedicaci\u00f3n y esfuerzos que nos han obsequiado unos 800,000 \u201cso\u00f1adores\u201d para contribuir a este pa\u00eds y mostrar que es posible un camino digno y respetuoso para los inmigrantes indocumentados.\n[\nLeer m\u00e1s >>\n](https://laredhispana.org/la-columna/aniversario-dreamers)\nEl actor y comediante mexicano Eugenio Derbez se suma junto a La Red Hispana y a Polaris en la lucha contra la trata de personas. El pasado martes 8 de agosto, el tambi\u00e9n productor y director, realiz\u00f3 un video en vivo a trav\u00e9s de Facebook donde habl\u00f3 p\u00fablicamente sobre su adhesi\u00f3n a la campa\u00f1a.\n[\nLeer m\u00e1s >>\n](https://laredhispana.org/informate/nuestra-comunidad/derbez-contra-la-trata)\nCuando nos proponemos enfrentar el desaf\u00edo de una dieta saludable, no es condici\u00f3n necesaria dejar de comer rico. De lo contrario, hay una gran variedad de recetas y buenos h\u00e1bitos que nos permitir\u00e1n comer durante todo el d\u00eda sin privarnos de nada.\n[\nLeer m\u00e1s >>\n](https://laredhispana.org/salud/vida-saludable/comer-saludable)\nLa decisi\u00f3n del presidente Donald Trump de apoyar la Ley RAISE, que busca reducir la inmigraci\u00f3n legal a la mitad en un lapso de 10 a\u00f1os, ha sido vista un\u00e1nimemente como una bofetada a los valores tradicionales de este pa\u00eds hospitalario.\n[\nLeer m\u00e1s >>\n](https://laredhispana.org/la-columna/disparo-en-pie)\nInmigrantes menores de edad no acompa\u00f1ados que llegan a las fronteras de Estados Unidos, tendr\u00e1n acceso a una audiencia migratoria.\n[\nLeer m\u00e1s >>\n](https://laredhispana.org/la-columna/elemtal-justicia)\nMi hijo cambi\u00f3 su comportamiento. En la escuela el maestro me dijo que el ni\u00f1o anda muy inquieto, que no lo deja dar la clase, y lo mismo me dice la se\u00f1ora que lo cuida despu\u00e9s de la escuela. Llega a casa con cosas que no son de \u00e9l, y dice que se las encontr\u00f3...\n[\nLeer m\u00e1s >>\n](https://laredhispana.org/salud/salud-mental/madre-preocupada-hijo)\nPreocupaci\u00f3n entre los defensores de los ni\u00f1os, inmigrantes y refugiados, a partir de la decisi\u00f3n de ir contra los padres o tutores legales indocumentados que traigan a sus hijos o parientes a Estados Unidos desde el extranjero, a trav\u00e9s de los llamados \u201ccoyotes\u201d o contrabandistas de personas.\n[\nLeer m\u00e1s >>\n](https://laredhispana.org/la-columna/nios-primero)\nEmpezar a hacer ejercicio puede ser muy dif\u00edcil sobretodo cuando no tienes el tiempo, o a\u00fan peor, la motivaci\u00f3n. \u00a1Estos trucos son tan f\u00e1ciles de seguir, que te sorprender\u00e1n!\n[\nLeer m\u00e1s >>\n](https://laredhispana.org/salud/trucos-hacer-ejercicio)\nLa victoria parcial de Trump obliga a la Administraci\u00f3n a completar su revisi\u00f3n de los procedimientos y razones para implantar el veto. Y este extremo podr\u00eda conducir al fin definitivo de la medida\n[\nLeer m\u00e1s >>\n](https://laredhispana.org/la-columna/camino-migratorio)\nEl Programa de Acci\u00f3n Diferida para Llegados en la Infancia (DACA) sigue vigente, pero mismo tiempo se rescindi\u00f3 la posible ampliaci\u00f3n y su variante para adultos DAPA.\n[\nLeer m\u00e1s >>\n](https://laredhispana.org/la-columna/vaso-madio-lleno)\nCon motivo del D\u00eda Nacional de la Prueba del VIH (27 de Junio) los reconocid\u00edsimos Huracanes del Norte te invitan a hacerte la prueba del VIH. La prueba es gratis, r\u00e1pida y confidencial. \u00a1Aqu\u00ed encontrar\u00e1s sitios donde hacerte la prueba!\n[\nLeer m\u00e1s >>\n](https://laredhispana.org/salud/haciendolo)\nDurante las vacaciones de verano, los estudiantes pierden un promedio de dos meses de aprendizaje de su nivel de grado. Aqu\u00ed te traemos consejos para divertirte con toda la familia y evitar la p\u00e9rdida de aprendizaje.\n[\nLeer m\u00e1s >>\n](https://laredhispana.org/informate/educacion/perdida-aprendizaje)\nUn panel de tres jueces de la Corte de Apelaciones del Noveno Circuito reconfirm\u00f3 que la orden ejecutiva de la Casa Blanca contra seis pa\u00edses de mayor\u00eda musulmana es una prohibici\u00f3n de viajes, y por lo tanto no pasa la prueba de la legalidad.\n[\nLeer m\u00e1s >>\n](https://laredhispana.org/la-columna/un-reves-mas)\nEs entendible que la decisi\u00f3n del presidente Donald Trump de abandonar el Acuerdo de Cambio Clim\u00e1tico de Paris haya provocado un rechazo global, que literalmente uni\u00f3 a la humanidad en la misi\u00f3n de salvar al planeta.\n[\nLeer m\u00e1s >>\n](https://laredhispana.org/la-columna/paso-atras)\nUna de las medidas que puedes tomar para protegerte a ti y a los dem\u00e1s es hacerte la prueba del VIH. Piensa de esta manera: \u00bfPor qu\u00e9 me siento tan confiado/a de que no tengo el VIH? La \u00fanica manera de saberlo con certeza es haci\u00e9ndote la prueba.\n[\nLeer m\u00e1s >>\n](https://laredhispana.org/la-columna/salvando-vidas)\nLa tr\u00e1gica muerte de la joven promesa del b\u00e9isbol, Jos\u00e9 Fern\u00e1ndez, as\u00ed como de dos de sus amigos, Eduardo Rivero y Emilio Jes\u00fas Mac\u00edas, es un triste recordatorio de las innumerables vidas que se pierden en el mar por ignorar la regla de usar un chaleco salvavidas.\n[\nLeer m\u00e1s >>\n](https://laredhispana.org/la-columna/tragica-tormenta)\nEs importante hacer consciencia de que los chalecos salvavidas para adultos no funcionar\u00e1n para los ni\u00f1os y que debemos escoger uno dise\u00f1ado especialmente para ellos.\n[\nLeer m\u00e1s >>\n](https://laredhispana.org/informate/solamente-salva-vidas-cuando-lo-usas)\nConocida como la ley \u201cMu\u00e9strame Tus Papeles\u201d faculta a los polic\u00edas a actuar como agentes migratorios, proh\u00edbe las ciudades santuario y obliga a las agencias estatales y locales del orden a acatar las \u00f3rdenes federales de retenci\u00f3n de migrantes.\n[\nLeer m\u00e1s >>\n](https://laredhispana.org/la-columna/muestra-humanidad)\nTodo lo que haces antes de irte a dormir tiene un impacto positivo o negativo a la hora de dormir. La noche es buen momento para empezar a incorporar rutinas diarias a tu d\u00eda, ya que est\u00e1s m\u00e1s calmado y no est\u00e1s corriendo para todos los lados para hacer cosas.\n[\nLeer m\u00e1s >>\n](https://laredhispana.org/lifestyle/bienestar/dormir-mejor)\nLa serie de televisi\u00f3n \u201c13 Reason Why\u201d es la nueva preocupaci\u00f3n para muchos padres de ni\u00f1os adolescentes. Es probable que tus hijos ya hayan escuchado hablar del libro o de la serie, y que incluso la hayan visto.\n[\nLeer m\u00e1s >>\n](https://laredhispana.org/salud/salud-mental/serie-de-netflix-preocupa-a-padres-de-adolescentes)\nLas elecciones del domingo pasado entre el banquero Emmanuel Macron y la nacionalista Marine Le Pen atrajeron una atenci\u00f3n sin precedentes porque no s\u00f3lo estaba en juego el destino de Francia, sino la definici\u00f3n de dos apuestas pol\u00edticas y filos\u00f3ficas marcadamente contrapuestas y cuyo desenlace debe importar a todos.\n[\nLeer m\u00e1s >>\n](https://laredhispana.org/la-columna/populismo-herido)\nCuando nos encontramos ante una encrucijada, sin saber para d\u00f3nde continuar, es el momento perfecto para evaluar nuestras decisiones, y es posible, que en estos momentos te hagas preguntas como \u00bfpor qu\u00e9...?\n[\nLeer m\u00e1s >>\n](https://laredhispana.org/informate/tomar-mejores-decisiones)\nEs posible que hayas pensado varias veces que preocuparse es la manera incorrecta de entender la vida, pero la ciencia ha demostrado lo contrario.\n[\nLeer m\u00e1s >>\n](https://laredhispana.org/salud/salud-mental/preocuparse-es-bueno)\nDos sucesos aparentemente inconexos ocurren alrededor de los primeros 100 d\u00edas del nuevo gobierno: las negociaciones del presupuesto suplementario del a\u00f1o fiscal 2017 y las movilizaciones del Primero de Mayo.\n[\nLeer m\u00e1s >>\n](https://laredhispana.org/la-columna/calor-en-mayo)\nDicen que el dinero genera dinero, y que para construir una peque\u00f1a riqueza es importante invertir\u2026 pero \u00bfpor d\u00f3nde empezar? \u00a1Sigue esta gu\u00eda!\n[\nLeer m\u00e1s >>\n](https://laredhispana.org/informate/finanzas/por-qu-debera-invertir-mi-dinero-hoy-mismo)\nEstados Unidos llega al umbral de los primeros 100 d\u00edas en medio de las mismas divisiones que se hicieron patentes en las elecciones. Es verdad que es prematuro emitir un juicio definitivo, pero los pr\u00f3ximos d\u00edas, semanas y meses ser\u00e1n claves para determinar si este pa\u00eds se encamina...\n[\nLeer m\u00e1s >>\n](https://laredhispana.org/la-columna/100-dias)\nEn un mundo perfecto, cada persona que se cruza por nuestro camino es agradable, amable, atenta, cosiderada, generosa y tantas otras cualidades positivas. Pero cuando eso no sucede necesitar\u00e1s estas t\u00e9cnicas para lidiar de forma inteligente, con esas personas que simplemente te caen mal.\n[\nLeer m\u00e1s >>\n](https://laredhispana.org/salud/salud-mental/lidiar-personas-mal)\nMucho se habla de la envidia, que hay una buena (que nos impulsa a ir por lo que queremos) y una mala, que s\u00f3lo nos hace desear lo que tiene el otro. Aqu\u00ed te ense\u00f1amos actitudes de personas envidiosas, a ver si las reconoces.\n[\nLeer m\u00e1s >>\n](https://laredhispana.org/salud/salud-mental/identifica-envidia)\nHola Doctora: Tengo problemas con mi esposo acerca de nuestra religi\u00f3n. No estoy de acuerdo con la clase de Iglesia a donde \u00e9l asiste. Yo y mi hija estamos reuni\u00e9ndonos en otra Iglesia. Eso ha causado mucho distanciamiento entre nosotros y me demuestra rechazo, enojo constante por nuestra situaci\u00f3n.\n[\nLeer m\u00e1s >>\n](https://laredhispana.org/salud/problemas-religion)\nLa humanidad celebra este 22 de abril el D\u00eda de la Tierra y llama la atenci\u00f3n que las conmemoraciones del a\u00f1o tengan como lema y objetivo promover el \u201calfabetismo clim\u00e1tico y ambiental\u201d, una especie de himno de batalla sobre la necesidad de promover una ciudadan\u00eda global consciente de la amenaza que representa el cambio clim\u00e1tico.\n[\nLeer m\u00e1s >>\n](https://laredhispana.org/la-columna/alfabetismo-ambiental)\nLos ojos de la naci\u00f3n y del mundo est\u00e1n volcados sobre la figura de Neil Gorsuch, el nuevo magistrado en sustituci\u00f3n del juez conservador Antonin Scalia. Gorsuch dej\u00f3 bien en claro que no ser\u00eda una marioneta judicial del presidente en turno.\n[\nLeer m\u00e1s >>\n](https://laredhispana.org/la-columna/max-responsabilidad)\nLos bosques son no s\u00f3lo una oportunidad recreativa sino adem\u00e1s se pueden recolectar productos especiales como arboles de navidad, flores, plantas de uso medicinal, hongos comestibles, arreglos decorativos, muchos de los cuales no requieren permisos.\n[\nLeer m\u00e1s >>\n](https://laredhispana.org/planeta/productos-forestales-no-maderables)\nEn primer lugar, valida los sentimientos de tu hija adolescente. Trata de ser comprensivo y accesible, pero confr\u00f3ntala con los hechos. Puede ser que una adolescente que busca quedar embarazada necesite atenci\u00f3n.\n[\nLeer m\u00e1s >>\n](https://laredhispana.org/salud/mi-hija-adolescente-dice-que-quiere-tener-un-beb-qu-le-digo)\nEstas deliciosas tartas de chocolate y caramelo no necesitan horneado y se usan galletas de chocolate como base. \u00a1Imperdibles para cualquier evento o para disfrutar una tarde!\n[\nLeer m\u00e1s >>\n](https://laredhispana.org/familia/recetas/tartas-choc-caramel)\nCuando el coraz\u00f3n se rompe, tenemos que ayudarlo a sanar. No se sana sin un compromiso personal tuyo, pero la buena noticia es que el coraz\u00f3n es uno de los \u00fanicos \u00f3rganos que se puede arreglar despu\u00e9s de estar roto. Los siguientes pasos te ayudar\u00e1n:\n[\nLeer m\u00e1s >>\n](https://laredhispana.org/familia/supera-ruptura)\nEn unas semanas vence el plazo para que los l\u00edderes republicanos y dem\u00f3cratas de la C\u00e1mara de Representantes y del Senado alcancen un acuerdo presupuestal sobre los temas de deportaciones, seguridad fronteriza y la planificaci\u00f3n familiar.\n[\nLeer m\u00e1s >>\n](https://laredhispana.org/la-columna/cuenta-regresiva)\nEstos chiles rellenos son absolutamente deliciosos. Y en especial pueden ser una buena opci\u00f3n para cuando quieres algo diferente y a base de vegetales, o para los viernes de Cuaresma. \u00a1Qui\u00e9n dir\u00eda que los platillos vegetarianos pueden ser tan ricos!\n[\nLeer m\u00e1s >>\n](https://laredhispana.org/familia/recetas/chiles-rellenos-picadillo)\nLa ansiedad es una condici\u00f3n que puede alejar a las personas. Para aquellos que tienen un amigo o familiar que vive con ansiedad, esto puede representar un serio desaf\u00edo. Aprende c\u00f3mo ayudar a una persona que padece esta condici\u00f3n.\n[\nLeer m\u00e1s >>\n](https://laredhispana.org/salud/salud-mental/ayudar-con-ansiedad)", "language": null, "image": "https://laredhispana.org/wp-content/uploads/2022/08/logo_lrh.png", "pagetype": "website", "links": ["https://laredhispana.org/", "https://laredhispana.org/familia", "https://laredhispana.org/familia/tips-de-crianza", "https://laredhispana.org/familia/recetas", "https://laredhispana.org/informate", "https://laredhispana.org/informate/educacion", "https://laredhispana.org/informate/politica", "https://laredhispana.org/informate/nuestra-comunidad", "https://laredhispana.org/informate/finanzas", "https://laredhispana.org/inmigracion", "https://laredhispana.org/inmigracion/bienvenidos-a-america", "https://laredhispana.org/inmigracion/recursos", "https://laredhispana.org/lifestyle", "https://laredhispana.org/lifestyle/bienestar", "https://laredhispana.org/lifestyle/tecnologia", "https://laredhispana.org/lifestyle/tendencias", "https://laredhispana.org/lifestyle/hogar", "https://laredhispana.org/planeta", "https://laredhispana.org/planeta/cambio-climatico", "https://laredhispana.org/planeta/agricultura", "https://laredhispana.org/planeta/vida-verde", "https://laredhispana.org/salud", "https://laredhispana.org/salud/salud-mental", "https://laredhispana.org/salud/vida-saludable", "https://laredhispana.org/", "https://laredhispana.org/", "https://laredhispana.org/", "https://laredhispana.org/familia", "https://laredhispana.org/familia/tips-de-crianza", "https://laredhispana.org/familia/recetas", "https://laredhispana.org/informate", "https://laredhispana.org/informate/educacion", "https://laredhispana.org/informate/politica", "https://laredhispana.org/informate/nuestra-comunidad", "https://laredhispana.org/informate/finanzas", "https://laredhispana.org/inmigracion", "https://laredhispana.org/inmigracion/bienvenidos-a-america", "https://laredhispana.org/inmigracion/recursos", "https://laredhispana.org/lifestyle", "https://laredhispana.org/lifestyle/bienestar", "https://laredhispana.org/lifestyle/tecnologia", "https://laredhispana.org/lifestyle/tendencias", "https://laredhispana.org/lifestyle/hogar", "https://laredhispana.org/planeta", "https://laredhispana.org/planeta/cambio-climatico", "https://laredhispana.org/planeta/agricultura", "https://laredhispana.org/planeta/vida-verde", "https://laredhispana.org/salud", "https://laredhispana.org/salud/salud-mental", "https://laredhispana.org/salud/vida-saludable", "https://laredhispana.org/salud/salud-mental/que-son-y-como-superar-fobias", "https://laredhispana.org/salud/salud-mental", "https://laredhispana.org/salud/salud-mental/que-son-y-como-superar-fobias", "https://laredhispana.org/author/laredhispanagmail-com", "https://laredhispana.org/salud/salud-mental/que-son-y-como-superar-fobias", "https://laredhispana.org/salud/10-objetos-que-no-debes-compartir", "https://laredhispana.org/salud", "https://laredhispana.org/salud/10-objetos-que-no-debes-compartir", "https://laredhispana.org/author/laredhispanagmail-com", "https://laredhispana.org/salud/10-objetos-que-no-debes-compartir", "https://laredhispana.org/inmigracion/el-presidente-trump-termina-daca", "https://laredhispana.org/inmigracion", "https://laredhispana.org/inmigracion/el-presidente-trump-termina-daca", "https://laredhispana.org/author/laredhispanagmail-com", "https://laredhispana.org/inmigracion/el-presidente-trump-termina-daca", "https://laredhispana.org/la-columna/el-perdon-imperdonable", "https://laredhispana.org/la-columna", "https://laredhispana.org/la-columna/el-perdon-imperdonable", "https://laredhispana.org/author/laredhispanagmail-com", "https://laredhispana.org/la-columna/el-perdon-imperdonable", "https://laredhispana.org/planeta/vida-verde/usda-pide-apoyo-de-viajeros-en-puerto-rico-para-evitar-plagas", "https://laredhispana.org/planeta", "https://laredhispana.org/planeta/vida-verde", "https://laredhispana.org/planeta/vida-verde/usda-pide-apoyo-de-viajeros-en-puerto-rico-para-evitar-plagas", "https://laredhispana.org/author/laredhispanagmail-com", "https://laredhispana.org/planeta/vida-verde/usda-pide-apoyo-de-viajeros-en-puerto-rico-para-evitar-plagas", "https://laredhispana.org/salud/joven-mexicano-busca-vencer-el-cncer-de-mama-con-un-innovador-invento", "https://laredhispana.org/salud", "https://laredhispana.org/salud/joven-mexicano-busca-vencer-el-cncer-de-mama-con-un-innovador-invento", "https://laredhispana.org/author/laredhispanagmail-com", "https://laredhispana.org/salud/joven-mexicano-busca-vencer-el-cncer-de-mama-con-un-innovador-invento", "https://laredhispana.org/informate/nuestra-comunidad/jorge-camps-harvard", "https://laredhispana.org/informate/nuestra-comunidad", "https://laredhispana.org/informate/nuestra-comunidad/jorge-camps-harvard", "https://laredhispana.org/author/laredhispanagmail-com", "https://laredhispana.org/informate/nuestra-comunidad/jorge-camps-harvard", "https://laredhispana.org/lifestyle/hogar/ordena-el-desorden", "https://laredhispana.org/lifestyle/hogar", "https://laredhispana.org/lifestyle/hogar/ordena-el-desorden", "https://laredhispana.org/author/laredhispanagmail-com", "https://laredhispana.org/lifestyle/hogar/ordena-el-desorden", "https://laredhispana.org/familia/tips-de-crianza/tecnicas-nios-caprichosos", "https://laredhispana.org/familia/tips-de-crianza", "https://laredhispana.org/familia/tips-de-crianza/tecnicas-nios-caprichosos", "https://laredhispana.org/author/laredhispanagmail-com", "https://laredhispana.org/familia/tips-de-crianza/tecnicas-nios-caprichosos", "https://laredhispana.org/la-columna/dandole-espalda", "https://laredhispana.org/la-columna", "https://laredhispana.org/la-columna/dandole-espalda", "https://laredhispana.org/author/laredhispanagmail-com", "https://laredhispana.org/la-columna/dandole-espalda", "https://laredhispana.org/lifestyle/bienestar/tratamientos-naturales-y-economicos-para-blanquear-tus-dientes", "https://laredhispana.org/lifestyle/bienestar", "https://laredhispana.org/lifestyle/bienestar/tratamientos-naturales-y-economicos-para-blanquear-tus-dientes", "https://laredhispana.org/author/laredhispanagmail-com", "https://laredhispana.org/lifestyle/bienestar/tratamientos-naturales-y-economicos-para-blanquear-tus-dientes", "https://laredhispana.org/la-columna/aniversario-dreamers", "https://laredhispana.org/la-columna", "https://laredhispana.org/la-columna/aniversario-dreamers", "https://laredhispana.org/author/laredhispanagmail-com", "https://laredhispana.org/la-columna/aniversario-dreamers", "https://laredhispana.org/informate/nuestra-comunidad/derbez-contra-la-trata", "https://laredhispana.org/informate", "https://laredhispana.org/informate/nuestra-comunidad", "https://laredhispana.org/informate/nuestra-comunidad/derbez-contra-la-trata", "https://laredhispana.org/author/laredhispanagmail-com", "https://laredhispana.org/informate/nuestra-comunidad/derbez-contra-la-trata", "https://laredhispana.org/salud/vida-saludable/comer-saludable", "https://laredhispana.org/salud/vida-saludable", "https://laredhispana.org/salud/vida-saludable/comer-saludable", "https://laredhispana.org/author/laredhispanagmail-com", "https://laredhispana.org/salud/vida-saludable/comer-saludable", "https://laredhispana.org/la-columna/disparo-en-pie", "https://laredhispana.org/la-columna", "https://laredhispana.org/la-columna/disparo-en-pie", "https://laredhispana.org/author/laredhispanagmail-com", "https://laredhispana.org/la-columna/disparo-en-pie", "https://laredhispana.org/la-columna/elemtal-justicia", "https://laredhispana.org/la-columna", "https://laredhispana.org/la-columna/elemtal-justicia", "https://laredhispana.org/author/laredhispanagmail-com", "https://laredhispana.org/la-columna/elemtal-justicia", "https://laredhispana.org/salud/salud-mental/madre-preocupada-hijo", "https://laredhispana.org/salud/salud-mental", "https://laredhispana.org/salud/salud-mental/madre-preocupada-hijo", "https://laredhispana.org/author/laredhispanagmail-com", "https://laredhispana.org/salud/salud-mental/madre-preocupada-hijo", "https://laredhispana.org/la-columna/nios-primero", "https://laredhispana.org/la-columna", "https://laredhispana.org/la-columna/nios-primero", "https://laredhispana.org/author/laredhispanagmail-com", "https://laredhispana.org/la-columna/nios-primero", "https://laredhispana.org/salud/trucos-hacer-ejercicio", "https://laredhispana.org/salud", "https://laredhispana.org/salud/trucos-hacer-ejercicio", "https://laredhispana.org/author/laredhispanagmail-com", "https://laredhispana.org/salud/trucos-hacer-ejercicio", "https://laredhispana.org/la-columna/camino-migratorio", "https://laredhispana.org/la-columna", "https://laredhispana.org/la-columna/camino-migratorio", "https://laredhispana.org/author/laredhispanagmail-com", "https://laredhispana.org/la-columna/camino-migratorio", "https://laredhispana.org/la-columna/vaso-madio-lleno", "https://laredhispana.org/la-columna", "https://laredhispana.org/la-columna/vaso-madio-lleno", "https://laredhispana.org/author/laredhispanagmail-com", "https://laredhispana.org/la-columna/vaso-madio-lleno", "https://laredhispana.org/salud/haciendolo", "https://laredhispana.org/salud", "https://laredhispana.org/salud/haciendolo", "https://laredhispana.org/author/laredhispanagmail-com", "https://laredhispana.org/salud/haciendolo", "https://laredhispana.org/informate/educacion/perdida-aprendizaje", "https://laredhispana.org/informate/educacion", "https://laredhispana.org/informate/educacion/perdida-aprendizaje", "https://laredhispana.org/author/laredhispanagmail-com", "https://laredhispana.org/informate/educacion/perdida-aprendizaje", "https://laredhispana.org/la-columna/un-reves-mas", "https://laredhispana.org/la-columna", "https://laredhispana.org/la-columna/un-reves-mas", "https://laredhispana.org/author/laredhispanagmail-com", "https://laredhispana.org/la-columna/un-reves-mas", "https://laredhispana.org/la-columna/paso-atras", "https://laredhispana.org/la-columna", "https://laredhispana.org/la-columna/paso-atras", "https://laredhispana.org/author/laredhispanagmail-com", "https://laredhispana.org/la-columna/paso-atras", "https://laredhispana.org/la-columna/salvando-vidas", "https://laredhispana.org/la-columna", "https://laredhispana.org/la-columna/salvando-vidas", "https://laredhispana.org/author/laredhispanagmail-com", "https://laredhispana.org/la-columna/salvando-vidas", "https://laredhispana.org/la-columna/tragica-tormenta", "https://laredhispana.org/la-columna", "https://laredhispana.org/la-columna/tragica-tormenta", "https://laredhispana.org/author/laredhispanagmail-com", "https://laredhispana.org/la-columna/tragica-tormenta", "https://laredhispana.org/informate/solamente-salva-vidas-cuando-lo-usas", "https://laredhispana.org/informate", "https://laredhispana.org/informate/solamente-salva-vidas-cuando-lo-usas", "https://laredhispana.org/author/laredhispanagmail-com", "https://laredhispana.org/informate/solamente-salva-vidas-cuando-lo-usas", "https://laredhispana.org/la-columna/muestra-humanidad", "https://laredhispana.org/la-columna", "https://laredhispana.org/la-columna/muestra-humanidad", "https://laredhispana.org/author/laredhispanagmail-com", "https://laredhispana.org/la-columna/muestra-humanidad", "https://laredhispana.org/lifestyle/bienestar/dormir-mejor", "https://laredhispana.org/lifestyle/bienestar", "https://laredhispana.org/lifestyle/bienestar/dormir-mejor", "https://laredhispana.org/author/laredhispanagmail-com", "https://laredhispana.org/lifestyle/bienestar/dormir-mejor", "https://laredhispana.org/salud/salud-mental/serie-de-netflix-preocupa-a-padres-de-adolescentes", "https://laredhispana.org/salud/salud-mental", "https://laredhispana.org/salud/salud-mental/serie-de-netflix-preocupa-a-padres-de-adolescentes", "https://laredhispana.org/author/laredhispanagmail-com", "https://laredhispana.org/salud/salud-mental/serie-de-netflix-preocupa-a-padres-de-adolescentes", "https://laredhispana.org/la-columna/populismo-herido", "https://laredhispana.org/la-columna", "https://laredhispana.org/la-columna/populismo-herido", "https://laredhispana.org/author/laredhispanagmail-com", "https://laredhispana.org/la-columna/populismo-herido", "https://laredhispana.org/informate/tomar-mejores-decisiones", "https://laredhispana.org/informate", "https://laredhispana.org/informate/tomar-mejores-decisiones", "https://laredhispana.org/author/laredhispanagmail-com", "https://laredhispana.org/informate/tomar-mejores-decisiones", "https://laredhispana.org/salud/salud-mental/preocuparse-es-bueno", "https://laredhispana.org/salud/salud-mental", "https://laredhispana.org/salud/salud-mental/preocuparse-es-bueno", "https://laredhispana.org/author/laredhispanagmail-com", "https://laredhispana.org/salud/salud-mental/preocuparse-es-bueno", "https://laredhispana.org/la-columna/calor-en-mayo", "https://laredhispana.org/la-columna", "https://laredhispana.org/la-columna/calor-en-mayo", "https://laredhispana.org/author/laredhispanagmail-com", "https://laredhispana.org/la-columna/calor-en-mayo", "https://laredhispana.org/informate/finanzas/por-qu-debera-invertir-mi-dinero-hoy-mismo", "https://laredhispana.org/informate/finanzas", "https://laredhispana.org/informate/finanzas/por-qu-debera-invertir-mi-dinero-hoy-mismo", "https://laredhispana.org/author/laredhispanagmail-com", "https://laredhispana.org/informate/finanzas/por-qu-debera-invertir-mi-dinero-hoy-mismo", "https://laredhispana.org/la-columna/100-dias", "https://laredhispana.org/la-columna", "https://laredhispana.org/la-columna/100-dias", "https://laredhispana.org/author/laredhispanagmail-com", "https://laredhispana.org/la-columna/100-dias", "https://laredhispana.org/planeta/bosques-nacionales-del-pacfico-noroccidental", "https://laredhispana.org/planeta", "https://laredhispana.org/planeta/bosques-nacionales-del-pacfico-noroccidental", "https://laredhispana.org/author/laredhispanagmail-com", "https://laredhispana.org/salud/salud-mental/lidiar-personas-mal", "https://laredhispana.org/salud/salud-mental", "https://laredhispana.org/salud/salud-mental/lidiar-personas-mal", "https://laredhispana.org/author/laredhispanagmail-com", "https://laredhispana.org/salud/salud-mental/lidiar-personas-mal", "https://laredhispana.org/salud/salud-mental/identifica-envidia", "https://laredhispana.org/salud/salud-mental", "https://laredhispana.org/salud/salud-mental/identifica-envidia", "https://laredhispana.org/author/laredhispanagmail-com", "https://laredhispana.org/salud/salud-mental/identifica-envidia", "https://laredhispana.org/salud/problemas-religion", "https://laredhispana.org/salud", "https://laredhispana.org/salud/problemas-religion", "https://laredhispana.org/author/laredhispanagmail-com", "https://laredhispana.org/salud/problemas-religion", "https://laredhispana.org/la-columna/alfabetismo-ambiental", "https://laredhispana.org/la-columna", "https://laredhispana.org/planeta", "https://laredhispana.org/la-columna/alfabetismo-ambiental", "https://laredhispana.org/author/laredhispanagmail-com", "https://laredhispana.org/la-columna/alfabetismo-ambiental", "https://laredhispana.org/la-columna/max-responsabilidad", "https://laredhispana.org/la-columna", "https://laredhispana.org/la-columna/max-responsabilidad", "https://laredhispana.org/author/laredhispanagmail-com", "https://laredhispana.org/la-columna/max-responsabilidad", "https://laredhispana.org/planeta/productos-forestales-no-maderables", "https://laredhispana.org/planeta", "https://laredhispana.org/planeta/productos-forestales-no-maderables", "https://laredhispana.org/author/laredhispanagmail-com", "https://laredhispana.org/planeta/productos-forestales-no-maderables", "https://laredhispana.org/salud/mi-hija-adolescente-dice-que-quiere-tener-un-beb-qu-le-digo", "https://laredhispana.org/informate", "https://laredhispana.org/salud", "https://laredhispana.org/salud/mi-hija-adolescente-dice-que-quiere-tener-un-beb-qu-le-digo", "https://laredhispana.org/author/laredhispanagmail-com", "https://laredhispana.org/salud/mi-hija-adolescente-dice-que-quiere-tener-un-beb-qu-le-digo", "https://laredhispana.org/familia/recetas/tartas-choc-caramel", "https://laredhispana.org/familia/recetas", "https://laredhispana.org/familia/recetas/tartas-choc-caramel", "https://laredhispana.org/author/laredhispanagmail-com", "https://laredhispana.org/familia/recetas/tartas-choc-caramel", "https://laredhispana.org/familia/supera-ruptura", "https://laredhispana.org/familia", "https://laredhispana.org/familia/supera-ruptura", "https://laredhispana.org/author/laredhispanagmail-com", "https://laredhispana.org/familia/supera-ruptura", "https://laredhispana.org/la-columna/cuenta-regresiva", "https://laredhispana.org/la-columna", "https://laredhispana.org/la-columna/cuenta-regresiva", "https://laredhispana.org/author/laredhispanagmail-com", "https://laredhispana.org/la-columna/cuenta-regresiva", "https://laredhispana.org/familia/recetas/chiles-rellenos-picadillo", "https://laredhispana.org/familia/recetas", "https://laredhispana.org/familia/recetas/chiles-rellenos-picadillo", "https://laredhispana.org/author/laredhispanagmail-com", "https://laredhispana.org/familia/recetas/chiles-rellenos-picadillo", "https://laredhispana.org/salud/salud-mental/ayudar-con-ansiedad", "https://laredhispana.org/salud/salud-mental", "https://laredhispana.org/salud/salud-mental/ayudar-con-ansiedad", "https://laredhispana.org/author/laredhispanagmail-com", "https://laredhispana.org/salud/salud-mental/ayudar-con-ansiedad", "https://laredhispana.org/reproductor", "/our-mission", "https://www.facebook.com/LaRedHispana", "https://www.instagram.com/laredhispana/", "https://www.youtube.com/user/LaRedHispana?sub_confirmation=1", "https://www.tiktok.com/@laredhispana", "https://twitter.com/LaRedHispana", "https://laredhispana.org/salud/8-sintomas-tempranos-del-cancer-de-pulmon", "https://laredhispana.org/salud/8-sintomas-tempranos-del-cancer-de-pulmon", "https://laredhispana.org/salud/siete-maneras-de-tener-una-relacion-mas-saludable-con-el-estres", "https://laredhispana.org/salud/siete-maneras-de-tener-una-relacion-mas-saludable-con-el-estres", "https://laredhispana.org/salud/salud-mental/el-duelo-migratorio-un-desafio-emocional", "https://laredhispana.org/salud/salud-mental/el-duelo-migratorio-un-desafio-emocional", "https://laredhispana.org/inmigracion/cmo-solicitar-un-permiso-de-trabajo-en-estados-unidos", "https://laredhispana.org/inmigracion/cmo-solicitar-un-permiso-de-trabajo-en-estados-unidos", "https://laredhispana.org/", "https://www.facebook.com/LaRedHispana", "https://www.instagram.com/laredhispana/", "https://www.youtube.com/user/LaRedHispana?sub_confirmation=1", "https://www.tiktok.com/@laredhispana", "https://twitter.com/LaRedHispana", "/our-mission", "/contacto", "/privacy-policy", "#top"]}