{"title": "La Red Hispana", "author": "La Red Hispana", "url": "https://laredhispana.org/author/laredhispanagmail-com", "hostname": "laredhispana.org", "description": null, "sitename": "La Red Hispana", "date": "2021-08-01", "id": null, "license": null, "body": null, "comments": "", "commentsbody": null, "raw_text": null, "text": "by PGN Staff, Public Good News September 13, 2023 Read in EnglishA lo largo de la pandemia de COVID-19, los trabajadores de salud comunitaria aprendieron a adaptarse\n[\nLeer m\u00e1s >>\n](https://laredhispana.org/salud/en-la-frontera-personal-de-salud-comunitaria-se-adapta-a-las-necesidades-de-solicitantes-de-asilo)\nAutor: La Red Hispana\nby PGN Staff, Public Good News September 13, 2023 Read in EnglishA lo largo de la pandemia de COVID-19, los trabajadores de salud comunitaria aprendieron a adaptarse\nEl primer consulado de Nicaragua en los Estados Unidos se estableci\u00f3 en la ciudad de Nueva York en el a\u00f1o 1946. Desde entonces, Nicaragua ha mantenido representaci\u00f3n\n[\nLeer m\u00e1s >>\n](https://laredhispana.org/informate/nuestra-comunidad/estos-son-los-consulados-de-nicaragua-en-estados-unidos)\nLa declaraci\u00f3n de bancarrota es un paso dr\u00e1stico que muchas personas consideran cuando se enfrentan a una abrumadora carga de deuda y no pueden pagar sus obligaciones\n[\nLeer m\u00e1s >>\n](https://laredhispana.org/informate/finanzas/consecuencias-de-declararse-en-bancarrota-en-estados-unidos)\nEl asilo en Estados Unidos es un recurso crucial para las personas que enfrentan persecuci\u00f3n, discriminaci\u00f3n y violencia en sus pa\u00edses de origen y buscan protecci\u00f3n en\n[\nLeer m\u00e1s >>\n](https://laredhispana.org/inmigracion/conoce-los-dos-tipos-de-asilo-en-estados-unidos)\nNada mejor que saber exactamente qu\u00e9 hacer y c\u00f3mo reaccionar ante una emergencia. Aqu\u00ed te compartimos esta informaci\u00f3n para saber c\u00f3mo elegir el lugar donde pasar la\n[\nLeer m\u00e1s >>\n](https://laredhispana.org/planeta/preparate-para-huracan)\nEl Mes de la Herencia Hispana es un per\u00edodo de tiempo que nos llena de celebraci\u00f3n, reflexi\u00f3n y reconocimiento por la influencia y las contribuciones que nuestra\n[\nLeer m\u00e1s >>\n](https://laredhispana.org/informate/nuestra-comunidad/10-motivos-para-sentirnos-orgullosos-este-mes-de-la-herencia-hispana)\nPor: Dra. Luz Towns-Miranda Apoyar a las madres despu\u00e9s del parto es fundamental, ya que una de cada ocho madres sufre s\u00edntomas de depresi\u00f3n postparto. En algunos\n[\nLeer m\u00e1s >>\n](https://laredhispana.org/familia/tips-de-crianza/como-brindar-apoyo-efectivo-a-madres-con-depresion-posparto)\nCuando se trata de dolores de est\u00f3mago leves y molestias gastrointestinales, las pastillas para el dolor de est\u00f3mago de venta libre se han convertido en un recurso\n[\nLeer m\u00e1s >>\n](https://laredhispana.org/salud/pastillas-para-el-dolor-de-estomago)\nLos hijos son uno de los mayores orgullos de los padres. Su educaci\u00f3n es clave para formar personas que contribuyan a la sociedad. Sin embargo, el costo\n[\nLeer m\u00e1s >>\n](https://laredhispana.org/informate/educacion/plan-de-ahorro-para-la-universidad)\nEsta temporada de regreso a clases, No Kid Hungry, una campa\u00f1a nacional para terminar con el hambre infantil en los Estados Unidos, celebra a los h\u00e9roes escolares\n[\nLeer m\u00e1s >>\n](https://laredhispana.org/inmigracion/recursos/celebrando-los-heroes-escolares-que-ayudan-con-la-nutricion-infantil)\nActualmente hay 13 consulados de Honduras en Estados Unidos, donde te pueden brindar asesor\u00eda y asistencia, en caso de ser necesario. Si eres un ciudadano hondure\u00f1o viviendo\n[\nLeer m\u00e1s >>\n](https://laredhispana.org/informate/encuentra-tu-consulado-de-honduras-en-estados-unidos)\nPor Alejandro Ochoa para La Red Hispana El crecimiento personal se refiere al continuo desarrollo y mejora de uno mismo en varios niveles: f\u00edsico, mental, emocional y\n[\nLeer m\u00e1s >>\n](https://laredhispana.org/lifestyle/bienestar/que-es-el-crecimiento-personal-y-como-liberar-nuestro-verdadero-potencial)\nPor Alejandro Ochoa para La Red Hispana Cuando se trata de la cocina latinoamericana, no se puede pasar por alto el ic\u00f3nico plato conocido como la arepa.\n[\nLeer m\u00e1s >>\n](https://laredhispana.org/informate/nuestra-comunidad/la-batalla-de-las-arepas-colombiana-o-venezolana)\nPor Alejandro Ochoa para La Red Hispana El caf\u00e9 se ha convertido en un compa\u00f1ero indispensable para los amantes del cine de todo el mundo. El caf\u00e9 y\n[\nLeer m\u00e1s >>\n](https://laredhispana.org/lifestyle/el-cafe-y-el-cine-dos-companeros-inseparables)\nLa deportaci\u00f3n es un tema que genera preocupaci\u00f3n y estr\u00e9s en aquellos que enfrentan esta situaci\u00f3n. Ya sea que est\u00e9s directamente involucrado o tengas un ser querido\n[\nLeer m\u00e1s >>\n](https://laredhispana.org/inmigracion/como-saber-si-tengo-una-orden-de-deportacion-y-si-puedo-quitarla)\nEl asilo pol\u00edtico en Estados Unidos ha sido durante mucho tiempo un recurso utilizado por individuos que huyen de la persecuci\u00f3n en sus pa\u00edses de origen debido\n[\nLeer m\u00e1s >>\n](https://laredhispana.org/inmigracion/ventajas-y-desventajas-del-asilo-politico-en-estados-unidos)\nA diferencia de otros pa\u00edses, la licencia de conducir en los Estados Unidos no se la considera una identificaci\u00f3n emitida a nivel nacional, es decir que cada\n[\nLeer m\u00e1s >>\n](https://laredhispana.org/inmigracion/recursos/requisitos-para-sacar-licencia-de-conducir-en-estados-unidos)\nPor: Maria Luisa Rossel de National Wildlife Federation La creaci\u00f3n del Monumento Nacional Baaj Nwaavjo I'tah Kukveni - Huellas Ancestrales del Gran Ca\u00f1\u00f3n, de casi 1 mill\u00f3n de acres, proteger\u00e1\n[\nLeer m\u00e1s >>\n](https://laredhispana.org/planeta/vida-verde/el-monumento-nacional-del-gran-canon-protegera-a-las-comunidades-indigenas-la-vida-silvestre-los-suministros-de-agua-y-la-recreacion)\nby PGN Staff, Public Good News August 1, 2023 Read in EnglishPaxlovid, el antiviral aprobado por la FDA que ha demostrado reducir la hospitalizaci\u00f3n y la muerte\n[\nLeer m\u00e1s >>\n](https://laredhispana.org/salud/covid-19/las-comunidades-de-color-no-tienen-acceso-equitativo-a-paxlovid)\n\u00a1Saludos, amigos del buen sabor y la vida saludable! Hoy vamos a hablar de algo que a todos nos encanta, pero que a veces nos pasamos de\n[\nLeer m\u00e1s >>\n](https://laredhispana.org/salud/vida-saludable/prestale-atencion-a-los-sintomas-del-exceso-de-sal-en-el-cuerpo)\nAlguna vez te has preguntado, \u00bfcu\u00e1ntos latinos hay en Estados Unidos? Seg\u00fan la Oficina de Censo de Estados Unidos y el Censo del 2020, de los m\u00e1s\n[\nLeer m\u00e1s >>\n](https://laredhispana.org/informate/nuestra-comunidad/latinos-en-estados-unidos-las-10-ciudades-en-las-que-viven-mas-hispanos)\nEl examen del GED sirve como equivalencia del t\u00edtulo de la escuela secundaria, y eval\u00faa el conocimiento y las habilidades que son esenciales en la preparaci\u00f3n para\n[\nLeer m\u00e1s >>\n](https://laredhispana.org/informate/educacion/preparate-con-las-clases-de-ged-en-espanol-gratis)\nUna receta original de Piloncillo & Vainilla En M\u00e9xico se utiliza el mango para todo. Es com\u00fan ver el mango en diferentes recetas, como ensalada, ceviche, paletas, guacamole\n[\nLeer m\u00e1s >>\n](https://laredhispana.org/familia/recetas/agua-fresca-de-mango-para-el-verano)\nEl GED (General Education Development, por sus siglas en ingl\u00e9s) es una prueba de equivalencia de escuela secundaria high school. Es para personas que no pudieron terminar\n[\nLeer m\u00e1s >>\n](https://laredhispana.org/informate/educacion/ged-que-es-puedo-hacer-el-examen-de-ged-en-espanol)\nLa comunicaci\u00f3n efectiva entre los padres y los maestros es fundamental para el \u00e9xito educativo de los ni\u00f1os. Sin embargo, para las familias hispanas en Estados Unidos\n[\nLeer m\u00e1s >>\n](https://laredhispana.org/informate/educacion/como-hablar-con-los-maestros-de-tus-hijos-si-no-sabes-ingles)\nEl regreso a clases en Estados Unidos puede ser un momento emocionante y desafiante tanto para los ni\u00f1os como para los padres. Despu\u00e9s de un largo verano\n[\nLeer m\u00e1s >>\n](https://laredhispana.org/familia/tips-de-crianza/10-tips-para-el-regreso-a-clases-consejos-para-padres)\nEstudiar en Estados Unidos es un sue\u00f1o que puedes cumplir gracias a la gran variedad de becas disponibles para estudiantes extranjeros. En este pa\u00eds hay un gran n\u00famero\n[\nLeer m\u00e1s >>\n](https://laredhispana.org/informate/becas-para-estudiar-en-estados-unidos)\nEl consumo frecuente de bebidas azucaradas puede tener un impacto perjudicial en nuestra salud de m\u00faltiples maneras. Estas bebidas, cargadas de az\u00facar a\u00f1adido, est\u00e1n vinculadas a un\n[\nLeer m\u00e1s >>\n](https://laredhispana.org/lifestyle/bienestar/consecuencias-de-las-bebidas-azucaradas-a-nuestro-organismo)\nEl puntaje de cr\u00e9dito (\"credit score\") en Estados Unidos se refiere a una calificaci\u00f3n num\u00e9rica que indica la solvencia crediticia de una persona. Este puntaje es utilizado\n[\nLeer m\u00e1s >>\n](https://laredhispana.org/informate/finanzas/guia-para-comprender-los-puntajes-de-credito-con-tabla-de-rangos-de-puntaje)\nAprender ingl\u00e9s siendo adulto en Estados Unidos es una meta alcanzable y tremendamente gratificante. Aunque los adultos pueden enfrentar desaf\u00edos \u00fanicos en el proceso de aprendizaje de\n[\nLeer m\u00e1s >>\n](https://laredhispana.org/informate/educacion/aprender-idiomas-siendo-adulto)\nMuchas personas viviendo en los Estados Unidos se preguntan cu\u00e1nto dinero deben ganar para comprar una casa. Y es que la cantidad de dinero que ganas al\n[\nLeer m\u00e1s >>\n](https://laredhispana.org/informate/finanzas/cuanto-debo-ganar-para-comprar-una-casa-en-usa)\nYa sea un incendio forestal o una tormenta que provoc\u00f3 un apag\u00f3n, aqu\u00ed hay algunos consejos sobre qu\u00e9 comer y c\u00f3mo garantizar la seguridad de tus alimentos.\n[\nLeer m\u00e1s >>\n](https://laredhispana.org/planeta/como-tu-y-tu-familia-se-pueden-alimentar-durante-un-apagon)\nEl emprendimiento y la determinaci\u00f3n pueden abrir muchas puertas y oportunidades. Si alguna vez has te has preguntado c\u00f3mo empezar un negocio con poco dinero en Estados\n[\nLeer m\u00e1s >>\n](https://laredhispana.org/informate/finanzas/como-empezar-un-negocio-con-poco-dinero)\nPor: Maria Luisa Rossel de National Wildlife Federation National Wildlife Federation y Sea Turtle Conservancy, han creado una nueva p\u00e1gina web para ayudar a la conservaci\u00f3n y protecci\u00f3n de las tortugas marinas en\n[\nLeer m\u00e1s >>\n](https://laredhispana.org/planeta/nueva-pagina-web-ayudara-a-la-proteccion-de-las-tortugas-marinas-en-florida)\nConstruir una vida crediticia en Estados Unidos es importante para tener acceso a pr\u00e9stamos, tarjetas de cr\u00e9dito y otros servicios financieros. Aqu\u00ed te contamos lo que puedes\n[\nLeer m\u00e1s >>\n](https://laredhispana.org/informate/finanzas/como-construir-credito-en-estados-unidos)\nPor: Maria Luisa Rossel de National Wildlife Federation La Agencia de Protecci\u00f3n Ambiental de Estados Unidos de Am\u00e9rica (EPA), present\u00f3 una propuesta para reducir las emisiones de di\u00f3xido\n[\nLeer m\u00e1s >>\n](https://laredhispana.org/planeta/epa-limitara-de-manera-responsable-las-emisiones-de-las-centrales-electricas)\nEl c\u00e1ncer de pulm\u00f3n es una enfermedad devastadora que puede afectar a personas de todas las edades y estilos de vida. A menudo, es silencioso en sus\n[\nLeer m\u00e1s >>\n](https://laredhispana.org/salud/8-sintomas-tempranos-del-cancer-de-pulmon)\nLas actividades extracurriculares son una excelente manera de enriquecer la vida de tu hijo y fomentar su desarrollo personal. Desde deportes hasta clases de arte y m\u00fasica,\n[\nLeer m\u00e1s >>\n](https://laredhispana.org/familia/tips-de-crianza/8-razones-por-la-que-deberas-anotar-a-tu-hijo-en-actividades-despus-de-la-escuela)\nUna receta original de Piloncillo & Vainilla Si te gusta celebrar el 5 de Mayo, puedes intentar preparar esta deliciosa receta. Este tipo de frijoles son super t\u00edpicos\n[\nLeer m\u00e1s >>\n](https://laredhispana.org/familia/frijoles-charros-para-celebrar-el-5-de-mayo)\nLa educaci\u00f3n es fundamental para el \u00e9xito y el progreso en la vida, pero muchas veces, los estudiantes hispanos e indocumentados enfrentan barreras financieras que les impiden\n[\nLeer m\u00e1s >>\n](https://laredhispana.org/informate/educacion/becas-estudiantiles-para-hispanos-e-indocumentados)\n[Hist\u00f3rico proyecto de ley proteger\u00e1 a miles de especies, comunidades y tradiciones que dependen de la vida silvestre](https://laredhispana.org/planeta/historico-proyecto-de-ley-protegera-a-miles-de-especies-en-eeuu)\nPor: Maria Luisa Rossel de National Wildlife Federation El proyecto de ley de recuperaci\u00f3n de la vida silvestre de Estados Unidos, Recovering America\u2019s Wildlife Act, presentado en\n[\nLeer m\u00e1s >>\n](https://laredhispana.org/planeta/historico-proyecto-de-ley-protegera-a-miles-de-especies-en-eeuu)\nLa ansiedad y el estr\u00e9s son problemas de salud mental que afectan a millones de personas en todo el mundo. A menudo, se requiere tratamiento profesional para\n[\nLeer m\u00e1s >>\n](https://laredhispana.org/salud/salud-mental/las-mascotas-ayudan-a-reducir-la-ansiedad-y-el-estres)\nLa caminata resulta uno de los ejercicios m\u00e1s efectivos, no \u00fanicamente para bajar de peso sino tambi\u00e9n para ayudarle al organismo a mantener los valores de colesterol\n[\nLeer m\u00e1s >>\n](https://laredhispana.org/lifestyle/bienestar/cuanto-necesito-caminar-para-bajar-de-peso-salud)\nCombinando ingredientes naturales con propiedades antibacterianas y astringentes puedes elaborar interesantes productos de limpieza org\u00e1nicos para llevar a cabo las tareas de aseo de tu hogar. Ver\n[\nLeer m\u00e1s >>\n](https://laredhispana.org/lifestyle/hogar/como-hacer-productos-de-limpieza-organicos)\nSi a\u00fan no conoces los beneficios del ajo este art\u00edculo es para ti. El ajo es uno de los ingredientes m\u00e1s utilizados en la cocina y ha\n[\nLeer m\u00e1s >>\n](https://laredhispana.org/lifestyle/bienestar/conoce-5-beneficios-del-ajo-en-tu-salud)\nA medida que los precios de la educaci\u00f3n superior aparecen en aumento, muchos padres se encuentran enfrentando la dif\u00edcil pregunta de c\u00f3mo financiar la universidad de sus\n[\nLeer m\u00e1s >>\n](https://laredhispana.org/informate/educacion/pagar-college)\nDistinguir a un ni\u00f1o inquieto e impulsivo de otro que realmente padece este trastorno no siempre resulta f\u00e1cil, y existen s\u00edntomas de hiperactividad diferentes dependiendo de si\n[\nLeer m\u00e1s >>\n](https://laredhispana.org/salud/salud-mental/cmo-ayudar-a-los-nios-con-hiperactividad-y-qu-debemos-saber-acerca-de-este-trastorno)\nCultivar papa y lechuga en casa puede tener muchos beneficios tanto para la salud como para el medio ambiente. Uno de los beneficios m\u00e1s notables es la\n[\nLeer m\u00e1s >>\n](https://laredhispana.org/planeta/vida-verde/cmo-cultivar-papas-y-lechuga)\nArmar tu propia huerta en casa es mucho m\u00e1s sencillo de lo que imaginas, adem\u00e1s es econ\u00f3micamente viable, te devuelve r\u00e1pidamente el tiempo y el dinero invertido,\n[\nLeer m\u00e1s >>\n](https://laredhispana.org/planeta/vida-verde/consejos-para-hacer-tu-propia-huerta-en-casa)\nEl 10 de Marzo es el D\u00eda Nacional de Concientizaci\u00f3n sobre el VIH y el SIDA en Mujeres y Ni\u00f1as (NWGHAAD, por sus siglas en ingl\u00e9s). Y aunque\n[\nLeer m\u00e1s >>\n](https://laredhispana.org/salud/el-vih-sida-en-las-mujeres-y-nias-latinas)", "language": null, "image": "https://secure.gravatar.com/avatar/16dd917ef4ad7789cb84cce186468272?s=500&d=mm&r=g", "pagetype": "profile", "links": ["https://laredhispana.org/", "https://laredhispana.org/familia", "https://laredhispana.org/familia/tips-de-crianza", "https://laredhispana.org/familia/recetas", "https://laredhispana.org/informate", "https://laredhispana.org/informate/educacion", "https://laredhispana.org/informate/politica", "https://laredhispana.org/informate/nuestra-comunidad", "https://laredhispana.org/informate/finanzas", "https://laredhispana.org/inmigracion", "https://laredhispana.org/inmigracion/bienvenidos-a-america", "https://laredhispana.org/inmigracion/recursos", "https://laredhispana.org/lifestyle", "https://laredhispana.org/lifestyle/bienestar", "https://laredhispana.org/lifestyle/tecnologia", "https://laredhispana.org/lifestyle/tendencias", "https://laredhispana.org/lifestyle/hogar", "https://laredhispana.org/planeta", "https://laredhispana.org/planeta/cambio-climatico", "https://laredhispana.org/planeta/agricultura", "https://laredhispana.org/planeta/vida-verde", "https://laredhispana.org/salud", "https://laredhispana.org/salud/salud-mental", "https://laredhispana.org/salud/vida-saludable", "https://laredhispana.org/", "https://laredhispana.org/", "https://laredhispana.org/", "https://laredhispana.org/familia", "https://laredhispana.org/familia/tips-de-crianza", "https://laredhispana.org/familia/recetas", "https://laredhispana.org/informate", "https://laredhispana.org/informate/educacion", "https://laredhispana.org/informate/politica", "https://laredhispana.org/informate/nuestra-comunidad", "https://laredhispana.org/informate/finanzas", "https://laredhispana.org/inmigracion", "https://laredhispana.org/inmigracion/bienvenidos-a-america", "https://laredhispana.org/inmigracion/recursos", "https://laredhispana.org/lifestyle", "https://laredhispana.org/lifestyle/bienestar", "https://laredhispana.org/lifestyle/tecnologia", "https://laredhispana.org/lifestyle/tendencias", "https://laredhispana.org/lifestyle/hogar", "https://laredhispana.org/planeta", "https://laredhispana.org/planeta/cambio-climatico", "https://laredhispana.org/planeta/agricultura", "https://laredhispana.org/planeta/vida-verde", "https://laredhispana.org/salud", "https://laredhispana.org/salud/salud-mental", "https://laredhispana.org/salud/vida-saludable", "https://laredhispana.org/salud/en-la-frontera-personal-de-salud-comunitaria-se-adapta-a-las-necesidades-de-solicitantes-de-asilo", "https://laredhispana.org/salud", "https://laredhispana.org/salud/en-la-frontera-personal-de-salud-comunitaria-se-adapta-a-las-necesidades-de-solicitantes-de-asilo", "https://laredhispana.org/author/laredhispanagmail-com", "https://laredhispana.org/salud/en-la-frontera-personal-de-salud-comunitaria-se-adapta-a-las-necesidades-de-solicitantes-de-asilo", "https://laredhispana.org/informate/nuestra-comunidad/estos-son-los-consulados-de-nicaragua-en-estados-unidos", "https://laredhispana.org/informate", "https://laredhispana.org/informate/nuestra-comunidad", "https://laredhispana.org/informate/nuestra-comunidad/estos-son-los-consulados-de-nicaragua-en-estados-unidos", "https://laredhispana.org/author/laredhispanagmail-com", "https://laredhispana.org/informate/nuestra-comunidad/estos-son-los-consulados-de-nicaragua-en-estados-unidos", "https://laredhispana.org/informate/finanzas/consecuencias-de-declararse-en-bancarrota-en-estados-unidos", "https://laredhispana.org/informate/finanzas", "https://laredhispana.org/informate/finanzas/consecuencias-de-declararse-en-bancarrota-en-estados-unidos", "https://laredhispana.org/author/laredhispanagmail-com", "https://laredhispana.org/informate/finanzas/consecuencias-de-declararse-en-bancarrota-en-estados-unidos", "https://laredhispana.org/inmigracion/conoce-los-dos-tipos-de-asilo-en-estados-unidos", "https://laredhispana.org/inmigracion", "https://laredhispana.org/inmigracion/conoce-los-dos-tipos-de-asilo-en-estados-unidos", "https://laredhispana.org/author/laredhispanagmail-com", "https://laredhispana.org/inmigracion/conoce-los-dos-tipos-de-asilo-en-estados-unidos", "https://laredhispana.org/planeta/preparate-para-huracan", "https://laredhispana.org/planeta", "https://laredhispana.org/planeta/preparate-para-huracan", "https://laredhispana.org/author/laredhispanagmail-com", "https://laredhispana.org/planeta/preparate-para-huracan", "https://laredhispana.org/informate/nuestra-comunidad/10-motivos-para-sentirnos-orgullosos-este-mes-de-la-herencia-hispana", "https://laredhispana.org/destacados", "https://laredhispana.org/informate/nuestra-comunidad", "https://laredhispana.org/informate/nuestra-comunidad/10-motivos-para-sentirnos-orgullosos-este-mes-de-la-herencia-hispana", "https://laredhispana.org/author/laredhispanagmail-com", "https://laredhispana.org/informate/nuestra-comunidad/10-motivos-para-sentirnos-orgullosos-este-mes-de-la-herencia-hispana", "https://laredhispana.org/familia/tips-de-crianza/como-brindar-apoyo-efectivo-a-madres-con-depresion-posparto", "https://laredhispana.org/salud/salud-mental", "https://laredhispana.org/familia/tips-de-crianza", "https://laredhispana.org/familia/tips-de-crianza/como-brindar-apoyo-efectivo-a-madres-con-depresion-posparto", "https://laredhispana.org/author/laredhispanagmail-com", "https://laredhispana.org/familia/tips-de-crianza/como-brindar-apoyo-efectivo-a-madres-con-depresion-posparto", "https://laredhispana.org/salud/pastillas-para-el-dolor-de-estomago", "https://laredhispana.org/lifestyle/bienestar", "https://laredhispana.org/salud", "https://laredhispana.org/salud/pastillas-para-el-dolor-de-estomago", "https://laredhispana.org/author/laredhispanagmail-com", "https://laredhispana.org/salud/pastillas-para-el-dolor-de-estomago", "https://laredhispana.org/informate/educacion/plan-de-ahorro-para-la-universidad", "https://laredhispana.org/informate/educacion", "https://laredhispana.org/informate/finanzas", "https://laredhispana.org/informate/educacion/plan-de-ahorro-para-la-universidad", "https://laredhispana.org/author/laredhispanagmail-com", "https://laredhispana.org/informate/educacion/plan-de-ahorro-para-la-universidad", "https://laredhispana.org/inmigracion/recursos/celebrando-los-heroes-escolares-que-ayudan-con-la-nutricion-infantil", "https://laredhispana.org/inmigracion/recursos", "https://laredhispana.org/inmigracion/recursos/celebrando-los-heroes-escolares-que-ayudan-con-la-nutricion-infantil", "https://laredhispana.org/author/laredhispanagmail-com", "https://laredhispana.org/inmigracion/recursos/celebrando-los-heroes-escolares-que-ayudan-con-la-nutricion-infantil", "https://laredhispana.org/informate/encuentra-tu-consulado-de-honduras-en-estados-unidos", "https://laredhispana.org/informate", "https://laredhispana.org/informate/nuestra-comunidad", "https://laredhispana.org/informate/encuentra-tu-consulado-de-honduras-en-estados-unidos", "https://laredhispana.org/author/laredhispanagmail-com", "https://laredhispana.org/informate/encuentra-tu-consulado-de-honduras-en-estados-unidos", "https://laredhispana.org/lifestyle/bienestar/que-es-el-crecimiento-personal-y-como-liberar-nuestro-verdadero-potencial", "https://laredhispana.org/lifestyle/bienestar", "https://laredhispana.org/destacados", "https://laredhispana.org/salud/salud-mental", "https://laredhispana.org/lifestyle/bienestar/que-es-el-crecimiento-personal-y-como-liberar-nuestro-verdadero-potencial", "https://laredhispana.org/author/laredhispanagmail-com", "https://laredhispana.org/lifestyle/bienestar/que-es-el-crecimiento-personal-y-como-liberar-nuestro-verdadero-potencial", "https://laredhispana.org/informate/nuestra-comunidad/la-batalla-de-las-arepas-colombiana-o-venezolana", "https://laredhispana.org/informate/nuestra-comunidad", "https://laredhispana.org/lifestyle/tendencias", "https://laredhispana.org/informate/nuestra-comunidad/la-batalla-de-las-arepas-colombiana-o-venezolana", "https://laredhispana.org/author/laredhispanagmail-com", "https://laredhispana.org/informate/nuestra-comunidad/la-batalla-de-las-arepas-colombiana-o-venezolana", "https://laredhispana.org/lifestyle/el-cafe-y-el-cine-dos-companeros-inseparables", "https://laredhispana.org/lifestyle/bienestar", "https://laredhispana.org/lifestyle", "https://laredhispana.org/lifestyle/el-cafe-y-el-cine-dos-companeros-inseparables", "https://laredhispana.org/author/laredhispanagmail-com", "https://laredhispana.org/lifestyle/el-cafe-y-el-cine-dos-companeros-inseparables", "https://laredhispana.org/inmigracion/como-saber-si-tengo-una-orden-de-deportacion-y-si-puedo-quitarla", "https://laredhispana.org/inmigracion", "https://laredhispana.org/inmigracion/recursos", "https://laredhispana.org/inmigracion/como-saber-si-tengo-una-orden-de-deportacion-y-si-puedo-quitarla", "https://laredhispana.org/author/laredhispanagmail-com", "https://laredhispana.org/inmigracion/como-saber-si-tengo-una-orden-de-deportacion-y-si-puedo-quitarla", "https://laredhispana.org/inmigracion/ventajas-y-desventajas-del-asilo-politico-en-estados-unidos", "https://laredhispana.org/inmigracion", "https://laredhispana.org/inmigracion/recursos", "https://laredhispana.org/inmigracion/ventajas-y-desventajas-del-asilo-politico-en-estados-unidos", "https://laredhispana.org/author/laredhispanagmail-com", "https://laredhispana.org/inmigracion/ventajas-y-desventajas-del-asilo-politico-en-estados-unidos", "https://laredhispana.org/inmigracion/recursos/requisitos-para-sacar-licencia-de-conducir-en-estados-unidos", "https://laredhispana.org/inmigracion/recursos", "https://laredhispana.org/inmigracion/recursos/requisitos-para-sacar-licencia-de-conducir-en-estados-unidos", "https://laredhispana.org/author/laredhispanagmail-com", "https://laredhispana.org/inmigracion/recursos/requisitos-para-sacar-licencia-de-conducir-en-estados-unidos", "https://laredhispana.org/planeta/vida-verde/el-monumento-nacional-del-gran-canon-protegera-a-las-comunidades-indigenas-la-vida-silvestre-los-suministros-de-agua-y-la-recreacion", "https://laredhispana.org/planeta", "https://laredhispana.org/planeta/vida-verde", "https://laredhispana.org/planeta/vida-verde/el-monumento-nacional-del-gran-canon-protegera-a-las-comunidades-indigenas-la-vida-silvestre-los-suministros-de-agua-y-la-recreacion", "https://laredhispana.org/author/laredhispanagmail-com", "https://laredhispana.org/planeta/vida-verde/el-monumento-nacional-del-gran-canon-protegera-a-las-comunidades-indigenas-la-vida-silvestre-los-suministros-de-agua-y-la-recreacion", "https://laredhispana.org/salud/covid-19/las-comunidades-de-color-no-tienen-acceso-equitativo-a-paxlovid", "https://laredhispana.org/salud/covid-19", "https://laredhispana.org/salud", "https://laredhispana.org/salud/covid-19/las-comunidades-de-color-no-tienen-acceso-equitativo-a-paxlovid", "https://laredhispana.org/author/laredhispanagmail-com", "https://laredhispana.org/salud/covid-19/las-comunidades-de-color-no-tienen-acceso-equitativo-a-paxlovid", "https://laredhispana.org/salud/vida-saludable/prestale-atencion-a-los-sintomas-del-exceso-de-sal-en-el-cuerpo", "https://laredhispana.org/salud/vida-saludable", "https://laredhispana.org/salud/vida-saludable/prestale-atencion-a-los-sintomas-del-exceso-de-sal-en-el-cuerpo", "https://laredhispana.org/author/laredhispanagmail-com", "https://laredhispana.org/salud/vida-saludable/prestale-atencion-a-los-sintomas-del-exceso-de-sal-en-el-cuerpo", "https://laredhispana.org/informate/nuestra-comunidad/latinos-en-estados-unidos-las-10-ciudades-en-las-que-viven-mas-hispanos", "https://laredhispana.org/informate/nuestra-comunidad", "https://laredhispana.org/informate/nuestra-comunidad/latinos-en-estados-unidos-las-10-ciudades-en-las-que-viven-mas-hispanos", "https://laredhispana.org/author/laredhispanagmail-com", "https://laredhispana.org/informate/nuestra-comunidad/latinos-en-estados-unidos-las-10-ciudades-en-las-que-viven-mas-hispanos", "https://laredhispana.org/informate/educacion/preparate-con-las-clases-de-ged-en-espanol-gratis", "https://laredhispana.org/informate/educacion", "https://laredhispana.org/informate/educacion/preparate-con-las-clases-de-ged-en-espanol-gratis", "https://laredhispana.org/author/laredhispanagmail-com", "https://laredhispana.org/informate/educacion/preparate-con-las-clases-de-ged-en-espanol-gratis", "https://laredhispana.org/familia/recetas/agua-fresca-de-mango-para-el-verano", "https://laredhispana.org/familia/recetas", "https://laredhispana.org/familia/recetas/agua-fresca-de-mango-para-el-verano", "https://laredhispana.org/author/laredhispanagmail-com", "https://laredhispana.org/familia/recetas/agua-fresca-de-mango-para-el-verano", "https://laredhispana.org/informate/educacion/ged-que-es-puedo-hacer-el-examen-de-ged-en-espanol", "https://laredhispana.org/destacados", "https://laredhispana.org/informate/educacion", "https://laredhispana.org/informate/educacion/ged-que-es-puedo-hacer-el-examen-de-ged-en-espanol", "https://laredhispana.org/author/laredhispanagmail-com", "https://laredhispana.org/informate/educacion/ged-que-es-puedo-hacer-el-examen-de-ged-en-espanol", "https://laredhispana.org/informate/educacion/como-hablar-con-los-maestros-de-tus-hijos-si-no-sabes-ingles", "https://laredhispana.org/informate/educacion", "https://laredhispana.org/familia/tips-de-crianza", "https://laredhispana.org/informate/educacion/como-hablar-con-los-maestros-de-tus-hijos-si-no-sabes-ingles", "https://laredhispana.org/author/laredhispanagmail-com", "https://laredhispana.org/informate/educacion/como-hablar-con-los-maestros-de-tus-hijos-si-no-sabes-ingles", "https://laredhispana.org/familia/tips-de-crianza/10-tips-para-el-regreso-a-clases-consejos-para-padres", "https://laredhispana.org/informate/educacion", "https://laredhispana.org/familia/tips-de-crianza", "https://laredhispana.org/familia/tips-de-crianza/10-tips-para-el-regreso-a-clases-consejos-para-padres", "https://laredhispana.org/author/laredhispanagmail-com", "https://laredhispana.org/familia/tips-de-crianza/10-tips-para-el-regreso-a-clases-consejos-para-padres", "https://laredhispana.org/informate/becas-para-estudiar-en-estados-unidos", "https://laredhispana.org/informate/educacion", "https://laredhispana.org/informate", "https://laredhispana.org/informate/becas-para-estudiar-en-estados-unidos", "https://laredhispana.org/author/laredhispanagmail-com", "https://laredhispana.org/informate/becas-para-estudiar-en-estados-unidos", "https://laredhispana.org/lifestyle/bienestar/consecuencias-de-las-bebidas-azucaradas-a-nuestro-organismo", "https://laredhispana.org/lifestyle/bienestar", "https://laredhispana.org/salud/vida-saludable", "https://laredhispana.org/lifestyle/bienestar/consecuencias-de-las-bebidas-azucaradas-a-nuestro-organismo", "https://laredhispana.org/author/laredhispanagmail-com", "https://laredhispana.org/lifestyle/bienestar/consecuencias-de-las-bebidas-azucaradas-a-nuestro-organismo", "https://laredhispana.org/informate/finanzas/guia-para-comprender-los-puntajes-de-credito-con-tabla-de-rangos-de-puntaje", "https://laredhispana.org/informate/finanzas", "https://laredhispana.org/informate/finanzas/guia-para-comprender-los-puntajes-de-credito-con-tabla-de-rangos-de-puntaje", "https://laredhispana.org/author/laredhispanagmail-com", "https://laredhispana.org/informate/finanzas/guia-para-comprender-los-puntajes-de-credito-con-tabla-de-rangos-de-puntaje", "https://laredhispana.org/informate/educacion/aprender-idiomas-siendo-adulto", "https://laredhispana.org/informate/educacion", "https://laredhispana.org/informate/educacion/aprender-idiomas-siendo-adulto", "https://laredhispana.org/author/laredhispanagmail-com", "https://laredhispana.org/informate/educacion/aprender-idiomas-siendo-adulto", "https://laredhispana.org/informate/finanzas/cuanto-debo-ganar-para-comprar-una-casa-en-usa", "https://laredhispana.org/informate/finanzas", "https://laredhispana.org/informate/finanzas/cuanto-debo-ganar-para-comprar-una-casa-en-usa", "https://laredhispana.org/author/laredhispanagmail-com", "https://laredhispana.org/informate/finanzas/cuanto-debo-ganar-para-comprar-una-casa-en-usa", "https://laredhispana.org/planeta/como-tu-y-tu-familia-se-pueden-alimentar-durante-un-apagon", "https://laredhispana.org/planeta", "https://laredhispana.org/planeta/como-tu-y-tu-familia-se-pueden-alimentar-durante-un-apagon", "https://laredhispana.org/author/laredhispanagmail-com", "https://laredhispana.org/planeta/como-tu-y-tu-familia-se-pueden-alimentar-durante-un-apagon", "https://laredhispana.org/informate/finanzas/como-empezar-un-negocio-con-poco-dinero", "https://laredhispana.org/informate/finanzas", "https://laredhispana.org/informate/finanzas/como-empezar-un-negocio-con-poco-dinero", "https://laredhispana.org/author/laredhispanagmail-com", "https://laredhispana.org/informate/finanzas/como-empezar-un-negocio-con-poco-dinero", "https://laredhispana.org/planeta/nueva-pagina-web-ayudara-a-la-proteccion-de-las-tortugas-marinas-en-florida", "https://laredhispana.org/planeta", "https://laredhispana.org/planeta/vida-verde", "https://laredhispana.org/planeta/nueva-pagina-web-ayudara-a-la-proteccion-de-las-tortugas-marinas-en-florida", "https://laredhispana.org/author/laredhispanagmail-com", "https://laredhispana.org/planeta/nueva-pagina-web-ayudara-a-la-proteccion-de-las-tortugas-marinas-en-florida", "https://laredhispana.org/informate/finanzas/como-construir-credito-en-estados-unidos", "https://laredhispana.org/informate/finanzas", "https://laredhispana.org/informate/finanzas/como-construir-credito-en-estados-unidos", "https://laredhispana.org/author/laredhispanagmail-com", "https://laredhispana.org/informate/finanzas/como-construir-credito-en-estados-unidos", "https://laredhispana.org/planeta/epa-limitara-de-manera-responsable-las-emisiones-de-las-centrales-electricas", "https://laredhispana.org/planeta/cambio-climatico", "https://laredhispana.org/planeta", "https://laredhispana.org/planeta/epa-limitara-de-manera-responsable-las-emisiones-de-las-centrales-electricas", "https://laredhispana.org/author/laredhispanagmail-com", "https://laredhispana.org/planeta/epa-limitara-de-manera-responsable-las-emisiones-de-las-centrales-electricas", "https://laredhispana.org/salud/8-sintomas-tempranos-del-cancer-de-pulmon", "https://laredhispana.org/salud", "https://laredhispana.org/salud/8-sintomas-tempranos-del-cancer-de-pulmon", "https://laredhispana.org/author/laredhispanagmail-com", "https://laredhispana.org/salud/8-sintomas-tempranos-del-cancer-de-pulmon", "https://laredhispana.org/familia/tips-de-crianza/8-razones-por-la-que-deberas-anotar-a-tu-hijo-en-actividades-despus-de-la-escuela", "https://laredhispana.org/informate/educacion", "https://laredhispana.org/familia/tips-de-crianza", "https://laredhispana.org/familia/tips-de-crianza/8-razones-por-la-que-deberas-anotar-a-tu-hijo-en-actividades-despus-de-la-escuela", "https://laredhispana.org/author/laredhispanagmail-com", "https://laredhispana.org/familia/tips-de-crianza/8-razones-por-la-que-deberas-anotar-a-tu-hijo-en-actividades-despus-de-la-escuela", "https://laredhispana.org/familia/frijoles-charros-para-celebrar-el-5-de-mayo", "https://laredhispana.org/familia", "https://laredhispana.org/familia/recetas", "https://laredhispana.org/familia/frijoles-charros-para-celebrar-el-5-de-mayo", "https://laredhispana.org/author/laredhispanagmail-com", "https://laredhispana.org/familia/frijoles-charros-para-celebrar-el-5-de-mayo", "https://laredhispana.org/informate/educacion/becas-estudiantiles-para-hispanos-e-indocumentados", "https://laredhispana.org/destacados", "https://laredhispana.org/informate/educacion", "https://laredhispana.org/informate/educacion/becas-estudiantiles-para-hispanos-e-indocumentados", "https://laredhispana.org/author/laredhispanagmail-com", "https://laredhispana.org/informate/educacion/becas-estudiantiles-para-hispanos-e-indocumentados", "https://laredhispana.org/planeta/historico-proyecto-de-ley-protegera-a-miles-de-especies-en-eeuu", "https://laredhispana.org/planeta", "https://laredhispana.org/planeta/vida-verde", "https://laredhispana.org/planeta/historico-proyecto-de-ley-protegera-a-miles-de-especies-en-eeuu", "https://laredhispana.org/author/laredhispanagmail-com", "https://laredhispana.org/planeta/historico-proyecto-de-ley-protegera-a-miles-de-especies-en-eeuu", "https://laredhispana.org/salud/salud-mental/las-mascotas-ayudan-a-reducir-la-ansiedad-y-el-estres", "https://laredhispana.org/lifestyle/bienestar", "https://laredhispana.org/salud/salud-mental", "https://laredhispana.org/salud/salud-mental/las-mascotas-ayudan-a-reducir-la-ansiedad-y-el-estres", "https://laredhispana.org/author/laredhispanagmail-com", "https://laredhispana.org/salud/salud-mental/las-mascotas-ayudan-a-reducir-la-ansiedad-y-el-estres", "https://laredhispana.org/lifestyle/bienestar/cuanto-necesito-caminar-para-bajar-de-peso-salud", "https://laredhispana.org/lifestyle/bienestar", "https://laredhispana.org/salud/vida-saludable", "https://laredhispana.org/lifestyle/bienestar/cuanto-necesito-caminar-para-bajar-de-peso-salud", "https://laredhispana.org/author/laredhispanagmail-com", "https://laredhispana.org/lifestyle/bienestar/cuanto-necesito-caminar-para-bajar-de-peso-salud", "https://laredhispana.org/lifestyle/hogar/como-hacer-productos-de-limpieza-organicos", "https://laredhispana.org/lifestyle/hogar", "https://laredhispana.org/planeta/vida-verde", "https://laredhispana.org/lifestyle/hogar/como-hacer-productos-de-limpieza-organicos", "https://laredhispana.org/author/laredhispanagmail-com", "https://laredhispana.org/lifestyle/hogar/como-hacer-productos-de-limpieza-organicos", "https://laredhispana.org/lifestyle/bienestar/conoce-5-beneficios-del-ajo-en-tu-salud", "https://laredhispana.org/lifestyle/bienestar", "https://laredhispana.org/lifestyle/bienestar/conoce-5-beneficios-del-ajo-en-tu-salud", "https://laredhispana.org/author/laredhispanagmail-com", "https://laredhispana.org/lifestyle/bienestar/conoce-5-beneficios-del-ajo-en-tu-salud", "https://laredhispana.org/informate/educacion/pagar-college", "https://laredhispana.org/informate/educacion", "https://laredhispana.org/informate/educacion/pagar-college", "https://laredhispana.org/author/laredhispanagmail-com", "https://laredhispana.org/informate/educacion/pagar-college", "https://laredhispana.org/salud/salud-mental/cmo-ayudar-a-los-nios-con-hiperactividad-y-qu-debemos-saber-acerca-de-este-trastorno", "https://laredhispana.org/salud/salud-mental", "https://laredhispana.org/salud/salud-mental/cmo-ayudar-a-los-nios-con-hiperactividad-y-qu-debemos-saber-acerca-de-este-trastorno", "https://laredhispana.org/author/laredhispanagmail-com", "https://laredhispana.org/salud/salud-mental/cmo-ayudar-a-los-nios-con-hiperactividad-y-qu-debemos-saber-acerca-de-este-trastorno", "https://laredhispana.org/planeta/vida-verde/cmo-cultivar-papas-y-lechuga", "https://laredhispana.org/lifestyle/hogar", "https://laredhispana.org/planeta/vida-verde", "https://laredhispana.org/planeta/vida-verde/cmo-cultivar-papas-y-lechuga", "https://laredhispana.org/author/laredhispanagmail-com", "https://laredhispana.org/planeta/vida-verde/cmo-cultivar-papas-y-lechuga", "https://laredhispana.org/planeta/vida-verde/consejos-para-hacer-tu-propia-huerta-en-casa", "https://laredhispana.org/lifestyle/hogar", "https://laredhispana.org/planeta/vida-verde", "https://laredhispana.org/planeta/vida-verde/consejos-para-hacer-tu-propia-huerta-en-casa", "https://laredhispana.org/author/laredhispanagmail-com", "https://laredhispana.org/planeta/vida-verde/consejos-para-hacer-tu-propia-huerta-en-casa", "https://laredhispana.org/salud/el-vih-sida-en-las-mujeres-y-nias-latinas", "https://laredhispana.org/salud", "https://laredhispana.org/salud/el-vih-sida-en-las-mujeres-y-nias-latinas", "https://laredhispana.org/author/laredhispanagmail-com", "https://laredhispana.org/salud/el-vih-sida-en-las-mujeres-y-nias-latinas", "https://laredhispana.org/reproductor", "/our-mission", "https://www.facebook.com/LaRedHispana", "https://www.instagram.com/laredhispana/", "https://www.youtube.com/user/LaRedHispana?sub_confirmation=1", "https://www.tiktok.com/@laredhispana", "https://twitter.com/LaRedHispana", "https://laredhispana.org/salud/8-sintomas-tempranos-del-cancer-de-pulmon", "https://laredhispana.org/salud/8-sintomas-tempranos-del-cancer-de-pulmon", "https://laredhispana.org/salud/siete-maneras-de-tener-una-relacion-mas-saludable-con-el-estres", "https://laredhispana.org/salud/siete-maneras-de-tener-una-relacion-mas-saludable-con-el-estres", "https://laredhispana.org/salud/salud-mental/el-duelo-migratorio-un-desafio-emocional", "https://laredhispana.org/salud/salud-mental/el-duelo-migratorio-un-desafio-emocional", "https://laredhispana.org/inmigracion/cmo-solicitar-un-permiso-de-trabajo-en-estados-unidos", "https://laredhispana.org/inmigracion/cmo-solicitar-un-permiso-de-trabajo-en-estados-unidos", "https://laredhispana.org/", "https://www.facebook.com/LaRedHispana", "https://www.instagram.com/laredhispana/", "https://www.youtube.com/user/LaRedHispana?sub_confirmation=1", "https://www.tiktok.com/@laredhispana", "https://twitter.com/LaRedHispana", "/our-mission", "/contacto", "/privacy-policy", "#top"]}