{"title": "Ceremonia y retiro de ayahuasca - Efecto, DMT y receta", "author": "Sebastian Freidank", "url": "https://www.drinkguya.com/es/blogs/traditionelle-nutzung-von-guayusa/ayahuasca-zeremonie-retreat-wirkung-dmt-rezept", "hostname": "drinkguya.com", "description": "\u00bfQu\u00e9 es Ayahuasca y DMT? Descubra todo sobre la ceremonia de ayahuasca, retiro, liana, efecto, ingredientes, recetas y estatus legal.", "sitename": "Bio Guayusa Tee kaufen - Guayusa Tee bestellen online", "date": "2023-07-18", "id": null, "license": null, "body": null, "comments": "", "commentsbody": null, "raw_text": null, "text": "Sebastian Freidank - 18. July 23\nCeremonia y retiro de ayahuasca - Efecto, DMT y receta\nIntroducci\u00f3n\nLa ceremonia de la ayahuasca es una tradici\u00f3n de al menos 2.500 a\u00f1os, que fue creada por el pueblo ind\u00edgena de Am\u00e9rica del Sur. En comparaci\u00f3n con\n[Ceremonias de cacao](https://www.drinkguya.com/blogs/wachmacher-energy-drink/kakao-zeremonie-rezept-inhaltsstoffe-wirkung-kaufen) y [Ceremonias de guayusa](https://www.drinkguya.com/blogs/traditionelle-nutzung-von-guayusa/der-gebrauch-von-guayusa-tee-durch-die-ureinwohner) Por lo tanto, es comparativamente joven, lo que probablemente se deba a la complejidad de una receta de ayahuasca. Al preparar un t\u00e9 de ayahuasca, se necesitan al menos dos ingredientes, p. B. El tronco de una liana y las hojas de otra planta.\nEn este art\u00edculo, descubrir\u00e1 por qu\u00e9 la ayahuasca es un tema altamente complejo que puede esperar del efecto y una ceremonia o incluso un retiro de varios d\u00edas.\nContenido\n[\u00bfQu\u00e9 es la ayahuasca?](#Was%20ist%20Ayahuasca?)\n-\n[Ingredientes y efectos de ayahuasca](#Ayahuasca%20Inhaltsstoffe%20&%20Wirkung)\n-\n[Ceremonia de ayahuasca](#Ayahuasca%20Zeremonie)\n-\n[Ceremonia/retiro de Ayahuasca en Alemania](#Ayahuasca%20Zeremonie/Retreat%20in%20Deutschland) [\u00bfLegal?](#Legal?) [Buenas experiencias de una ceremonia de ayahuasca](#Gute%20Erfahrungen%20einer%20Ayahuasca%20Zeremonie)\n-\n[Ayahuasca condujo - malas experiencias](#yahuasca%20Gefahren%20%E2%80%93%20schlechte%20Erfahrungen) [Ayahuasca vs dmt](#Ayahuasca%20VS%20DMT)\n-\n[Recetas de ayahuasca](#Ayahuasca%20Rezepte)\n[Viaje de ayahuasca](#Ayahuasca%20Reise) [Conclusi\u00f3n](#Fazit)\n1. \u00bfQu\u00e9 es la ayahuasca?\nLa ayahuasca es una liana de la selva tropical sudamericana. Traducido del lenguaje de la Kichwa, el pueblo ind\u00edgena del Amazonas, dice tanto como \"ranks de alma\" o \"liana de esp\u00edritus\" porque la medicina promete un profundo viaje espiritual. Traducido exactamente, \"aya\" significa algo como la mente o los antepasados y \"huasca\" tanto como la vid o la cuerda. Los hallazgos de una ceremonia de la ceremonia de ayahuasca hecha de piedra fueron en aproximadamente 500 a. C. Chr. Fechado. La costumbre ha existido durante al menos 2.500 a\u00f1os.\nLa liana es utilizada por las tribus ind\u00edgenas del Amazonas para lograr un estado cambiado de conciencia en ceremonias rituales y retiros de ayahuasca de varios d\u00edas para curar enfermedades mentales y f\u00edsicas.\nLa ayahuasca ha sido utilizada para la curaci\u00f3n en la Amazon\u00eda de Am\u00e9rica del Sur por los lugare\u00f1os desde los primeros d\u00edas. La planta medicinal tambi\u00e9n recibe m\u00e1s y m\u00e1s atenci\u00f3n en nuestras latitudes.\nLa poci\u00f3n de los chamanes promete mucho, por lo que Ayahuasca se conoce cada vez m\u00e1s aqu\u00ed en Alemania. Est\u00e1 destinado a ampliar la conciencia, permitir viajar hacia el pasado y mirar hacia el futuro e incluso sanar enfermedades.\nEl ayahuasca-liane estar\u00e1 junto con\n[Dmt](https://www.medicalnewstoday.com/articles/306889#history)-Ta hojas a base de [Chakruna](https://en.wikipedia.org/wiki/Psychotria_viridis), cocinado a una planta. DMT es un ingrediente activo psicod\u00e9lico que se puede encontrar en la naturaleza, en muchas plantas y tambi\u00e9n en el cuerpo humano. DMT, si se absorbe por encima del est\u00f3mago, su efecto solo se desarrolla junto con otras sustancias vegetales que son [Inhibidor de MAO](https://de.wikipedia.org/wiki/Monoaminoxidase-Hemmer) son conocidos.\n2. Ingredientes y efectos de Ayahuasca\nPara cumplir con los efectos de la ayahuasca para hacer justicia, comenzamos con la descripci\u00f3n de los ingredientes m\u00e1s importantes y luego pasamos el cuerpo, la mente y la mente.\nCualquiera que haya experimentado una ceremonia de ayahuasca encontrar\u00e1 muchos de los efectos descritos y probablemente perder\u00e1 mucho, porque las experiencias individuales tienen lugar para cada participante, lo que no se puede describir.\nSi piensa en visitar un retiro de ayahuasca, puede usar mucha informaci\u00f3n de este art\u00edculo para ir bien preparado para el viaje.\nQuien siga nuestras contribuciones y posiblemente incluso en\n[Boletin informativo](https://www.drinkguya.com/pages/10-prozent-bei-deinem-guayusa-einkauf-sparen) est\u00e1 registrado, qui\u00e9n sabe que siempre arrojamos luz sobre el lado cient\u00edfico. Para nosotros, lo espiritual y cient\u00edfico no es una manera opuesta, porque ambos pueden beneficiarse el uno del otro.\nPor lo tanto, tambi\u00e9n observamos exactamente esta publicaci\u00f3n c\u00f3mo los informes y estudios oficiales sobre el tema de Ayahuasca son tan medicina y especialmente como una herramienta de terapia.\nM\u00e1s tarde entramos en las experiencias de los participantes individuales, que ser\u00e1n significativamente m\u00e1s espirituales.\n2.1. Ingredientes de ayahuasca\nSi se habla de ayahuasca, entonces la cerveza terminada es una especie de t\u00e9, de\n[al menos](https://www.ncbi.nlm.nih.gov/pmc/articles/PMC5509699/) significaba dos plantas. La liana [Banisteriopsis Caapi](https://en.wikipedia.org/wiki/Banisteriopsis_caapi), o simplemente llamado Caapi y Psicotria viridis, o Chakruna.\nCaapi contiene los siguientes ingredientes importantes para una receta de ayahuasca:\n- Armin\n- Armalina\n- Tetrahidroharmina\nLos tres son alcaloides que se calculanInhibidor de MAO (inhibidor de monoamino oxidasa) obras.\nChakruna, por otro lado, contiene el psicoactivoDMT (dimetiltriptamina).\nLos inhibidores de MAO en CAAPI son necesarios para que el DMT pueda aparecer oralmente en Chakruna. Estos evitan el\n[Oxidaci\u00f3n](https://en.wikipedia.org/wiki/Monoamine_oxidase), as\u00ed que destruye, de DMT en el est\u00f3mago.\n2.2. Efecto\nInhibidor de MAO\nSi solo consideramos los inhibidores de la monoamina oxidasa, ya tienen el suyo en numerosos estudios\n[eficacia](https://en.wikipedia.org/wiki/Monoamine_oxidase_inhibitor) Probado como un remedio para las siguientes im\u00e1genes cl\u00ednicas.\n- Ataque de p\u00e1nico\n- Agorafobia\n- Fobia social\n- Depresi\u00f3n at\u00edpica\n- Trastornos de ansiedad de varios tipos\n- bulimia\n- Trastorno de estr\u00e9s postraum\u00e1tico\n- Trastorno l\u00edmite de la personalidad\n- Trastorno obsesivo compulsivo\n- Depresi\u00f3n bipolar\nDmt\nDMT es un ingrediente activo natural en plantas, animales y humanos. Oralmente, sin embargo, el cuerpo simplemente desglosa sin efecto o contin\u00faa como amino\u00e1cido.\nDMT solo funciona por v\u00eda intravenosa o como inhalaci\u00f3n, con la administraci\u00f3n oral, tambi\u00e9n se debe tomar un inhibidor de MAO.\nEl \u00fanico efecto de DMT incluido\n- Un sentido cambiante del tiempo\n- Percepciones visuales, auditivas y h\u00e1pticas\n- Alucinaciones de formas geom\u00e9tricas\n- Percibir de diferentes seres que a menudo se describen como peque\u00f1os gnomos, elfos y personas peque\u00f1as que hablan en voces altas\nLa DMT est\u00e1 de acuerdo con el ingrediente activo alucin\u00f3geno en una ceremonia de ayahuasca. Strarly no hay Ayahuasca liane y para una receta de actuaci\u00f3n necesita al menos dos plantas que contengan DMT y una vez que los inhibidores de MAO como ingrediente activo.\nPor cierto, los cient\u00edficos identificaron DMT como uno de nuestro cerebro, de hecho, de hecho la gl\u00e1ndula fibrosa, produciendo tela. Atribuye un papel importante en la fase REM del sue\u00f1o.\nEfecto de ayahuasca en el cerebro\nLos ingredientes activos en ayahuasca, DMT y la \u03b2-carbolina del caapi ayahuasca liane (Harmin, Harmalin, Tetrahydroharmine), se promete un efecto de protecci\u00f3n nerviosa e incluso renovaci\u00f3n en nuestro cerebro.\nEl DMT en Ayahuasca activa z. B. La producci\u00f3n de la prote\u00edna SIG-1R, que nerviosa de la degeneraci\u00f3n en el cerebro al producir antioxidantes\n[prevenido](https://www.ncbi.nlm.nih.gov/pmc/articles/PMC5021697/). Las pruebas de laboratorio tambi\u00e9n encontraron un efecto protector de las c\u00e9lulas nerviosas, que sufrieron falta de ox\u00edgeno.\nHarimin act\u00faa en contra\n[antiinflamatorio](https://www.ncbi.nlm.nih.gov/pubmed/27918874) y positivo para eso [Memoria](https://www.ncbi.nlm.nih.gov/pubmed/28706205). Tambi\u00e9n fue posible apoyar el crecimiento de las c\u00e9lulas nerviosas al aumentar la producci\u00f3n de prote\u00ednas de apoyo. [establecido](https://www.ncbi.nlm.nih.gov/pubmed/27918874) convertirse en.\nAdem\u00e1s, un 70% aument\u00f3 el crecimiento de las c\u00e9lulas progenitoras de las cuales surgen c\u00e9lulas nerviosas posteriores en las pruebas de laboratorio\n[probado](https://www.ncbi.nlm.nih.gov/pmc/articles/PMC5144684/) convertirse en.\nEsta podr\u00eda ser una justificaci\u00f3n cient\u00edfica de por qu\u00e9 muchos participantes pueden experimentar eventos pasados nuevamente. El efecto de la ayahuasca podr\u00eda influir positivamente en la memoria del cerebro.\nEfecto de ayahuasca en la psique\nLa ayahuasca ha demostrado en varios estudios que puede aumentar significativamente la atenci\u00f3n plena y la aceptaci\u00f3n de los participantes. Ambos son aspectos que en psicolog\u00eda son componentes importantes para\n[Bien](https://www.ncbi.nlm.nih.gov/pmc/articles/PMC5869920/) ser visto. Otro estudio tambi\u00e9n confirma una mejora en el estado de \u00e1nimo y la capacidad con las emociones. [manejar](https://www.ncbi.nlm.nih.gov/pubmed/26612618).\nEn un estudio en los 57 participantes en una ceremonia de ayahuasca, todos informaron una enorme reducci\u00f3n en el estr\u00e9s, que hasta varias semanas despu\u00e9s de la ceremonia\n[interrumpido](https://www.ncbi.nlm.nih.gov/pubmed/26612618).\nLos efectos adicionales de la ayahuasca en nuestra psique son las propiedades positivas ya mencionadas en la depresi\u00f3n, los trastornos del estr\u00e9s postraum\u00e1tico, las adicciones y los cambios de humor. Una sola dosis de ayahuasca ya condujo a un claro en un estudio con 29 sujetos deprimidos cr\u00f3nicamente\n[mejora](https://www.ncbi.nlm.nih.gov/pubmed/29903051) Y visitar un retiro de ayahuasca tiene un estudio directo en otro estudio [alivio](https://www.ncbi.nlm.nih.gov/pubmed/29867608) que fue realizado por los sujetos.\nEl t\u00e9 de ayahuasca hecho de hojas y lianas tambi\u00e9n mostr\u00f3 su efecto positivo en los pacientes con coca\u00edna, alcohol y nicotina que depende de muchos a\u00f1os en numerosos estudios.\nSeg\u00fan la situaci\u00f3n actual del estudio, los efectos de la ayahuasca parecen tener un efecto positivo en la formaci\u00f3n de la nueva formaci\u00f3n y la protecci\u00f3n de las c\u00e9lulas nerviosas en el cerebro. Parece mejorar el estado de \u00e1nimo para mejorar la depresi\u00f3n y el control de las emociones y ayudar a los adictos a separarse de sus sustancias adictivas.\n3. Ceremonia de ayahuasca\nEl retiro de ayahuasca m\u00e1s aut\u00e9ntico con la preparaci\u00f3n de una receta de ayahuasca real solo se puede experimentar en pa\u00edses sudamericanos como Ecuador, Per\u00fa, Brasil y Costa Rica. Sin embargo, tambi\u00e9n hay proveedores ocasionales de ceremonias de Pseudohuasca en Alemania.\nExiste la posibilidad de participar en una sola ceremonia o visitar un retiro durante varios d\u00edas o semanas y conectarse varias veces con el efecto de Ayahuasca durante este tiempo.\n3.1. Secuencia\nEl curso de un retiro de Ayahuasca no siempre es el mismo, sino similar. Dependiendo de d\u00f3nde dependa de su ceremonia, ya sea en Ecuador, Per\u00fa, Colombia o incluso en Alemania, habr\u00e1 diferencias f\u00e1ciles de grandes. Sin embargo, siempre tendr\u00e1 un \"curandero\" a su lado. Es un cham\u00e1n, es decir, un sanador tradicional.\nEl retiro generalmente se inicia d\u00edas o semanas antes de la ceremonia real siguiendo una dieta especial. Debe prescindir de los productos animales, el az\u00facar, la sal y las cosas como el tabaco y el alcohol.\nPuede comenzar la ceremonia de la ayahuasca que el cham\u00e1n lo limpiar\u00e1 de las energ\u00edas malvadas usando humo. Esto generalmente sucede con la ayuda de\n[Mapacho](https://en.wikipedia.org/wiki/Nicotiana_rustica), el tabaco de la jungla. El humo no es inhalado por el cham\u00e1n, sino solo sopla.\nDespu\u00e9s de la primera limpieza, recibir\u00e1 el t\u00e9 de ayahuasca. Ahora puedes Z. B. retirarse a la meditaci\u00f3n. Sin embargo, es m\u00e1s probable que su sanador que lo acompa\u00f1a lo lleva a una experiencia de curaci\u00f3n a trav\u00e9s de cantos especiales.\nLas canciones se convierten\n[Icaros](https://en.wikipedia.org/wiki/Icaro) Nombrado y permitir que el cham\u00e1n se comunique con los esp\u00edritus necesarios para la curaci\u00f3n y, por lo tanto, controle la intensidad de la ceremonia. El efecto del t\u00e9 de ayahuasca hecho de liana y hojas comienza aproximadamente 30 a 60 minutos despu\u00e9s de beber y, dependiendo de la intensidad, dura de 2 a 6 horas.\nDesde el principio, pueden ocurrir v\u00f3mitos y diarrea. Esto se ve como una buena se\u00f1al y un proceso de limpieza m\u00e1s. Cuanto m\u00e1s intensamente hiciera la dieta de antemano, m\u00e1s bajos son estos procesos de limpieza probablemente.\nJungle Medicine lo lleva a otro mundo visionario. La cura que logra Ayahuasca es la comprensi\u00f3n de lo que ha sucedido en su vida actual y en el pasado. La ceremonia te permite enojarte para resolver la amargura y los miedos y convertirlo en aceptaci\u00f3n, alegr\u00eda y amor.\n3.2. Costos de una ceremonia de ayahuasca en Am\u00e9rica del Sur\nLa ceremonia de la ayahuasca ofrece variar enormemente y var\u00edan desde costos diarios entre \u20ac 100 a \u20ac 500.\nHay \"hoteles\" completos con todo incluido en los que puedes quedarte durante varias semanas para participar en muchas ceremonias. Pero tambi\u00e9n hay cursos de d\u00eda.\nPuede descubrir c\u00f3mo puede ahorrar costos para una ceremonia de ayahuasca en Am\u00e9rica del Sur sin tener que prescindir de la calidad.\n4. Ceremonia/retiro de ayahuasca en Alemania\nAdem\u00e1s del viaje a Sudam\u00e9rica, al que le daremos algunos consejos al final del art\u00edculo, tambi\u00e9n tiene la oportunidad de celebrar un retiro de ayahuasca en Alemania. Por lo general, son ceremonias de 1 d\u00eda con inhibidores de MAO comparables como el Caapi Liane utilizado en la ayahuasca real.\nDado que DMT es ilegal en Alemania, se usan inhibidores de la MAO conocidos, como las tijeras de estepa y se hirvieron en una concentraci\u00f3n particularmente alta para la receta de pseudo ayahuasca. Esto est\u00e1 destinado a activar el cuerpo de su propio DMT, que produce nuestra gl\u00e1ndula pineal.\n4.1. Retiro de Ayahuasca Berl\u00edn\nDebido a la prohibici\u00f3n de DMT en Alemania, tambi\u00e9n es dif\u00edcil encontrar una ceremonia de ayahuasca en Berl\u00edn. Pero si no aqu\u00ed, \u00bfd\u00f3nde? Podemos recomendar buscar grupos de Facebook y estar en Instagram para encontrar posibles reuniones.\nAseg\u00farate de que la receta de la ayahuasca no est\u00e9 preparada con plantas que contienen DMT para que no te hagas castigo en Alemania ...\n4.2. Costos de una ceremonia de ayahuasca en Alemania\nLos costos para un retiro de Ayahuasca o una sola ceremonia en Alemania no son significativamente m\u00e1s caros ni m\u00e1s baratos que en Am\u00e9rica del Sur. El rango de precios de \u20ac 100 a 500 por d\u00eda tambi\u00e9n est\u00e1 representado.\nLa mayor\u00eda de las veces, sin embargo, solo la ceremonia en s\u00ed, es decir, se incluye la preparaci\u00f3n de la receta de ayahuasca, y el acompa\u00f1amiento durante el tiempo de efectividad. La estad\u00eda debe pagarse adicionalmente, aunque en Am\u00e9rica del Sur, la estad\u00eda en el precio generalmente se incluye.\nAqu\u00ed surge la pregunta de si unas vacaciones y un retiro de ayahuasca completo pueden no ser una mejor combinaci\u00f3n y rentable para experimentar una ceremonia real en un entorno aut\u00e9ntico.\n5. \u00bfLegal?\nYa hemos mencionado que Ayahuasca o el ingrediente activo individual DMT es ilegal en Alemania. Sin embargo, las plantas que contienen DTM no son ilegales. Esto tampoco podr\u00eda aplicarse porque muchas especies de plantas contienen DMT, algunas m\u00e1s, algunas menos.\nLa preparaci\u00f3n de estas plantas, el consumo del t\u00e9 resultante o que tiene cristales DMT puros, fue prohibido por el estado.\nEn general, la situaci\u00f3n en Europa es en gran medida la misma. Con la excepci\u00f3n de Portugal, donde las drogas de todo tipo generalmente fueron despenalizadas por autoconsumo, no hemos encontrado un pa\u00eds que DMT o Ayahuasca declaran legal. Puede encontrar una visi\u00f3n general de los pa\u00edses en los que la ayahuasca es legal\n[aqu\u00ed](https://en.wikipedia.org/wiki/Legal_status_of_ayahuasca_by_country).\nPor cierto, el Ayahuasca Liane no tiene DMT. Haga que las tiendas conduzcan el Liane como un solo producto, pero no se puede hacer nada.\n6. Buenas experiencias de una ceremonia de ayahuasca\nEl\n[buenas experiencias](https://cdn.shopify.com/s/files/1/0012/1952/6721/files/87536891-Ayahuasca-and-Visionary-Art-Retreat-2012.pdf?v=1679494923)que lo describiremos que venga de los participantes de retiro y ceremonia de Am\u00e9rica del Sur. Creemos que estas son las experiencias m\u00e1s aut\u00e9nticas porque se cansan tanto geogr\u00e1ficamente como humanamente en el origen de la ayahuasca.\n\u201ePude aprender de los otros participantes tanto como de las ceremonias mismas, solo escuchando sus experiencias de vida personal.\u201c\n\u201eIncluso semanas despu\u00e9s, todav\u00eda aprendo y aprendo cosas nuevas de la experiencia.\u201c\n\u201eUna comprensi\u00f3n profunda de m\u00ed mismo y c\u00f3mo funciona mi mente y me mantiene en el caos todos los d\u00edas.\u201c\n\u201eAyahuasca me llev\u00f3 a un viaje fant\u00e1stico hacia m\u00ed mismo. El Amazon me mostr\u00f3 mucho, extra\u00f1o los impresionantes ruidos de la selva tropical.\u201c\n\u201eRuidos m\u00e1gicos de la jungla.\u201c\n\u201eLo m\u00e1s destacado de la medicina era la naturaleza misma.\u201c\n\u201eLoco, maravilloso y decepcionante. Las expectativas deben permanecer en casa. Cada ceremonia de Ayahuasca es diferente, \u00fanica y en nuevos niveles \".\n\u201eCambio mi vida.\u201c\n\u201eAyahuasca me ayud\u00f3 a saber lo maravillosa que es la vida y lo agradable que es estar vivo.\u201c\n\u201eSaca a relucir la verdad brutal.\u201c\n\u201eLos sonidos de la jungla eran un enriquecimiento todas las noches y todas las ma\u00f1anas \u201d.\n\u201eAprend\u00ed mucho a trav\u00e9s de la planta, es casi como si me estuviera comunicando con mis propias c\u00e9lulas. Adem\u00e1s de estas fant\u00e1sticas experiencias, no siempre es f\u00e1cil. Los v\u00f3mitos pueden ser extremadamente inc\u00f3modos, pero incluso esta experiencia me ense\u00f1\u00f3 el mayor conocimiento de todo el tiempo.\u201c\n\u201eRecomiendo un retiro de ayahuasca con muchas ceremonias a cualquiera que quiera desarrollarse personalmente para encontrar su camino individual.\u201c\n7. condujo Ayahuasca - malas experiencias\nAdem\u00e1s de los numerosos positivos, tambi\u00e9n hay malas experiencias que muestran los peligros potenciales de una ceremonia de ayahuasca, pero tambi\u00e9n la existencia de poder \"cham\u00e1n\".\nLas malas experiencias m\u00e1s comunes equivalen al hecho de que la dosis del t\u00e9 de ayahuasca es demasiado fuerte o que los efectos secundarios como los v\u00f3mitos, la diarrea, la ansiedad y los llamados viajes de terror predominan a trav\u00e9s de alucinaciones.\nAdem\u00e1s de estas malas experiencias, que se deben a la poci\u00f3n en s\u00ed, los participantes tambi\u00e9n informan peligros que pueden asumir el cham\u00e1n.\nPuedes encontrar algunas de las malas experiencias aqu\u00ed, las traducimos libremente por nosotros:\n\u201eLos empleados son personas realmente agradables y lo dicen bien. En mi caso, sin embargo, me dieron una dosis demasiado alta para la que no estaba listo, lo que llev\u00f3 a mi primer ataque de p\u00e1nico. Desde entonces, los \u00faltimos 2 meses han sido un infierno para m\u00ed, en el que tuve que ser hospitalizado en mi ciudad natal.\u201c\n[Fuente Google](https://goo.gl/maps/4NnKx77gH3M683Wt7)\n\u201e\u00a1No vayas aqu\u00ed! Fui atacado sexualmente durante mi masaje y fue una experiencia terrible y traum\u00e1tica. Rezo para que ninguna otra chica tenga que sufrir el mismo trato desagradable por parte de este hombre.\u201c\n[Fuente Google](https://goo.gl/maps/FtYmxBgEUksM9FoN7)\n\u201eSi eres mujer, \u00a1ev\u00edtelo! Me instaron a beber ayahuasca, aunque no quer\u00eda. Me dijeron que mi amigo me dejar\u00eda y no me sent\u00eda seguro. Uno de los chamanes era inapropiado y me dijo que quer\u00eda verme y quer\u00eda verme en mi hotel cuando mi amigo todav\u00eda estaba en el retiro.\u201c\n[Fuente Google](https://goo.gl/maps/YobQZSb6TLpGuank8)\n\u201eAhora que estoy de vuelta en casa, a veces tengo la sensaci\u00f3n de que la vida no es real y que nunca regres\u00e9 y realmente ca\u00ed en coma. Siento que estoy en coma y mis padres y mi familia est\u00e1n esperando que me despierte.\u201c\n[Fuente de Reddit Post](https://www.reddit.com/r/Ayahuasca/comments/epev9q/feeling_like_im_in_a_coma_and_i_never_came_back/)\n7.1. Ayahuasca y medicamentos\nSi consume un tipo de medicamento recetado, como B. Tener antibi\u00f3ticos o presi\u00f3n arterial alta o problemas card\u00edacos, probablemente no deber\u00eda llevarte ayahuasca. Tomar antidepresivos y ayahuasca tambi\u00e9n debe discutirse con un m\u00e9dico de antemano.\nTambi\u00e9n se recomienda detener cualquier tipo de drogas y estimulantes unas semanas antes de la ceremonia de la ayahuasca.\nCualquier tipo de medicamento y hierbas que deber\u00edan influir en los niveles de serotonina.\nSe aconseja a Ayahuasca contra pacientes con trastornos de personalidad diagnosticados.\n8. Ayahuasca vs DMT\nDMT es el ingrediente activo psicoactivo en Chakruna. El Caapi Ayahuasca Liane, por otro lado, contiene solo los inhibidores de MAO que son necesarios para que el DMT pueda funcionar.\nSin embargo, la DMT tambi\u00e9n se puede consumir como una sola sustancia en forma de humo sobre los pulmones y luego no requiere un inhibidor de MAO.\nLa gran diferencia entre DMT y Ayahuasca es que Ayahuasca representa un paquete general de ingredientes activos. DMT, por otro lado, es un extracto. En consecuencia, esto es comparable a uno\n[T\u00e9 de guayusa](https://www.drinkguya.com/blogs/was-ist-guayusa/was-ist-guayusa-tee-wirkung-vorteile-zubereitung-kauf) y uno puro [Extracto de cafe\u00edna](https://www.drinkguya.com/blogs/inhaltsstoffe-wirkung/naturliches-koffein-vs-reines-koffein-pulver). El t\u00e9 guayusa contiene todo tipo de cafe\u00edna [Otros ingredientes activos](https://www.drinkguya.com/blogs/supplements-sport-leistungssteigerung/guayusa-inhaltsstoffe-die-dir-grenzenlose-energie-geben), que en todo el conjunto [Efecto](https://www.drinkguya.com/blogs/inhaltsstoffe-wirkung/guayusa-tee-wirkung-guayusa-wirkung-was-du-wissen-musst) tener como extracto de cafe\u00edna pura.\nEl consumo de DMT puro conduce a un frenes\u00ed corto, muy fuerte y muy fuerte, que los consumidores describen como una experiencia espiritual incre\u00edblemente intensiva. Por lo tanto, DMT a menudo fue utilizado por los empresarios en la d\u00e9cada de 1960 para tener un viaje corto durante el trabajo o entre las reuniones.\nTampoco hay evidencia de que DMT o Ayahuasca sean realmente adictivos, como hero\u00edna, crack, tabaco, alcohol o az\u00facar. La prohibici\u00f3n de la sustancia es, por lo tanto, extremadamente controvertida.\nPuede encontrar un documental emocionante sobre DMT y Ayahuasca en YouTube:\n9. Recetas de ayahuasca\nNo parece haber un tipo uniforme de preparaci\u00f3n tradicional, pero en general la finalizaci\u00f3n de la receta lleva varias horas hasta un d\u00eda entero e incluye al menos una planta con inhibidores de MAO.\nDependiendo del cham\u00e1n, el caapi ayahuasca liane solo o directamente junto con las hojas de chakruna u otra planta que contiene DMT\n[Chaliponga](https://en.wikipedia.org/wiki/Diplopterys_cabrerana) o [Ra\u00edces mimosa](https://en.wikipedia.org/wiki/Mimosa_tenuiflora) preparado. La receta de ayahuasca m\u00e1s com\u00fan es con Cackruna y Caapi.\nLas hojas de chakruna deben recogerse por la ma\u00f1ana con amanecer o por la noche con la puesta de sol. El contenido de DMT es m\u00e1s alto en estos momentos. Viene la liana debe ser aplastada con la ayuda de un martillo u otro objeto duro como una rama hasta que las fibras se separen. Todos los ingredientes son limpiados por el humo de Mapacho y las oraciones o los cantos.\nLos ingredientes para la receta de ayahuasca se cocinan en una cacerola grande o por separado en dos macetas sobre fuego abierto hasta que la mayor\u00eda del l\u00edquido se evapore. La cerveza restante es el t\u00e9 de ayahuasca, que se combina en los \u00faltimos minutos de preparaci\u00f3n.\nPr\u00e1ctico, no ser\u00eda ilegal preparar un t\u00e9 de ayahuasca con DMT en Alemania, porque ciertas hierbas como esa\n[Junco](https://de.wikipedia.org/wiki/Dimethyltryptamin#:~:text=Weitere%20Pflanzen%2C%20in%20denen%20DMT,Gattung%20Acacia%20sowie%20weiteren%20Pflanzen.) O contener la hierba de glosos de tuber\u00eda DMT.\n9.1. Guayusa\nOtro ingrediente emocionante, que las tribus Kichwa en Ecuador a menudo\n[ingrediente](https://www.researchgate.net/publication/311981728_Ilex_guayusa_Aquifoliaceae_Amazon_and_Andean_Native_Plant) se agrega, Guayusa es. Guayusa es una planta particularmente emocionante que est\u00e1 hervida como un t\u00e9, pero no es una. Su efecto se describe como particularmente enfocado, despierto y reductor de estr\u00e9s. Puede encontrar m\u00e1s sobre la planta m\u00e1s cafe\u00edna del mundo en nuestro art\u00edculo \" [Que es guayusa](https://www.drinkguya.com/blogs/was-ist-guayusa/was-ist-guayusa-tee-wirkung-vorteile-zubereitung-kauf)\u201c.\nEl Ayahuasca Liane, m\u00e1s precisamente, la bebida resultante tiene un sabor extremadamente amargo. Por lo tanto, Guayusa se agrega a la receta de ayahuasca para que el sabor sea m\u00e1s agradable, pero tambi\u00e9n al mismo tiempo para dar a los participantes suficiente energ\u00eda para la ceremonia y evitar un efecto de resaca.\nAl igual que la ayahuasca, Guayusa tiene una tradici\u00f3n del milenio entre Kichwa y se usa para numerosos fines ceremoniales adem\u00e1s del efecto estimulante, para el cual tambi\u00e9n nos encanta en este pa\u00eds, incluso\n[Sue\u00f1os l\u00facidos](https://www.drinkguya.com/blogs/traditionelle-nutzung-von-guayusa/luzide-traume-luzides-traumen-lernen-techniken-anleitung?_pos=1&_sid=ccba18bd2&_ss=r).\nPuedes comprar y beber legalmente Guayusa, a diferencia de Ayahuasca. Como t\u00e9 de energ\u00eda lo obtienes en nuestro\n[Comercio](https://www.drinkguya.com/pages/collection).\n10. viaje de ayahuasca\nComo hemos indicado anteriormente, el viaje a Am\u00e9rica del Sur es una buena oportunidad para experimentar la aut\u00e9ntica ceremonia de la ayahuasca o un retiro completo con una receta real. Dado que la ayahuasca es reconocida como medicina legal en algunos pa\u00edses, de todos modos deber\u00eda ser la primera opci\u00f3n para evitar dificultades con el estado aqu\u00ed en Alemania.\nComo compa\u00f1\u00eda de Guayusa, a menudo viajamos a Ecuador y pudimos experimentar c\u00f3mo normalmente el consumo de ayahuasca se considera un remedio. Si ya est\u00e1 en el sitio, podemos combinar en la regi\u00f3n de Napo con locales e incluso emigrantes de habla inglesa o en ingl\u00e9s.\nSin embargo, no podemos dar una recomendaci\u00f3n de viaje directo para un solo retiro de ayahuasca. En su elecci\u00f3n, debe asegurarse de que sea un lugar al este de los Andes y que la oferta tenga muchas y buenas recesiones o que se le recomendara por primera vez.\n11. Conclusi\u00f3n\nTener una conclusi\u00f3n a las ceremonias de Ayahuasca es todo menos f\u00e1cil. Creemos que dependiendo de la persona, tal ceremonia o incluso un retiro de ayahuasca entero puede ser una experiencia fant\u00e1stica. Si tiene miedo de uso, es posible que lo tenga por cierta raz\u00f3n y debe evitar usarlo por el momento.\nLa mol\u00e9cula DMT, que es responsable del efecto intensivo de una receta de ayahuasca, ocurre en la naturaleza en numerosas plantas, animales y nosotros mismos. Es una sustancia extremadamente emocionante que los cient\u00edficos tambi\u00e9n llaman la \"mol\u00e9cula de conciencia\".\nDMT y la receta de ayahuasca preparada son ilegales en Alemania y toda la UE, pero la compra de un Caapi Liane o las hojas de Chakruna es legal.\nCreemos que para una experiencia de ayahuasca aut\u00e9ntica y legal, el viaje a Am\u00e9rica del Sur es la mejor opci\u00f3n, pero todos tienen que decidir esto individualmente.\nEsperamos sus comentarios sobre este art\u00edculo, por favor escr\u00edbanos\n[nuestra tienda](https://www.drinkguya.com/pages/collection) con Comprar un descuento del 5%por ti C\u00f3digo \"Blog-5\" \u00daselo en el pago. Como [Boletin informativo](https://www.drinkguya.com/pages/10-prozent-bei-deinem-guayusa-einkauf-sparen) Incluso obtienes un miembro 10% de descuento. [\nUnsere vielseitigen Guayusa Sorten bringen Abwechslung in deinen Alltag, halten wach, fokussiert & entspannt.\n](/es/collections/guayusa_tee)\nT\u00e9 de guayusa\n[\nKaufe puren Guayusa Tee als Pulver. Die perfekte Wahl f\u00fcr Tee-Cappuccino, Ice-Brew und Dripper.\n](/es/collections/guayusa-pulver-fein-gesiebtes-guayusa-pulver-kaufen)\nGuayusa en polvo\n[\nBestelle g\u00fcnstigen Bio Guayusa-Tee mit unseren Probier-Sets. W\u00e4hle aus kleinen und gro\u00dfen Sets und spare.\n](/es/collections/guayusa-set-online-bestellen-alle-guayusa-sorten-gunstiger)\nManojo\n[\nKaufe Guayusa Teezubeh\u00f6r in unserem Online-Shop. Hochwertige Glas-Produkte f\u00fcr die optimale Zubereitung.\n](/es/collections/teezubehor-online-shop-fur-tee-zubehor-und-bio-guayusa-tee)\nEsencial\nWeitere Blogartikel\n[El uso del t\u00e9 guayusa por parte de los pueblos ind\u00edgenas](/es/blogs/traditionelle-nutzung-von-guayusa/el-uso-del-te-guayusa-por-parte-de-los-pueblos-indigenas)\n18. July 23\nLos Ecuadores de Indios Kichwa no solo beben t\u00e9 Guayusa, sino que tambi\u00e9n fuman las hojas y las preparan de muchas maneras diferentes.\n[Vida y tradiciones de los indios kichwa y los pueblos quechua](/es/blogs/traditionelle-nutzung-von-guayusa/vida-y-tradiciones-de-los-indios-kichwa-y-los-pueblos-quechua)\n18. July 23\nLos indios Kichwa del pueblo Quechua llevan miles de a\u00f1os utilizando la Guayusa como alternativa al caf\u00e9. Conozca sus tradiciones y su modo de vida.\n[El calebasse - una cosecha - t\u00e9 guayusa tradicionalmente bebe](/es/blogs/traditionelle-nutzung-von-guayusa/el-calebasse-una-cosecha-te-guayusa-tradicionalmente-bebe)\n26. March 20\nDescubra todo sobre el Calebasse, tambi\u00e9n llamado Kalebass & Bottle Pumpkin. Tambi\u00e9n le damos ejemplos de c\u00f3mo usa una calebla calebassen.\n[Guayusa Tea for Lucid Dreams - Reforzar las salas llanas](/es/blogs/traditionelle-nutzung-von-guayusa/guayusa-tea-for-lucid-dreams-reforzar-las-salas-llanas)\n18. July 23\n\u00a1Los sue\u00f1os l\u00facidos son fascinantes! Mostramos c\u00f3mo puedes aprender a so\u00f1ar l\u00facidos y seguir t\u00e9cnicas, peligros y una hierba de ensue\u00f1o.\n- Al seleccionar una opci\u00f3n, se actualiza toda la p\u00e1gina.", "language": null, "image": "https://www.drinkguya.com/cdn/shop/articles/Ayahuasca_Zeremonie_Retreat_Wirkung_DMT_Rezept.png?v=1679494502", "pagetype": "article", "links": ["#MainContent", "javascript:void(0)", "/es/pages/collection", "/es/pages/blogs", "/es/pages/aboutus", "https://www.drinkguya.com/blogs/was-ist-guayusa/faq-zu-guayusa-koffeinhaltigen-getranken", "/es/pages/gratis-guayusa-wissen", "/es/pages/brewing", "/es/pages/guayusa-eigenschaften-eigenschaften-von-guayusa-tee-sorten", "/es/pages/project-media", "/es/pages/10-prozent-bei-deinem-guayusa-einkauf-sparen", "/es/pages/collection", "/es/pages/blogs", "/es/pages/aboutus", "/es#", "https://www.drinkguya.com/blogs/was-ist-guayusa/faq-zu-guayusa-koffeinhaltigen-getranken", "/es/pages/gratis-guayusa-wissen", "/es/pages/brewing", "/es/pages/guayusa-eigenschaften-eigenschaften-von-guayusa-tee-sorten", "/es/pages/project-media", "/es/pages/10-prozent-bei-deinem-guayusa-einkauf-sparen", "/es/cart", "https://www.drinkguya.com/blogs/wachmacher-energy-drink/kakao-zeremonie-rezept-inhaltsstoffe-wirkung-kaufen", "https://www.drinkguya.com/blogs/traditionelle-nutzung-von-guayusa/der-gebrauch-von-guayusa-tee-durch-die-ureinwohner", "#Was%20ist%20Ayahuasca?", "#Ayahuasca%20Inhaltsstoffe%20&%20Wirkung", "#Ayahuasca%20Inhaltsstoffe", "#Wirkung", "#Ayahuasca%20Wirkung%20auf%20das%20Gehirn", "#Ayahuasca%20Wirkung%20auf%20die%20Psyche", "#Ayahuasca%20Zeremonie", "#Ablauf", "#Kosten%20einer%20Ayahuasca%20Zeremonie%20in%20S%C3%BCdamerika", "#Ayahuasca%20Zeremonie/Retreat%20in%20Deutschland", "#Ayahuasca%20Retreat%20Berlin", "#Kosten%20einer%20Ayahuasca%20Zeremonie%20in%20Deutschland", "#Legal?", "#Gute%20Erfahrungen%20einer%20Ayahuasca%20Zeremonie", "#yahuasca%20Gefahren%20%E2%80%93%20schlechte%20Erfahrungen", "#Ayahuasca%20und%20Medikamente", "#Ayahuasca%20VS%20DMT", "#Ayahuasca%20Rezepte", "#Guayusa", "#Ayahuasca%20Reise", "#Fazit", "https://www.medicalnewstoday.com/articles/306889#history", "https://en.wikipedia.org/wiki/Psychotria_viridis", "https://de.wikipedia.org/wiki/Monoaminoxidase-Hemmer", "https://www.drinkguya.com/pages/10-prozent-bei-deinem-guayusa-einkauf-sparen", "https://www.ncbi.nlm.nih.gov/pmc/articles/PMC5509699/", "https://en.wikipedia.org/wiki/Banisteriopsis_caapi", "https://en.wikipedia.org/wiki/Monoamine_oxidase", "https://en.wikipedia.org/wiki/Monoamine_oxidase_inhibitor", "https://www.ncbi.nlm.nih.gov/pmc/articles/PMC5021697/", "https://www.ncbi.nlm.nih.gov/pubmed/27918874", "https://www.ncbi.nlm.nih.gov/pubmed/28706205", "https://www.ncbi.nlm.nih.gov/pubmed/27918874", "https://www.ncbi.nlm.nih.gov/pmc/articles/PMC5144684/", "https://www.ncbi.nlm.nih.gov/pmc/articles/PMC5869920/", "https://www.ncbi.nlm.nih.gov/pubmed/26612618", "https://www.ncbi.nlm.nih.gov/pubmed/26612618", "https://www.ncbi.nlm.nih.gov/pubmed/29903051", "https://www.ncbi.nlm.nih.gov/pubmed/29867608", "https://en.wikipedia.org/wiki/Nicotiana_rustica", "https://en.wikipedia.org/wiki/Icaro", "https://en.wikipedia.org/wiki/Legal_status_of_ayahuasca_by_country", "https://cdn.shopify.com/s/files/1/0012/1952/6721/files/87536891-Ayahuasca-and-Visionary-Art-Retreat-2012.pdf?v=1679494923", "https://goo.gl/maps/4NnKx77gH3M683Wt7", "https://goo.gl/maps/FtYmxBgEUksM9FoN7", "https://goo.gl/maps/YobQZSb6TLpGuank8", "https://www.reddit.com/r/Ayahuasca/comments/epev9q/feeling_like_im_in_a_coma_and_i_never_came_back/", "https://www.drinkguya.com/blogs/was-ist-guayusa/was-ist-guayusa-tee-wirkung-vorteile-zubereitung-kauf", "https://www.drinkguya.com/blogs/inhaltsstoffe-wirkung/naturliches-koffein-vs-reines-koffein-pulver", "https://www.drinkguya.com/blogs/supplements-sport-leistungssteigerung/guayusa-inhaltsstoffe-die-dir-grenzenlose-energie-geben", "https://www.drinkguya.com/blogs/inhaltsstoffe-wirkung/guayusa-tee-wirkung-guayusa-wirkung-was-du-wissen-musst", "https://en.wikipedia.org/wiki/Diplopterys_cabrerana", "https://en.wikipedia.org/wiki/Mimosa_tenuiflora", "https://de.wikipedia.org/wiki/Dimethyltryptamin#:~:text=Weitere%20Pflanzen%2C%20in%20denen%20DMT,Gattung%20Acacia%20sowie%20weiteren%20Pflanzen.", "https://www.researchgate.net/publication/311981728_Ilex_guayusa_Aquifoliaceae_Amazon_and_Andean_Native_Plant", "https://www.drinkguya.com/blogs/was-ist-guayusa/was-ist-guayusa-tee-wirkung-vorteile-zubereitung-kauf", "https://www.drinkguya.com/blogs/traditionelle-nutzung-von-guayusa/luzide-traume-luzides-traumen-lernen-techniken-anleitung?_pos=1&_sid=ccba18bd2&_ss=r", "https://www.drinkguya.com/pages/collection", "https://www.facebook.com/drinkguya/", "https://www.instagram.com/drinkguya/", "https://www.drinkguya.com/pages/collection", "https://www.drinkguya.com/pages/10-prozent-bei-deinem-guayusa-einkauf-sparen", "/es/collections/guayusa_tee", "/es/collections/guayusa-pulver-fein-gesiebtes-guayusa-pulver-kaufen", "/es/collections/guayusa-set-online-bestellen-alle-guayusa-sorten-gunstiger", "/es/collections/teezubehor-online-shop-fur-tee-zubehor-und-bio-guayusa-tee", "/es/blogs/traditionelle-nutzung-von-guayusa/el-uso-del-te-guayusa-por-parte-de-los-pueblos-indigenas", "/es/blogs/traditionelle-nutzung-von-guayusa/el-uso-del-te-guayusa-por-parte-de-los-pueblos-indigenas", "/es/blogs/traditionelle-nutzung-von-guayusa/vida-y-tradiciones-de-los-indios-kichwa-y-los-pueblos-quechua", "/es/blogs/traditionelle-nutzung-von-guayusa/vida-y-tradiciones-de-los-indios-kichwa-y-los-pueblos-quechua", "/es/blogs/traditionelle-nutzung-von-guayusa/el-calebasse-una-cosecha-te-guayusa-tradicionalmente-bebe", "/es/blogs/traditionelle-nutzung-von-guayusa/el-calebasse-una-cosecha-te-guayusa-tradicionalmente-bebe", "/es/blogs/traditionelle-nutzung-von-guayusa/guayusa-tea-for-lucid-dreams-reforzar-las-salas-llanas", "/es/blogs/traditionelle-nutzung-von-guayusa/guayusa-tea-for-lucid-dreams-reforzar-las-salas-llanas", "https://www.drinkguya.com", " /es/pages/impressum ", " /es/pages/zahlung-und-versand-guayusa-tee-guya ", " /es/pages/widerruf ", " /es/pages/agb ", " /es/pages/datenschutz ", " /es/pages/guayusa-gro-handel-b2b-deutschland-europa ", " https://www.drinkguya.com/blogs/was-ist-guayusa/faq-zu-guayusa-koffeinhaltigen-getranken ", " /es/pages/gratis-guayusa-wissen ", " https://www.drinkguya.com/pages/10-prozent-bei-deinem-guayusa-einkauf-sparen ", "mailto: support@drinkguya.com", "#", "https://www.instagram.com/drinkguya/", "https://www.facebook.com/drinkguya/", "https://youtube.com/drinkguya"]}