{"title": "Preguntas frecuentes sobre la vacuna contra COVID-19", "author": null, "url": "https://www.argentina.gob.ar/coronavirus/vacuna/preguntas-frecuentes", "hostname": "argentina.gob.ar", "description": "Actualizaci\u00f3n: 21 de junio de 2023", "sitename": "Argentina.gob.ar", "date": "2021-01-21", "id": null, "license": null, "body": null, "comments": "", "commentsbody": null, "raw_text": null, "text": "Preguntas frecuentes sobre la vacuna contra COVID-19\nActualizaci\u00f3n: 21 de junio de 2023\nCon el objetivo de mantener los logros de control y eliminaci\u00f3n de enfermedades prevenibles por vacunas, es prioritario que te acerques al vacunatorio m\u00e1s cercano, para iniciar y/o completar esquemas.\nNuestro Calendario Nacional de Vacunaci\u00f3n incluye vacunas para todas las etapas de la vida, situaciones especiales o para grupos espec\u00edficos. Son seguras, obligatorias, gratuitas y se aplican en los centros de salud sin necesidad de orden m\u00e9dica.\nLas vacunas contra COVID-19 se suman a la estrategia de vacunaci\u00f3n con el objetivo principal de minimizar la internaci\u00f3n, las complicaciones y los desenlaces fatales y se pueden co-administrar junto con cualquier otra vacuna, pudi\u00e9ndose aplicar el mismo d\u00eda o en d\u00edas diferentes, sin requerir intervalo entre las dosis.\n\u00cdndice\nProducci\u00f3n y desarrollo de vacunas candidatas\n[1. \u00bfQu\u00e9 plataformas de vacunas contra COVID-19 se est\u00e1n utilizando?](#1) [2. \u00bfSe aplican vacunas producidas bajo plataformas similares a \u00e9stas en nuestro Calendario Nacional de Vacunaci\u00f3n o en el mundo?](#2) [3. \u00bfQu\u00e9 plataformas usa cada una de las vacunas que se utilizan en Argentina?](#3) [4. \u00bfSe omiten pasos en el desarrollo de la vacuna contra COVID-19?](#4)\nAspecto regulatorio\n[5. \u00bfCu\u00e1l es la normativa legal en la que se encuadra la vacunaci\u00f3n contra COVID-19?](#5) [6. \u00bfCu\u00e1l es el procedimiento en nuestro pa\u00eds para la autorizaci\u00f3n del uso de las vacunas contra COVID-19?](#6) [7. \u00bfQu\u00e9 vacunas contra COVID-19 est\u00e1n actualmente autorizadas para su uso en nuestro pa\u00eds?](#7) [8. \u00bfQu\u00e9 son las vacunas bivariantes?](#8) [9. \u00bf Cu\u00e1l es la principal diferencia en el proceso de autorizaci\u00f3n de las vacunas seg\u00fan qui\u00e9n la solicite?](#9)\nIndicaciones y escalonamiento\n[10. \u00bfCu\u00e1les son los prop\u00f3sitos de la campa\u00f1a de vacunaci\u00f3n contra COVID-19 en Argentina?](#10) [11. \u00bfCu\u00e1l es el objetivo de la campa\u00f1a de vacunaci\u00f3n contra la COVID-19 en Argentina?](#11) [12. \u00bfEn qu\u00e9 consiste actualmente la vacunaci\u00f3n contra la COVID-19 en nuestro pa\u00eds?](#12) [13. \u00bfCu\u00e1l es la poblaci\u00f3n priorizada para la vacunaci\u00f3n contra la COVID-19?](#13) [14. La vacunaci\u00f3n contra COVID-19 en Argentina, \u00bfes obligatoria?](#14) [15. \u00bfLa vacuna contra COVID-19 es de acceso gratuito?](#15) [16. \u00bfC\u00f3mo se realiza el registro de las dosis aplicadas?](#16) [17. \u00bfEs posible conocer c\u00f3mo avanza la campa\u00f1a de vacunaci\u00f3n en el pa\u00eds?](#17) [18. \u00bfLas diferentes vacunas disponibles son intercambiables (se puede completar esquema con una vacuna diferente)?](#18) [19. \u00bfSe puede coadministrar la vacuna contra COVID-19 con otras vacunas?](#19) [20. \u00bfQu\u00e9 se considera esquema primario?](#20) [21. \u00bfQu\u00e9 significa dosis adicional y dosis refuerzo?](#21) [22. \u00bfQui\u00e9nes tienen que recibir una dosis adicional?](#22) [23. \u00bfCu\u00e1l es el intervalo m\u00ednimo para recibir la dosis adicional?](#23) [24. \u00bfQui\u00e9nes tienen que recibir la dosis de refuerzo o booster?](#24) [25. \u00bfCon qu\u00e9 frecuencia se deben aplicar los refuerzos?](#25) [26. \u00bfCu\u00e1l es el intervalo m\u00ednimo para la dosis refuerzo o booster?](#26)\nPoblaci\u00f3n Objetivo\nAdultos\nAdolescentes entre 12 a 17 a\u00f1os\nNi\u00f1os y ni\u00f1as entre 6 meses y 11 a\u00f1os de edad\u201d\n[29. \u00bfQu\u00e9 vacunas est\u00e1n disponibles para uso en menores de 12 a\u00f1os en el pa\u00eds?](#29) [30. \u00bfEs segura la vacunaci\u00f3n en las infancias?](#30) [31. \u00bfPor qu\u00e9 vacunar en las infancias?](#31) [32. \u00bfQu\u00e9 otros beneficios tendr\u00eda vacunar a esta poblaci\u00f3n?](#32) [33. \u00bfQui\u00e9nes necesitan una dosis adicional?](#33) [34. \u00bfTiene que recibir refuerzo la poblaci\u00f3n pedi\u00e1trica?](#34)\nSituaciones especiales\n[35. \u00bfLas personas gestantes y/o en per\u00edodo de lactancia pueden vacunarse?](#35) [36. Si recib\u00ed la vacuna y estoy amamantando \u00bfdebe suspenderse la lactancia?](#36) [37. \u00bfEst\u00e1 indicada la vacunaci\u00f3n para las personas que presenten alg\u00fan grado de inmunocompromiso?](#37) [38. \u00bfSe pueden vacunar las personas que recibieron tratamiento con anticuerpos monoclonales contra SARS-CoV-2 o plasma de convaleciente?](#38) [39. \u00bfDebo vacunarme si tengo indicaci\u00f3n y estoy cursando una infecci\u00f3n aguda por SARS-CoV-2?](#39) [40. Si ya tuve COVID-19 y me recuper\u00e9 \u00bfdebo vacunarme?](#40)\nSeguridad\nSobre las vacunas utilizadas en Argentina\n[42. \u00bfLas vacunas evitan la infecci\u00f3n por coronavirus?](#42) [43. \u00bfCu\u00e1l es el intervalo m\u00ednimo entre las dosis de esquema primario para cada vacuna seg\u00fan la evidencia cient\u00edfica?](#43) [44. Una vez que te aplic\u00e1s la vacuna \u00bfdesde qu\u00e9 momento te protege?](#44) [45. \u00bfQu\u00e9 recaudos hay que tomar luego de aplicarse la vacuna?](#45) [46. \u00bfCu\u00e1les son las contraindicaciones o precauciones para recibir las vacunas que se utilizan actualmente?](#46) [47. \u00bfPuede haber un \u201cfalso positivo\u201d en un test diagn\u00f3stico para SARS-CoV-2 por haberse aplicado alguna de las vacunas?](#47) [48\u00bfPierden efectividad las vacunas frente a las nuevas variantes de SARS-CoV-2?](#48) [49. \u00bfPuede la vacuna producir la muerte si se recibe en el periodo de incubaci\u00f3n de la enfermedad?](#49) [50. \u00bfCu\u00e1l es la recomendaci\u00f3n actual sobre la utilizaci\u00f3n de las vacunas contra coronavirus respecto a la ocurrencia de casos de trombosis venosa?](#50) [51. \u00bfEs recomendable realizarte un test de anticuerpos contra SARS-CoV-2 luego de haber recibido la vacuna contra COVID-19?](#51) [52. \u00bfCu\u00e1les son las causas por las que, luego de vacunarme, un test de anticuerpos contra SARS-CoV-2 podr\u00eda darme negativo?](#52) [53. \u00bfSi despu\u00e9s de vacunarme no tuve fiebre, dolor de cuerpo, cefalea o cualquier otro s\u00edntoma, quiere decir que la vacuna no me hizo efecto?](#53)\nProducci\u00f3n y desarrollo de vacunas candidatas\n1. \u00bfQu\u00e9 plataformas de vacunas contra COVID-19 se est\u00e1n utilizando?\nUna plataforma es el mecanismo a trav\u00e9s del cual se le presenta al sistema inmune del organismo el virus (o la parte de \u00e9l) cuya acci\u00f3n se pretende bloquear.\nLas 4 plataformas principales son:\n- Vacunas con virus inactivados: utilizan el virus SARS-CoV-2 previamente inactivado, de modo que no provoca la enfermedad, pero s\u00ed genera una respuesta inmunitaria.\n- Vacunas basadas en prote\u00ednas: utilizan fragmentos inocuos de prote\u00ednas o estructuras proteicas que imitan el virus causante de COVID-19, con el fin de generar una respuesta inmunitaria.\n- Vacunas con vectores virales: utilizan un virus distinto al SARS-CoV-2 (Ej.: adenovirus) y gen\u00e9ticamente modificado que no puede provocar la enfermedad, pero s\u00ed puede producir prote\u00ednas del SARS-CoV-2 para generar una respuesta inmunitaria segura.\n- Vacunas con ARN y ADN: es un enfoque novedoso que utiliza ARN o ADN gen\u00e9ticamente modificados para generar una prote\u00edna que por s\u00ed sola desencadena una respuesta inmunitaria contra el SARS-CoV-2.\n2. \u00bfSe aplican vacunas producidas bajo plataformas similares a \u00e9stas en nuestro Calendario Nacional de Vacunaci\u00f3n o en el mundo?\nExiste amplia experiencia en las plataformas de virus vivos atenuados o inactivados, y en las basadas en prote\u00ednas o subunidades proteicas. Las mismas se utilizan desde hace a\u00f1os en vacunas incluidas en nuestro Calendario Nacional de Vacunaci\u00f3n, as\u00ed como en todos los pa\u00edses del mundo (ej. sarampi\u00f3n, varicela, polio, hepatitis A, VPH, entre otras).\nLas plataformas de vectores virales son utilizadas en vacunas contra \u00c9bola, MERS y en terapias g\u00e9nicas.\nLas plataformas de \u00e1cidos nucleicos (ARNm y ADN) son innovadoras, de reciente desarrollo y actualmente solo est\u00e1n disponibles las vacunas licenciadas recientemente.\n3. \u00bfQu\u00e9 plataformas usa cada una de las vacunas que se utilizan en Argentina?\n- La vacuna ChAdOx1-S de origen brit\u00e1nico (Oxford/ AstraZeneca) y la hom\u00f3loga Covishield del Serum Institute de India utilizan plataforma de vector viral no replicativo (utiliza adenovirus de chimpanc\u00e9).\n- La vacuna de origen ruso (Sputnik V del Instituto Gamaleya) utiliza vector viral no replicativo (utiliza 2 adenovirus humanos: 26 y 5).\n- La vacuna de origen chino, Sinopharm, es una plataforma de virus inactivados.\n- Las vacunas del laboratorio Moderna, utiliza una plataforma de \u00e1cidos nucleicos: ARNm.\n- La vacuna Convidecia o Ad5-nCoV es una vacuna recombinante que utiliza vector viral no replicante de adenovirus tipo 5 que expresa la glicoprote\u00edna Spike (S) del SARS-CoV-2, producida por el laboratorio del Instituto de Biotecnolog\u00eda de Beijing (Beijing, China) y CanSino Biologics Inc.\n- La vacuna Comirnaty es una vacuna que utiliza una plataforma de \u00e1cidos nucleicos: ARNm, producida por Pfizer-BioNTech.\n- La vacuna Sputnik light producida por el Instituto Gamaleya utiliza una plataforma vector viral no replicativo (adenovirus humano 26).\n4. \u00bfSe omiten pasos en el desarrollo de la vacuna contra COVID-19?\nNo. Se cumplen todos los pasos necesarios durante la investigaci\u00f3n. En contexto de pandemia el paradigma de investigaci\u00f3n difiere del utilizado habitualmente y las etapas o fases pueden realizarse de manera superpuesta y consecutiva, lo que permite optimizar los tiempos. Pero todas las etapas son realizadas para evaluar, principalmente, la seguridad y la eficacia de la vacuna en desarrollo.\nAspecto regulatorio\n5. \u00bfCu\u00e1l es la normativa legal en la que se encuadra la vacunaci\u00f3n contra COVID-19?\nSe dispone de las siguientes normas legales:\n[Ley 27573](/normativa/nacional/ley-27573-343958)de vacunas destinadas a generar inmunidad adquirida contra COVID-19. [Resoluci\u00f3n 2883/2020 del Ministerio de Salud de la Naci\u00f3n](/normativa/nacional/resoluci\u00f3n-2883-2020-345799), aprobaci\u00f3n del Plan Estrat\u00e9gico para la vacunaci\u00f3n contra COVID-19 en la Rep\u00fablica Argentina.\n- Resoluciones provinciales para la ejecuci\u00f3n de las acciones y uso de los fondos.\n- Resoluciones provinciales para la incorporaci\u00f3n de la figura de vacunadores eventuales.\n- Autorizaci\u00f3n por la ANMAT para uso de emergencia de vacunas contra COVID-19.\n6. \u00bfCu\u00e1l es el procedimiento en nuestro pa\u00eds para la autorizaci\u00f3n del uso de las vacunas contra COVID-19?\nLa autorizaci\u00f3n de uso de emergencia de las vacunas contra COVID-19 se encuadra en el marco de la Ley 27.573 y es el Ministerio de Salud de la Naci\u00f3n el que dicta la resoluci\u00f3n correspondiente que establece su uso, luego de la intervenci\u00f3n de los organismos competentes. En los art. 8 y 9 se establece qu\u00e9 organismos deben participar del proceso y la manera en que debe realizarse el mismo.\nEn este caso, la Administraci\u00f3n Nacional de Medicamentos, Alimentos y Tecnolog\u00eda M\u00e9dica (ANMAT), como organismo competente, solicita a los adquirientes la informaci\u00f3n necesaria que respalde la evidencia cient\u00edfica que permita comprobar su seguridad y eficacia y eval\u00faa las condiciones para la disponibilidad de esa vacuna en el marco de la estrategia que fije nuestro pa\u00eds.\nOtro procedimiento, en caso de compa\u00f1\u00edas farmac\u00e9uticas p\u00fablicas o privadas con representaci\u00f3n en el pa\u00eds (titulares regulados por la ANMAT), es la solicitud de Registro de una vacuna -ya sea de emergencia o de modo definitivo- en el marco de la\n[Disposici\u00f3n ANMAT N\u00b0 705/05](https://www.argentina.gob.ar/sites/default/files/liberacion_de_lotes_vacunas.pdf). En la mencionada norma se establecen los requisitos que deben cumplimentarse para la Inscripci\u00f3n en el registro de especialidades medicinales (REM), entre ellos, la informaci\u00f3n del desarrollo, producci\u00f3n y control de calidad, as\u00ed como tambi\u00e9n los estudios cl\u00ednicos, que avalen la calidad, seguridad y eficacia requerida para su uso en humanos.\n7. \u00bfQu\u00e9 vacunas contra COVID-19 est\u00e1n actualmente autorizadas para su uso en nuestro pa\u00eds?\nLa ANMAT inform\u00f3 el 22 de diciembre de 2020 que, mediante la Disposici\u00f3n 9210/20, autoriz\u00f3 la inscripci\u00f3n en el Registro de Especialidades Medicinales (REM) del producto \u201cCOMIRNATY/BNT162b2\u201d, vacuna para el SARS-COV-2 de la firma PFIZER S.R.L.\nEl d\u00eda 23 de diciembre de 2020, por Resoluci\u00f3n Ministerial 2020-2784-APN-MS, autoriz\u00f3 con car\u00e1cter de emergencia la vacuna Gam-COVID-Vac, denominada Sputnik-V, desarrollada por el Centro Nacional Gamaleya de Epidemiolog\u00eda y Microbiolog\u00eda de Rusia, en virtud de lo establecido por los art\u00edculos 8\u00b0 y 9\u00b0 de la Ley 27.573 y de conformidad con las recomendaciones de la ANMAT.\nEl 30 de diciembre de 2020, por medio de la Disposici\u00f3n 9271/20, la ANMAT autoriz\u00f3 la inscripci\u00f3n en el Registro de Especialidades Medicinales (REM) del producto COVID-19 Vacuna AstraZeneca y nombre gen\u00e9rico VACUNA CONTRA COVID-19 ChAdOx1-S recombinante, de la firma AstraZeneca S.A.\nEl 19 de enero de 2021, la ANMAT, luego de analizar la nueva informaci\u00f3n aportada de la vacuna Gam-COVID-vac (Sputnik-V), establece por medio del informe de ampliaci\u00f3n, que la misma se encuentra en un margen aceptable de seguridad, inmunogenicidad y eficacia para el grupo etario de mayores de 60 a\u00f1os, por lo que recomend\u00f3 al Ministerio de Salud de la Naci\u00f3n el uso de la Vacuna Gam-COVID-Vac en el grupo etario mencionado.\nEl d\u00eda 21 de febrero de 2021 se autoriz\u00f3 con car\u00e1cter de emergencia, a trav\u00e9s de la Resoluci\u00f3n Ministerial 688/2021, la vacuna SARS COV-2 (c\u00e9lulas vero) inactivada, desarrollada por el laboratorio Beijing Institute of Biological Products de la Rep\u00fablica Popular China, luego de las recomendaciones realizadas por ANMAT.\nEl 10 de junio de 2021 por medio de la Resoluci\u00f3n Ministerial N 1671/2021, se autoriz\u00f3 con car\u00e1cter de emergencia la vacuna CONVIDECIA (Recombinant Novel Coronavirus Vaccine (Adenovirus Type 5 Vector) del laboratorio Cansino Biologics Inc (Beijing institute of Biotechnology).\nEl 23 de julio de 2021 el Committee for Medicinal Products for Human Use (CHMP, Comit\u00e9 de medicamentos de uso humano) de la European Medicines Agency (EMA) ha recomendado la ampliaci\u00f3n de la autorizaci\u00f3n de uso de la vacuna Moderna para la prevenci\u00f3n de la COVID en adolescentes de 12-17 a\u00f1os.\nEl 1 de octubre de 2021, la ANMAT, luego de analizar la nueva informaci\u00f3n aportada de la Vacuna SARS COV-2 (c\u00e9lulas vero) inactivada - SINOPHARM, del Laboratorio Beijing Institute of Biological Products, establece por medio del informe de ampliaci\u00f3n, que la misma se encuentra en un margen aceptable de seguridad e inmunogenicidad a partir de los 3 a\u00f1os, por lo que recomend\u00f3 al Ministerio de Salud de la Naci\u00f3n otorgar la autorizaci\u00f3n de uso de emergencia de la vacuna SINOPHARM en el grupo etario evaluado.\nEse mismo d\u00eda, la ANMAT por medio de la disposici\u00f3n 7502/2021 registra para uso de emergencia la VACUNA CONTRA COVID-19 Ad26.COV2-S (recombinante), nombre comercial COVID-19 VACCINE JANSSEN.\nEl 3 de diciembre de 2021, la ANMAT por medio de la resoluci\u00f3n 3451/2021 registra para el uso de emergencia a la vacuna Sputnik Light, del laboratorio Centro Nacional de Investigaciones Gamaleya de Epidemiolog\u00eda y Microbiolog\u00eda, Ministerio de Salud de la Federaci\u00f3n de Rusia.\nEl 13 de enero de 2022, por medio de la disposici\u00f3n DI-2022-450-APN-ANMAT#MS, la ANMAT aprueba la nueva formulaci\u00f3n de la vacuna COMIRNATY de Pfizer-Biontech para la indicaci\u00f3n en franja etaria entre 5 y 11 a\u00f1os de edad.\nEl 12 de marzo de 2022, la ANMAT recomend\u00f3 (seg\u00fan el informe IF-2022-22630342-APN-DERM#ANMAT) la incorporaci\u00f3n de la vacuna ARNm Moderna contra SARS COV-2 en el grupo etario de 6 a 11 a\u00f1os.\nEl 17 de junio de 2022 la Administraci\u00f3n de Alimentos y Medicamentos de EEUU. (FDA, por sus siglas en ingl\u00e9s) autoriz\u00f3 el uso de emergencia de la vacuna Moderna para la prevenci\u00f3n de COVID-19 a partir de los 6 meses de edad.\nEn enero de 2023, Argentina, incorpora la vacuna COMIRNATY BIVARIANTE, Original/Omicron BA.4-5 como dosis de refuerzo en personas de 12 a\u00f1os o m\u00e1s.\nEn febrero de 2023, Argentina incorpora la vacuna SPIKEVAX BIVARIANTE, Original/Omicron BA.4-5 como dosis de refuerzo en personas de 6 a\u00f1os o m\u00e1s.\n8. \u00bfQu\u00e9 son las vacunas bivariantes?\nLas vacunas bivariantes contra la COVID-19 son vacunas que tienen dos componentes de ARNm: uno corresponde a la cepa original del virus y el otro a los linajes BA.4 y BA.5 de la variante \u00f3micron. Son igual de seguras y eficaces que las vacunas monovariantes.\n9. \u00bfCu\u00e1l es la principal diferencia en el proceso de autorizaci\u00f3n de las vacunas seg\u00fan qui\u00e9n la solicite?\nCuando el adquirente es el Ministerio de Salud de la Naci\u00f3n, en uso del art. 8 de la Ley 27.573, \u00e9ste presenta a la ANMAT el pedido de recomendaci\u00f3n. Esta entidad, actuando en el marco de sus competencias, le recomienda al Ministerio de Salud de la Naci\u00f3n proceder a otorgar la autorizaci\u00f3n de emergencia. Es por ello que en el caso de la vacuna Sputnik-V, por citar un ejemplo, el Ministerio de Salud de la Naci\u00f3n realiza, en base a la recomendaci\u00f3n del ANMAT, la resoluci\u00f3n de autorizaci\u00f3n de emergencia.\nCuando son los laboratorios productores de vacunas los que requieren a la ANMAT el registro de emergencia para comercializaci\u00f3n (lo que se encuadra dentro de la Disposici\u00f3n 705/05), es la ANMAT la entidad que firma dicha autorizaci\u00f3n.\nA pesar de que los mecanismos de autorizaci\u00f3n difieren, en ambos casos se realizan todos los procesos de evaluaci\u00f3n que corresponden.\nIndicaciones y escalonamiento\n10. \u00bfCu\u00e1les son los prop\u00f3sitos de la campa\u00f1a de vacunaci\u00f3n contra COVID-19 en Argentina?\nLos prop\u00f3sitos de la vacunaci\u00f3n contra la COVID-19 son disminuir la morbilidad-mortalidad y el impacto socio-econ\u00f3mico ocasionados por la COVID 19 en Argentina as\u00ed como contribuir a la estrategia de contenci\u00f3n de la pandemia de la COVID-19 incidiendo en la transmisi\u00f3n viral.\n11. \u00bfCu\u00e1l es el objetivo de la campa\u00f1a de vacunaci\u00f3n contra la COVID-19 en Argentina?\nVacunar al 100% de la poblaci\u00f3n objetivo en forma escalonada y progresiva, de acuerdo con la disponibilidad gradual creciente del recurso y la priorizaci\u00f3n de riesgo.\n12. \u00bfEn qu\u00e9 consiste actualmente la vacunaci\u00f3n contra la COVID-19 en nuestro pa\u00eds?\nActualmente, dada la posibilidad de contar con diferentes vacunas autorizadas en Argentina contra la COVID-19, se avanza en la vacunaci\u00f3n de distintos grupos poblacionales a partir de los 6 meses de edad as\u00ed como la aplicaci\u00f3n de dosis adicionales y refuerzos.\n[Lineamientos t\u00e9cnicos y Manual del/de la vacunador/a](blank:#https://www.argentina.gob.ar/coronavirus/vacuna/equipos-salud/lineamientos-manual-vacunador)\n13. \u00bfCu\u00e1l es la poblaci\u00f3n priorizada para la vacunaci\u00f3n contra la COVID-19?\nDebido a la disponibilidad gradual de dosis de vacunas, desde el inicio de la campa\u00f1a se prioriz\u00f3 la poblaci\u00f3n a vacunar seg\u00fan riesgo de exposici\u00f3n y de desarrollar enfermedad grave y complicaciones por COVID-19.\nLa poblaci\u00f3n considerada con mayor riesgo de enfermedad:\n-\nPersonal de salud.\n-\nPersonal estrat\u00e9gico.\n-\nPersonas mayores de 50 a\u00f1os.\n-\nPersonas gestantes en cualquier trimestre del embarazo.\n-\nPersonas menores de 50 a\u00f1os que presenten alguna de estas condiciones.\n-\nDiabetes tipo 1 o 2 (insulinodependiente y no insulinodependiente).\n-\nObesidad.\n-\nDesnutrici\u00f3n grave.\n-\nEnfermedad cardiovascular cr\u00f3nica: insuficiencia card\u00edaca, enfermedad coronaria, valvulopat\u00edas, miocardiopat\u00edas, hipertensi\u00f3n pulmonar.\n-\nEnfermedad renal cr\u00f3nica (incluidos pacientes en di\u00e1lisis cr\u00f3nica). S\u00edndrome nefr\u00f3tico.\n-\nEnfermedad respiratoria cr\u00f3nica: enfermedad pulmonar obstructiva cr\u00f3nica [EPOC], fibrosis qu\u00edstica, enfermedad intersticial pulmonar, asma grave.\n-\nCirrosis.\n-\nVIH independientemente del recuento de CD4 y niveles de carga viral.\n-\nLista de espera para trasplante de \u00f3rganos s\u00f3lidos y trasplantados de \u00f3rganos s\u00f3lidos.\n-\nDiscapacidad Intelectual y del desarrollo.\n-\nEnfermedad oncol\u00f3gica y/o oncohematol\u00f3gica con diagn\u00f3stico reciente o enfermedad \u201cACTIVA\u201d.\n-\nTuberculosis activa.\n-\nS\u00edndrome de Down.\n-\nEnfermedades reum\u00e1ticas Inflamatorias Cr\u00f3nicas Autoinmune (ERICA) y personas que reciben tratamientos inmunosupresores.\n-\nInmunodeficiencias primarias.\n-\nPara m\u00e1s informaci\u00f3n consultar en:\n[https://bancos.salud.gob.ar/recurso/resumen-de-recomendaciones-vigentes-para-la-campana-nacional-de-vacunacion-contra-la-covid](blank:#https://bancos.salud.gob.ar/recurso/resumen-de-recomendaciones-vigentes-para-la-campana-nacional-de-vacunacion-contra-la-covid)\n14. La vacunaci\u00f3n contra COVID-19 en Argentina, \u00bfes obligatoria?\nNo, la vacunaci\u00f3n contra COVID-19 no es obligatoria. Desde el Ministerio de Salud de la Naci\u00f3n y el Programa Ampliado de Inmunizaciones se aboga por construir y fomentar la aceptaci\u00f3n y confianza en la vacunaci\u00f3n como una estrategia de salud p\u00fablica solidaria, equitativa y beneficiosa para el bienestar y la salud de las personas y de la poblaci\u00f3n, basada en evidencia cient\u00edfica contundente y que ha salvado millones de vidas en el mundo como medida primaria de prevenci\u00f3n. As\u00ed es que, en Argentina, la mayor parte de la poblaci\u00f3n comprende los beneficios individuales y colectivos de la vacunaci\u00f3n y la acepta voluntariamente.\n15. \u00bfLa vacuna contra COVID-19 es de acceso gratuito?\nLa campa\u00f1a de vacunaci\u00f3n contra la COVID-19 se est\u00e1 implementando, desde el sector p\u00fablico, garantizando el acceso gratuito a la vacuna para la poblaci\u00f3n a partir de los 6 meses de edad.\n16. \u00bfC\u00f3mo se realiza el registro de las dosis aplicadas?\nSeg\u00fan consta en el Plan Estrat\u00e9gico aprobado por la R.M. 2883/2020, todas las dosis aplicadas de vacunas contra la COVID-19 en Argentina deben ser registradas en el Registro Nominal de Vacunaci\u00f3n (NOMIVAC) siendo de car\u00e1cter obligatorio. En el registro constan los datos de fecha de vacunaci\u00f3n, vacuna recibida, lote, n\u00famero de dosis, entre otros.\nEste hecho tiene como objetivo contar con la informaci\u00f3n en tiempo real necesaria para realizar un adecuado seguimiento de las personas vacunadas.\n17. \u00bfEs posible conocer c\u00f3mo avanza la campa\u00f1a de vacunaci\u00f3n en el pa\u00eds?\nS\u00ed. El monitor de vacunaci\u00f3n muestra datos en tiempo real sobre dosis distribuidas, dosis aplicadas en todo el pa\u00eds, as\u00ed como dosis aplicadas por condici\u00f3n y por sexo. Esta informaci\u00f3n es actualizada dos veces por d\u00eda y es de acceso p\u00fablico.\nPara conocer el monitor p\u00fablico de vacunaci\u00f3n, puede acceder a:\n[https://www.argentina.gob.ar/coronavirus/vacuna/aplicadas](blank:#https://www.argentina.gob.ar/coronavirus/vacuna/aplicadas)\nTambi\u00e9n es posible conocer la informaci\u00f3n sobre la seguridad de las vacunas aplicadas en Argentina a trav\u00e9s de los informes semanales disponibles en:\n[https://www.argentina.gob.ar/coronavirus/vacuna/equipos-salud/informes-seguridad](blank:#https://www.argentina.gob.ar/coronavirus/vacuna/equipos-salud/informes-seguridad)\nPara mayor informaci\u00f3n de las recomendaciones, lineamientos y manuales del/de la vacunador/a puede consultar en:\n[https://bancos.salud.gob.ar/recurso/resumen-de-recomendaciones-vigentes-para-la-campana-nacional-de-vacunacion-contra-la-covid](blank:#https://bancos.salud.gob.ar/recurso/resumen-de-recomendaciones-vigentes-para-la-campana-nacional-de-vacunacion-contra-la-covid)\n[https://www.argentina.gob.ar/coronavirus/vacuna/equipos-salud/lineamientos-manual-vacunador](blank:#https://www.argentina.gob.ar/coronavirus/vacuna/equipos-salud/lineamientos-manual-vacunador)\n18. \u00bfLas diferentes vacunas disponibles son intercambiables (se puede completar esquema con una vacuna diferente)?\nSi. Las diferentes vacunas disponibles son intercambiables.\n19. \u00bfSe puede coadministrar la vacuna contra la COVID-19 con otras vacunas?\nS\u00ed, las vacunas contra la COVID-19 se pueden coadministrar junto con cualquier otra vacuna, pudi\u00e9ndose aplicar el mismo d\u00eda (en sitios diferentes) o d\u00edas diferentes sin requerir intervalo entre las dosis. De esta manera no se atrasan los esquemas del resto de las vacunas.\n20. \u00bfQu\u00e9 se considera esquema primario?\nEs el esquema inicial de vacunaci\u00f3n para garantizar una respuesta inmunol\u00f3gica inicial suficiente. El n\u00famero de dosis es variable, dependiendo de la edad y de la vacuna que hayas recibido.\n- Si recibiste Cansino o Sputnik light, tu esquema primario es una dosis.\n- Si recibiste AstraZ\u00e9neca/Covishield, Sputnik V, Pfizer-BioNTech o Moderna, Sinopharm tu esquema primario es de dos dosis.\n- Si recibiste Sinopharm y sos menor de 50 a\u00f1os, tu esquema primario es de dos dosis.\n- Si recibiste Sinopharm y sos mayor de 50 a\u00f1os, tu esquema primario es de dos dosis m\u00e1s una adicional.\n- Si ten\u00e9s inmunocompromiso, tu esquema primario es de dos dosis m\u00e1s una dosis adicional independiente de la vacuna utilizada.\n21. \u00bfQu\u00e9 significa dosis adicional y dosis refuerzo?\nDosis adicional: es la administraci\u00f3n de una tercera dosis como parte del esquema primario, cuando la respuesta inmune inicial es probablemente insuficiente. O sea, se agrega una tercera dosis al esquema. Otras vacunas con esquema primario de 3 dosis son, por ejemplo, la vacuna qu\u00edntuple y la vacuna contra la Polio.\nDosis de refuerzo o booster: es la administraci\u00f3n de una dosis de vacuna luego de un esquema primario completo con respuesta inmunol\u00f3gica inicial suficiente, teniendo en cuenta la posible disminuci\u00f3n de la respuesta en el tiempo. Se aplica peri\u00f3dicamente con un intervalo que no suele ser menor a los 4 meses. Otras vacunas con refuerzo son, por ejemplo, la triple viral y la doble bacteriana.\n22. \u00bfQui\u00e9nes tienen que recibir una dosis adicional?\n- Personas de 50 a\u00f1os o mayores que hayan recibido un esquema primario de vacuna a virus inactivado (Sinopharm).\n- Personas con inmunocompromiso, independientemente del esquema primario recibido:\n- Tratamiento oncol\u00f3gico para tumores s\u00f3lidos y onco-hematol\u00f3gicos.\n- Receptores de trasplante de \u00f3rgano s\u00f3lido en tratamiento inmunosupresor.\n- Receptores de trasplante de c\u00e9lulas progenitoras hematopoy\u00e9ticas en los \u00faltimos 2 a\u00f1os o en tratamiento inmunosupresor.\n- Inmunodeficiencia primaria moderada o grave.\n- Personas que viven con VIH independientemente del recuento de CD4 y niveles de carga viral.\n- Tratamiento activo con corticosteroides en dosis altas o medicaci\u00f3n inmunosupresora.\n- Insuficiencia renal cr\u00f3nica en hemodi\u00e1lisis.\n- Enfermedades autoinmunes y/o tratamientos con inmunosupresores, inmunomoduladores o biol\u00f3gicos.\n[https://bancos.salud.gob.ar/recurso/resumen-de-recomendaciones-vigentes-para-la-campana-nacional-de-vacunacion-contra-la-covid](blank:#https://bancos.salud.gob.ar/recurso/resumen-de-recomendaciones-vigentes-para-la-campana-nacional-de-vacunacion-contra-la-covid)\n[https://www.argentina.gob.ar/coronavirus/vacuna/equipos-salud/lineamientos-manual-vacunador](blank:#https://www.argentina.gob.ar/coronavirus/vacuna/equipos-salud/lineamientos-manual-vacunador)\n23. \u00bfCu\u00e1l es el intervalo m\u00ednimo para recibir la dosis adicional?\nPara la aplicaci\u00f3n de la dosis adicional, DEBER\u00c1N HABER PASADO AL MENOS 4 SEMANAS desde la aplicaci\u00f3n de la \u00faltima dosis.\n24 \u00bfQui\u00e9nes tienen que recibir la dosis de refuerzo o booster?\nTodas las personas a partir de los 6 meses de edad que hayan completado su esquema primario deben contar al menos con un refuerzo aplicado en los \u00faltimos 6 meses (independientemente de la cantidad de refuerzos recibidos previamente).\n25. \u00bfCon qu\u00e9 frecuencia se deben aplicar los refuerzos?\nSe continuar\u00e1n con sucesivas dosis de refuerzo con la periodicidad de acuerdo a las siguientes recomendaciones:\nAlto riesgo de enfermedad grave:\n- personas de 50 a\u00f1os o mayores, personas con inmunocompromiso y personas gestantes\n- dosis de refuerzo a los 6 meses (independiente del n\u00famero de refuerzos) y continuar con esta periodicidad\nDosis de refuerzo con intervalo de 6 meses desde la \u00faltima dosis y continuidad de dosis de refuerzos cada 6 meses:\nPoblaci\u00f3n considerada de alto riesgo de enfermedad grave:\n- Personas de 50 a\u00f1os o mayores.\n- Personas gestantes en cualquier trimestre del embarazo.\n- Personas con VIH independientemente del recuento de CD4 y niveles de carga viral.\n- Personas en lista de espera para trasplante de \u00f3rganos s\u00f3lidos y trasplantadas de \u00f3rganos s\u00f3lidos.\n- Personas con enfermedad oncol\u00f3gica y/o oncohematol\u00f3gica con diagn\u00f3stico reciente o enfermedad \u201cACTIVA\u201d.\n- Personas con Enfermedades Reum\u00e1ticas Inflamatorias Cr\u00f3nicas Autoinmune (ERICA) y aquellas que reciben tratamientos inmunosupresores.\n- Personas con inmunodeficiencias primarias.\n- Personas receptoras de trasplante de c\u00e9lulas progenitoras hematopoy\u00e9ticas en los \u00faltimos 2 a\u00f1os o en tratamiento inmunosupresor.\n- Personas que reciben tratamiento activo con corticosteroides en dosis altas o medicaci\u00f3n inmunosupresora\nDosis de refuerzo con intervalo de 6 meses desde la \u00faltima dosis y continuidad de dosis de refuerzos anuales:}\nPoblaci\u00f3n considerada de riesgo intermedio de enfermedad grave:\n- Obesidad.\n- Diabetes tipo 1 o 2 (insulinodependiente y no insulinodependiente).\n- Desnutrici\u00f3n grave.\n- Enfermedad cardiovascular cr\u00f3nica: insuficiencia card\u00edaca, enfermedad coronaria, valvulopat\u00edas, miocardiopat\u00edas, hipertensi\u00f3n pulmonar.\n- Enfermedad renal cr\u00f3nica (incluidos pacientes en di\u00e1lisis cr\u00f3nica).\n- S\u00edndrome nefr\u00f3tico.\n- Enfermedad respiratoria cr\u00f3nica: enfermedad pulmonar obstructiva cr\u00f3nica [EPOC], fibrosis qu\u00edstica, enfermedad intersticial pulmonar, asma grave.\n- Cirrosis.\n- Tuberculosis activa.\n- S\u00edndrome de Down.\n- Discapacidad Intelectual y del desarrollo.\nPoblaci\u00f3n con mayor exposici\u00f3n laboral a la infecci\u00f3n por SARS-CoV-2: - Personal de salud.\n- Personal estrat\u00e9gico.\nDosis de refuerzo con intervalo de 12 meses desde la \u00faltima dosis y continuidad de dosis de refuerzos anuales:\nPoblaci\u00f3n considerada de riesgo bajo de enfermedad grave: personas entre 6 meses y 49 a\u00f1os inclusive sin comorbilidades.\n26. \u00bfCu\u00e1l es el intervalo m\u00ednimo para la dosis refuerzo o booster?\nLa dosis de refuerzo o booster, SE DEBER\u00c1 APLICAR A PARTIR DE 4 MESES (120 D\u00cdAS) desde la \u00faltima dosis.\nPoblaci\u00f3n Objetivo\n27. \u00bfCu\u00e1l es la poblaci\u00f3n objetivo a vacunar?\nLa vacunaci\u00f3n contra la COVID-19 est\u00e1 destinada a toda la poblaci\u00f3n a partir de los 6 meses.\nAdolescentes entre 12 y 17 a\u00f1os\n28. \u00bfQu\u00e9 vacunas est\u00e1n disponibles para adolescentes entre 12 y 17 a\u00f1os?\nLas vacunas de MODERNA, y PFIZER y Sinopharm, han sido autorizadas para su uso en la poblaci\u00f3n de personas de 12 a\u00f1os y m\u00e1s.\nNi\u00f1os y ni\u00f1as entre los 6 meses y los 11 a\u00f1os\n29. \u00bfQu\u00e9 vacunas est\u00e1n disponibles para uso en menores de 12 a\u00f1os en el pa\u00eds?\nA la fecha, se encuentran autorizadas las siguientes vacunas para esta poblaci\u00f3n:\nLa vacuna inactivada de SINOPHARM: disponible para personas de 3 a\u00f1os y mayores.\nLa vacuna ARNm de Moderna disponible para personas a partir de los 6 meses de edad.\nVacuna Pfizer-BioNTech disponible para personas a partir de los 5 a\u00f1os.\n30. \u00bfEs segura la vacunaci\u00f3n en las infancias?\nSi. Las vacunas autorizadas para el uso en las infancias (Pfizer-BioNTech, Moderna y Sinopharm) demostraron perfil de seguridad adecuado en las fases de investigaci\u00f3n. Adem\u00e1s, la seguridad de las vacunas se contin\u00faa vigilando permanentemente.\nToda la informaci\u00f3n sobre seguridad est\u00e1 disponible en:\n[https://bancos.salud.gob.ar/recurso/resumen-de-recomendaciones-vigentes-para-la-campana-nacional-de-vacunacion-contra-la-covid](blank:#https://bancos.salud.gob.ar/recurso/resumen-de-recomendaciones-vigentes-para-la-campana-nacional-de-vacunacion-contra-la-covid)\n[https://www.argentina.gob.ar/coronavirus/vacuna/equipos-salud/informes-seguridad](blank:#https://www.argentina.gob.ar/coronavirus/vacuna/equipos-salud/informes-seguridad)\n31. \u00bfPor qu\u00e9 vacunar en las infancias?\nSi bien la infecci\u00f3n por SARS-CoV-2 tiende a ser m\u00e1s leve en la poblaci\u00f3n pedi\u00e1trica respecto a la adulta, los ni\u00f1os y las ni\u00f1as pueden enfermar gravemente, requerir internaci\u00f3n y presentar secuelas que son m\u00e1s frecuentes en quienes tengan alguna afecci\u00f3n m\u00e9dica subyacente. A su vez, en caso de infectarse, podr\u00edan desarrollar complicaciones graves como el s\u00edndrome inflamatorio multisist\u00e9mico, una afecci\u00f3n en las que se inflaman diferentes partes del cuerpo (coraz\u00f3n, pulm\u00f3n, \u00f3rganos gastrointestinales, entre otros).\n32. \u00bfQu\u00e9 otros beneficios tendr\u00eda vacunar a esta poblaci\u00f3n?\n- La vacunaci\u00f3n de ni\u00f1os, ni\u00f1as y adolescentes permite la prevenci\u00f3n de enfermedad severa y complicaciones de la COVID-19 y ayuda a disminuir la transmisi\u00f3n del virus a la poblaci\u00f3n vulnerable.\n- Mantiene al sistema sanitario sin riesgo de saturaci\u00f3n y colapso al disminuir el n\u00famero de personas que pueden enfermarse gravemente en el caso de contraer COVID-19.\n- Mantiene la presencialidad en las escuelas y permite participar de manera m\u00e1s segura en actividades deportivas, art\u00edsticas, juegos y otras actividades grupales.\n- Reduce el n\u00famero de personas susceptibles al contagio y por lo tanto la circulaci\u00f3n viral de las nuevas variantes del virus.\n33. \u00bfQui\u00e9nes necesitan una dosis adicional?\nIndependientemente del esquema primario recibido y la edad recibir\u00e1n una dosis adicional a los 28 d\u00edas de la segunda quienes tengan los siguientes factores de riesgo:\n- Tratamiento oncol\u00f3gico para tumores s\u00f3lidos y onco-hematol\u00f3gicos.\n- Trasplante de \u00f3rgano s\u00f3lido en tratamiento inmunosupresor.\n- Trasplante de c\u00e9lulas progenitoras hematopoy\u00e9ticas en los \u00faltimos 2 a\u00f1os o en tratamiento inmunosupresor.\n- Inmunodeficiencia primaria moderada o grave\n- VIH independientemente del recuento de CD4 y nivel de Carga Viral.\n- Tratamiento activo con corticosteroides en dosis altas o medicaci\u00f3n inmunosupresora.\n34. \u00bfTiene que recibir refuerzo la poblaci\u00f3n pedi\u00e1trica?\nSi, la evidencia disponible a nivel internacional sobre el uso de un refuerzo en personas a partir de los 6 meses muestra ser una estrategia recomendable considerando la situaci\u00f3n epidemiol\u00f3gica actual, la seguridad demostrada por las vacunas contra la COVID-19 y la necesidad de prolongar la protecci\u00f3n contra internaci\u00f3n, complicaciones y mortalidad por COVID-19 as\u00ed como el riesgo de secuelas a largo plazo (long COVID) a\u00fan en casos de enfermedad leve.\nSituaciones especiales\n35. \u00bfLas personas gestantes y/o en per\u00edodo de lactancia pueden vacunarse?\nSe recomienda la vacunaci\u00f3n contra COVID-19 en personas gestantes en cualquier trimestre del embarazo, incluy\u00e9ndose como un grupo espec\u00edfico priorizado dentro de la poblaci\u00f3n objetivo, sin necesidad de presentar una orden m\u00e9dica para la vacunaci\u00f3n.\n[https://bancos.salud.gob.ar/recurso/resumen-de-recomendaciones-vigentes-para-la-campana-nacional-de-vacunacion-contra-la-covid](blank:#https://bancos.salud.gob.ar/recurso/resumen-de-recomendaciones-vigentes-para-la-campana-nacional-de-vacunacion-contra-la-covid) [Memor\u00e1ndum | \"Recomendaci\u00f3n de vacunaci\u00f3n contra la COVID-19 en personas gestantes\"](blank:#https://bancos.salud.gob.ar/recurso/recomendacion-de-vacunacion-contra-la-covid-19-en-personas-gestantes).\n36. Si recib\u00ed la vacuna y estoy amamantando \u00bfdebe suspenderse la lactancia?\nNo se recomienda interrumpir la lactancia.\n37. \u00bfEst\u00e1 indicada la vacunaci\u00f3n para las personas que presenten alg\u00fan grado de inmunocompromiso?\nEst\u00e1n incluidas dentro de los grupos priorizados por mayor riesgo de presentar enfermedad grave, complicaciones y muerte, las personas menores de 50 a\u00f1os:\n- Que viven con VIH independientemente del recuento de CD4 y niveles de carga viral.\n- En lista de espera para trasplante de \u00f3rganos s\u00f3lidos y que hayan recibido trasplante de \u00f3rganos s\u00f3lidos.\n- Con enfermedad oncol\u00f3gica y/o oncohematol\u00f3gicas con diagn\u00f3stico reciente o enfermedad \u201cACTIVA\u201d (menos de 1 a\u00f1o desde el diagn\u00f3stico; tratamiento actual o haber recibido tratamiento inmunosupresor en los \u00faltimos 12 meses; enfermedad en reca\u00edda o no controlada).\n- Personas con enfermedades autoinmunes y/o tratamientos inmunosupresores, inmunomoduladores o biol\u00f3gicos.\n38. \u00bfSe pueden vacunar las personas que recibieron tratamiento con anticuerpos monoclonales contra SARS-CoV-2 o plasma de convaleciente?\nSe recomienda que la vacunaci\u00f3n se posponga durante al menos 90 d\u00edas desde el tratamiento para evitar su interferencia en la respuesta inmune inducida por la vacuna.\n39. \u00bfDebo vacunarme si tengo indicaci\u00f3n y estoy cursando una infecci\u00f3n aguda por SARS-CoV-2?\nLas dosis del esquema inicial (primera dosis, segunda dosis y dosis adicional si corresponde), pueden aplicarse cuando se hayan cumplido los criterios de alta cl\u00ednica y epidemiol\u00f3gica en personas con diagn\u00f3stico de COVID-19.\nPara el caso de la dosis de refuerzo, para optimizar la respuesta inmunol\u00f3gica en personas con diagn\u00f3stico COVID-19 se recomienda diferirla por lo menos 90 d\u00edas una vez cumplidos los criterios de alta, si transcurrieron al menos 4 meses desde la aplicaci\u00f3n de la \u00faltima dosis\n40. Si ya tuve COVID-19 y me recuper\u00e9 \u00bfdebo vacunarme?\nS\u00ed. La vacunaci\u00f3n es independiente del antecedente de haber padecido la enfermedad. Para el caso de la dosis de refuerzo, para optimizar la respuesta inmunol\u00f3gica en personas con diagn\u00f3stico COVID-19 se recomienda diferirla por lo menos 90 d\u00edas una vez cumplidos los criterios de alta, si transcurrieron al menos 4 meses desde la aplicaci\u00f3n de la \u00faltima dosis.\nSeguridad\n41. \u00bfC\u00f3mo se realiza el monitoreo de la seguridad de las vacunas?\nLa vigilancia de eventos supuestamente atribuibles a la vacunaci\u00f3n e inmunizaci\u00f3n (ESAVI) se realiza mediante el reporte al Ministerio de Salud de la Naci\u00f3n de los eventos que ocurran en todo el pa\u00eds, estos son luego analizados por cada jurisdicci\u00f3n y por la CoNaSeVa (Comisi\u00f3n Nacional de Seguridad en Vacunas) tomando medidas dependiendo del caso y seg\u00fan normativas vigentes nacionales e internacionales.\nPara m\u00e1s informaci\u00f3n consultar en:\n[https://www.argentina.gob.ar/coronavirus/vacuna/equipos-salud/seguridad](blank:#https://www.argentina.gob.ar/coronavirus/vacuna/equipos-salud/seguridad)\nSobre las vacunas utilizadas en Argentina\n42. \u00bfLas vacunas evitan la infecci\u00f3n por coronavirus?\nTodas las vacunas contra COVID-19 demostraron eficacia cercana del 100% para prevenir enfermedad grave y muerte. Tambi\u00e9n redujeron el riesgo de desarrollo de enfermedad sintom\u00e1tica en porcentajes significativos. Alcanzar altas coberturas en la poblaci\u00f3n a partir de los 6 meses podr\u00eda impactar en la circulaci\u00f3n viral.\n43. \u00bfCu\u00e1l es el intervalo m\u00ednimo entre las dosis de esquema primario para cada vacuna seg\u00fan la evidencia cient\u00edfica?\nSeg\u00fan la plataforma de desarrollo de cada vacuna en funci\u00f3n de la evidencia cient\u00edfica, los datos de eficacia/efectividad y las oportunidades respecto a la implementaci\u00f3n se recomendaron los siguientes intervalos m\u00ednimos:\n[Descargar archivo](blank:#https://www.argentina.gob.ar/sites/default/files/p_43.pdf)\nRecordar que la vacuna de CanSino y Sputnik light son solo una dosis\nPara mayor informaci\u00f3n consultar en:\n[https://bancos.salud.gob.ar/recurso/resumen-de-recomendaciones-vigentes-para-la-campana-nacional-de-vacunacion-contra-la-covid](blank:#https://bancos.salud.gob.ar/recurso/resumen-de-recomendaciones-vigentes-para-la-campana-nacional-de-vacunacion-contra-la-covid)\n[https://www.argentina.gob.ar/coronavirus/vacuna/equipos-salud/lineamientos-manual-vacunador](blank:#https://www.argentina.gob.ar/coronavirus/vacuna/equipos-salud/lineamientos-manual-vacunador)\n44. Una vez que te aplic\u00e1s la vacuna \u00bfdesde qu\u00e9 momento te protege?\nLa protecci\u00f3n de la vacuna no es inmediata. Los esquemas que contemplan una serie de 2 dosis, tomar\u00e1 al menos 2 semanas luego de la segunda dosis para considerar que la protecci\u00f3n es adecuada.\n45. \u00bfQu\u00e9 recaudos hay que tomar luego de aplicarse la vacuna?\nAnte la ocurrencia de cualquier s\u00edntoma posterior a la vacunaci\u00f3n, se debe consultar al centro de salud m\u00e1s cercano.\nSe recomienda el uso de ibuprofeno/paracetamol ante la aparici\u00f3n de fiebre despu\u00e9s de la vacunaci\u00f3n.\nM\u00e1s frecuentes:\n- Locales: dolor espont\u00e1neo o a la palpaci\u00f3n en el sitio de la inyecci\u00f3n, hiperemia, hinchaz\u00f3n\n- Generales: cefalea, fatiga, dolor muscular, malestar general, fiebre, escalofr\u00edos, dolor articular y n\u00e1useas.\nLas personas vacunadas deber\u00e1n estar alertas y consultar ante la aparici\u00f3n de s\u00edntomas posteriores a la vacunaci\u00f3n.\nPara m\u00e1s informaci\u00f3n sobre seguridad de las vacunas:\n[https://bancos.salud.gob.ar/recurso/resumen-de-recomendaciones-vigentes-para-la-campana-nacional-de-vacunacion-contra-la-covid](blank:#https://bancos.salud.gob.ar/recurso/resumen-de-recomendaciones-vigentes-para-la-campana-nacional-de-vacunacion-contra-la-covid)\n[https://www.argentina.gob.ar/coronavirus/vacuna/equipos-salud/lineamientos-manual-vacunador](blank:#https://www.argentina.gob.ar/coronavirus/vacuna/equipos-salud/lineamientos-manual-vacunador)\n[https://www.argentina.gob.ar/coronavirus/vacuna/equipos-salud/seguridad](blank:#https://www.argentina.gob.ar/coronavirus/vacuna/equipos-salud/seguridad)\n46. \u00bfCu\u00e1les son las contraindicaciones o precauciones para recibir las vacunas que se utilizan actualmente?\nLas contraindicaciones absolutas, temporales y precauciones generales para todas las vacunas que actualmente se administran en Argentina son las siguientes:\nSe entiende por \u201cambiente controlado\u201d: Instituci\u00f3n de salud con servicio de emergencia y/o cuidados cr\u00edticos que cuenta con personal m\u00e9dico y de enfermer\u00eda entrenado para el manejo de anafilaxia y reacciones al\u00e9rgicas graves. El/la paciente debe permanecer en observaci\u00f3n durante 30 minutos.\nLas vacunas de ARNm, COMIRNATY (Pfizer-BioNTech), contienen POLIETILENGLICOL (PEG) que tambi\u00e9n puede estar presente en algunos cosm\u00e9ticos, geles de ba\u00f1o y medicamentos.\n[https://bancos.salud.gob.ar/recurso/resumen-de-recomendaciones-vigentes-para-la-campana-nacional-de-vacunacion-contra-la-covid](blank:#https://bancos.salud.gob.ar/recurso/resumen-de-recomendaciones-vigentes-para-la-campana-nacional-de-vacunacion-contra-la-covid)\nCUADRO COMPARATIVO DE LOS COMPONENTES DE LAS VACUNAS DISPONIBLES CONTRA LA COVID-19\n[Descargar archivo](blank:#https://www.argentina.gob.ar/sites/default/files/p46-completo.pdf)\n47. \u00bfPuede haber un \u201cfalso positivo\u201d en un test diagn\u00f3stico para SARS-CoV-2 por haberse aplicado alguna de las vacunas?\nNo. Ninguna de las vacunas que se aplican en Argentina poseen la capacidad de replicar el virus SARS-CoV 2 y desarrollar la enfermedad. En el caso de presentar s\u00edntomas compatibles con COVID-19 y PCR positiva, existen m\u00faltiples posibilidades, en orden decreciente de probabilidad:\n1-Personas que fueron vacunadas inadvertidamente durante el per\u00edodo de incubaci\u00f3n de la enfermedad.\n2-Personas que se infectaron pocos d\u00edas post-vacunaci\u00f3n, ya que la respuesta del sistema inmune demora hasta 28 d\u00edas, y si bien se conoce su protecci\u00f3n frente a la enfermedad, a\u00fan se desconoce su posible efecto protector sobre la infecci\u00f3n.\n3- Personas que se enfermaron a pesar del efecto protector de la vacuna, ya que las mismas no ofrecen una protecci\u00f3n del 100%.\n48. \u00bfPierden efectividad las vacunas frente a las nuevas variantes de SARS-CoV-2?\nSeg\u00fan los datos disponibles hasta el momento, todas las vacunas son eficaces y efectivas frente a las hospitalizaciones y muertes causadas por el SARS-CoV-2, tanto frente a los linajes que han circulado desde los inicios de la pandemia como a las variantes, de m\u00e1s reciente aparici\u00f3n. Es fundamental para mantener la protecci\u00f3n en el tiempo la aplicaci\u00f3n de los refuerzos.\n49. \u00bfPuede la vacuna producir la muerte si se recibe en el periodo de incubaci\u00f3n de la enfermedad?\nNo hay ninguna evidencia cient\u00edfica que indique que vacunarse estando en per\u00edodo de incubaci\u00f3n pueda producir complicaciones de gravedad ni la muerte.\n50. \u00bfCu\u00e1l es la recomendaci\u00f3n actual sobre la utilizaci\u00f3n de las vacunas contra coronavirus respecto a la ocurrencia de casos de trombosis venosa?\nLa Comisi\u00f3n Nacional de Seguridad en Vacunas (CoNaSeVa) recomienda continuar con la aplicaci\u00f3n de vacunas contra COVID-19 seg\u00fan los lineamientos elaborados por el Ministerio de Salud de la Naci\u00f3n.\nEsta recomendaci\u00f3n se bas\u00f3 en que, si bien la vacunaci\u00f3n con vectores virales puede resultar en el raro desarrollo de trombocitopenia tromb\u00f3tica inmune mediada por anticuerpos, hasta el momento la presentaci\u00f3n de estos eventos posteriores a la aplicaci\u00f3n de las vacunas contra COVID-19 se registr\u00f3 con muy baja frecuencia; no se han identificado factores de riesgo asociados a este evento y la infecci\u00f3n por SARS-CoV-2 tambi\u00e9n implica un riesgo significativo de desarrollar trombosis.\n51. \u00bfEs recomendable realizarte un test de anticuerpos contra SARS-CoV-2 luego de haber recibido la vacuna contra COVID-19?\nNo, no se recomienda realizar un test de anticuerpos luego de vacunarte porque si el test de anticuerpos te da negativo, no quiere decir que no est\u00e9s inmunizado. Del mismo modo, si te da positivo, no quiere decir que no puedas contagiarte y contagiar SARS CoV-2 o tener COVID-19.\nPor ello, lo m\u00e1s importante es que recuerdes que, a\u00fan estando vacunado, es fundamental continuar con las medidas de protecci\u00f3n, como el uso de tapaboca o barbijo, las medidas de higiene de manos y respiratoria, la ventilaci\u00f3n de los ambientes y el distanciamiento social.\n52. \u00bfCu\u00e1les son las causas por las que, luego de vacunarme, un test de anticuerpos contra SARS-CoV-2 podr\u00eda darme negativo?\nEn la Argentina existen diversos dispositivos de diagn\u00f3stico aprobados por la ANMAT que buscan detectar anticuerpos pero no todos son capaces de identificar el tipo y la calidad de los anticuerpos generados por las vacunas que se utilizan actualmente en Argentina. Con lo cual, un resultado negativo no implica que tu cuerpo no haya generado una respuesta inmune contra COVID-19.\n53. \u00bfSi despu\u00e9s de vacunarme no tuve fiebre, dolor de cuerpo, cefalea o cualquier otro s\u00edntoma, quiere decir que la vacuna no me hizo efecto?\nNO. No hay relaci\u00f3n en lo que sientas inmediatamente luego de vacunarte y la producci\u00f3n de inmunidad generada por la vacuna. Record\u00e1 consultar a profesionales de la salud ante la presencia de cualquier s\u00edntoma luego de haber recibido la vacuna.", "language": null, "image": "https://www.argentina.gob.ar/sites/default/files/argentina-fb.png", "pagetype": null, "links": ["#main-content", "/", "https://mi.argentina.gob.ar", "#", "#", "https://mi.argentina.gob.ar", "/", "/salud", "/coronavirus/vacuna", "https://www.facebook.com/sharer/sharer.php?u=https%3A%2F%2Fwww.argentina.gob.ar%2Fcoronavirus%2Fvacuna%2Fpreguntas-frecuentes&amp;title=Preguntas+frecuentes+sobre+la+vacuna+contra+COVID-19", "https://twitter.com/share?url=https%3A%2F%2Fwww.argentina.gob.ar%2Fcoronavirus%2Fvacuna%2Fpreguntas-frecuentes&amp;title=Preguntas+frecuentes+sobre+la+vacuna+contra+COVID-19", "https://www.linkedin.com/shareArticle?mini=true&url=https%3A%2F%2Fwww.argentina.gob.ar%2Fcoronavirus%2Fvacuna%2Fpreguntas-frecuentes", "https://web.whatsapp.com/send?text=https%3A%2F%2Fwww.argentina.gob.ar%2Fcoronavirus%2Fvacuna%2Fpreguntas-frecuentes", "https://t.me/share/url?url=https%3A%2F%2Fwww.argentina.gob.ar%2Fcoronavirus%2Fvacuna%2Fpreguntas-frecuentes", "#1", "#2", "#3", "#4", "#5", "#6", "#7", "#8", "#9", "#10", "#11", "#12", "#13", "#14", "#15", "#16", "#17", "#18", "#19", "#20", "#21", "#22", "#23", "#24", "#25", "#26", "#27", "#28", "#29", "#30", "#31", "#32", "#33", "#34", "#35", "#36", "#37", "#38", "#39", "#40", "#41", "#42", "#43", "#44", "#45", "#46", "#47", "#48", "#49", "#50", "#51", "#52", "#53", "#indice", "#indice", "blank:#https://www.argentina.gob.ar/coronavirus/vacuna/cuales", "#indice", "#indice", "/normativa/nacional/ley-27573-343958", "/normativa/nacional/resoluci\u00f3n-2883-2020-345799", "#indice", "https://www.argentina.gob.ar/sites/default/files/liberacion_de_lotes_vacunas.pdf", "#indice", "#indice", "#indice", "#indice", "#indice", "#indice", "blank:#https://www.argentina.gob.ar/coronavirus/vacuna/equipos-salud/lineamientos-manual-vacunador", "#indice", "blank:#https://bancos.salud.gob.ar/recurso/resumen-de-recomendaciones-vigentes-para-la-campana-nacional-de-vacunacion-contra-la-covid", "#indice", "#indice", "#indice", "#indice", "blank:#https://www.argentina.gob.ar/coronavirus/vacuna/aplicadas", "blank:#https://www.argentina.gob.ar/coronavirus/vacuna/equipos-salud/informes-seguridad", "blank:#https://bancos.salud.gob.ar/recurso/resumen-de-recomendaciones-vigentes-para-la-campana-nacional-de-vacunacion-contra-la-covid", "blank:#https://www.argentina.gob.ar/coronavirus/vacuna/equipos-salud/lineamientos-manual-vacunador", "#indice", "#indice", "#indice", "#indice", "#indice", "blank:#https://bancos.salud.gob.ar/recurso/resumen-de-recomendaciones-vigentes-para-la-campana-nacional-de-vacunacion-contra-la-covid", "blank:#https://www.argentina.gob.ar/coronavirus/vacuna/equipos-salud/lineamientos-manual-vacunador", "#indice", "#indice", "#indice", "#indice", "#indice", "#indice", "#indice", "#indice", "blank:#https://bancos.salud.gob.ar/recurso/resumen-de-recomendaciones-vigentes-para-la-campana-nacional-de-vacunacion-contra-la-covid", "blank:#https://www.argentina.gob.ar/coronavirus/vacuna/equipos-salud/informes-seguridad", "#indice", "#indice", "#indice", "#indice", "#indice", "blank:#https://bancos.salud.gob.ar/recurso/resumen-de-recomendaciones-vigentes-para-la-campana-nacional-de-vacunacion-contra-la-covid", "blank:#https://bancos.salud.gob.ar/recurso/recomendacion-de-vacunacion-contra-la-covid-19-en-personas-gestantes", "#indice", "#indice", "#indice", "#indice", "#indice", "#indice", "blank:#https://www.argentina.gob.ar/coronavirus/vacuna/equipos-salud/seguridad", "#indice", "#indice", "blank:#https://www.argentina.gob.ar/sites/default/files/p_43.pdf", "blank:#https://bancos.salud.gob.ar/recurso/resumen-de-recomendaciones-vigentes-para-la-campana-nacional-de-vacunacion-contra-la-covid", "blank:#https://www.argentina.gob.ar/coronavirus/vacuna/equipos-salud/lineamientos-manual-vacunador", "#indice", "#indice", "blank:#https://bancos.salud.gob.ar/recurso/resumen-de-recomendaciones-vigentes-para-la-campana-nacional-de-vacunacion-contra-la-covid", "blank:#https://www.argentina.gob.ar/coronavirus/vacuna/equipos-salud/lineamientos-manual-vacunador", "blank:#https://www.argentina.gob.ar/coronavirus/vacuna/equipos-salud/seguridad", "#indice", "blank:#https://www.argentina.gob.ar/sites/default/files/p_46.pdf", "blank:#https://bancos.salud.gob.ar/recurso/resumen-de-recomendaciones-vigentes-para-la-campana-nacional-de-vacunacion-contra-la-covid", "blank:#https://www.argentina.gob.ar/sites/default/files/p46-completo.pdf", "#indice", "#indice", "#indice", "#indice", "#indice", "#indice", "#indice", "#indice", "/turnos", "/jefatura/innovacion-publica/innovacion-administrativa/tramites-distancia-tad", "/miargentina/mesadeayuda", "/pais", "/normativa", "/organismos", "/jefatura/mapa-del-estado", "/acerca", "/terminos-y-condiciones", "/sugerencias"]}