{"title": "Cardo mariano", "author": null, "url": "https://www.cancer.gov/espanol/cancer/tratamiento/mca/paciente/cardo-mariano-pdq", "hostname": "cancer.gov", "description": "Resumen de informaci\u00f3n revisada por expertos sobre el uso del cardo mariano como tratamiento para personas con c\u00e1ncer.", "sitename": "Instituto Nacional del C\u00e1ncer", "date": "2016-09-22", "id": null, "license": null, "body": null, "comments": "", "commentsbody": null, "raw_text": null, "text": "Cardo mariano (PDQ\u00ae)\u2013Versi\u00f3n para pacientes\nAspectos generales\nNOTA: La informaci\u00f3n contenida en este sumario ya no se actualiza y se ofrece solo con fines de consulta.\n- El\n[cardo mariano](/Common/PopUps/popDefinition.aspx?id=305993&version=patient&language=Spanish&dictionary=Cancer.gov)es una planta cuyos frutos y semillas se emplean para elaborar remedios para [trastornos](/Common/PopUps/popDefinition.aspx?id=407758&version=patient&language=Spanish&dictionary=Cancer.gov)del [h\u00edgado](/Common/PopUps/popDefinition.aspx?id=46312&version=patient&language=Spanish&dictionary=Cancer.gov)y el [conducto biliar](/Common/PopUps/popDefinition.aspx?id=46738&version=patient&language=Spanish&dictionary=Cancer.gov)(vea la [Pregunta 1](/espanol/cancer/tratamiento/mca/paciente/cardo-mariano-pdq#_4)).\n- En general, el cardo mariano se ingiere en\n[c\u00e1psulas](/Common/PopUps/popDefinition.aspx?id=455334&version=patient&language=Spanish&dictionary=Cancer.gov)o comprimidos (vea la [Pregunta 2](/espanol/cancer/tratamiento/mca/paciente/cardo-mariano-pdq#_7)).\n- Se han realizado estudios del cardo mariano para la\n[leucemia linfobl\u00e1stica aguda](/Common/PopUps/popDefinition.aspx?id=45586&version=patient&language=Spanish&dictionary=Cancer.gov), el [c\u00e1ncer de pr\u00f3stata](/Common/PopUps/popDefinition.aspx?id=445079&version=patient&language=Spanish&dictionary=Cancer.gov),el [c\u00e1ncer de mama](/Common/PopUps/popDefinition.aspx?id=444971&version=patient&language=Spanish&dictionary=Cancer.gov)y el [c\u00e1ncer de cabeza y cuello](/Common/PopUps/popDefinition.aspx?id=257519&version=patient&language=Spanish&dictionary=Cancer.gov)(vea la [Pregunta 4](/espanol/cancer/tratamiento/mca/paciente/cardo-mariano-pdq#_9)).\n- Los\n[efectos secundarios](/Common/PopUps/popDefinition.aspx?id=46580&version=patient&language=Spanish&dictionary=Cancer.gov)del uso del cardo mariano o la [silimarina](/Common/PopUps/popDefinition.aspx?id=340936&version=patient&language=Spanish&dictionary=Cancer.gov)son leves (vea la [Pregunta 5](/espanol/cancer/tratamiento/mca/paciente/cardo-mariano-pdq#_10)).\n- La\n[Administraci\u00f3n de Alimentos y Medicamentos de los Estados Unidos](/Common/PopUps/popDefinition.aspx?id=454785&version=patient&language=Spanish&dictionary=Cancer.gov)(FDA) no ha aprobado el uso del cardo mariano para el tratamiento del [c\u00e1ncer](/Common/PopUps/popDefinition.aspx?id=45333&version=patient&language=Spanish&dictionary=Cancer.gov)ni de ninguna otra [afecci\u00f3n](/Common/PopUps/popDefinition.aspx?id=651193&version=patient&language=Spanish&dictionary=Cancer.gov)(vea la [Pregunta 6](/espanol/cancer/tratamiento/mca/paciente/cardo-mariano-pdq#_11)).\n- En los Estados Unidos, el cardo mariano se vende como\n[suplemento alimentario](/Common/PopUps/popDefinition.aspx?id=373932&version=patient&language=Spanish&dictionary=Cancer.gov)(vea la [Pregunta 6](/espanol/cancer/tratamiento/mca/paciente/cardo-mariano-pdq#_11)).\nPreguntas y respuestas sobre el cardo mariano\n- \u00bfQu\u00e9 es el cardo mariano?\nEl\n[cardo mariano](/Common/PopUps/popDefinition.aspx?id=305993&version=patient&language=Spanish&dictionary=Cancer.gov)es una planta cuyos frutos y semillas se han utilizado durante m\u00e1s de dos mil a\u00f1os como tratamiento de los [trastornos](/Common/PopUps/popDefinition.aspx?id=407758&version=patient&language=Spanish&dictionary=Cancer.gov)del [h\u00edgado](/Common/PopUps/popDefinition.aspx?id=46312&version=patient&language=Spanish&dictionary=Cancer.gov)y el [conducto biliar](/Common/PopUps/popDefinition.aspx?id=46738&version=patient&language=Spanish&dictionary=Cancer.gov). El cardo mariano es originario de Europa, pero tambi\u00e9n se encuentra en los Estados Unidos y Am\u00e9rica del Sur.\nLa\n[silimarina](/Common/PopUps/popDefinition.aspx?id=340936&version=patient&language=Spanish&dictionary=Cancer.gov), que se encuentra en las semillas del cardo mariano, es una mezcla que contiene [compuestos](/Common/PopUps/popDefinition.aspx?id=422394&version=patient&language=Spanish&dictionary=Cancer.gov)como silibina, isosilibina, silicristina e isosilicristina, silidianina y taxifolina. En la mayor\u00eda de los estudios se investig\u00f3 la silimarina o la sibilina, en vez de la planta entera.\nEl nombre\n[bot\u00e1nico](/Common/PopUps/popDefinition.aspx?id=367458&version=patient&language=Spanish&dictionary=Cancer.gov)del cardo mariano es [Silybum marianum](/Common/PopUps/popDefinition.aspx?id=372948&version=patient&language=Spanish&dictionary=Cancer.gov). El cardo mariano tambi\u00e9n se llama [cardo santo](/Common/PopUps/popDefinition.aspx?id=330188&version=patient&language=Spanish&dictionary=Cancer.gov), cardo lechero o lechoso, cardo de Mar\u00eda, cardo de Santa Mar\u00eda, cardo de Nuestra Se\u00f1ora, alcaucil o alcachofa silvestre, Mariendistel (en alem\u00e1n) y Chardon-Marie (en franc\u00e9s).\n- \u00bfC\u00f3mo se toma o administra el cardo mariano?\nEn general, el cardo mariano se suele tomar por v\u00eda oral en\n[c\u00e1psulas](/Common/PopUps/popDefinition.aspx?id=455334&version=patient&language=Spanish&dictionary=Cancer.gov)o comprimidos. En Europa, la sibilina se administra por [infusi\u00f3n intravenosa](/Common/PopUps/popDefinition.aspx?id=520363&version=patient&language=Spanish&dictionary=Cancer.gov)como \u00fanico tratamiento para la intoxicaci\u00f3n por [Amanita phalloides](/Common/PopUps/popDefinition.aspx?id=367455&version=patient&language=Spanish&dictionary=Cancer.gov), que es la [toxina](/Common/PopUps/popDefinition.aspx?id=46622&version=patient&language=Spanish&dictionary=Cancer.gov)de un hongo que causa la muerte.\n- \u00bfSe ha llevado a cabo alg\u00fan estudio de laboratorio o con animales sobre el uso del cardo mariano?\nEn los\n[estudios de laboratorio](/Common/PopUps/popDefinition.aspx?id=44512&version=patient&language=Spanish&dictionary=Cancer.gov)se utilizan [c\u00e9lulas](/Common/PopUps/popDefinition.aspx?id=46476&version=patient&language=Spanish&dictionary=Cancer.gov) [tumorales](/Common/PopUps/popDefinition.aspx?id=46634&version=patient&language=Spanish&dictionary=Cancer.gov)para probar sustancias y averiguar sus efectos anticancerosos. En los [estudios con animales](/Common/PopUps/popDefinition.aspx?id=454774&version=patient&language=Spanish&dictionary=Cancer.gov), se hacen pruebas para saber si un [medicamento](/Common/PopUps/popDefinition.aspx?id=348921&version=patient&language=Spanish&dictionary=Cancer.gov), procedimiento o tratamiento nuevo es seguro y eficaz en los animales. Los estudios de laboratorio y con animales se hacen antes de probar una sustancia en seres humanos.\nEn los estudios de laboratorio y con animales se probaron los efectos del cardo mariano mediante experimentos de laboratorio. En estudios de laboratorio, se analizaron la silimarina (sustancia activa en las semillas del cardo mariano) y la sibilina A y B, los componentes principales de la silimarina. Para obtener m\u00e1s informaci\u00f3n acerca de estudios de laboratorio y con animales en los que se utiliza el cardo mariano, consulte la secci\u00f3n sobre\n[Estudios de laboratorio, con animales y estudios precl\u00ednicos](/espanol/cancer/tratamiento/mca/pro/cardo-mariano-pdq#_19)de la versi\u00f3n para profesionales de la salud del sumario [Cardo mariano](/about-cancer/treatment/cam/hp/milk-thistle-pdq).\n- \u00bfSe ha llevado a cabo alg\u00fan estudio sobre el cardo mariano con seres humanos?\nEn varios estudios peque\u00f1os se investig\u00f3 si el cardo mariano serv\u00eda para reducir los\n[efectos secundarios](/Common/PopUps/popDefinition.aspx?id=46580&version=patient&language=Spanish&dictionary=Cancer.gov)del tratamiento del c\u00e1ncer.\n- En un\n[ensayo cl\u00ednico aleatorizado](/Common/PopUps/popDefinition.aspx?id=45858&version=patient&language=Spanish&dictionary=Cancer.gov)de ni\u00f1os con [leucemia linfobl\u00e1stica aguda](/Common/PopUps/popDefinition.aspx?id=45586&version=patient&language=Spanish&dictionary=Cancer.gov), se encontr\u00f3 que la silimarina disminu\u00eda los efectos secundarios de la [quimioterapia](/Common/PopUps/popDefinition.aspx?id=45214&version=patient&language=Spanish&dictionary=Cancer.gov)sobre el h\u00edgado sin efectos negativos en el tratamiento del c\u00e1ncer.\n- En un ensayo cl\u00ednico aleatorizado de hombres con\n[c\u00e1ncer de pr\u00f3stata](/Common/PopUps/popDefinition.aspx?id=445079&version=patient&language=Spanish&dictionary=Cancer.gov)que se hab\u00edan sometido a [cirug\u00eda](/Common/PopUps/popDefinition.aspx?id=45570&version=patient&language=Spanish&dictionary=Cancer.gov)para extirpar la [pr\u00f3stata](/Common/PopUps/popDefinition.aspx?id=46539&version=patient&language=Spanish&dictionary=Cancer.gov), se encontr\u00f3 que la administraci\u00f3n de silimarina y [selenio](/Common/PopUps/popDefinition.aspx?id=45113&version=patient&language=Spanish&dictionary=Cancer.gov)mejoraron la [calidad de vida](/Common/PopUps/popDefinition.aspx?id=45417&version=patient&language=Spanish&dictionary=Cancer.gov), disminuyeron el [colesterol](/Common/PopUps/popDefinition.aspx?id=407756&version=patient&language=Spanish&dictionary=Cancer.gov)y aumentaron la concentraci\u00f3n de selenio en la [sangre](/Common/PopUps/popDefinition.aspx?id=270735&version=patient&language=Spanish&dictionary=Cancer.gov).\n- En un ensayo cl\u00ednico aleatorizado con 30 pacientes de\n[c\u00e1ncer de cabeza y cuello](/Common/PopUps/popDefinition.aspx?id=257519&version=patient&language=Spanish&dictionary=Cancer.gov)que recibieron [radioterapia](/Common/PopUps/popDefinition.aspx?id=44971&version=patient&language=Spanish&dictionary=Cancer.gov), se encontr\u00f3 que los pacientes que tomaron silimarina durante 6 semanas tuvieron tasas m\u00e1s bajas de [mucositis](/Common/PopUps/popDefinition.aspx?id=45789&version=patient&language=Spanish&dictionary=Cancer.gov)relacionada con la radiaci\u00f3n en comparaci\u00f3n con los que no la tomaron.\n- En un\n[estudio de observaci\u00f3n](/Common/PopUps/popDefinition.aspx?id=286105&version=patient&language=Spanish&dictionary=Cancer.gov)de mujeres con [c\u00e1ncer de mama](/Common/PopUps/popDefinition.aspx?id=444971&version=patient&language=Spanish&dictionary=Cancer.gov)sometidas a cirug\u00eda y radioterapia, se encontr\u00f3 que una crema a base de silimarina ayud\u00f3 a [prevenir](/Common/PopUps/popDefinition.aspx?id=439419&version=patient&language=Spanish&dictionary=Cancer.gov)el sarpullido en la piel causado por la radioterapia.\nEn varios\n[ensayos cl\u00ednicos](/Common/PopUps/popDefinition.aspx?id=45961&version=patient&language=Spanish&dictionary=Cancer.gov), se analiz\u00f3 el uso del cardo mariano para el tratamiento de pacientes con [hepatitis](/Common/PopUps/popDefinition.aspx?id=46371&version=patient&language=Spanish&dictionary=Cancer.gov), [cirrosis](/Common/PopUps/popDefinition.aspx?id=45478&version=patient&language=Spanish&dictionary=Cancer.gov), intoxicaci\u00f3n por hongos o trastornos de los conductos biliares. Las [dosis](/Common/PopUps/popDefinition.aspx?id=44664&version=patient&language=Spanish&dictionary=Cancer.gov)en estos ensayos eran muy variadas y se obtuvieron resultados desiguales. En un ensayo de [terapia biol\u00f3gica](/Common/PopUps/popDefinition.aspx?id=45617&version=patient&language=Spanish&dictionary=Cancer.gov)para pacientes con hepatitis cr\u00f3nica, los pacientes que tomaron silimarina tuvieron menos [s\u00edntomas](/Common/PopUps/popDefinition.aspx?id=45022&version=patient&language=Spanish&dictionary=Cancer.gov)y una mejor calidad de vida que los pacientes que no la tomaron.\nSe encontr\u00f3 que la silimarina aumenta la eficacia del tratamiento de quelaci\u00f3n del\n[hierro](/Common/PopUps/popDefinition.aspx?id=446805&version=patient&language=Spanish&dictionary=Cancer.gov), que elimina el exceso de hierro de la sangre de los pacientes que recibieron muchas [transfusiones de sangre](/Common/PopUps/popDefinition.aspx?id=45991&version=patient&language=Spanish&dictionary=Cancer.gov).\n- En un\n- \u00bfSe ha informado sobre algunos efectos secundarios o riesgos del cardo mariano?\nSe han notificado muy pocos efectos secundarios del uso del cardo mariano o la silimarina. En varios estudios grandes de pacientes con trastornos hep\u00e1ticos, se encontr\u00f3 que la toma de silimarina en pocas ocasiones tuvo un efecto\n[laxante](/Common/PopUps/popDefinition.aspx?id=373085&version=patient&language=Spanish&dictionary=Cancer.gov)o caus\u00f3 [n\u00e1useas](/Common/PopUps/popDefinition.aspx?id=390302&version=patient&language=Spanish&dictionary=Cancer.gov), ardor o malestar de [est\u00f3mago](/Common/PopUps/popDefinition.aspx?id=46604&version=patient&language=Spanish&dictionary=Cancer.gov). En dosis altas, se han observado [reacciones al\u00e9rgicas](/Common/PopUps/popDefinition.aspx?id=443292&version=patient&language=Spanish&dictionary=Cancer.gov).\n- \u00bfLa Administraci\u00f3n de Alimentos y Medicamentos de los Estados Unidos aprob\u00f3 el cardo mariano para usarlo en el tratamiento del c\u00e1ncer en este pa\u00eds?\nLa\n[Administraci\u00f3n de Alimentos y Medicamentos de los Estados Unidos](/Common/PopUps/popDefinition.aspx?id=454785&version=patient&language=Spanish&dictionary=Cancer.gov)(FDA) no ha aprobado el uso del cardo mariano para el tratamiento del c\u00e1ncer ni de ninguna otra [afecci\u00f3n](/Common/PopUps/popDefinition.aspx?id=651193&version=patient&language=Spanish&dictionary=Cancer.gov).\nLa FDA no aprueba los suplementos alimentarios ni determina la inocuidad o eficacia de estos. El fabricante de dichos productos se responsabiliza por asegurar que no sean peligrosos y que las etiquetas incluyan informaci\u00f3n correcta y veraz para el consumidor. Debido a que la FDA no reglamenta la elaboraci\u00f3n de los suplementos, es probable que hayan diferencias entre los lotes y las marcas de cardo mariano.\nEnsayos cl\u00ednicos en curso\nRealice una\n[b\u00fasqueda](https://www.cancer.gov/about-cancer/treatment/clinical-trials/search) en ingl\u00e9s de ensayos cl\u00ednicos sobre c\u00e1ncer auspiciados por el NCI que aceptan pacientes en este momento. Busque por tipo de c\u00e1ncer, edad del paciente y lugar del ensayo. Consulte tambi\u00e9n [informaci\u00f3n general](https://www.cancer.gov/espanol/cancer/tratamiento/estudios-clinicos) sobre los ensayos cl\u00ednicos.\nInformaci\u00f3n sobre este sumario del PDQ\nInformaci\u00f3n sobre el PDQ\nEl Physician Data Query (PDQ) es la base de datos integral del Instituto Nacional del C\u00e1ncer (NCI). La base de datos del PDQ contiene sumarios de la \u00faltima informaci\u00f3n publicada sobre prevenci\u00f3n, detecci\u00f3n, gen\u00e9tica, tratamiento, cuidados m\u00e9dicos de apoyo, y medicina complementaria y alternativa relacionada con el c\u00e1ncer. La mayor\u00eda de los sumarios se redactan en dos versiones. En las versiones para profesionales de la salud se ofrece informaci\u00f3n detallada en lenguaje t\u00e9cnico. Las versiones para pacientes se presentan en un lenguaje f\u00e1cil de comprender, que no es t\u00e9cnico. Ambas versiones contienen informaci\u00f3n sobre el c\u00e1ncer que es exacta y actualizada. Tambi\u00e9n es posible consultar estos sumarios en\n[ingl\u00e9s](https://www.cancer.gov/publications/pdq).\nEl PDQ es uno de los servicios del NCI. El NCI pertenece a los Institutos Nacionales de la Salud (NIH). Los NIH son el centro de investigaci\u00f3n biom\u00e9dica del gobierno federal. Los sumarios del PDQ se basan en un an\u00e1lisis independiente de las publicaciones m\u00e9dicas. No constituyen declaraciones de la pol\u00edtica del NCI ni de los NIH.\nProp\u00f3sito de este sumario\nEste sumario del PDQ sobre el c\u00e1ncer contiene informaci\u00f3n actualizada sobre el uso del cardo mariano como tratamiento para personas con c\u00e1ncer. El prop\u00f3sito es informar y ayudar a los pacientes, las familias y las personas encargadas de cuidar a los pacientes. No provee pautas ni recomendaciones formales para tomar decisiones relacionadas con la atenci\u00f3n de la salud.\nRevisores y actualizaciones\nLos Consejos editoriales redactan los sumarios de informaci\u00f3n sobre el c\u00e1ncer del PDQ y los actualizan. Estos Consejos est\u00e1n integrados por expertos en el tratamiento del c\u00e1ncer y otras especialidades relacionadas con esta enfermedad. Los sumarios se revisan con regularidad y se modifican si surge informaci\u00f3n nueva. La fecha de actualizaci\u00f3n al pie de cada sumario indica cu\u00e1ndo se hizo el cambio m\u00e1s reciente.\nLa informaci\u00f3n en este sumario para pacientes se basa en la versi\u00f3n para profesionales de la salud, que el\n[Consejo editorial del PDQ\u00ae sobre las terapias integrales, alternativas y complementarias](https://www.cancer.gov/espanol/publicaciones/pdq/consejos-editoriales/medicina-complementaria-alternativa) revisa con regularidad y actualiza en caso necesario.\nInformaci\u00f3n sobre ensayos cl\u00ednicos\nUn ensayo cl\u00ednico es un estudio para responder a una pregunta cient\u00edfica; por ejemplo, si un tratamiento es mejor que otro. Los ensayos se basan en estudios anteriores y lo que se aprendi\u00f3 en el laboratorio. Cada ensayo responde a ciertas preguntas cient\u00edficas dirigidas a encontrar formas nuevas y mejores de ayudar a los pacientes de c\u00e1ncer. Durante los ensayos cl\u00ednicos de tratamiento, se recopila informaci\u00f3n sobre los efectos de un tratamiento nuevo y su eficacia. Si un ensayo cl\u00ednico indica que un tratamiento nuevo es mejor que el tratamiento est\u00e1ndar, el tratamiento nuevo se puede convertir en \"est\u00e1ndar\". Los pacientes podr\u00edan considerar la participaci\u00f3n en un ensayo cl\u00ednico. Algunos ensayos cl\u00ednicos solo aceptan a pacientes que a\u00fan no comenzaron un tratamiento.\nLa lista en ingl\u00e9s de ensayos cl\u00ednicos est\u00e1 disponible en el\n[portal de Internet del NCI](https://www.cancer.gov/espanol/cancer/tratamiento/estudios-clinicos). Para obtener m\u00e1s informaci\u00f3n, llamar al [Servicio de Informaci\u00f3n de C\u00e1ncer](https://www.cancer.gov/espanol/contactenos/centro-de-contacto) (CIS), centro de contacto del NCI, al 1-800-422-6237 (1-800-4-CANCER).\nPermisos para el uso de este sumario\nPDQ (Physician Data Query) es una marca registrada. Se autoriza el libre uso del texto de los documentos del PDQ. Sin embargo, no se podr\u00e1 identificar como un sumario de informaci\u00f3n sobre c\u00e1ncer del PDQ del NCI, salvo que se reproduzca en su totalidad y se actualice con regularidad. Por otra parte, se permitir\u00e1 que un autor escriba una oraci\u00f3n como \u201cEn el sumario del PDQ del NCI de informaci\u00f3n sobre la prevenci\u00f3n del c\u00e1ncer de mama se describen, en breve, los siguientes riesgos: [incluir fragmento del sumario]\u201d.\nSe sugiere citar la referencia bibliogr\u00e1fica de este sumario del PDQ de la siguiente forma:\nPDQ\u00ae . PDQ Cardo mariano. Bethesda, MD: National Cancer Institute. Actualizaci\u00f3n: <MM/DD/YYYY>. Disponible en:\n[https://www.cancer.gov/espanol/cancer/tratamiento/mca/paciente/cardo-mariano-pdq](https://www.cancer.gov/espanol/cancer/tratamiento/mca/paciente/cardo-mariano-pdq). Fecha de acceso: <MM/DD/YYYY>.\nLas im\u00e1genes en este sumario se reproducen con el permiso del autor, el artista o la editorial para uso exclusivo en los sumarios del PDQ. La utilizaci\u00f3n de las im\u00e1genes fuera del PDQ requiere la autorizaci\u00f3n del propietario, que el Instituto Nacional del C\u00e1ncer no puede otorgar. Para obtener m\u00e1s informaci\u00f3n sobre el uso de las ilustraciones de este sumario o de otras im\u00e1genes relacionadas con el c\u00e1ncer, consultar\n[Visuals Online](https://visualsonline.cancer.gov/), una colecci\u00f3n de m\u00e1s de 3000 im\u00e1genes cient\u00edficas.\nCl\u00e1usula sobre el descargo de responsabilidad\nLa informaci\u00f3n en estos sumarios no debe fundamentar ninguna decisi\u00f3n sobre reintegros de seguros. Para obtener m\u00e1s informaci\u00f3n sobre cobertura de seguros, consultar la p\u00e1gina\n[Manejo de la atenci\u00f3n del c\u00e1ncer](https://www.cancer.gov/espanol/cancer/manejo-del-cancer) disponible en Cancer.gov/espanol.\nPara obtener m\u00e1s informaci\u00f3n\nEn Cancer.gov/espanol, se ofrece m\u00e1s informaci\u00f3n sobre c\u00f3mo comunicarse o recibir ayuda en\n[\u00bfEn qu\u00e9 podemos ayudarle?](https://www.cancer.gov/espanol/contactenos). Tambi\u00e9n puede enviar un mensaje de correo electr\u00f3nico mediante el [formulario de comunicaci\u00f3n](https://www.cancer.gov/espanol/contactenos/correo-electronico).\nInformaci\u00f3n general sobre medicina complementaria y alternativa\nLa medicina complementaria y alternativa (MCA), que tambi\u00e9n se llama medicina integral, comprende una gran variedad de filosof\u00edas, enfoques y tratamientos de sanaci\u00f3n. En general, se dice que una terapia es complementaria cuando se a\u00f1ade a un tratamiento convencional; se llama alternativa cuando lo remplaza. (Los tratamientos convencionales son aquellos que la comunidad m\u00e9dica establecida acepta y practica). Las terapias se consideran complementarias o alternativas, seg\u00fan la forma en que se utilicen. El prop\u00f3sito de las terapias complementarias o alternativas es prevenir enfermedades, reducir la tensi\u00f3n, evitar o disminuir los efectos secundarios y los s\u00edntomas, y controlar o curar enfermedades.\nA diferencia de los tratamientos convencionales para el c\u00e1ncer, es com\u00fan que las compa\u00f1\u00edas de seguro no ofrezcan cobertura para las terapias complementarias y alternativas. Los pacientes deben confirmar si su seguro m\u00e9dico cubre estas terapias.\nLos pacientes de c\u00e1ncer que piensen en utilizar terapias complementarias o alternativas, deben hablar sobre esta decisi\u00f3n con su m\u00e9dico, enfermero o farmac\u00e9utico del mismo modo que lo har\u00edan con cualquier otro tratamiento. Algunas terapias interfieren en el tratamiento est\u00e1ndar o causan da\u00f1o cuando se usan al mismo tiempo.\nEvaluaci\u00f3n de los tratamientos de medicina complementaria y alternativa\nEs importante que los tratamientos de MCA se sometan a los mismos m\u00e9todos cient\u00edficos que se emplean para poner a prueba los tratamientos convencionales. El Instituto Nacional del C\u00e1ncer (NCI) y el Centro Nacional de Salud Complementaria e Integral (NCCIH) patrocinan varios ensayos cl\u00ednicos (estudios de investigaci\u00f3n) en centros m\u00e9dicos para probar el uso de los tratamientos de MCA para el c\u00e1ncer.\nEn general, se estudian la inocuidad y eficacia de los abordajes convencionales para tratar el c\u00e1ncer mediante un proceso cient\u00edfico que incluye ensayos cl\u00ednicos con un gran n\u00famero de pacientes. Se sabe menos acerca de la inocuidad y la eficacia de los m\u00e9todos complementarios y alternativos. Muy pocas terapias de MCA se han examinado con m\u00e9todos cient\u00edficos rigurosos. En ciertos casos, las terapias de MCA que antes solo se consideraban alternativas se est\u00e1n incorporando poco a poco en el tratamiento del c\u00e1ncer: no como curas, sino como terapias complementarias que tal vez ayuden a los pacientes a sentirse mejor y recuperarse m\u00e1s pronto. Un ejemplo de esto es la acupuntura. En noviembre de 1997, un grupo de expertos de los Institutos Nacionales de la Salud (NIH), anunci\u00f3 que se hab\u00eda comprobado que la acupuntura ayuda a controlar las n\u00e1useas y los v\u00f3mitos provocados por la quimioterapia, y el dolor relacionado con la cirug\u00eda. Por otra parte, en el caso de otros abordajes, como el uso del laetrilo, se hall\u00f3 que no surten efecto e incluso podr\u00edan causar da\u00f1o.\n[The NCI Best Case Series Program](https://cam.cancer.gov/indentifying_novel_cam_therapies/best_case_series_program.htm) (disponible solo en ingl\u00e9s), se estableci\u00f3 en 1991, y es un proceso para estudiar los abordajes de MCA que se encuentran en pr\u00e1ctica. La Oficina de Medicina Complementaria y Alternativa para el C\u00e1ncer (OCCAM) del NCI supervisa este programa. Mediante este proceso, los profesionales de la salud que emplean terapias alternativas en el tratamiento del c\u00e1ncer env\u00edan a la OCCAM los antecedentes m\u00e9dicos de sus pacientes y otros materiales relacionados. La OCCAM hace una revisi\u00f3n minuciosa de los materiales y decide si hay terapias que merecen m\u00e1s investigaci\u00f3n.\nPreguntas para su proveedor de salud sobre la medicina complementaria y alternativa\nCuando los pacientes est\u00e1n tomando en cuenta los tratamientos complementarios y alternativos, deben hacer las siguientes preguntas a su proveedor de atenci\u00f3n de la salud:\n- \u00bfQu\u00e9 efectos secundarios se pueden esperar?\n- \u00bfCu\u00e1les son los riesgos relacionados con este tratamiento?\n- \u00bfLos beneficios son mayores que los riesgos?\n- \u00bfQu\u00e9 beneficios se deben esperar de este tratamiento?\n- \u00bfEl tratamiento puede interferir con el tratamiento convencional?\n- \u00bfEste tratamiento es parte de un ensayo cl\u00ednico?\n- De ser as\u00ed, \u00bfqui\u00e9n patrocina este ensayo?\n- \u00bfMi seguro cubre este tratamiento?\nInformaci\u00f3n adicional\nCentro Nacional de Salud Complementaria e Integral\nEl Centro Nacional de Salud Complementaria e Integral (NCCIH) de los Institutos Nacionales de la Salud (NIH) facilita la investigaci\u00f3n y evaluaci\u00f3n de las pr\u00e1cticas complementarias y alternativas y ofrece informaci\u00f3n acerca de una variedad de enfoques para los profesionales de la salud y el p\u00fablico en general.\n- Centro de Informaci\u00f3n del NCCIH\n- Post Office Box 7923 Gaithersburg, MD 20898-7923\n- Tel\u00e9fono: 1-888-644-6226 (l\u00ednea gratuita)\n- TTY (para personas sordas o con dificultades auditivas): 1-866-464-3615\n- E-mail: info@nccih.nih.gov\n- Portal de Internet:\n[https://nccih.nih.gov/health/espanol](https://nccih.nih.gov/health/espanol?lang=es)\nMedicina complementaria y alternativa en PubMed\nEl NCCIH y la Biblioteca Nacional de Medicina (NLM) de los NIH crearon juntos\n[CAM on PubMed](https://nccih.nih.gov/research/camonpubmed) (disponible en ingl\u00e9s), una herramienta de b\u00fasqueda gratuita y f\u00e1cil de usar para encontrar citas de revistas cient\u00edficas sobre medicina complementaria y alternativa. CAM on PubMed es un subgrupo de la base de datos bibliogr\u00e1ficos PubMed de la NLM que cuenta con m\u00e1s de 230 000 referencias y res\u00famenes de art\u00edculos sobre medicina complementaria y alternativa publicados en revistas cient\u00edficas. Esta base de datos tambi\u00e9n tiene enlaces a las p\u00e1ginas de Internet de m\u00e1s de 1800 revistas, lo que ofrece a los usuarios acceso a los art\u00edculos completos. (Es posible que deba pagar una suscripci\u00f3n u otro cargo para leer los art\u00edculos completos).\nOficina de Medicina Complementaria y Alternativa para el C\u00e1ncer\nLa Oficina de Medicina Complementaria y Alternativa para el C\u00e1ncer (OCCAM) del NCI coordina las actividades del NCI en el \u00e1rea de la medicina complementaria y alternativa (MCA). La OCCAM fomenta la investigaci\u00f3n sobre la MCA para el c\u00e1ncer y ofrece informaci\u00f3n a los profesionales de la salud y al p\u00fablico en general en el\n[portal de Internet del NCI](https://www.cancer.gov/espanol).\nServicio de Informaci\u00f3n de C\u00e1ncer del Instituto Nacional del C\u00e1ncer\nEn los Estados Unidos, llame a la l\u00ednea gratuita del\n[Servicio de Informaci\u00f3n de C\u00e1ncer](https://www.cancer.gov/espanol/contactenos/centro-de-contacto) (CIS), centro de contacto del Instituto Nacional del C\u00e1ncer (NCI): 1-800-422-6237 (1-800-4-CANCER) de lunes a viernes, de 9:00 a. m. a 9:00 p. m. Un especialista capacitado en informaci\u00f3n sobre el c\u00e1ncer estar\u00e1 disponible para contestar sus preguntas.\nAdministraci\u00f3n de Alimentos y Medicamentos de los Estados Unidos\nLa Administraci\u00f3n de Alimentos y Medicamentos de los Estados Unidos (FDA) reglamenta los medicamentos y los dispositivos m\u00e9dicos para asegurar que sean inocuos y eficaces.\n- Food and Drug Administration\n- 10903 New Hampshire Avenue\n- Silver Spring, MD 20993\n- Tel\u00e9fono: 1-888-463-6332 (l\u00ednea gratuita)\n- Portal de Internet:\n[http://www.fda.gov](https://www.fda.gov/aboutfda/enespanol/default.htm)\nComisi\u00f3n Federal de Comercio\nLa Comisi\u00f3n Federal de Comercio (FTC) hace cumplir las leyes de protecci\u00f3n al consumidor. Las siguientes son algunas de las publicaciones disponibles de este organismo:\n- Cuidando su Salud: Fuentes de Informaci\u00f3n sobre Productos y Servicios para la Salud\n- Fraudulent Health Claims: Don\u2019t Be Fooled\n- Consumer Response Center\n- Federal Trade Commission\n- 600 Pennsylvania Avenue, NW\n- Washington, DC 20580\n- Tel\u00e9fono: 1-877-382-4357 (1-877-FTC-HELP) (l\u00ednea gratuita)\n- TTY (para personas sordas o con dificultades auditivas): 202-326-2502\n- Portal de Internet:\n[http://www.ftc.gov/es](https://www.ftc.gov/es)", "language": null, "image": null, "pagetype": "Website", "links": ["#main-content", "/about-cancer/treatment/cam/patient/milk-thistle-pdq", "/espanol", "/espanol/cancer", "/espanol/tipos", "/espanol/investigacion", "/espanol/subvenciones-capacitacion", "/espanol/noticias", "/espanol/instituto", "/espanol", "/espanol/cancer", "/espanol/cancer/tratamiento", "/espanol/cancer/tratamiento/mca", "/espanol/cancer/tratamiento/mca/paciente", "mailto:?subject=Informaci\u00f3n del portal de Internet del Instituto Nacional del C\u00e1ncer &body=Encontr\u00e9 esta informaci\u00f3n en cancer.gov/espanol y quiero compartirla contigo: https://www.cancer.gov/espanol/cancer/tratamiento/mca/paciente/cardo-mariano-pdq %0D%0A%0D%0A El sitio web del Instituto Nacional del C\u00e1ncer (NCI), www.cancer.gov/espanol, provee informaci\u00f3n precisa, al d\u00eda y completa de la dependencia principal del gobierno de EE. UU. sobre investigaci\u00f3n de c\u00e1ncer. Si tiene preguntas o necesita m\u00e1s informaci\u00f3n, le invitamos a que se comunique en espa\u00f1ol con el servicio de mensajer\u00eda instant\u00e1nea LiveHelp del NCI en https://livehelp-es.cancer.gov, o llame el Centro de Contacto del NCI al 1-800-422-6237 (1-800-4-CANCER) sin cargos en los Estados Unidos.", "/espanol/cancer/tratamiento", "/espanol/cancer/tratamiento/tipos", "/espanol/cancer/tratamiento/efectos-secundarios", "/espanol/cancer/tratamiento/estudios-clinicos", "/espanol/cancer/tratamiento/medicamentos", "/espanol/cancer/tratamiento/mca", "/espanol/cancer/tratamiento/mca/paciente", "/espanol/cancer/tratamiento/mca/pro", "/espanol/cancer/tratamiento/preguntas", "/espanol/cancer/tratamiento/investigacion", "#_1", "#_2", "#_44", "#_AboutThis_1", "#_AboutIACT_2", "#_AboutIACT_6", "#_QandA_2", "#_ToLearnMore_2", "/espanol/cancer/tratamiento/mca/pro/cardo-mariano-pdq", "/Common/PopUps/popDefinition.aspx?id=305993&version=patient&language=Spanish&dictionary=Cancer.gov", "/Common/PopUps/popDefinition.aspx?id=407758&version=patient&language=Spanish&dictionary=Cancer.gov", "/Common/PopUps/popDefinition.aspx?id=46312&version=patient&language=Spanish&dictionary=Cancer.gov", "/Common/PopUps/popDefinition.aspx?id=46738&version=patient&language=Spanish&dictionary=Cancer.gov", "/espanol/cancer/tratamiento/mca/paciente/cardo-mariano-pdq#_4", "/Common/PopUps/popDefinition.aspx?id=455334&version=patient&language=Spanish&dictionary=Cancer.gov", "/espanol/cancer/tratamiento/mca/paciente/cardo-mariano-pdq#_7", "/Common/PopUps/popDefinition.aspx?id=45586&version=patient&language=Spanish&dictionary=Cancer.gov", "/Common/PopUps/popDefinition.aspx?id=445079&version=patient&language=Spanish&dictionary=Cancer.gov", "/Common/PopUps/popDefinition.aspx?id=444971&version=patient&language=Spanish&dictionary=Cancer.gov", "/Common/PopUps/popDefinition.aspx?id=257519&version=patient&language=Spanish&dictionary=Cancer.gov", "/espanol/cancer/tratamiento/mca/paciente/cardo-mariano-pdq#_9", "/Common/PopUps/popDefinition.aspx?id=46580&version=patient&language=Spanish&dictionary=Cancer.gov", "/Common/PopUps/popDefinition.aspx?id=340936&version=patient&language=Spanish&dictionary=Cancer.gov", "/espanol/cancer/tratamiento/mca/paciente/cardo-mariano-pdq#_10", "/Common/PopUps/popDefinition.aspx?id=454785&version=patient&language=Spanish&dictionary=Cancer.gov", "/Common/PopUps/popDefinition.aspx?id=45333&version=patient&language=Spanish&dictionary=Cancer.gov", "/Common/PopUps/popDefinition.aspx?id=651193&version=patient&language=Spanish&dictionary=Cancer.gov", "/espanol/cancer/tratamiento/mca/paciente/cardo-mariano-pdq#_11", "/Common/PopUps/popDefinition.aspx?id=373932&version=patient&language=Spanish&dictionary=Cancer.gov", "/espanol/cancer/tratamiento/mca/paciente/cardo-mariano-pdq#_11", "/Common/PopUps/popDefinition.aspx?id=305993&version=patient&language=Spanish&dictionary=Cancer.gov", "/Common/PopUps/popDefinition.aspx?id=407758&version=patient&language=Spanish&dictionary=Cancer.gov", "/Common/PopUps/popDefinition.aspx?id=46312&version=patient&language=Spanish&dictionary=Cancer.gov", "/Common/PopUps/popDefinition.aspx?id=46738&version=patient&language=Spanish&dictionary=Cancer.gov", "/Common/PopUps/popDefinition.aspx?id=340936&version=patient&language=Spanish&dictionary=Cancer.gov", "/Common/PopUps/popDefinition.aspx?id=422394&version=patient&language=Spanish&dictionary=Cancer.gov", "/Common/PopUps/popDefinition.aspx?id=367458&version=patient&language=Spanish&dictionary=Cancer.gov", "/Common/PopUps/popDefinition.aspx?id=372948&version=patient&language=Spanish&dictionary=Cancer.gov", "/Common/PopUps/popDefinition.aspx?id=330188&version=patient&language=Spanish&dictionary=Cancer.gov", "/Common/PopUps/popDefinition.aspx?id=455334&version=patient&language=Spanish&dictionary=Cancer.gov", "/Common/PopUps/popDefinition.aspx?id=520363&version=patient&language=Spanish&dictionary=Cancer.gov", "/Common/PopUps/popDefinition.aspx?id=367455&version=patient&language=Spanish&dictionary=Cancer.gov", "/Common/PopUps/popDefinition.aspx?id=46622&version=patient&language=Spanish&dictionary=Cancer.gov", "/Common/PopUps/popDefinition.aspx?id=44512&version=patient&language=Spanish&dictionary=Cancer.gov", "/Common/PopUps/popDefinition.aspx?id=46476&version=patient&language=Spanish&dictionary=Cancer.gov", "/Common/PopUps/popDefinition.aspx?id=46634&version=patient&language=Spanish&dictionary=Cancer.gov", "/Common/PopUps/popDefinition.aspx?id=454774&version=patient&language=Spanish&dictionary=Cancer.gov", "/Common/PopUps/popDefinition.aspx?id=348921&version=patient&language=Spanish&dictionary=Cancer.gov", "/espanol/cancer/tratamiento/mca/pro/cardo-mariano-pdq#_19", "/about-cancer/treatment/cam/hp/milk-thistle-pdq", "/Common/PopUps/popDefinition.aspx?id=46580&version=patient&language=Spanish&dictionary=Cancer.gov", "/Common/PopUps/popDefinition.aspx?id=45858&version=patient&language=Spanish&dictionary=Cancer.gov", "/Common/PopUps/popDefinition.aspx?id=45586&version=patient&language=Spanish&dictionary=Cancer.gov", "/Common/PopUps/popDefinition.aspx?id=45214&version=patient&language=Spanish&dictionary=Cancer.gov", "/Common/PopUps/popDefinition.aspx?id=445079&version=patient&language=Spanish&dictionary=Cancer.gov", "/Common/PopUps/popDefinition.aspx?id=45570&version=patient&language=Spanish&dictionary=Cancer.gov", "/Common/PopUps/popDefinition.aspx?id=46539&version=patient&language=Spanish&dictionary=Cancer.gov", "/Common/PopUps/popDefinition.aspx?id=45113&version=patient&language=Spanish&dictionary=Cancer.gov", "/Common/PopUps/popDefinition.aspx?id=45417&version=patient&language=Spanish&dictionary=Cancer.gov", "/Common/PopUps/popDefinition.aspx?id=407756&version=patient&language=Spanish&dictionary=Cancer.gov", "/Common/PopUps/popDefinition.aspx?id=270735&version=patient&language=Spanish&dictionary=Cancer.gov", "/Common/PopUps/popDefinition.aspx?id=257519&version=patient&language=Spanish&dictionary=Cancer.gov", "/Common/PopUps/popDefinition.aspx?id=44971&version=patient&language=Spanish&dictionary=Cancer.gov", "/Common/PopUps/popDefinition.aspx?id=45789&version=patient&language=Spanish&dictionary=Cancer.gov", "/Common/PopUps/popDefinition.aspx?id=286105&version=patient&language=Spanish&dictionary=Cancer.gov", "/Common/PopUps/popDefinition.aspx?id=444971&version=patient&language=Spanish&dictionary=Cancer.gov", "/Common/PopUps/popDefinition.aspx?id=439419&version=patient&language=Spanish&dictionary=Cancer.gov", "/Common/PopUps/popDefinition.aspx?id=45961&version=patient&language=Spanish&dictionary=Cancer.gov", "/Common/PopUps/popDefinition.aspx?id=46371&version=patient&language=Spanish&dictionary=Cancer.gov", "/Common/PopUps/popDefinition.aspx?id=45478&version=patient&language=Spanish&dictionary=Cancer.gov", "/Common/PopUps/popDefinition.aspx?id=44664&version=patient&language=Spanish&dictionary=Cancer.gov", "/Common/PopUps/popDefinition.aspx?id=45617&version=patient&language=Spanish&dictionary=Cancer.gov", "/Common/PopUps/popDefinition.aspx?id=45022&version=patient&language=Spanish&dictionary=Cancer.gov", "/Common/PopUps/popDefinition.aspx?id=446805&version=patient&language=Spanish&dictionary=Cancer.gov", "/Common/PopUps/popDefinition.aspx?id=45991&version=patient&language=Spanish&dictionary=Cancer.gov", "/Common/PopUps/popDefinition.aspx?id=373085&version=patient&language=Spanish&dictionary=Cancer.gov", "/Common/PopUps/popDefinition.aspx?id=390302&version=patient&language=Spanish&dictionary=Cancer.gov", "/Common/PopUps/popDefinition.aspx?id=46604&version=patient&language=Spanish&dictionary=Cancer.gov", "/Common/PopUps/popDefinition.aspx?id=443292&version=patient&language=Spanish&dictionary=Cancer.gov", "/Common/PopUps/popDefinition.aspx?id=454785&version=patient&language=Spanish&dictionary=Cancer.gov", "/Common/PopUps/popDefinition.aspx?id=651193&version=patient&language=Spanish&dictionary=Cancer.gov", "https://www.cancer.gov/about-cancer/treatment/clinical-trials/search", "https://www.cancer.gov/espanol/cancer/tratamiento/estudios-clinicos", "https://www.cancer.gov/publications/pdq", "https://www.cancer.gov/espanol/publicaciones/pdq/consejos-editoriales/medicina-complementaria-alternativa", "https://www.cancer.gov/espanol/cancer/tratamiento/estudios-clinicos", "https://www.cancer.gov/espanol/contactenos/centro-de-contacto", "https://www.cancer.gov/espanol/cancer/tratamiento/mca/paciente/cardo-mariano-pdq", "https://visualsonline.cancer.gov/", "https://www.cancer.gov/espanol/cancer/manejo-del-cancer", "https://www.cancer.gov/espanol/contactenos", "https://www.cancer.gov/espanol/contactenos/correo-electronico", "https://cam.cancer.gov/indentifying_novel_cam_therapies/best_case_series_program.htm", "https://nccih.nih.gov/health/espanol?lang=es", "https://nccih.nih.gov/research/camonpubmed", "https://www.cancer.gov/espanol", "https://www.cancer.gov/espanol/contactenos/centro-de-contacto", "https://www.fda.gov/aboutfda/enespanol/default.htm", "https://www.ftc.gov/es", "/espanol/politicas/derechos-de-autor-y-uso", "/espanol/sindicacion", "mailto:?subject=Informaci\u00f3n del portal de Internet del Instituto Nacional del C\u00e1ncer &body=Encontr\u00e9 esta informaci\u00f3n en cancer.gov/espanol y quiero compartirla contigo: https://www.cancer.gov/espanol/cancer/tratamiento/mca/paciente/cardo-mariano-pdq %0D%0A%0D%0A El sitio web del Instituto Nacional del C\u00e1ncer (NCI), www.cancer.gov/espanol, provee informaci\u00f3n precisa, al d\u00eda y completa de la dependencia principal del gobierno de EE. UU. sobre investigaci\u00f3n de c\u00e1ncer. Si tiene preguntas o necesita m\u00e1s informaci\u00f3n, le invitamos a que se comunique en espa\u00f1ol con el servicio de mensajer\u00eda instant\u00e1nea LiveHelp del NCI en https://livehelp-es.cancer.gov, o llame el Centro de Contacto del NCI al 1-800-422-6237 (1-800-4-CANCER) sin cargos en los Estados Unidos.", "#top", "/espanol/acerca-sitio", "/", "/espanol/politicas/derechos-de-autor-y-uso", "/espanol/redes-sociales", "/espanol/contactenos", "/espanol/publicaciones", "/espanol/publicaciones/diccionarios/diccionario-cancer", "/espanol/politicas/accesibilidad", "/espanol/politicas/foia", "/espanol/politicas/confidencialidad-seguridad", "/espanol/politicas/exoneracion", "https://www.hhs.gov/es/vulnerability-disclosure-policy/index.html", "https://livehelp-es.cancer.gov/", "tel:1-800-422-6237", "mailto:NCIinfo@nih.gov", "https://www.facebook.com/cancer.govEspanol", "https://twitter.com/NCIespanol", "https://www.youtube.com/playlist?list=PLYKy4VbxNln7Cy6K2hZvwHLIZAElio5ai", "https://www.hhs.gov/", "https://salud.nih.gov/", "https://www.cancer.gov/espanol", "https://www.usa.gov/espanol/"]}