{"title": "Sumergirse en agua fr\u00eda est\u00e1 de moda, \u00bfpuede reducir la ansiedad y la depresi\u00f3n? (Published 2022)", "author": "Chloe Williams", "url": "https://www.nytimes.com/es/2022/02/23/espanol/bano-agua-helada-beneficios.html", "hostname": "nytimes.com", "description": "Las primeras investigaciones sugieren que esta pr\u00e1ctica ancestral podr\u00eda ser beneficiosa para la salud mental, pero se necesitan m\u00e1s estudios.", "sitename": "The New York Times", "date": "2022-02-23", "id": null, "license": null, "body": null, "comments": "", "commentsbody": null, "raw_text": null, "text": "Supported by\n[SKIP ADVERTISEMENT](#after-sponsor)\n\u00bfEstafa o no?\nSumergirse en agua fr\u00eda est\u00e1 de moda, \u00bfpuede reducir la ansiedad y la depresi\u00f3n?\nLas primeras investigaciones sugieren que esta pr\u00e1ctica ancestral podr\u00eda ser beneficiosa para la salud mental, pero se necesitan m\u00e1s estudios.\nEn un\n[video de TikTok](https://www.tiktok.com/@melrobbins/video/7052093598413671685?is_copy_url=1&is_from_webapp=v1) de enero, la autora de autoayuda Mel Robbins sosten\u00eda un martillo en su patio en Vermont; la temperatura era de 11 grados Celsius bajo cero. \u201cEstamos a punto de hacer el chapuz\u00f3n en fr\u00edo\u201d, dijo a la c\u00e1mara, despu\u00e9s de romper una capa de hielo en la superficie de un barril y dejar al descubierto el agua de abajo. A continuaci\u00f3n, se subi\u00f3 al barril y, respirando profundamente, se sumergi\u00f3 en el agua hasta el pecho.\nRobbins adopt\u00f3 el\n[m\u00e9todo Wim Hof](https://www.wimhofmethod.com/), que combina la exposici\u00f3n al fr\u00edo con la respiraci\u00f3n y la meditaci\u00f3n, para ayudar a controlar la ansiedad y el estr\u00e9s. El agua helada provoca lo que al principio parece un ataque de p\u00e1nico, dijo en una entrevista reciente. Pero al final, su cuerpo se relaja y su mente se calma. \u201cEl agua sigue estando fr\u00eda, pero la respuesta de ansiedad desaparece\u201d, explica.\nLa inmersi\u00f3n en agua fr\u00eda ha suscitado mucha\n[atenci\u00f3n \u00faltimamente](https://www.nytimes.com/2021/01/01/style/cold-water-swimming-benefits.html), sobre todo por sus supuestos beneficios para la salud mental. Wim Hof, atleta extremo y gur\u00fa de la actividad f\u00edsica que desarroll\u00f3 la t\u00e9cnica, apareci\u00f3 en un [reciente documental](https://www.youtube.com/watch?v=C0RBMwirwC4) del m\u00fasico e influencer Jacob Sartorius. Su r\u00e9gimen tambi\u00e9n fue objeto de un episodio de [The Goop Lab](https://www.netflix.com/title/80244690) de Netflix, estrenado el a\u00f1o pasado.\nEl m\u00e9todo Wim Hof suele consistir en sumergirse en un ba\u00f1o de hielo o en una ducha fr\u00eda, pero otros han recurrido a una versi\u00f3n m\u00e1s activa para gestionar su salud mental.\n[Mental Health Swims](https://www.nytimes.com/interactive/2021/12/06/well/cold-water-mental-health-benefits.html), una organizaci\u00f3n sin fines de lucro que organiza nataci\u00f3n en agua fr\u00eda en toda Gran Breta\u00f1a, ha pasado de tener un solo grupo a m\u00e1s de 80 desde 2019.\nIs This A Scam?\n\u00bfY si ...\n[](https://www.nytimes.com/2019/10/16/style/self-care/celery-juice-benefits.html)\nel jugo de apio\n,\n[](https://www.nytimes.com/2019/10/16/style/self-care/kombucha-benefits.html)\nla kombucha\n,\n[](https://www.nytimes.com/2019/10/16/style/self-care/activated-charcoal-benefits.html)\nel carb\u00f3n activado\n,\n[](https://www.nytimes.com/2019/10/16/style/self-care/cbd-oil-benefits.html)\nel CBD\n,\n[](https://www.nytimes.com/2019/10/16/style/self-care/turmeric-benefits.html)\nla c\u00farcuma\n,\n[](https://www.nytimes.com/2019/11/01/style/self-care/fish-oil-benefits.html)\nel aceite de pescado\n,\n[](https://www.nytimes.com/2019/11/15/style/chlorophyll-benefits.html)\nla clorofila\n,\n[](https://www.nytimes.com/2019/11/23/style/self-care/intermittent-fasting-benefits.html)\nel ayuno intermitente\n,\n[](https://www.nytimes.com/2020/01/02/style/self-care/keto-diet-explained-benefits.html)\nla dieta keto\n,\n[](https://www.nytimes.com/2019/11/27/style/self-care/probiotics-benefits.html)\nlos probi\u00f3ticos\n,\n[](https://www.nytimes.com/es/2021/05/14/espanol/leches-vegetales.html)\nlas leches vegetales\n,\n[](https://www.nytimes.com/es/2021/05/25/espanol/colageno-beneficios-piel.html)\nel col\u00e1geno\n,\n[](https://www.nytimes.com/es/2021/05/21/espanol/IMC-formula.html)\nel IMC\n,\n[](https://www.nytimes.com/2020/02/13/style/self-care/coffee-benefits.html)\nel caf\u00e9\n,\n[](https://www.nytimes.com/es/2021/09/08/espanol/sabila-mitos-verdades.html)\nla s\u00e1bila\n,\n[](https://www.nytimes.com/es/2022/02/23/espanol/bano-agua-helada-beneficios.html)\nla inmersi\u00f3n en agua helada\n,\n[](https://www.nytimes.com/es/2022/05/24/espanol/fajas-moldeadoras-cintura.html)\nlos cors\u00e9s\n,\n[](https://www.nytimes.com/es/2023/02/09/espanol/gel-musgo-marino-beneficios.html)\nel musgo marino\n,\nes una estafa?\nEl bienestar, con datos.\n\u00bfTe cambiar\u00e1n la vida estas tendencias\no solo te har\u00e1n gastar en vano?\nLa gente ha utilizado el agua fr\u00eda para promover la salud durante siglos. Hip\u00f3crates\n[cre\u00eda que la terapia acu\u00e1tica](https://www.ncbi.nlm.nih.gov/pmc/articles/PMC7730683/) pod\u00eda aliviar la fatiga, y los m\u00e9dicos del siglo XVIII recomendaban los ba\u00f1os fr\u00edos para tratar afecciones como la [fiebre](https://www.ncbi.nlm.nih.gov/pmc/articles/PMC2101983/) y el [raquitismo](https://collections.nlm.nih.gov/catalog/nlm:nlmuid-2544040R-bk).\nHoy en d\u00eda, los que conf\u00edan en los beneficios del agua fr\u00eda dicen que los hace sentir\n[vigorizados](https://www.bbc.com/worklife/article/20200228-the-danish-trick-to-shock-your-body-into-happiness), con la [cabeza despejada](https://www.outsideonline.com/outdoor-adventure/water-activities/cold-water-swimming-mindfulness/) y [m\u00e1s capaces de manejar el estr\u00e9s](https://elemental.medium.com/swimming-in-cold-water-has-done-wonders-for-my-stress-45be3083be96). Algunos dicen que les ha ayudado a superar el [dolor](https://www.theguardian.com/news/2021/mar/23/how-cold-water-swimming-cured-my-broken-heart), la [ansiedad](https://thetyee.ca/Culture/2021/12/27/Into-The-Deep/), la [depresi\u00f3n](https://www.sciencefocus.com/the-human-body/cold-water-swimming-why-an-icy-dip-is-good-for-your-mental-and-physical-health/) y otros problemas de salud mental. Las pruebas preliminares sugieren que pueden estar en lo cierto, pero la base cient\u00edfica detr\u00e1s de c\u00f3mo o por qu\u00e9 el agua fr\u00eda afecta a la salud mental a\u00fan no est\u00e1 clara.\n\u00bfEl agua fr\u00eda puede mejorar realmente la salud mental?\nNing\u00fan estudio ha demostrado que el m\u00e9todo Wim Hof o la inmersi\u00f3n en agua fr\u00eda por s\u00ed solos mejoren la salud mental, pero algunas investigaciones sugieren que la nataci\u00f3n en agua fr\u00eda puede mejorar el estado de \u00e1nimo y el bienestar. Varios equipos de investigadores, especialmente en Europa,\n[han explorado](https://www.sciencedirect.com/science/article/abs/pii/S1550830720300859) los efectos psicol\u00f3gicos de la nataci\u00f3n en aguas fr\u00edas y han obtenido [resultados alentadores](https://pubmed.ncbi.nlm.nih.gov/15253480/). Un estudio realizado en 2020 en el Reino Unido descubri\u00f3 que 61 personas que siguieron un curso de diez semanas para aprender a nadar en el mar helado [experimentaron mayores mejoras](https://onlinelibrary.wiley.com/doi/10.1002/lim2.12) en el estado de \u00e1nimo y el bienestar que 22 de sus amigos y familiares que los observaron desde la orilla.\nAlgunos cient\u00edficos tambi\u00e9n sospechan que un chapuz\u00f3n en agua helada podr\u00eda ayudar a tratar enfermedades mentales, como la ansiedad y la depresi\u00f3n. Un\n[estudio de caso de 2018](https://pubmed.ncbi.nlm.nih.gov/30131418/), tambi\u00e9n en el Reino Unido, describe a una mujer de 24 a\u00f1os con depresi\u00f3n y ansiedad que emprendi\u00f3 la nataci\u00f3n en aguas fr\u00edas y, despu\u00e9s de cuatro meses, ya no necesitaba medicaci\u00f3n. Desde entonces, los investigadores han hecho un seguimiento con un [ensayo m\u00e1s amplio](https://clinicaltrials.gov/ct2/show/NCT04528485), pero los resultados a\u00fan no se han publicado.\nEstos primeros resultados son prometedores, pero conseguir pruebas s\u00f3lidas es todo un reto, afirma Jeremy Howick, investigador s\u00e9nior del Centro de Investigaci\u00f3n de Ensayos de la Universidad de Cardiff que estudia medicina basada en evidencias. Los investigadores no pueden ocultar el hecho de que alguien est\u00e1 recibiendo un tratamiento con agua fr\u00eda, dijo, y sus buenas expectativas pueden llevarlos a experimentar un efecto placebo. Hof lo ha sugerido en su libro El m\u00e9todo Wim Hof, al escribir que \u201cpara sacar el m\u00e1ximo provecho del m\u00e9todo, hay que comprometerse mentalmente con \u00e9l\u201d.\nIncluso si no es el efecto placebo, todav\u00eda no est\u00e1 claro qu\u00e9 componente de la nataci\u00f3n en aguas fr\u00edas puede contribuir a las mejoras reportadas en el estado de \u00e1nimo y el bienestar, dijo Mike Tipton, profesor de fisiolog\u00eda humana y aplicada en la Universidad de Portsmouth en el Reino Unido, quien estudia la reacci\u00f3n del cuerpo a los ambientes extremos. Los nadadores no solo se sumergen en aguas g\u00e9lidas, sino que tambi\u00e9n suelen hacer ejercicio, socializar, pasar tiempo al aire libre y asumir un reto, todo lo cual puede mejorar la salud mental. \u201cNadie ha realizado estudios para determinar el ingrediente activo\u201d, afirma.\n\u00bfPor qu\u00e9 la gente cree que el agua fr\u00eda es clave?\nHay varias razones para pensar que el agua fr\u00eda puede aportar beneficios para la salud mental. Sumergirse en agua helada provoca la liberaci\u00f3n de hormonas del estr\u00e9s, como la\n[noradrenalina](https://pubmed.ncbi.nlm.nih.gov/18382932/) y el [cortisol](https://pubmed.ncbi.nlm.nih.gov/10735978/). Es probable que por eso la gente diga que un chapuz\u00f3n en agua fr\u00eda los despierta, dijo Tipton.\nAlgunos estudios tambi\u00e9n han informado de un aumento de las sustancias qu\u00edmicas cerebrales que regulan el estado de \u00e1nimo, como la\n[dopamina](https://pubmed.ncbi.nlm.nih.gov/10751106/), tras un ba\u00f1o fr\u00edo, lo que podr\u00eda explicar la euforia que siente la gente despu\u00e9s de nadar. Adem\u00e1s, meter la cara en agua fr\u00eda puede [activar la rama parasimp\u00e1tica](https://www.jstage.jst.go.jp/article/circj/70/6/70_6_773/_article) del sistema nervioso, que hace que el cuerpo se relaje despu\u00e9s de un acontecimiento estresante. Esto puede ayudar a las personas a sentirse tranquilas y a reducir la inflamaci\u00f3n. Varias enfermedades, entre ellas la [depresi\u00f3n](https://bmcmedicine.biomedcentral.com/articles/10.1186/1741-7015-11-200), est\u00e1n relacionadas con la inflamaci\u00f3n cr\u00f3nica, afirma Mark Harper, consultor de anestesiolog\u00eda del Royal Sussex County Hospital, que estudia la nataci\u00f3n en agua fr\u00eda como tratamiento de la depresi\u00f3n.\nAlgunos investigadores tambi\u00e9n plantean la hip\u00f3tesis de que la adaptaci\u00f3n al choque del agua fr\u00eda puede mejorar la capacidad de una persona para hacer frente a otras tensiones. Un peque\u00f1o\n[estudio de 2010](https://pubmed.ncbi.nlm.nih.gov/20643773/) demostr\u00f3 que las personas habituadas al agua fr\u00eda presentaban una respuesta reducida al estr\u00e9s cuando se las somet\u00eda a otro esfuerzo, en este caso, hacer ejercicio en un entorno con poco ox\u00edgeno. Sin embargo, no es lo mismo soportar el ejercicio hip\u00f3xico que el estr\u00e9s psicol\u00f3gico, y se requiere trabajo adicional.\nAunque est\u00e1 claro que la inmersi\u00f3n en agua fr\u00eda brinda algunos\n[efectos fisiol\u00f3gicos](https://www.nytimes.com/2019/09/25/well/move/weights-muscles-cold-ice-bath-weightlifting-exercise-recovery.html), \u201cno hay suficientes estudios de alta calidad\u201d para recomendarla como tratamiento de salud mental, afirma Sophie Lazarus, psic\u00f3loga cl\u00ednica de la Universidad Estatal de Ohio. Otros tratamientos para la ansiedad y la depresi\u00f3n, como la [terapia cognitivo-conductual](https://www.apa.org/ptsd-guideline/patients-and-families/cognitive-behavioral), tienen m\u00e1s respaldo cient\u00edfico, dijo. Tambi\u00e9n pueden ser m\u00e1s seguros.\n\u00bfLa inmersi\u00f3n en agua fr\u00eda puede ser perjudicial?\nS\u00ed. Los investigadores saben m\u00e1s sobre los\n[peligros del agua fr\u00eda](https://physoc.onlinelibrary.wiley.com/doi/full/10.1113/EP086283) que sobre sus posibles efectos terap\u00e9uticos. Uno de los m\u00e1s evidentes es la hipotermia, que en los adultos suele aparecer al cabo de unos 30 minutos de exposici\u00f3n. Pero el agua fr\u00eda presenta riesgos importantes mucho antes.\nEl shock inicial de sumergirse en agua helada puede provocar arritmias y ataques card\u00edacos. El riesgo de arritmias\n[aumenta](https://physoc.onlinelibrary.wiley.com/doi/pdfdirect/10.1113/jphysiol.2012.229864) cuando la gente pone la cara bajo el agua mientras experimenta este \u201cchoque fr\u00edo\u201d inicial. La combinaci\u00f3n activa ramas opuestas del sistema nervioso, que env\u00edan se\u00f1ales contradictorias al coraz\u00f3n. El choque fr\u00edo tambi\u00e9n [desencadena el reflejo de jadeo](https://journals.physiology.org/doi/full/10.1152/physiol.00002.2015), seguido de la hiperventilaci\u00f3n. Si las v\u00edas respiratorias est\u00e1n bajo el agua, esto puede llevar al ahogamiento. Al riesgo de ahogamiento se suma el hecho de que nadar en agua helada te [agota r\u00e1pidamente](https://www.ncbi.nlm.nih.gov/pmc/articles/PMC1982576/).\nLa mayor\u00eda de los expertos recomiendan consultar al m\u00e9dico antes de lanzarse al agua fr\u00eda. Las personas que planean nadar al aire libre tambi\u00e9n deben considerar la posibilidad de unirse a un grupo, asegurarse de que conocen los peligros locales del agua, evitar tirarse de cabeza y asegurarse de que tienen una forma de salir del agua antes de entrar.\n\u00bfDeber\u00edas probar la inmersi\u00f3n en agua fr\u00eda?\nSi se realiza con precauci\u00f3n, la inmersi\u00f3n en agua fr\u00eda puede valer la pena. \u201cNo te va a curar\u201d, dijo Harper, pero puede ayudar a las personas a gestionar su salud mental. Adem\u00e1s, no requiere ning\u00fan equipo especializado. Aunque puedes\n[gastar miles](https://thecoldplunge.com/) de d\u00f3lares en una piscina de inmersi\u00f3n, tu ba\u00f1era o una superficie acu\u00e1tica cercana pueden servir.\nLos investigadores a\u00fan no saben cu\u00e1l es la mejor manera de aprovechar los beneficios del agua fr\u00eda para la salud mental ni la \u201cdosis\u201d m\u00ednima necesaria. Sin embargo, si resulta que el choque fr\u00edo inicial es importante, el agua no tiene por qu\u00e9 ser glacial. La respuesta al choque de fr\u00edo alcanza su punto m\u00e1ximo entre los 10 y los 15 grados Celsius, y unos pocos minutos en el agua son probablemente suficientes para experimentar sus efectos.\nEs importante recordar que m\u00e1s no es necesariamente mejor cuando se trata de inmersi\u00f3n en agua fr\u00eda, dijo Tipton. \u201cUn poco es bueno para ti, demasiado no lo es\u201d, dijo.\nChloe Williams es una periodista cient\u00edfica que cubre salud y medio ambiente.", "language": null, "image": "https://static01.nyt.com/images/2022/02/18/well/00well-scam-or-not-ice-baths-esp1/00well-scam-or-not-ice-baths-facebookJumbo.jpg?year=2022&h=549&w=1050&s=d1fc6d0d8ea0faf71f4125ef4362f1fba00384b571b83ffbfa7aaeb364a26f71&k=ZQJBKqZ0VN", "pagetype": "article", "links": ["#site-content", "#site-index", "https://www.nytimes.com/es/", "/", "https://www.nytimes.com/section/todayspaper", "/es/", "/", "/", "#after-top", "#after-sponsor", "https://www.nytimes.com/2022/02/20/well/mind/cold-water-plunge-mental-health.html", "https://www.tiktok.com/@melrobbins/video/7052093598413671685?is_copy_url=1&is_from_webapp=v1", "https://www.wimhofmethod.com/", "https://www.nytimes.com/2021/01/01/style/cold-water-swimming-benefits.html", "https://www.youtube.com/watch?v=C0RBMwirwC4", "https://www.netflix.com/title/80244690", "https://www.nytimes.com/interactive/2021/12/06/well/cold-water-mental-health-benefits.html", "https://www.nytimes.com/2019/10/16/style/self-care/celery-juice-benefits.html", "https://www.nytimes.com/2019/10/16/style/self-care/kombucha-benefits.html", "https://www.nytimes.com/2019/10/16/style/self-care/activated-charcoal-benefits.html", "https://www.nytimes.com/2019/10/16/style/self-care/cbd-oil-benefits.html", "https://www.nytimes.com/2019/10/16/style/self-care/turmeric-benefits.html", "https://www.nytimes.com/2019/11/01/style/self-care/fish-oil-benefits.html", "https://www.nytimes.com/2019/11/15/style/chlorophyll-benefits.html", "https://www.nytimes.com/2019/11/23/style/self-care/intermittent-fasting-benefits.html", "https://www.nytimes.com/2020/01/02/style/self-care/keto-diet-explained-benefits.html", "https://www.nytimes.com/2019/11/27/style/self-care/probiotics-benefits.html", "https://www.nytimes.com/es/2021/05/14/espanol/leches-vegetales.html", "https://www.nytimes.com/es/2021/05/25/espanol/colageno-beneficios-piel.html", "https://www.nytimes.com/es/2021/05/21/espanol/IMC-formula.html", "https://www.nytimes.com/2020/02/13/style/self-care/coffee-benefits.html", "https://www.nytimes.com/es/2021/09/08/espanol/sabila-mitos-verdades.html", "https://www.nytimes.com/es/2022/02/23/espanol/bano-agua-helada-beneficios.html", "https://www.nytimes.com/es/2022/05/24/espanol/fajas-moldeadoras-cintura.html", "https://www.nytimes.com/es/2023/02/09/espanol/gel-musgo-marino-beneficios.html", "https://www.ncbi.nlm.nih.gov/pmc/articles/PMC7730683/", "https://www.ncbi.nlm.nih.gov/pmc/articles/PMC2101983/", "https://collections.nlm.nih.gov/catalog/nlm:nlmuid-2544040R-bk", "https://www.bbc.com/worklife/article/20200228-the-danish-trick-to-shock-your-body-into-happiness", "https://www.outsideonline.com/outdoor-adventure/water-activities/cold-water-swimming-mindfulness/", "https://elemental.medium.com/swimming-in-cold-water-has-done-wonders-for-my-stress-45be3083be96", "https://www.theguardian.com/news/2021/mar/23/how-cold-water-swimming-cured-my-broken-heart", "https://thetyee.ca/Culture/2021/12/27/Into-The-Deep/", "https://www.sciencefocus.com/the-human-body/cold-water-swimming-why-an-icy-dip-is-good-for-your-mental-and-physical-health/", "https://www.sciencedirect.com/science/article/abs/pii/S1550830720300859", "https://pubmed.ncbi.nlm.nih.gov/15253480/", "https://onlinelibrary.wiley.com/doi/10.1002/lim2.12", "https://pubmed.ncbi.nlm.nih.gov/30131418/", "https://clinicaltrials.gov/ct2/show/NCT04528485", "https://pubmed.ncbi.nlm.nih.gov/18382932/", "https://pubmed.ncbi.nlm.nih.gov/10735978/", "https://pubmed.ncbi.nlm.nih.gov/10751106/", "https://www.jstage.jst.go.jp/article/circj/70/6/70_6_773/_article", "https://bmcmedicine.biomedcentral.com/articles/10.1186/1741-7015-11-200", "https://pubmed.ncbi.nlm.nih.gov/20643773/", "https://www.nytimes.com/2019/09/25/well/move/weights-muscles-cold-ice-bath-weightlifting-exercise-recovery.html", "https://www.apa.org/ptsd-guideline/patients-and-families/cognitive-behavioral", "https://physoc.onlinelibrary.wiley.com/doi/full/10.1113/EP086283", "https://physoc.onlinelibrary.wiley.com/doi/pdfdirect/10.1113/jphysiol.2012.229864", "https://journals.physiology.org/doi/full/10.1152/physiol.00002.2015", "https://www.ncbi.nlm.nih.gov/pmc/articles/PMC1982576/", "https://thecoldplunge.com/", "#after-bottom", "https://help.nytimes.com/hc/en-us/articles/115014792127-Copyright-notice", "https://www.nytco.com/", "https://help.nytimes.com/hc/en-us/articles/115015385887-Contact-Us", "https://help.nytimes.com/hc/en-us/articles/115015727108-Accessibility", "https://www.nytco.com/careers/", "https://nytmediakit.com/", "https://www.tbrandstudio.com/", "https://www.nytimes.com/privacy/cookie-policy#how-do-i-manage-trackers", "https://www.nytimes.com/privacy/privacy-policy", "https://help.nytimes.com/hc/en-us/articles/115014893428-Terms-of-service", "https://help.nytimes.com/hc/en-us/articles/115014893968-Terms-of-sale", "/sitemap/", "https://www.nytimes.com/ca/", "https://www.nytimes.com/international/", "https://help.nytimes.com/hc/en-us", "https://www.nytimes.com/subscription?campaignId=37WXW"]}