{"title": "55 ideas de negocios para emprender siendo tu propio jefe en 2023", "author": "Hotmart", "url": "https://hotmart.com/es/blog/ideas-de-negocios", "hostname": "hotmart.com", "description": "\u00bfTe gustar\u00eda emprender? Entonces tienes que conocer 55 ideas de negocio que te mostramos en este post para ayudarte a lograrlo.", "sitename": "Hotmart", "date": "2023-05-16", "id": null, "license": null, "body": null, "comments": "", "commentsbody": null, "raw_text": null, "text": "55 ideas de negocios para emprender siendo tu propio jefe en 2023\nConoce nichos con potencial y formas de sacar tus ideas del papel con poco dinero\nEl sue\u00f1o de muchas personas hoy en d\u00eda es tener su propio negocio. Lo que algunos a\u00f1os atr\u00e1s parec\u00eda muy dif\u00edcil de realizar, ahora es posible, ya que es mucho m\u00e1s f\u00e1cil iniciar un negocio propio sin invertir una gran cantidad de capital. Y como siempre es importante tener varias alternativas, en este post te presentaremos ideas de negocios que podr\u00edan cambiarte la vida.\n\u00bfEres una de estas personas? \u00bfCrees que\n[ has elegido la carrera equivocada](https://hotmart.com/es/blog/el-arte-de-elegir-la-carrera-equivocada) o quieres hacer un cambio en tu vida? \u00bfTe gustar\u00eda descubrir cu\u00e1les son las mejores estrategias para cumplir tus objetivos?\nSi ya has pensando en\n[emprender](https://hotmart.com/es/blog/perfil-del-emprendedor), entonces este post es para ti. Seleccionamos 55 ideas de negocios para que te inspires. Elige la que m\u00e1s tenga que ver contigo y empieza a planear tu negocio. [Ideas de negocios en Educaci\u00f3n](#t1) [Ideas para la Salud y Desarrollo Personal](#t2) [Ideas de negocio Fitness](#t3) [Ideas para Est\u00e9tica y Bienestar](#t4) [Consultor\u00eda Empresarial](#t5) [Ideas rentables en el \u00e1rea de Gastronom\u00eda](#t6) [Ideas relacionadas al Arte y Manualidades](#t7) [Ideas de negocios en el segmento de la Moda](#t8) [Ideas de negocio para emprender en Eventos](#t9) [Ideas de negocios online](#t10) [Ideas de negocio innovadoras](#t12) [14 tips para desarrollar tu idea de negocio con poco dinero](#t11)\nIdeas de negocios en Educaci\u00f3n\n1. Clases particulares\nSi dominas un asunto con profundidad, puedes dar clases particulares de modo presencial, virtual o adoptar un\n[modelo h\u00edbrido](https://hotmart.com/es/blog/educacion-hibrida), usando muchas de las plataformas y soluciones disponibles hoy en d\u00eda.\nSi eliges hacer encuentros personalmente, tienes que pensar en un espacio adecuado, u ofrecer tus servicios a domicilio.\nDespu\u00e9s de definir el espacio, lo primero que debes hacer es pensar en tu\n[p\u00fablico objetivo](https://hotmart.com/es/blog/publico-objetivo) y conocerlo lo mejor posible.\n\u00bfVas a enfocarte en adultos, j\u00f3venes o ni\u00f1os? \u00bfPrefieres clases individuales o grupales? \u00bfSer\u00eda mejor delimitar una regi\u00f3n geogr\u00e1fica o podr\u00edas desplazarte sin problemas?\nResponder y analizar estas preguntas te ayudar\u00e1 a preparar un buen material de estudio, seg\u00fan la\n[metodolog\u00eda educativa](https://hotmart.com/es/blog/metodologias-educativas) que elijas.\n2. Cursos online\nLos\n[ cursos online](https://hotmart.com/es/blog/como-vender-cursos-online) son cada vez m\u00e1s buscados y consumidos en todo el mundo porque ofrecen muchas ventajas tanto para estudiantes como para profesores.\nBeneficios para estudiantes:\n- No tienen que salir de su casa para hacer el curso.\n- Pueden acceder a las clases a cualquier hora.\n- M\u00e1s libertad para respetar su ritmo de aprendizaje.\nBeneficios para profesores:\n[Grabar las videoclases](https://hotmart.com/es/blog/como-hacer-videoclases-atractivas)una sola vez.\n- Vender el curso en el mundo entero.\n- Elegir sus horarios de trabajo.\n- Trabajar en cualquier lugar, incluso viajando.\nY cuenta con una aliada para crear y vender tu curso online\nReg\u00edstrate gratis\nY cuenta con una aliada para crear y vender tu curso online\n3. Refuerzo escolar\nEl refuerzo educativo significa ayudar a ni\u00f1os, ni\u00f1as o adolescentes con el contenido que est\u00e1n trabajando en la escuela. No tienes que ense\u00f1arles necesariamente algo nuevo, sino profundizar y ejercitar lo que est\u00e1n aprendiendo.\nPor eso, es una buena oportunidad para quien conoce a fondo alguna asignatura escolar: Matem\u00e1ticas, Ciencias, Historia, Geograf\u00eda, M\u00fasica o cualquier otra.\nEs necesario tener\n[creatividad](https://hotmart.com/es/blog/trabajo-creativo) para emplear estrategias para cada estudiante. Si te has graduado en Pedagog\u00eda, \u00a1mejor a\u00fan!\nLas clases pueden ser presenciales u online, y deber\u00e1s evaluar qu\u00e9 funciona mejor con cada persona o grupo.\n4. Ebooks\nCrear ebooks es una excelente opci\u00f3n para quien quiere crear un\n[negocio digital rentable](https://hotmart.com/es/blog/negocios-rentables-sin-inversion) de manera f\u00e1cil y r\u00e1pida.\nEl ebook, o libro digital, es es un material muy buscado por los usuarios de internet, ya que es f\u00e1cil de descargar y consumir. En \u00e9l, debes transmitir alg\u00fan conocimiento que pueda ayudar a otras personas.\nSi tu contenido est\u00e1 listo, pero no tienes muchas habilidades de dise\u00f1o, crea tu libro digital en Power Point. En nuestro blog, tenemos\n[4 plantillas descargables que puedes usar gratis](https://hotmart.com/es/blog/como-crear-un-ebook-power-point).\nSi te interes\u00f3 el tema, te recomendamos nuestra gu\u00eda completa con todo lo que necesitas saber para\n[crear tu primer ebook y venderlo en internet](https://hotmart.com/es/blog/convierte-tu-conocimiento-en-beneficio).\n5. Preparador de ex\u00e1menes\nEsta es otra de las actividades que puedes hacer desde tu casa, de forma remota, por internet.\nMuchas veces, las personas no quieren hacer clases regulares o un curso, pero necesitan prepararse para alg\u00fan examen con temas espec\u00edficos. Esto es muy com\u00fan para ingresar a universidades, conseguir puestos de trabajo u obtener la aprobaci\u00f3n en un programa de posgrado.\nAdem\u00e1s, en algunas escuelas hay especialistas en asignaturas escolares que se dedican a elaborar o corregir ex\u00e1menes. Esta es una buena alternativa para quien quiere trabajar con educaci\u00f3n sin tener que dar clases.\n6. Escuela de idiomas\nEsta es una idea de negocio muy rentable que no pasa de moda. Sin embargo, tendr\u00e1s que ofrecer algo que te distinga de los\n[competidores](https://hotmart.com/es/blog/analisis-de-la-competencia): un m\u00e9todo de ense\u00f1anza, un p\u00fablico objetivo espec\u00edfico, una estructura f\u00edsica o clases de un idioma que pocas escuelas ofrezcan.\nSi no tienes dinero para invertir en una escuela f\u00edsica, puedes crear tu escuela online y ofrecer servicios diversos, como algunos de los que hemos nombrado aqu\u00ed: clases particulares y grupales, videoclases, ebooks, etc.\nPor otro lado, un primer paso puede ser empezar dando clases particulares y de a poco ir construyendo tu marca como escuela.\n7. Congresos online\nSi eres especialista en alg\u00fan tema y te gusta\n[hablar en p\u00fablico](https://hotmart.com/es/blog/como-hablar-en-publico), una buena forma de ganar dinero desde casa es dar conferencias sobre tu \u00e1mbito de estudio y participar en congresos.\nActualmente, es muy com\u00fan\n[hacer cursos](https://hotmart.com/es/blog/crear-cursos-a-distancia) o encuentros virtuales. Esto permite que personas de todo el mundo participen sin tener que invertir tanto dinero en viajes e infraestructura.\nAprovecha y prepara un buen material de presentaci\u00f3n para empezar a divulgar tu trabajo y hacer las primeras presentaciones. Al principio, puede que tengas que hacerlo sin que te paguen por ello, pero si fortaleces tu autoridad, es muy posible que empiecen a invitarte y contratarte.\nIdeas de negocios para emprender en Salud y Desarrollo personal\n8. Terapias\nHoy en d\u00eda, existen muchas opciones para estudiar y formarse en terapias alternativas, inclusive de forma virtual.\nSi esta es tu l\u00ednea de trabajo o te interesa entrar en el universo de la salud y el cuidado, abrir un espacio terap\u00e9utico en casa es una de las mejores ideas de negocios. Puede que necesites invertir algo en infraestructura y, como siempre, en divulgar tus servicios.\nAlgunas de las opciones disponibles son reiki, acupuntura, medicina floral, aromaterapia, reflexolog\u00eda, shiatsu y terapia transpersonal. Pero esto no es todo, hay much\u00edsimas otras posibilidades para que puedas trabajar como terapeuta.\nSi la t\u00e9cnica lo permite, puedes crear tu negocio online y atender de forma remota a personas en cualquier lugar del mundo.\n9. Health Coaching\nSi eres una persona que tiene experiencia en comportamiento humano y salud, el Health Coaching es un camino muy interesante para que empieces a emprender.\nEstos profesionales ayudan a las personas a alcanzar\n[h\u00e1bitos saludables](https://hotmart.com/es/blog/buenos-habitos) sostenibles y a cambiar su estilo de vida en busca de un mayor bienestar y relaci\u00f3n consigo mismas y su entorno.\nEs una profesi\u00f3n que vino para quedarse, ya que cada vez m\u00e1s la gente busca hacer cambios significativos para vivir mejor.\nSi te interesa, puedes hacer cursos de formaci\u00f3n online para prepararte y tener m\u00e1s herramientas en tu atenci\u00f3n como health coach.\n10. Mindfulness\nMuchas personas buscan conocer y desarrollar el\n[mindfulness](https://hotmart.com/es/blog/mindfulness) para tener mejores resultados en sus carreras profesionales o trabajos.\nSe trata de una t\u00e9cnica de meditaci\u00f3n para alcanzar la atenci\u00f3n plena y regular los estados emocionales negativos.\nSi ya practicas algunas otras t\u00e9cnicas de meditaci\u00f3n ser\u00e1 mucho m\u00e1s f\u00e1cil empezar tu negocio en esta \u00e1rea. Puedes ofrecer entrenamientos personalizados de forma virtual o crear otras opciones de pr\u00e1cticas que se adapten a tu p\u00fablico.\nIdeas de negocios fitness\n11. Personal training\nEsta es una buena opci\u00f3n para quien tiene formaci\u00f3n en educaci\u00f3n f\u00edsica, pues se trata de un negocio rentable que no exige grandes inversiones para empezar.\nLa alta demanda de este tipo de profesionales se debe a que muchas personas necesitan rutinas personalizadas que se adapten a sus horarios y estilos de vida.\nUna ventaja es que puedes trabajar en gimnasios, \u00e1reas al aire libre o en la casa de tus clientes.\n12. Clases de baile\n\u00bfTienes formaci\u00f3n y conocimiento en alg\u00fan tipo de baile y te gusta ense\u00f1ar? Entonces puedes empezar a dar clases particulares o grupales.\nSi tu idea de negocios est\u00e1 relacionada con invertir en algo mayor, puedes crear una escuela de baile y contratar a otros profesionales que ampl\u00eden la oferta de actividades.\n13. Tienda de art\u00edculos especializados\nEn caso de que tu idea de negocio sea tener una tienda y adem\u00e1s te encantan los deportes, una buena opci\u00f3n es unir las dos cosas ofreciendo productos para diferentes pr\u00e1cticas deportivas.\nUna tienda de art\u00edculos especializados es bastante rentable, pero hay que tener en cuenta que necesitar\u00e1s\n[invertir dinero](https://hotmart.com/es/blog/consejos-para-invertir-dinero) para empezar.\n14. Gimnasio\nSi quieres tener un trabajo en el segmento de los deportes y tienes dinero para invertir, una de las mejores ideas de negocios es poner un gimnasio, con distintas modalidades.\nSin embargo, acu\u00e9rdate de que tendr\u00e1s que\n[gestionar](https://hotmart.com/es/blog/indicadores-financieros) la compra de equipamientos y maquinarias, el personal que deber\u00e1 ser contratado, el alquiler o la compra del espacio, adem\u00e1s de los clientes.\nIdeas de emprendimiento en est\u00e9tica y bienestar\n15. Maquillaje para eventos\n\u00bfTienes talento para el maquillaje y te gusta aprender y estar al tanto de las\n[tendencias de mercado](https://hotmart.com/es/blog/tendencias-de-mercado)?\nEntonces, una excelente oportunidad puede ser el maquillaje para eventos. Para empezar, es necesario tener pr\u00e1ctica y buenos productos para trabajar. Cuanta m\u00e1s variedad de material tengas, mejor podr\u00e1s atender a tus clientes.\nEste trabajo exige creatividad, conocimiento y una constante actualizaci\u00f3n. Si todo va bien, puedes pensar en un segundo paso, como inaugurar tu espacio de trabajo.\n16. Manicura y pedicura\nEste es un servicio cada vez m\u00e1s buscado, y no solo por las mujeres. Actualmente, la manicura y pedicura involucran un trabajo est\u00e9tico, pero tambi\u00e9n de cuidado personal y salud.\nEs importante estudiar y hacer cursos pr\u00e1cticos para acompa\u00f1ar las t\u00e9cnicas y novedades en esta \u00e1rea. Sin duda, el alto nivel de calidad de tu trabajo har\u00e1 que te destaques en este mercado.\nUna ventaja es que este es un servicio que las personas realizan peri\u00f3dicamente: puede ser 1 vez por semana o cada 15 d\u00edas. Por eso, despu\u00e9s de que consigas conquistar a tus clientes, tendr\u00e1s trabajo siempre.\n17. Masajes\nEl masaje es otro servicio muy popular que atiende a un p\u00fablico muy amplio.\nDentro de este punto, encontramos diversas t\u00e9cnicas y tipos de masaje, seg\u00fan su origen y objetivo. Por ejemplo, masajes terap\u00e9uticos, relajantes o reductores, entre muchos otros.\nPrimero debes saber qu\u00e9 te interesa estudiar y elegir el tipo de curso. Piensa c\u00f3mo te gustar\u00eda ayudar a las personas y empieza a\n[trazar un plan](https://hotmart.com/es/blog/planificacion).\nUna vez que tengas una buena base de formaci\u00f3n, puedes empezar a atender a domicilio o en alg\u00fan espacio que ya est\u00e9 en funcionamiento, antes de pensar en tener tu propio lugar.\n18. Dise\u00f1o de cejas y depilaci\u00f3n\nEl dise\u00f1o de cejas y la depilaci\u00f3n son servicios muy buscados y tienen muchos puntos positivos: son necesarios pocos productos para empezar, se pueden realizar en diferentes ambientes y generalmente hay mucha oferta de cursos de formaci\u00f3n para iniciantes.\nAdem\u00e1s, puedes combinarlos con otros servicios de est\u00e9tica que t\u00fa hagas u otras personas con las que te propongas trabajar.\n19. Peluquer\u00eda\nEsta es una de las ideas de negocios m\u00e1s antiguas y que, probablemente, van a existir para siempre. La mayor\u00eda de la gente necesita este servicio, sea con mayor o menor frecuencia.\nSi tienes talento para ese tipo de trabajo y no tienes mucho dinero para invertir, puedes realizar cursos y hacer el trabajo a domicilio o en tu hogar.\nSi tu idea es algo mayor, puedes poner un sal\u00f3n y contratar a profesionales especialistas, ofreciendo distintos servicios, como tintes, peinados y diversos tratamientos capilares.\n20. Asesor\u00eda de skincare\nLos cuidados de la piel y la est\u00e9tica se diversifican a medida que pasa el tiempo, y probablemente la tendencia siga igual: m\u00e1s cuidados, m\u00e1s servicios, m\u00e1s opciones y m\u00e1s productos.\nPor eso, una persona especializada en productos y rutinas de skincare, o cuidados de la piel, tendr\u00e1 una alta demanda de trabajo y clientes.\nLa\n[consultor\u00eda](https://hotmart.com/es/blog/consultoria-online) puede ser presencial o en l\u00ednea. Incluso, muchos influencers est\u00e1n ganando fama dentro de este nicho. Eso s\u00ed, debes tener una gran disposici\u00f3n para investigar y probar constantemente las novedades del mercado, adem\u00e1s de estudiar mucho para orientar a tu p\u00fablico y tus clientes de forma responsable.\n21. Cursos de maquillaje\nHace poco te recomendamos algunas ideas de negocios relacionadas al maquillaje para eventos. Ahora, te damos otra opci\u00f3n, que es usar todo tu conocimiento para crear uno o m\u00e1s cursos de maquillaje.\nAdem\u00e1s de conocer y aplicar bien las t\u00e9cnicas, debes tener cierta facilidad para ense\u00f1arlas y mostrar contenido interesante para quien tenga inter\u00e9s en aprender.\nLo ideal es ofrecer cursos diversos, ya sea por niveles o por el estilo de maquillaje que vas a ense\u00f1ar.\nPuedes grabar las clases y venderlas como un\n[curso en l\u00ednea](https://hotmart.com/es/blog/cursos-en-linea) en una [plataforma EaD](https://hotmart.com/es/blog/que-es-plataforma-de-cursos-online), hacer un curso online en vivo, y tambi\u00e9n de forma presencial.\nConsultor\u00eda empresarial\n22. Asesoramiento financiero\nEl mercado de\n[asesor\u00eda financiera](https://hotmart.com/es/blog/consultoria-financiera) es creciente y recurrente.\nPor lo tanto, si tienes experiencia en esta \u00e1rea, la\n[consultor\u00eda financiera](https://blog.nubox.com/contadores/negocio-contable) es una idea de negocio a la que puedes apostar.\nEl consejo para comenzar es tener contactos en el \u00e1rea y desarrollar tu autoridad para tener un negocio exitoso.\nAdem\u00e1s, es a\u00fan m\u00e1s probable que crezcas si te enfocas en un nicho espec\u00edfico y tienes tu propio m\u00e9todo.\n23. Consultor\u00eda de marketing\nCuando hablamos de\n[consultor\u00eda de marketing](https://hotmart.com/es/blog/consultoria-de-marketing), nos referimos a un \u00e1rea muy amplia. Dentro de este tipo de consultor\u00eda, tenemos el marketing tradicional y el digital.\nEn el\n[marketing digital](https://hotmart.com/es/blog/que-es-marketing-digital), las posibilidades son infinitas y el mercado est\u00e1 expandi\u00e9ndose. Hay varias empresas e incluso emprendedores principiantes que necesitan especialistas para ayudarlos en \u00e1reas como:\nPara abrir un negocio de consultor\u00eda, es importante tener experiencia, saber analizar datos y desarrollar soluciones creativas. Esto es lo que elevar\u00e1 la calidad de tu servicio y encantar\u00e1 a tu cliente.\n24. Consultor\u00eda de business plan\nBusiness plan es\n[planificaci\u00f3n de negocios](https://hotmart.com/es/blog/plan-de-negocios-producto-digital).\nEsta idea es para quienes entienden c\u00f3mo ense\u00f1ar a otros a abrir y desarrollar nuevos negocios.\nPor lo general, es necesario tener una base s\u00f3lida en administraci\u00f3n, pero cualquier persona con talento y experiencia puede abrir un negocio en esta \u00e1rea.\nNegocios para emprender en Gastronom\u00eda\n25. Restaurante especializado en un nicho espec\u00edfico\nSi piensas en abrir un restaurante, probablemente sabes que existen miles de opciones ya disponibles en el mercado. Por eso, la competencia es muy alta y destacarse no es una tarea f\u00e1cil.\nSin embargo, si piensas en\n[un nicho espec\u00edfico](https://hotmart.com/es/blog/como-elegir-un-nicho-para-tu-primer-producto-digital), las probabilidades de \u00e9xito son mucho mayores, porque tendr\u00e1s un p\u00fablico particular al cual direccionar todas tus estrategias, adem\u00e1s de pocos competidores en el mercado.\nPor ejemplo, si optas por un restaurante vegetariano o vegano, tendr\u00e1s un p\u00fablico objetivo espec\u00edfico: personas que no comen carne o productos de origen animal.\nEsa es una tendencia muy importante del mercado actual. Se trata de enfocarse en la necesidad de un grupo de personas y atenderlas de la mejor forma posible.\n26. Venta de alimentos congelados\nLa venta de alimentos congelados es otra de las ideas de negocios que est\u00e1 en alza, principalmente cuando hablamos de comidas sanas, nutritivas y caseras.\nActualmente, existe una gran preocupaci\u00f3n por la calidad de los alimentos que consumimos y, al mismo tiempo, las personas desean opciones pr\u00e1cticas y r\u00e1pidas.\nSi tienes habilidad para la cocina, esta es una buena posibilidad, que puedes empezar con poca inversi\u00f3n, incluso captando a clientes de tu entorno social.\n27. Food Truck\nQuiz\u00e1s ya has visto un Food Truck, o cami\u00f3n de comida. Estos veh\u00edculos adaptados para producir y vender alimentos en las calles tienen mucho \u00e9xito.\nEs una excelente opci\u00f3n de negocios para quienes desean emprender en el \u00e1rea gastron\u00f3mica. Especialmente en las grandes ciudades, todos buscan soluciones alimentarias f\u00e1ciles y pr\u00e1cticas.\n28. Comida para ni\u00f1os\nLa comida para ni\u00f1os llama mucho la atenci\u00f3n de los padres o quienes conviven con ni\u00f1os peque\u00f1os y tienen dificultad para organizar su rutina de alimentaci\u00f3n o buscan opciones saludables y atractivas.\nEl problema, sin embargo, es conseguir competir con las conocidas \u201ccomidas chatarra\u201d, que llaman much\u00edsimo la atenci\u00f3n de los ni\u00f1os.\nUna excelente opci\u00f3n, entonces, es preparar comidas sanas que tengan aspectos y sabores capaces de encantar a los peque\u00f1os: ensaladas que forman dibujos divertidos, helados hechos con frutas naturales y alimentos puestos en recipientes llamativos, por ejemplo.\n29. Pasteler\u00eda\nLos pasteles son infaltables en una fiesta, es por ello que est\u00e1n dentro de nuestra lista de mejores ideas de negocios. Si te enfocas en pasteles tem\u00e1ticos, con elementos actuales como pel\u00edculas, series de televisi\u00f3n, dibujos, bandas y celebridades, ten por seguro que tendr\u00e1s excelentes resultados.\nAdem\u00e1s de entregar productos de excelente calidad, esta idea de negocio exige hacer anuncios con\n[buenas im\u00e1genes](https://hotmart.com/es/blog/fotos-para-instagram) y presentaciones, para que el p\u00fablico se interese en probarlos.\nSi te gusta la pasteler\u00eda tradicional, perfecci\u00f3nate en esta \u00e1rea. Pero si quieres innovar, apuesta a la pasteler\u00eda con alguna caracter\u00edstica especial, como productos libres de trigo y gluten.\n30. Gastronom\u00eda internacional\nLa gastronom\u00eda internacional suele ser una excelente idea de negocio, principalmente en el mundo actual. Las personas est\u00e1n cada vez m\u00e1s abiertas y curiosas para probar alimentos distintos, de pa\u00edses y culturas diferentes.\nSi no tienes ning\u00fan lazo cultural o hist\u00f3rico con la gastronom\u00eda de otro lugar, lo ideal es\n[realizar una investigaci\u00f3n](https://hotmart.com/es/blog/investigacion-cuantitativa) y analizar los intereses del p\u00fablico de la regi\u00f3n en que vives para poder pensar en una propuesta rentable.\nHoy en d\u00eda no hace falta que tengas un espacio f\u00edsico para iniciar este tipo de emprendimiento. Puedes empezar vendiendo comida a trav\u00e9s de aplicaciones y aumentar tus clientes hasta posicionarte mejor en el mercado.\n31. Clases de cocina\nSi te gusta la cocina y crees que tu experiencia puede ayudar a las personas, una de las mejores ideas de negocios es dar clases sobre el tema.\nPara ense\u00f1ar las recetas adecuadas, primero debes conocer a tu p\u00fablico y saber si le interesa aprender sobre gastronom\u00eda gourmet, recetas f\u00e1ciles, saludables o alg\u00fan otro tipo de cocina espec\u00edfica.\n32. Productos artesanales\nLa producci\u00f3n de alimentos caseros tambi\u00e9n permite explorar muchas opciones, por eso, es una de las ideas de negocios que no pod\u00eda faltar en nuestra lista.\nPuedes preparar bebidas y comidas artesanales, como cerveza, dulces, o quesos; o cultivar productos org\u00e1nicos, por ejemplo, y atraer a un p\u00fablico diverso.\nPara las ventas, si no tienes un espacio f\u00edsico adecuado, como una tienda, aprovecha para hacer la divulgaci\u00f3n en internet y entregar a domicilio.\n33. Servicio de comida para el d\u00eda a d\u00eda\nLa \u00faltima idea de negocios sobre gastronom\u00eda es ocuparse de preparar platos hechos para el almuerzo o la cena. El formato de tu negocio puede variar. Aqu\u00ed te dejo algunos ejemplos:\n- Preparar un men\u00fa semanal y vender los platos congelados.\n- Hacer uno o dos platos diferentes cada d\u00eda y venderlos en el momento.\n- Preparar men\u00fas personalizados para cada cliente.\nElige la opci\u00f3n que m\u00e1s te guste y, sobre todo, que\n[mejor atienda a tu p\u00fablico](https://hotmart.com/es/blog/buena-atencion-al-cliente).\nIdeas de negocios sobre arte y manualidades\n34. Productos reciclados\nCada vez m\u00e1s las personas reconocen la importancia de cuidar al medio ambiente y, por eso, est\u00e1 creciendo la cantidad de gente que busca opciones de objetos que no da\u00f1en m\u00e1s nuestro ecosistema.\nSi tienes habilidades manuales, los productos reciclados pueden ser una excelente idea de negocio. Obviamente la inversi\u00f3n inicial es muy baja y por eso empezar a emprender puede resultar un poco m\u00e1s f\u00e1cil.\n35. Regalos personalizados\nEsta es una de las ideas de negocios m\u00e1s comunes, pero que nunca pierden su encanto.\nLo ideal es elegir una t\u00e9cnica, como por ejemplo, impresi\u00f3n digital, y crear productos para fechas especiales, cumplea\u00f1os y bodas, entre otros.\nTambi\u00e9n puedes definir una tem\u00e1tica o un estilo que le de una identidad a tu trabajo.\n36. Bisuter\u00eda y joyer\u00eda\nOtra de las mejores ideas de negocios en este segmento son los relacionados a la fabricaci\u00f3n de collares, pulseras, aretes y otros objetos similares, ya que nunca pasan de moda. Adem\u00e1s, existe una infinidad de modelos y estilos que pueden ser comercializados.\nSin dudas, como en todo trabajo manual, necesitas probar lo que funciona mejor y practicar mucho para alcanzar resultados cada vez mejores.\nPara venderlos, puedes crear una tienda virtual y hacer env\u00edos fuera de tu regi\u00f3n. As\u00ed, llegar\u00e1s a un p\u00fablico mucho m\u00e1s amplio.\n37. Reparaciones en casa\nPor \u00faltimo, una idea de negocio muy \u00fatil y divertida. Se trata de crear contenido con consejos y soluciones para resolver problemas en casa, como cambiar un grifo, pintar una habitaci\u00f3n o montar un armario.\nPuedes crear un canal en\n[YouTube](https://hotmart.com/es/blog/cuanto-paga-youtube) o [escribir un blog](https://hotmart.com/es/blog/como-escribir-en-tu-blog-9-tips) y subir fotos con la explicaci\u00f3n de cada proceso.\nM\u00e1s all\u00e1 de los ejemplos que te dimos, las opciones son infinitas y puedes concentrarte en algo espec\u00edfico que hagas muy bien o crear respuestas a lo que tu p\u00fablico te pide.\nIdeas de negocios en la Moda\n38. Venta de ropa de un nicho espec\u00edfico\nEste es un caso muy semejante al del restaurante de nicho espec\u00edfico, solo que en otro segmento: el de moda y vestuario.\nVender productos para un p\u00fablico m\u00e1s espec\u00edfico puede ser una buena idea para tener\n[clientes fieles](https://hotmart.com/es/blog/como-fidelizar-clientes) a tus productos. Mira algunos ejemplos:\n- Ropa interior c\u00f3moda y vers\u00e1til\n- Pijamas combinados para toda la familia\n- Ropa con estampas inspiradas en obras de arte\n- Conjuntos divertidos para ni\u00f1os\n39. Tienda de ropa usada\nVender ropa usada o de segunda mano es definitivamente una idea de negocio simple y rentable.\nSi te encanta comprar ropa, pero no quieres llenar tus armarios con lo que ya no usas, \u00a1crear una tienda de segunda mano es la idea perfecta!\nA medida que tu negocio crece, tambi\u00e9n puedes llamar a otros para que colaboren y vendan ropa en tu tienda.\nRecuerda brindarles una buena experiencia a tus clientes, tener un perfil comercial en Instagram para publicitar las piezas,\n[crear tu marca](https://hotmart.com/es/blog/manual-de-marca) y usar tu creatividad para innovar con la ropa usada.\n40. Alquiler de vestidos de fiesta\nLos vestidos de fiesta suelen ser art\u00edculos caros y que las personas, en general, usan solo una o dos veces. Por eso, una alternativa es el alquiler de vestidos de fiesta.\nSi te gusta la moda y cuentas con una buena capacidad de negociaci\u00f3n, esta idea de negocio puede ser ideal para ti. No es necesario tener una tienda, pues puedes llevar las prendas a domicilio y gestionar tu negocio de forma online.\n41. Coaching de estilo\nSi todos te admiran por tu capacidad de elegir y combinar piezas de ropa y accesorios, una buena idea de negocio puede ser el\n[coaching](https://hotmart.com/es/blog/que-es-el-coaching) de estilo o la funci\u00f3n de personal shopper.\nRealizar una evaluaci\u00f3n de las prendas disponibles en el ropero del cliente, dar consejos sobre qu\u00e9 comprar y d\u00f3nde hacerlo, o incluso adquirir los productos, son algunas de las actividades de este profesional.\nSi no quieres hacerlo personalmente, tambi\u00e9n puedes\n[crear un blog](https://hotmart.com/es/blog/como-ganar-dinero-con-blog-guia-completa) o un ebook sobre el tema.\n42. Personalizaci\u00f3n y arreglo de ropa\nEs muy com\u00fan comprar una prenda de vestir y necesitar hacerle ajustes al tama\u00f1o o la forma. Sin embargo, no todas las personas tienen habilidades manuales, tiempo o paciencia para hacerlo.\nPor eso, muchos profesionales de corte y confecci\u00f3n tambi\u00e9n est\u00e1n buscando formas de aprender a personalizar prendas para satisfacer la demanda en este mercado.\nCon creatividad, es posible sacar provecho de este nicho.\nIdeas de negocio para emprender en Eventos\n43. Organizaci\u00f3n de eventos.\nLos eventos ocurren todo el tiempo en nuestras vidas y muchas personas no tienen tiempo o realmente no les gusta pensar en la\n[organizaci\u00f3n](https://hotmart.com/es/blog/cultura-organizacional). Ah\u00ed es donde entra el profesional de planificaci\u00f3n de eventos.\nSi te gusta planificar, crear y organizar, esta es una gran oportunidad para emprender.\nEsta \u00e1rea es muy completa, por lo que es ideal que te concentres en un nicho espec\u00edfico, como por ejemplo, fiestas de cumplea\u00f1os infantiles.\nOtro consejo para abrir un negocio de organizaci\u00f3n de eventos es tener buenos socios y proveedores: esto ser\u00e1 muy importante para la buena calidad del servicio ofrecido.\n44. Decoraci\u00f3n de eventos\nSi la planificaci\u00f3n no es lo tuyo, pero a\u00fan piensas en emprender en el \u00e1rea de\n[eventos](https://hotmart.com/es/blog/eventos-corporativos) y tienes talento para la decoraci\u00f3n, \u00a1esta idea es para ti!\nMuchas personas quieren tener el evento perfecto, pero necesitan a alguien que pueda hacerlo por ellas.\nAl igual que organizar eventos, un decorador de fiestas necesita buenos socios y proveedores para encantar a sus clientes y garantizar el \u00e9xito empresarial.\n45. Alquiler de juguetes y art\u00edculos de fiesta.\nA\u00fan en eventos, el alquiler de juguetes y art\u00edculos de fiesta es un \u00e1rea incre\u00edble para abrir un negocio. Lo mejor de todo es que no tienes que conocer los eventos para empezar.\nLo que necesitar\u00e1s es una inversi\u00f3n inicial para comprar juguetes o art\u00edculos de fiesta, como: trampol\u00edn, billar, mesas, sillas, etc., y un lugar para guardarlos.\nEste negocio es muy escalable, pero siempre debes prestar atenci\u00f3n al mantenimiento de los juguetes y de los objetos que vas a alquilar.\nIdeas de negocios online\nLos\n[negocios digitales](https://hotmart.com/es/blog/negocios-digitales) son actualmente una de las mejores opciones para quien quiere emprender. Te mostramos por qu\u00e9:\n- El\n[emprendimiento digital](https://hotmart.com/es/blog/negocios-online)crece cada vez m\u00e1s\n- Puedes trabajar en cualquier lado, ya que no necesitas estar en un lugar espec\u00edfico para realizar tus tareas\n- Puedes trabajar en el momento que te parezca mejor pues no necesitas preocuparte con los horarios de oficina\n- Consigues clientes en cualquier lugar del mundo y no solamente en la zona en que vives\n- No siempre necesitas grandes inversiones para comenzar\n- Puedes escalar tus ganancias mucho m\u00e1s que en otro tipo de negocio\nAhora te daremos algunas ideas de negocio online para que te inspires.\n46. Trafficker digital\nEsta es una de las profesiones m\u00e1s innovadoras de los \u00faltimos tiempos y, por eso, quiz\u00e1s no sepas de qu\u00e9 se trata.\nUn\n[trafficker digital](https://hotmart.com/es/blog/trafficker-digital-roberto-gamboa) se encarga de crear y optimizar campa\u00f1as publicitarias de personas o empresas. Es un trabajo totalmente online y, por eso, es fundamental tener una buena conexi\u00f3n a Internet.\nExige preparaci\u00f3n en el asunto, lo que implica una inversi\u00f3n de tiempo y dinero mayor que en otro tipo de profesiones. Sin embargo, si te gusta trabajar con redes sociales y marketing digital, vale mucho la pena.\nMira el video de Roberto Gamboa, el creador del primer Instituto de Tr\u00e1fico del mundo hispano, donde nos cuenta en qu\u00e9 consiste el tr\u00e1fico digital y c\u00f3mo ha sido su experiencia:\n47. Gesti\u00f3n de redes sociales\nComo has visto, muchas de las ideas de negocios que vemos aqu\u00ed pueden divulgarse a trav\u00e9s de las redes sociales. Sin dudas, plataformas como Instagram, Facebook, YouTube, entre otras, se han convertido en los principales medios de comunicaci\u00f3n y difusi\u00f3n de marcas, productos y servicios.\nPor eso, hacer una excelente\n[gesti\u00f3n de los perfiles profesionales](https://hotmart.com/es/blog/marketing-en-redes-sociales) e incluso personales, es fundamental para tener un emprendimiento exitoso.\nMuchas empresas y personas contratan profesionales que se dedican exclusivamente a este trabajo. Si te interesa el asunto y tienes disponibilidad para actualizarte constantemente, esta idea de negocio puede ser para ti.\n48. Asistente Virtual\nEsta profesi\u00f3n est\u00e1 en alza y cada vez m\u00e1s personas y empresas recurren a este tipo de servicios.\nComo\n[asistente virtual](https://hotmart.com/es/blog/asistencia-virtual), puedes desarrollar tareas administrativas o contables, gesti\u00f3n de proyectos, organizaci\u00f3n y planificaci\u00f3n de tareas, asistencia ejecutiva o brindarle apoyo al \u00e1rea de recursos humanos.\n49. Influencer digital\nLos llamados influencers o influenciadores son creadores de contenido en diferentes plataformas y redes sociales.\nSeguramente te resulta f\u00e1cil pensar en alg\u00fan blogger,\n[youtuber](https://hotmart.com/es/blog/cuanto-gana-un-youtuber) o influencer en\nPara tener \u00e9xito y hacer de esta idea de negocio un emprendimiento rentable, deber\u00e1s crear contenido interesante para tu p\u00fablico, aumentar tu audiencia y empezar a hacer publicidad o recibir patrocinio de marcas.\nSi te resulta f\u00e1cil comunicarte y dominas un tema muy bien, aprovecha esta oportunidad de negocio. Crea contenido, gana seguidores y emprende.\n50. Afiliaci\u00f3n\nEl\n[marketing de afiliaci\u00f3n](https://hotmart.com/es/blog/mercado-de-afiliados) es una de las ideas de negocios m\u00e1s interesantes para quien quiere trabajar con Internet sin tener una mercanc\u00eda.\nLos afiliados son personas que divulgan productos de terceros y reciben comisiones de ventas, sin la necesidad de crear un producto.\nPara mucha gente, esta es una puerta de entrada al mercado digital. Si te interesa saber m\u00e1s, descubre\n[qu\u00e9 es un programa de afiliados y c\u00f3mo funciona](https://hotmart.com/es/blog/programa-de-afiliados-principales-ventajas).\n51. Tienda online\nTambi\u00e9n llamado\n[ecommerce](https://hotmart.com/es/blog/ecommerce), es decir, comercio electr\u00f3nico. Las tiendas virtuales son sitios para vender productos f\u00edsicos o digitales.\nSi deseas abrir una\n[tienda virtual](https://hotmart.com/es/blog/tienda-virtual), necesitar\u00e1s un software que administre la tienda y los medios de pago. Tambi\u00e9n ser\u00e1s responsable de cuidar la log\u00edstica del stock, si los productos vendidos son f\u00edsicos.\n52. Aplicaciones m\u00f3viles\nQuien sabe desarrollar software y\n[aplicaciones m\u00f3viles](https://hotmart.com/es/blog/aplicaciones-moviles) tiene una gran oportunidad de trabajar con Internet y conseguir muchas conquistas profesionales.\nSi no tienes conocimientos de programaci\u00f3n, pero tienes una idea excelente que puede funcionar, puedes buscar a alguien con los conocimientos necesarios para que sea tu socio.\nIdeas de negocio innovadoras\n53. Robots y entregas a domicilio\nUnos a\u00f1os atr\u00e1s, hablar de robots realizando tareas cotidianas parec\u00eda algo muy distante, pero lo cierto es que ese futuro lejano, hoy, es una realidad.\nY una de las ideas de negocio innovadoras que te proponemos para este 2023 tiene que ver justamente con este tipo de tecnolog\u00eda, aliada a un comportamiento muy consolidado de los consumidores actuales: el delivery.\nEn otras palabras, se trata de hacer entregas a domicilio usando robots en lugar de seres humanos. Esto exigir\u00eda una inversi\u00f3n significativa, derivada de la adquisici\u00f3n de los robots, pero, si no cuentas con el capital necesario, tienes la posibilidad de buscar inversionistas que apoyen tu emprendimiento.\n54. Venta de NFTs\nLos\n[NFTs](https://hotmart.com/es/blog/nft), una especie de certificados que validan la autenticidad de un producto, son una excelente idea de negocio para emprender online.\nDebido a que trabajan en un nicho de productos exclusivos, su potencial de generar ingresos es bastante grande, incluso ya se est\u00e1n utilizando en eventos y videojuegos como premios o recompensas.\n55. Inteligencia artificial\n2023 est\u00e1 siendo un a\u00f1o muy marcado por la Inteligencia Artificial y el lanzamiento del\n[ChatGPT](https://hotmart.com/es/blog/chatgpt) es una prueba de eso. La humanidad est\u00e1 ante un gran avance tecnol\u00f3gico que est\u00e1 modificando varias profesiones, el mercado de trabajo en s\u00ed y nuestra visi\u00f3n de mundo.\nPor eso, emprender creando soluciones que utilizan la tecnolog\u00eda de IA es una excelente idea de negocio en este momento.\n14 tips para desarrollar tu idea de negocio con poco dinero\nEmprender es un camino con desaf\u00edos, pero tambi\u00e9n con muchas posibilidades de crecimiento, autonom\u00eda y \u00e9xito.\nUna de las grandes objeciones para quien est\u00e1 empezando es contar con una inversi\u00f3n inicial. Si est\u00e1s entre estas personas, no te preocupes. Hemos preparado una lista con consejos para abrir tu negocio con poca o ninguna inversi\u00f3n inicial.\n1. Busca algo realmente te guste\nNo sirve de nada abrir un negocio que no te gusta y que terminar\u00e1 siendo un peso. Es muy probable que termines renunciando y dejando atr\u00e1s tu proyecto.\nEntonces,\n[apuesta a lo que te apasiona](https://hotmart.com/es/blog/realizacion-personal). As\u00ed, el trabajo se har\u00e1 m\u00e1s leve y enfrentar\u00e1s las dificultades con m\u00e1s convicci\u00f3n.\n2. Define tu nicho operativo\nHemos hablado de esto algunas veces a lo largo de este post.\nUn negocio dentro de un nicho establecido aumenta las posibilidades de crecimiento y buen posicionamiento de marca, ya que las acciones estar\u00e1n estrat\u00e9gicamente pensadas para un p\u00fablico interesado y calificado.\n3. Prioriza el negocio digital\nLas ideas de negocios online, sin duda, son las m\u00e1s f\u00e1ciles de emprender pues la inversi\u00f3n es baja.\nDependiendo del \u00e1rea en la que quieras emprender, solo necesitar\u00e1s una computadora, muchas ganas de estudiar y aprender a hacer una buena divulgaci\u00f3n para atraer a tu p\u00fablico con\n[tr\u00e1fico org\u00e1nico](https://hotmart.com/es/blog/consejos-seo).\nEste tipo de negocios es muy rentable y escalable.\n4. Marca presencia en las redes sociales\nLas redes sociales son un canal al que muchas personas pueden acceder de forma gratuita. Hoy en d\u00eda, es esencial que una empresa de cualquier segmento tenga su perfil comercial en al menos una de las redes sociales m\u00e1s utilizadas.\nAnaliza d\u00f3nde est\u00e1 tu audiencia, crea tu perfil comercial y haz publicaciones constantes con contenido de calidad para\n[vender m\u00e1s usando las redes sociales](https://hotmart.com/es/blog/vender-por-redes-sociales).\n5. Haz estudios de mercado\nLa\n[investigaci\u00f3n de mercado](https://hotmart.com/es/blog/investigacion-de-mercados) es un paso muy importante en la creaci\u00f3n de nuevos negocios.\nCon ella, puedes identificar qu\u00e9 funciona, definir tu p\u00fablico objetivo, descubrir qu\u00e9 les gusta y detectar espacios para innovar.\nEste es un paso fundamental para entender el escenario en el que vas a emprender y evitar grandes errores.\n6. Planifica tu negocio con enfoque en innovaci\u00f3n\nCon los resultados de la investigaci\u00f3n de mercado es m\u00e1s f\u00e1cil reconocer los espacios en tu \u00e1rea de actuaci\u00f3n para\n[crear un negocio innovador](https://hotmart.com/es/blog/negocios-innovadores).\nInnovar puede parecer algo dif\u00edcil de lograr, pero es m\u00e1s f\u00e1cil de lo que parece. Hay muchas posibilidades, principalmente relacionadas con la tecnolog\u00eda.\nTu empresa puede ser mucho mejor con servicios que rompen con los modelos tradicionales y brindan soluciones verdaderamente \u00fatiles para las personas.\n7. Desarrolla las razones que tienes para emprender\nEn muchas ocasiones, los emprendedores toman la decisi\u00f3n de empezar un negocio negocio o\n[startup](https://hotmart.com/es/blog/ideas-de-pequenos-negocios) con una buena intenci\u00f3n, pero por las razones incorrectas. Por ejemplo, para salir de alguna deuda, para derrumbar alg\u00fan competidor personal o, simplemente, por el dinero.\nEmprender requiere m\u00e1s que ambici\u00f3n financiera o personal, necesita de un verdadero \u00edmpetu y esp\u00edritu ganador y resiliente para poder tener \u00e9xito. Por ello, es imprescindible que identifiques las razones que tienes para empezar tu empresa y eval\u00faes si estas se alinean con el inter\u00e9s genuino de mejorar la vida de los clientes o solo la tuya.\n8. Elige ideas sencillas\nEs muy com\u00fan que en camino del emprendedor al principio se quiera abarcar un mont\u00f3n de aspectos que, al final, solo lograr\u00e1n diluir los esfuerzos y perjudicar los resultados.\nPara que esto no te suceda a ti, inicia tu aventura con ideas sencillas y f\u00e1ciles de aplicar e implementar, por ejemplo: armar una estrategia de redes sociales org\u00e1nica,\n[crear tutoriales](https://hotmart.com/es/blog/videos-tutoriales) de uso de los productos o empezar un proceso de dise\u00f1o y creaci\u00f3n de producto artesanal.\nCon el tiempo y el \u00e9xito de tu negocio podr\u00e1s ir agreg\u00e1ndole capas de complejidad a tus operaciones, haciendo que tus tareas sean m\u00e1s f\u00e1ciles de ejecutar, incrementando el alcance de tus acciones e, incluso, llegando a automatizar las actividades para obtener resultados por un costo mucho menor.\n9. Construye un modelo rentable para tu negocio\nLa\n[rentabilidad](https://hotmart.com/es/blog/calculadora-de-rentabilidad-hotmart) es un aspecto que casi cualquier emprendedor tiene en mente desde la misma generaci\u00f3n de la idea de negocio: \u00bfMi idea ser\u00e1 rentable como para hacerla un negocio?\nSi alguna vez te has preguntado esto y por eso decidiste empezar tu empresa, debes saber que para estas ideas de negocios es necesario crear modelos de rentabilidad que demuestren la viabilidad del proyecto.\nEsto no solo te permitir\u00e1 determinar la efectividad potencial de tu negocio, sino que conseguir\u00e1 convencer a los inversionistas e instituciones financieras para proporcionarte recursos para llevar al pr\u00f3ximo nivel a tu emprendimiento.\n10. Forma un equipo de trabajo comprometido\nUna empresa, ya sea una startup o una gran corporaci\u00f3n, depende muy estrechamente de los esfuerzos y habilidades de su recurso humano para salir adelante. Si quieres que tus ideas de negocios puedan generar los frutos que deseas, debes lograr que tu fuerza laboral se sienta comprometida y fiel a los valores y misi\u00f3n de la organizaci\u00f3n.\nEsto puedes lograrlo de muchas formas, como reconoci\u00e9ndoles sus aportes y premi\u00e1ndolos por sus objetivos cumplidos, integr\u00e1ndolos en la toma de decisiones de la empresa, involucr\u00e1ndote m\u00e1s en sus vidas para conocer sus\n[metas personales](https://hotmart.com/es/blog/tips-para-cumplir-metas) y as\u00ed ayudarlos a conseguirlas, entre otros.\nSea cual sea el medio que escojas para estrechar tu relaci\u00f3n con tu equipo de trabajo, es fundamental que desarrolles tus habilidades de liderazgo para inspirarlos y llevarlos a ser la mejor versi\u00f3n de s\u00ed mismos.\n11. Busca financiaci\u00f3n adecuada\nUna parte fundamental del \u00e9xito de las ideas de negocio es la financiaci\u00f3n que reciben para facilitar el camino. Muchos emprendimientos mueren en sus primeros 5 a\u00f1os a causa de situaciones econ\u00f3micas inviables y que no permiten alcanzar su m\u00e1ximo potencial.\nEn ese sentido, busca diversas fuentes de financiamiento, conoce m\u00e1s sobre sus pros y contras e identifica alguna que pueda satisfacer en el corto y mediano plazo las necesidades de tu negocio. Un ejemplo puede ser los inversionistas \u00e1ngeles, cr\u00e9ditos bancarios o pr\u00e9stamos con instituciones financieras con una tasa razonable que brinden la oportunidad de robustecer las operaciones de tu negocio y lograr la rentabilidad r\u00e1pidamente.\n12. Comienza a trabajar desde casa\nAntes de pensar en tener una oficina o tienda f\u00edsica con una s\u00faper infraestructura, comienza por lo simple. Ofrece tu servicio\n[trabajando en casa](https://hotmart.com/es/blog/trabajos-desde-casa), priorizando el servicio y la calidad de entrega.\nA medida que ganas la confianza del cliente y creces con tu negocio, tus ganancias aumentar\u00e1n y puedes pensar en algo m\u00e1s estructurado para seguir desarroll\u00e1ndote.\n13. Crea un blog\nOtra forma de aumentar tu presencia en l\u00ednea de manera org\u00e1nica, obtener clientes y realizar ventas sin gastar nada es\n[creando un blog](https://hotmart.com/es/blog/como-crear-un-blog).\nLa idea es escribir contenido interesante que tenga que ver con tu negocio y que ofrezca soluciones reales para las personas. As\u00ed, adem\u00e1s de consumirlo, conocer\u00e1n tu marca y, en consecuencia, comprar\u00e1n tu producto o servicio.\n14. Haz networking y alianzas\nTener una buena red de contactos es importante para quien emprende. Por lo tanto, nuestro \u00faltimo consejo es establecer redes y\n[hacer alianzas](https://hotmart.com/es/blog/como-hacer-buenas-alianzas-de-negocios) para fortalecer tu negocio.\nSi no tienes tanto dinero para invertir al principio, alguien puede brindarte el apoyo que necesitas para comenzar.\nEntonces, ve a eventos, habla con personas estrat\u00e9gicas, busca otras compa\u00f1\u00edas en tu nicho y ofrece algo de valor a cambio de una buena asociaci\u00f3n.\n\u00bfQu\u00e9 tal empezar hoy mismo?\nSi has llegado hasta aqu\u00ed, ya sabes que existen muchas ideas de negocios excelentes para emprender. Es muy probable que al menos una de las opciones que te mostramos haya llamado tu atenci\u00f3n, \u00bfno es as\u00ed?\nEntonces qu\u00e9, \u00bfte animas a dar el primer paso?\nPara ayudarte, te presentamos nuestra\n[gu\u00eda pr\u00e1ctica para lanzar tu primer producto](https://resources.hotmart.com/es/guia-practica-para-lanzar-tu-primer-producto) y adentrarte el mundo de los negocios como un profesional.", "language": null, "image": null, "pagetype": "website", "links": ["#", "/es/blog", "javascript:void(0)", "/es/blog/ideas-de-negocios", "https://sso.hotmart.com/signup?service=https://app.hotmart.com/", "#", "https://sso.hotmart.com/signup?service=https://app.hotmart.com/", "/es/blog/autores/hotmart-responde", "", "", "", "", "https://hotmart.com/es/blog/el-arte-de-elegir-la-carrera-equivocada", "https://hotmart.com/es/blog/perfil-del-emprendedor", "#t1", "#t2", "#t3", "#t4", "#t5", "#t6", "#t7", "#t8", "#t9", "#t10", "#t12", "#t11", "https://signup.hotmart.com/comienza-como-productor?itm_medium=internal&itm_source=blog-hotmart&itm_campaign=es_signup_su_banner_post-banner", null, "https://hotmart.com/es/blog/educacion-hibrida", "https://hotmart.com/es/blog/publico-objetivo", "https://hotmart.com/es/blog/metodologias-educativas", "https://hotmart.com/es/blog/como-vender-cursos-online", "https://hotmart.com/es/blog/como-hacer-videoclases-atractivas", "https://hotmart.com/es/blog/trabajo-creativo", "https://hotmart.com/es/blog/negocios-rentables-sin-inversion", "https://hotmart.com/es/blog/como-crear-un-ebook-power-point", "https://hotmart.com/es/blog/convierte-tu-conocimiento-en-beneficio", "https://hotmart.com/es/blog/analisis-de-la-competencia", "https://hotmart.com/es/blog/como-hablar-en-publico", "https://hotmart.com/es/blog/crear-cursos-a-distancia", null, "https://hotmart.com/es/blog/buenos-habitos", "https://hotmart.com/es/blog/mindfulness", null, "https://hotmart.com/es/blog/consejos-para-invertir-dinero", "https://hotmart.com/es/blog/indicadores-financieros", null, "https://hotmart.com/es/blog/tendencias-de-mercado", "https://hotmart.com/es/blog/planificacion", "https://hotmart.com/es/blog/consultoria-online", "https://hotmart.com/es/blog/cursos-en-linea", "https://hotmart.com/es/blog/que-es-plataforma-de-cursos-online", null, "https://hotmart.com/es/blog/consultoria-financiera", "https://blog.nubox.com/contadores/negocio-contable", "https://hotmart.com/es/blog/consultoria-de-marketing", "https://hotmart.com/es/blog/que-es-marketing-digital", "https://hotmart.com/es/blog/redes-sociales-mas-usadas", "https://hotmart.com/es/blog/que-es-seo", "https://hotmart.com/es/blog/medio-digital", "https://hotmart.com/es/blog/plan-de-negocios-producto-digital", null, "https://hotmart.com/es/blog/como-elegir-un-nicho-para-tu-primer-producto-digital", "https://hotmart.com/es/blog/fotos-para-instagram", "https://hotmart.com/es/blog/investigacion-cuantitativa", "https://hotmart.com/es/blog/buena-atencion-al-cliente", null, "https://hotmart.com/es/blog/cuanto-paga-youtube", "https://hotmart.com/es/blog/como-escribir-en-tu-blog-9-tips", null, "https://hotmart.com/es/blog/como-fidelizar-clientes", "https://hotmart.com/es/blog/manual-de-marca", "https://hotmart.com/es/blog/que-es-el-coaching", "https://hotmart.com/es/blog/como-ganar-dinero-con-blog-guia-completa", null, "https://hotmart.com/es/blog/cultura-organizacional", "https://hotmart.com/es/blog/eventos-corporativos", null, "https://hotmart.com/es/blog/negocios-digitales", "https://hotmart.com/es/blog/negocios-online", "https://hotmart.com/es/blog/trafficker-digital-roberto-gamboa", "https://hotmart.com/es/blog/marketing-en-redes-sociales", "https://hotmart.com/es/blog/asistencia-virtual", "https://hotmart.com/es/blog/cuanto-gana-un-youtuber", "https://hotmart.com/es/blog/hacer-publicidad-en-instagram", "https://hotmart.com/es/blog/mercado-de-afiliados", "https://hotmart.com/es/blog/programa-de-afiliados-principales-ventajas", "https://hotmart.com/es/blog/ecommerce", "https://hotmart.com/es/blog/tienda-virtual", "https://hotmart.com/es/blog/aplicaciones-moviles", null, "https://hotmart.com/es/blog/nft", "https://hotmart.com/es/blog/chatgpt", null, "https://hotmart.com/es/blog/realizacion-personal", "https://hotmart.com/es/blog/consejos-seo", "https://hotmart.com/es/blog/vender-por-redes-sociales", "https://hotmart.com/es/blog/investigacion-de-mercados", "https://hotmart.com/es/blog/negocios-innovadores", "https://hotmart.com/es/blog/ideas-de-pequenos-negocios", "https://hotmart.com/es/blog/videos-tutoriales", "https://hotmart.com/es/blog/calculadora-de-rentabilidad-hotmart", "https://hotmart.com/es/blog/tips-para-cumplir-metas", "https://hotmart.com/es/blog/trabajos-desde-casa", "https://hotmart.com/es/blog/como-crear-un-blog", "https://hotmart.com/es/blog/como-hacer-buenas-alianzas-de-negocios", "https://resources.hotmart.com/es/guia-practica-para-lanzar-tu-primer-producto", "https://resources.hotmart.com/es/guia-practica-para-lanzar-tu-primer-producto", "https://signup.hotmart.com/comienza-como-productor?itm_medium=internal&itm_source=blog-hotmart&itm_campaign=es_signup_su_side-banner_side-banner-default-all-blog-posts", "https://hotm.art/TQozu4S", "/es/blog/abandono-escolar", "/es/blog/7-errores-que-pueden-perjudicar-tu-negocio", "/es/blog/que-es-google-lens", "/es/blog/para-que-sirve-la-inteligencia-artificial", "https://hotmart.com/es", "https://hotmart.com/es/blog", "/es/blog/ideas-de-negocios", "https://www.facebook.com/hotmart.lat/", "https://twitter.com/hotmart_es", "https://www.linkedin.com/company/hotmart", "https://www.youtube.com/hotmartespanol", "https://www.instagram.com/hotmart.lat/", "https://www.tiktok.com/@hotmart.es", "https://hotmart.co/"]}