{"title": "Lo que sabemos sobre el coronavirus (Published 2020)", "author": "The New York Times", "url": "https://www.nytimes.com/es/2020/06/04/espanol/datos-coronavirus.html", "hostname": "nytimes.com", "description": "A\u00fan desconocemos mucho del virus, pero estas son algunas de las cosas de las que estamos bastante seguros despu\u00e9s de medio a\u00f1o de esta pandemia.", "sitename": "The New York Times", "date": "2020-06-04", "id": null, "license": null, "body": null, "comments": "", "commentsbody": null, "raw_text": null, "text": "Supported by\n[SKIP ADVERTISEMENT](#after-sponsor)\nLo que sabemos sobre el coronavirus\nA\u00fan desconocemos mucho del virus, pero estas son algunas de las cosas de las que estamos bastante seguros despu\u00e9s de medio a\u00f1o de esta pandemia.\n[Reg\u00edstrate para recibir nuestro bolet\u00edn](https://www.nytimes.com/newsletters/el-times) por correo con lo mejor de The New York Times. [[Toda nuestra cobertura del coronavirus en espa\u00f1ol es de libre acceso y est\u00e1 aqu\u00ed]](https://www.nytimes.com/es/spotlight/coronavirus)\nRealmente no sabemos cu\u00e1ndo el nuevo coronavirus comenz\u00f3 a infectar a las personas. Pero ahora que entramos a junio, es justo afirmar que el\n[SARS-CoV-2 ya ha estado con nosotros unos seis meses](https://www.nytimes.com/es/2020/06/02/espanol/ciencia-y-tecnologia/perfil-coronavirus-covid.html).\nAl principio, no ten\u00eda nombre ni identidad verdadera. A principios de enero, los informes noticiosos se refer\u00edan a\n[s\u00edntomas extra\u00f1os y amenazadores](https://www.nytimes.com/2020/01/06/world/asia/china-SARS-pneumonialike.html) que hab\u00edan enfermado a decenas de personas en una gran ciudad china con la que muchas personas del mundo probablemente no estaban familiarizadas. Despu\u00e9s de medio a\u00f1o, esa gran metr\u00f3poli, Wuhan, es bien conocida, como lo es el coronavirus y la enfermedad que causa, la COVID-19.\nEn ese tiempo, muchos reporteros y editores encargados de la secci\u00f3n de ciencia y salud de The New York Times hemos modificado nuestro enfoque period\u00edstico a fin de contar la historia de la pandemia. Si bien el coronavirus\n[sigue siendo bastante misterioso y desconocido](https://www.nytimes.com/es/2020/06/03/espanol/misterios-coronavirus.html) tras seis meses, hay algunas cosas de las que estamos bastante seguros. A continuaci\u00f3n, algo de ese conocimiento.\nAqu\u00ed hay algunas cosas que creemos saber del coronavirus:\n[Vamos a vivir con esto por mucho tiempo](#link-32c788db) [Deber\u00edas usar mascarilla](#link-dd68b8) [La infraestructura de salud p\u00fablica estadounidense necesita una actualizaci\u00f3n](#link-2eb0bf5d) [Responder al virus es extraordinariamente costoso](#link-78088cfa) [Tenemos un largo camino por recorrer para corregir las pruebas de virus](#link-767f3574) [No podemos contar con la inmunidad de reba\u00f1o para mantenernos sanos](#link-4d993a0f)\nVamos a vivir con esto por mucho tiempo\nEl verano est\u00e1 a la vuelta de la esquina, los estados est\u00e1n reactiv\u00e1ndose y los nuevos casos de coronavirus se est\u00e1n reduciendo o, al menos, se est\u00e1n manteniendo estables en muchas partes de Estados Unidos. Al\n[menos cien equipos cient\u00edficos](https://www.nytimes.com/interactive/2020/05/20/science/coronavirus-vaccine-development.html?searchResultPosition=6) de todo el mundo est\u00e1n compitiendo para desarrollar una vacuna.\nEsas son las buenas noticias.\nEl virus no ha dado se\u00f1ales de que vaya a desaparecer: estaremos en esta era pand\u00e9mica por mucho tiempo, probablemente un a\u00f1o o m\u00e1s. Los cubrebocas, el distanciamiento social, lavarse las manos compulsivamente, el alejamiento doloroso de amigos y familiares, todas esas medidas siguen siendo la mayor esperanza de mantenernos a salvo, y lo seguir\u00e1n siendo durante alg\u00fan tiempo.\n\u201cEste virus podr\u00eda convertirse en otro virus end\u00e9mico en nuestras comunidades, y tal vez nunca desaparezca\u201d, advirti\u00f3 el mes pasado Mike Ryan, director ejecutivo del programa de emergencias de la Organizaci\u00f3n Mundial de la Salud. Algunos cient\u00edficos creen que mientras m\u00e1s tiempo vivamos con el virus,\n[m\u00e1s leves terminar\u00e1n siendo sus efectos,](https://www.nytimes.com/es/2020/04/21/espanol/ciencia-y-tecnologia/coronavirus-futuro.html) pero eso a\u00fan est\u00e1 por verse.\nLas predicciones que afirman que millones de dosis de una vacuna podr\u00edan estar disponibles para finales de este a\u00f1o podr\u00edan ser demasiado optimistas. Ninguna vacuna ha sido creada as\u00ed de r\u00e1pido.\nLa enfermedad ser\u00eda menos aterradora si existiera un tratamiento que pudiera curarla o, al menos, prevenir su gravedad. Pero no lo hay. \u00bfY qu\u00e9 hay del remdesivir, el muy esperado medicamento antiviral? Seg\u00fan los expertos, lo m\u00e1ximo que se puede esperar de \u00e9l son beneficios \u201cmodestos\u201d.\nLo cual nos remite de nuevo a los cubrebocas y al distanciamiento social, los cuales han llegado a sentirse bastante antisociales. Si tan solo pudi\u00e9ramos volver a como sol\u00eda ser la vida.\nNo podemos. No todav\u00eda. Hay demasiadas sorpresas con esta enfermedad \u2014por ejemplo, adultos y ni\u00f1os con buena salud que inexplicablemente se enferman de gravedad\u2014 como para permitir tomarnos a la ligera la posibilidad de contagiarnos.\n[Cerca del 35 por ciento de las personas infectadas no presentan ning\u00fan s\u00edntoma](https://www.cdc.gov/coronavirus/2019-ncov/hcp/planning-scenarios.html), por lo que, si andan por ah\u00ed libremente y sin precauciones, podr\u00edan infectar a otras personas sin saberlo.\nHay preguntas muy importantes por responder. \u00bfPodr\u00e1 lograrse que los lugares de trabajo sean seguros? \u00bfQu\u00e9 hacemos con los trenes, metros, aviones, autobuses escolares? \u00bfCu\u00e1ntas personas pueden trabajar desde casa? \u00bfCu\u00e1ndo ser\u00e1 seguro reabrir las escuelas? \u00bfC\u00f3mo logras que un ni\u00f1o de 6 a\u00f1os con la capacidad de concentraci\u00f3n de una ardilla aplique el distanciamiento social?\nEn resumen: usa un cubrebocas, mant\u00e9n tu distancia. Cuando llegue el momento, a finales de a\u00f1o, vac\u00fanate contra la gripe para protegerte de la enfermedad respiratoria que puedes evitar y para ayudar a que las salas de emergencia no se saturen. Anhela un tratamiento, una cura, una vacuna. S\u00e9 paciente. Tenemos que tomarnos nuestro tiempo. Si existe algo como un marat\u00f3n de enfermedad, ya estamos en \u00e9l.\nDeber\u00edas usar mascarilla\nEl debate sobre si los estadounidenses deben utilizar mascarillas para controlar la transmisi\u00f3n del coronavirus se ha resuelto. Aunque las autoridades de salud p\u00fablica dieron consejos confusos y a veces hasta contradictorios durante los primeros meses de la pandemia, la mayor\u00eda de los expertos ya est\u00e1n de acuerdo en que los individuos se protegen mejor entre ellos si todos utilizan cubrebocas.\nLos investigadores saben que incluso las mascarillas m\u00e1s sencillas pueden detener efectivamente las got\u00edculas expulsadas de la nariz o boca de un infectado. En un\n[estudio publicado en abril en la revista Nature](https://www.nature.com/articles/s41591-020-0843-2), un grupo de cient\u00edficos demostr\u00f3 que cuando las personas infectadas con influenza, rinovirus o un coronavirus generador de resfriados leves utilizaron una mascarilla, bloquearon casi el 100 por ciento de las got\u00edculas virales que exhalaron, as\u00ed como tambi\u00e9n algunas min\u00fasculas part\u00edculas de aerosol.\nSin embargo, el uso de mascarillas sigue siendo irregular en muchas partes de Estados Unidos. Pero los gobiernos y negocios est\u00e1n empezando a exigir, o al menos recomendar, que las mascarillas sean utilizadas en muchos espacios p\u00fablicos.\nTambi\u00e9n hay cada vez mayor evidencia de que algunos tipos de mascarillas pueden protegerte de los g\u00e9rmenes de otras personas. Los respiradores desechables de alta calidad N95 han sido aprobados por las agencias federales de salud p\u00fablica porque, si se usan correctamente, son capaces de filtrar al menos el 95 por ciento de las part\u00edculas que tienen 0,3 micras de di\u00e1metro. Un estudio revel\u00f3 que los N95 eran capaces de capturar\n[m\u00e1s del 90 por ciento de las part\u00edculas virales](https://www.ajicjournal.org/article/S0196-6553(05)00911-9/fulltext#articleInformation), incluso si las part\u00edculas eran alrededor de una quinta parte del tama\u00f1o de un coronavirus. Otros estudios han mostrado que las simples mascarillas quir\u00fargicas azules bloquean entre un 50 y un 80 por ciento de las part\u00edculas, mientras que las [mascarillas de tela bloquean entre un 10 y un 30 por ciento](https://academic.oup.com/annweh/article/54/7/789/202744) de las peque\u00f1as part\u00edculas.\n\u201cUtilizar una mascarilla es mejor que no usar nada\u201d, dijo Robert Atmar, especialista en enfermedades infecciosas de la Escuela de Medicina de Baylor. Debido a que el coronavirus por lo general infecta a las personas cuando entra a sus cuerpos a trav\u00e9s de la nariz y la boca, cubrir estas \u00e1reas puede ser la primera l\u00ednea de defensa contra el virus, dijo.\nUtilizar un protector facial probablemente tambi\u00e9n logre que evites tocarte el rostro, lo cual es otra manera en la que el coronavirus puede transmitirse, de superficies contaminadas a individuos desprevenidos. Cuando se combinan con otras medidas protectoras como lavarse las manos y el\n[distanciamiento social](https://www.nytimes.com/2020/04/22/us/politics/social-distancing-coronavirus.html), las mascarillas ayudan a reducir la transmisi\u00f3n de la enfermedad, dijo Atmar.\nLa infraestructura de salud p\u00fablica estadounidense necesita una actualizaci\u00f3n\nEstados Unidos sabe c\u00f3mo combatir guerras. Sin embargo, como bien han demostrado estos \u00faltimos meses, la respuesta estadounidense a pat\u00f3genos puede f\u00e1cilmente volverse un desastre, pese a que los pat\u00f3genos matan a m\u00e1s estadounidenses que muchas guerras.\nNo tenemos un Pent\u00e1gono para los virus. Los Centros para el Control y la Prevenci\u00f3n de Enfermedades (CDC, por su sigla en ingl\u00e9s) son m\u00e1s como un FBI para investigaciones sobre epidemias que una m\u00e1quina de guerra. Por a\u00f1os \u2014tanto en el gobierno de Barack Obama como en el de Donald Trump\u2014 sus l\u00edderes han tenido que pedir autorizaci\u00f3n para decir casi cualquier palabra.\nAnthony S. Fauci, el m\u00e1s prominente de los m\u00e9dicos asesores del equipo especial del coronavirus del gobierno estadounidense, es de hecho el director de un centro de investigaci\u00f3n, el Instituto Nacional de Alergias y Enfermedades Infecciosas, en vez de alg\u00fan equivalente m\u00e9dico a un batall\u00f3n de combate.\nEl director general de Salud P\u00fablica de Estados Unidos es, en esencia, un almirante sin tripulaci\u00f3n. Reparte recomendaciones y advertencias sanitarias, pero el Cuerpo Comisionado del Servicio de Salud P\u00fablica de Estados Unidos, el cual est\u00e1 bajo sus \u00f3rdenes, solo tiene unos 6500 miembros activos, y muchos de ellos tienen otros trabajos, por lo general en los CDC.\nCasi todas las tropas de primera l\u00ednea \u2014rastreadores de contactos, t\u00e9cnicos de laboratorio, epidemi\u00f3logos, personal en los hospitales de estados y ciudades\u2014 son financiadas por departamentos de salud estatales y locales cuyos presupuestos tienen a\u00f1os reduci\u00e9ndose. Estos soldados son liderados por 50 comandantes, en la forma de gobernadores y, con tantos de ellos a cargo, es sorprendente que alg\u00fan tipo de respuesta avance.\nEl resto de la respuesta est\u00e1 en manos de miles de milicias privadas: hospitales, aseguradoras, m\u00e9dicos, enfermeros, t\u00e9cnicos en terapia respiratoria, farmac\u00e9uticos, entre otros, todos ellos con distintos empleadores. Dentro de algunos l\u00edmites, pueden hacer lo que quieran. Cuando no pueden obtener algo que necesitan del extranjero, est\u00e1n pr\u00e1cticamente indefensos sin ayuda log\u00edstica federal.\nAl igual que la guerra hace con las naciones derrotadas, las pandemias exponen las debilidades de sus sistemas. Nuestra descoordinada y entramada respuesta ha producido m\u00e1s de 100.000 muertes. No hay duda de que podemos hacerlo mejor.\n\u201cLas grandes potencias tienen muy mal organizadas sus prioridades\u201d, dijo recientemente Michael Ryan, director del programa de emergencias de la Organizaci\u00f3n Mundial de la Salud (OMS).\n\u201cGastan miles de millones en misiles y submarinos y en combatir el terrorismo, y a los virus solo les dan unos centavos. Se pueden iniciar negociaciones de paz con el enemigo. Se pueden cambiar pol\u00edticas para reducir la amenaza del terrorismo\u201d, a\u00f1adi\u00f3. \u201cPero no se puede negociar con un virus, y sabemos que cada a\u00f1o est\u00e1n llegando nuevas amenazas\u201d.\nResponder al virus es extraordinariamente costoso\nEl gobierno federal ha gastado cientos de miles de millones de d\u00f3lares y\n[prometido gastar m\u00e1s de 2 billones de d\u00f3lares](https://www.nytimes.com/2020/04/24/business/congress-coronavirus-stimulus-bill.html) para abordar la pandemia de coronavirus.\nDe ese dinero,\n[2000 millones de d\u00f3lares se destinaron a ayudar a las empresas a desarrollar nuevas vacunas,](https://www.nytimes.com/2020/05/21/health/coronavirus-vaccine-astrazeneca.html) expandir la capacidad de hacer pruebas en todo el pa\u00eds y apuntalar las consecuencias econ\u00f3micas desde principios de marzo. (A\u00fan m\u00e1s podr\u00eda estar en camino, pero [no est\u00e1 claro cu\u00e1nto y cu\u00e1ndo](https://www.nytimes.com/2020/05/15/us/politics/house-simulus-vote.html)).\nLa gran mayor\u00eda de este gasto ha tenido como objetivo mitigar el sufrimiento econ\u00f3mico de peque\u00f1as empresas que cierran y las personas que pierden sus empleos o son despedidas. El Congreso tambi\u00e9n proporcion\u00f3 dinero adicional para Medicaid y otros programas sociales.\nA los hospitales, centros de salud comunitarios y otros proveedores se les han asignado 175.000 millones de d\u00f3lares para cubrir el costo del cuidado de pacientes con la COVID-19 y para las visitas, procedimientos y cirug\u00edas que se cancelaron debido a la pandemia. En el \u00faltimo proyecto de ley, 25.000 millones de d\u00f3lares fueron destinados para pruebas de coronavirus.\nMuchos expertos dicen que se necesita m\u00e1s financiamiento, pero existe una gran controversia sobre c\u00f3mo se gasta el dinero ya asignado y cu\u00e1les entidades obtienen fondos. Varios grupos, como el Comit\u00e9 para un Presupuesto Federal Responsable,\n[est\u00e1n rastreando el gasto](http://www.crfb.org/blogs/covid-money-tracker-policies-enacted-to-date). Seg\u00fan el c\u00e1lculo de esa organizaci\u00f3n, ya se han desembolsado o comprometido aproximadamente 1,6 billones de d\u00f3lares. La Reserva Federal tambi\u00e9n ha proporcionado m\u00e1s de 2 billones de d\u00f3lares en pr\u00e9stamos de emergencia, compras de activos y otras actividades, dijo.\nTenemos un largo camino por recorrer para corregir las pruebas de virus\nEl panorama para las pruebas se ve mucho mejor que en los primeros d\u00edas del brote, cuando\n[un fallido despliegue de pruebas de coronavirus](https://www.nytimes.com/2020/03/28/us/testing-coronavirus-pandemic.html) no pudo detectar su propagaci\u00f3n en Estados Unidos.\nHoy,\n[se administran cientos de miles de ](https://covidtracking.com/data/us-daily) [tests](https://covidtracking.com/data/us-daily) [ diarios en Estados Unidos](https://covidtracking.com/data/us-daily), y en algunas \u00e1reas est\u00e1n tan ampliamente disponibles que los funcionarios de salud p\u00fablica se han quejado de que [no tienen suficientes personas para hacerles las pruebas](https://www.washingtonpost.com/health/as-coronavirus-testing-expands-a-new-problem-arises-not-enough-people-to-test/2020/05/17/3f3297de-8bcd-11ea-8ac1-bfb250876b7a_story.html). En Los \u00c1ngeles, donde las pruebas son gratis para todos, [un autoservicio en el estadio de los Dodgers](https://www.latimes.com/california/story/2020-05-26/los-angeles-opens-largest-coronavirus-testing-site-at-dodger-stadiu) puede atender a 6000 personas al d\u00eda.\nLa gama de pruebas disponibles tambi\u00e9n se est\u00e1 ampliando. Aquellas que alguna vez requirieron que un trabajador de la salud insertase un hisopo a trav\u00e9s de la nariz hasta la parte posterior de la garganta ahora se puede hacer con un barrido dentro de la nariz, o escupiendo en una taza. Un pu\u00f1ado de compa\u00f1\u00edas\n[venden ahora pruebas caseras](https://www.nytimes.com/2020/04/21/health/fda-in-home-test-coronavirus.html) y [un ](https://www.nytimes.com/interactive/2020/05/12/us/coronavirus-testing-white-house.html?action=click&module=RelatedLinks&pgtype=Article) [test](https://www.nytimes.com/interactive/2020/05/12/us/coronavirus-testing-white-house.html?action=click&module=RelatedLinks&pgtype=Article) [ de Abbott](https://www.nytimes.com/interactive/2020/05/12/us/coronavirus-testing-white-house.html?action=click&module=RelatedLinks&pgtype=Article) puede detectar el virus en tan solo cinco minutos.\nAdem\u00e1s de las pruebas que detectan infecciones activas, los estadounidenses tambi\u00e9n pueden hacerse la prueba de anticuerpos contra el virus, que muestra si han estado infectados, y puede ayudar a tener m\u00e1s claro cu\u00e1n amplia ha sido la propagaci\u00f3n del coronavirus en las comunidades.\nPero a pesar de este progreso, Estados Unidos a\u00fan tiene un largo camino que recorrer. Los expertos en salud p\u00fablica dicen que se necesitar\u00e1n entre\n[900.000 ](https://www.npr.org/sections/health-shots/2020/05/07/851610771/u-s-coronavirus-testing-still-falls-short-hows-your-state-doing)a [millones de pruebas al d\u00eda](https://www.newyorker.com/news/q-and-a/paul-romer-on-how-to-survive-the-chaos-of-the-coronavirus) para evaluar a pacientes de hospital, residentes de asilos de ancianos y empleados que regresan al trabajo.\nY aunque las pruebas son abundantes en algunas \u00e1reas, a\u00fan son dif\u00edciles de realizar en otras. La escasez de suministros claves necesarios para ejecutar las pruebas \u2014como hisopos y reactivos qu\u00edmicos\u2014 ha persistido. El\n[gobierno federal ha delegado la supervisi\u00f3n](https://www.nytimes.com/2020/05/25/health/coronavirus-testing-trump.html) a los estados, creando un mosaico de pol\u00edticas y poniendo a los estados a competir unos con otros. Incluso el seguimiento del n\u00famero de pruebas realizadas ha resultado dif\u00edcil: para el desconcierto de los epidemi\u00f3logos, quienes intentan rastrear infecciones activas (que las pruebas de anticuerpos no muestran), [los CDC](https://www.nytimes.com/2020/05/22/us/politics/coronavirus-tests-cdc.html) y varios estados comenzaron a agrupar las pruebas para el virus y las para los anticuerpos.\nNo podemos contar con la inmunidad de reba\u00f1o para mantenernos sanos\nLa idea es la simplicidad misma: si un n\u00famero suficiente de la poblaci\u00f3n tiene anticuerpos para el nuevo coronavirus, el virus se encontrar\u00e1 con demasiados \u201ccallejones sin salida\u201d como para poder seguir infectando personas. Eso es lo que se conoce como\n[inmunidad de reba\u00f1o](https://www.nytimes.com/interactive/2020/05/28/upshot/coronavirus-herd-immunity.html).\nY esa es la gran esperanza de una vacuna. Pero podr\u00eda no suceder, incluso habiendo disponibilidad de vacunas, como nos ha demostrado la experiencia con las vacunas contra la gripe.\nPaul Offit, m\u00e9dico del Hospital Infantil de Filadelfia y de la Universidad de Pensilvania, se\u00f1al\u00f3 que, si bien las vacunas eliminaron el sarampi\u00f3n, la rub\u00e9ola y la viruela, y casi erradicaron la poliomielitis en Estados Unidos, las vacunas contra la influenza y la tos ferina no han detenido los brotes (debido a que algunos padres se han negado a que sus hijos reciban las vacunas contra el sarampi\u00f3n, esa enfermedad tambi\u00e9n est\u00e1 regresando).\nLa influenza y la tos ferina se han seguido propagando, incluso luego de que suficientes personas en una comunidad se han vacunado para, en teor\u00eda, detener esas enfermedades. Eso se debe a que los anticuerpos que protegen a las personas contra los virus que infectan las superficies mucosas, como el revestimiento de la nariz, tienden a tener una vida muy corta.\nLas vacunas contra las enfermedades respiratorias son, en el mejor de los casos, modestamente efectivas, afirm\u00f3 Arnold Monto de la Universidad de M\u00edchigan.\nComo el coronavirus suele infectar primero al sistema respiratorio, Monto sospecha que una vacuna contra la COVID-19 tendr\u00eda un efecto similar al de una vacuna de la gripe: reducir\u00e1 la incidencia de la enfermedad y la har\u00e1 menos grave en promedio, pero no erradicar\u00e1 la COVID-19.\nPor supuesto, a Monto le gustar\u00eda que el virus desapareciera, pero una vacuna que reduzca la propagaci\u00f3n y la gravedad de la enfermedad es mucho mejor que nada.\n\u201cComo persona mayor, lo que quiero es no terminar conectado a un respirador\u201d, dijo Monto.\nEl virus produce m\u00e1s s\u00edntomas de lo esperado\nLa COVID-19 es una enfermedad respiratoria viral. Muchas descripciones iniciales de los s\u00edntomas se enfocaron en pacientes con problemas para respirar que despu\u00e9s necesitaban respiradores. Sin embargo, el virus no limita su ataque a los pulmones, y los m\u00e9dicos han identificado varios s\u00edntomas y s\u00edndromes asociados con \u00e9l.\nEn algunos pacientes, el virus sobreestimula el sistema inmunitario, lo que provoca que los pulmones se llenen de fluidos y da\u00f1ando m\u00faltiples \u00f3rganos, entre ellos el cerebro, el coraz\u00f3n, los ri\u00f1ones y el h\u00edgado.\nLos primeros s\u00edntomas de la infecci\u00f3n son, por lo general, tos y dificultad para respirar. Pero en abril,\n[los CDC a\u00f1adieron a la lista de s\u00edntomas](https://www.nytimes.com/2020/04/27/health/coronavirus-symptoms-cdc.html) el dolor de garganta, fiebre, escalofr\u00edos y dolores musculares. Tambi\u00e9n se han observado malestares gastrointestinales, como diarrea y n\u00e1useas.\nOtra se\u00f1al indicadora de la infecci\u00f3n puede ser una s\u00fabita y profunda disminuci\u00f3n del sentido del olfato y gusto. En algunos casos, adolescentes y adultos j\u00f3venes han desarrollado lesiones dolorosas de color rojizo y p\u00farpura en los dedos de los pies y las manos, pero pocos otros s\u00edntomas graves.\nUn caso grave puede derivar en neumon\u00eda y s\u00edndrome de dificultad respiratoria aguda. Los niveles de ox\u00edgeno en la sangre se desploman y los pacientes pueden requerir ox\u00edgeno suplementario o un respirador.\nPero incluso sin deterioro pulmonar, la enfermedad puede causar lesiones a los ri\u00f1ones, el coraz\u00f3n o el h\u00edgado. Los pacientes enfermos de gravedad son propensos a desarrollar peligrosos co\u00e1gulos de sangre en las piernas y los pulmones. En algunos casos inusuales, la enfermedad detona accidentes cerebrovasculares isqu\u00e9micos que bloquean las arterias que suministran sangre al cerebro, o da\u00f1os cerebrales, como alteraci\u00f3n del estado mental o encefalopat\u00eda.\nLa muerte\n[puede ser causada](https://www.thelancet.com/journals/lancet/article/PIIS0140-6736(20)30558-4/fulltext) por paro card\u00edaco, insuficiencia renal, fallo multiorg\u00e1nico, dificultad respiratoria o choque circulatorio.\nPodemos preocuparnos un poco menos por infectarnos a trav\u00e9s de las superficies\nLa noticia, cuando se report\u00f3, agreg\u00f3 un giro aterrador a la amenaza del coronavirus: un estudio realizado en marzo en The New England Journal of Medicine descubri\u00f3 que, en condiciones de laboratorio, el virus puede\n[sobrevivir hasta tres d\u00edas](https://www.nytimes.com/es/2020/03/25/espanol/coronavirus-aire-como-se-transmite.html) en algunas superficies, como pl\u00e1stico y acero, y en cart\u00f3n por hasta 24 horas.\nOtros estudios informaron haber encontrado el virus en conductos de ventilaci\u00f3n y en\n[ratones de computadora, pasamanos y las manijas de las puertas.](https://wwwnc.cdc.gov/eid/article/26/7/20-0885_article)\nMuchas personas se preocuparon de que contraer\u00edan el virus al tocar una superficie que hab\u00eda sido cubierta de gotas por una persona infectada, y luego tocarse su boca, nariz u ojos.\nA\u00fan debes usar una mascarilla, evitar tocarte la cara en p\u00fablico y seguir lav\u00e1ndose las manos. Pero ninguno de estos estudios prob\u00f3 al virus vivo, solo las huellas de su material gen\u00e9tico. Otros cient\u00edficos que opinaron sobre estos estudios dijeron que el virus en esas superficies se podr\u00eda degradar m\u00e1s r\u00e1pidamente. Los CDC han dicho desde marzo que las superficies contaminadas \u201cno se consideran la forma principal\u201d de propagaci\u00f3n del virus.\nSe cree que el principal impulsor de la infecci\u00f3n es la inhalaci\u00f3n directa de las got\u00edculas liberadas cuando una persona infectada estornuda, tose, canta o habla. Los CDC hace poco realizaron cambios en su p\u00e1gina web para hacer este mensaje a\u00fan m\u00e1s expl\u00edcito.\nTambi\u00e9n podemos preocuparnos menos por un virus que mute\nEn febrero, tres expertos en virus publicaron\n[un editorial en una revista titulado](https://www.nature.com/articles/s41564-020-0690-4) \u201cWe Shouldn\u2019t Worry When a Virus Mutates During Outbreaks\u201d (No debemos preocuparnos cuando un virus muta durante los brotes).\nPero nos preocupamos. A medida que la pandemia del coronavirus barri\u00f3 el planeta, los titulares y los tuits nos inundaban diciendo que el nuevo coronavirus estaba experimentando mutaciones peligrosas.\nMuchas de estas preocupaciones se basaron en un malentendido de lo que significa que un virus mute. Cuando una c\u00e9lula infectada produce nuevos virus, a veces comete errores al copiar los genes virales. Esos errores son mutaciones, y resulta que la mayor\u00eda son malas para los virus, lo que obstaculiza su capacidad de secuestrar a nuestras c\u00e9lulas.\nLos virus que logran propagarse a nuevos anfitriones tambi\u00e9n tienen mutaciones. Pero esas mutaciones a menudo no tienen ning\u00fan efecto significativo. Las alteraciones que causan en los genes de un virus no conducen a ning\u00fan cambio en c\u00f3mo funciona el virus.\nLos cient\u00edficos han identificado nuevas mutaciones inofensivas en diferentes linajes del nuevo coronavirus. Estos linajes no son nuevas cepas peligrosas.\nAlgunos de estos linajes han llegado a ser la versi\u00f3n m\u00e1s com\u00fan del coronavirus en algunos pa\u00edses. Nuevamente, esto no significa que tengan alguna ventaja evolutiva. Existe un fen\u00f3meno muy com\u00fan en la naturaleza llamado el efecto fundador: cualquier mutaci\u00f3n usual en los fundadores de una nueva poblaci\u00f3n ser\u00e1 tambi\u00e9n usual en sus descendientes.\nEs posible que los virus obtengan mutaciones que s\u00ed afectan la forma en que funcionan. El nuevo coronavirus no ser\u00e1 diferente. Pero la \u00fanica manera de saber si una nueva mutaci\u00f3n es significativa o no es realizar una investigaci\u00f3n. Se necesitar\u00e1 mucha evidencia para rechazar la hip\u00f3tesis m\u00e1s probable: que la nueva mutaci\u00f3n no tiene importancia alguna.\nAfortunadamente, no parece que los coronavirus incorporen estas nuevas mutaciones de forma muy r\u00e1pida. Los cient\u00edficos han descubierto que, comparado con otros virus, el nuevo coronavirus tiene una tasa relativamente lenta de nuevas mutaciones.\nEste es un gran alivio para los fabricantes de vacunas. Los virus de la influenza mutan tan r\u00e1pido que, para mantenerse protegidas, las personas necesitan vacunarse contra la gripe cada a\u00f1o. El VIH tiene tanta diversidad gen\u00e9tica que a\u00fan no se ha encontrado una vacuna efectiva contra \u00e9l. El nuevo coronavirus plantea enormes desaf\u00edos para los fabricantes de vacunas, pero la mayor\u00eda de ellos tienen que ver con la fabricaci\u00f3n de miles de millones de dosis en cuesti\u00f3n de meses.\nTenemos suficientes preocupaciones cuando se trata de la COVID-19; no hay necesidad de agregar a la lista una innecesaria.\nNo podemos contar con el clima c\u00e1lido para vencer al virus\nEl clima c\u00e1lido y h\u00famedo del verano\n[no detendr\u00e1 la pandemia](https://www.nytimes.com/2020/05/08/health/virus-summer-pandemic.html). M\u00e1s luz solar y humedad pueden ralentizar su propagaci\u00f3n, pero probablemente no sabremos cu\u00e1nto. Otros factores, como la reducci\u00f3n de los viajes, el aumento de la distancia personal, las escuelas cerradas, las reuniones canceladas y el uso de mascarillas, tienen efectos que superar\u00edan la influencia del clima.\nSe conocen algunas cosas sobre las condiciones que favorecen o no el virus. Los rayos ultravioletas de la luz solar ayudan a destruir el virus en las superficies y algunos estudios han mostrado un peque\u00f1o efecto de la humedad. Parece durar m\u00e1s sobre superficies duras como el pl\u00e1stico y el metal. No\n[sobrevivir\u00e1 en una piscina](https://www.nytimes.com/es/2020/05/19/espanol/coronavirus-que-hacer-afuera.html) o lago o el agua del mar. El viento lo dispersa. [El riesgo de transmisi\u00f3n es menor en exteriores que en interiores](https://www.nytimes.com/es/2020/05/19/espanol/coronavirus-que-hacer-afuera.html).\nUn banco de madera bajo un sol radiante en una playa ventosa es una mejor apuesta que un reclinador de metal o pl\u00e1stico en el lado sombreado de la piscina. Pero si alguien infectado se sienta cerca de ti y tose, o habla mucho o canta, realmente no importa d\u00f3nde est\u00e9s sentado y cu\u00e1n lindo sea el d\u00eda.\n\u201cEl virus no necesita condiciones favorables\u201d, dijo Peter Juni, epidemi\u00f3logo de la Universidad de Toronto. Tiene una poblaci\u00f3n mundial sin inmunidad esperando ser infectada. Trae al sol: el nuevo coronavirus sobrevivir\u00e1.\nEl aire acondicionado\n[puede empujar al virus directamente a tu mesa en el restaurante.](https://www.nytimes.com/2020/04/20/health/airflow-coronavirus-restaurants.html)\nEn el D\u00eda de los Ca\u00eddos, muchas personas en Estados Unidos se reunieron en agradable cercan\u00eda bajo un clima encantador y sin mascarillas. Si alguno de ellos estaba infectado y respirando, probablemente haya infectado a alguien m\u00e1s. Lo mismo aplicar\u00e1 para el 4 de julio. Incluso si el clima es glorioso.", "language": null, "image": "https://static01.nyt.com/images/2020/06/02/science/02SCI-CV-KNOW-promo/02SCI-CV-KNOW-promo-facebookJumbo.jpg?year=2020&h=550&w=1050&s=52f74d9014ffb8eef70d4f8d0f647f6cbed61e5640ba291a1670e5a09b86eadf&k=ZQJBKqZ0VN", "pagetype": "article", "links": ["#site-content", "#site-index", "https://www.nytimes.com/es/", "/", "https://www.nytimes.com/section/todayspaper", "/?name=styln-coronavirus-es&region=TOP_BANNER&block=storyline_menu_home_logo&action=click&pgtype=Article", "https://www.nytimes.com/es/spotlight/coronavirus", "https://www.nytimes.com/es/2022/11/17/espanol/covid-sintomas-poco-frecuentes.html", "https://www.nytimes.com/es/2022/11/29/espanol/covid-omicron.html", "https://www.nytimes.com/es/2022/11/16/espanol/covid-sintomas-depresion.html", "https://www.nytimes.com/es/2022/06/14/espanol/covid-otra-vez-reinfeccion.html", "https://www.nytimes.com/es/2022/07/18/espanol/como-reforzar-el-sistema-inmunitario.html", "#after-top", "#after-sponsor", "https://www.nytimes.com/newsletters/el-times", "https://www.nytimes.com/es/spotlight/coronavirus", "https://www.nytimes.com/es/2020/06/02/espanol/ciencia-y-tecnologia/perfil-coronavirus-covid.html", "https://www.nytimes.com/2020/01/06/world/asia/china-SARS-pneumonialike.html", "https://www.nytimes.com/es/2020/06/03/espanol/misterios-coronavirus.html", "#link-32c788db", "#link-dd68b8", "#link-2eb0bf5d", "#link-78088cfa", "#link-767f3574", "#link-4d993a0f", "https://www.nytimes.com/interactive/2020/05/20/science/coronavirus-vaccine-development.html?searchResultPosition=6", "https://www.nytimes.com/es/2020/04/21/espanol/ciencia-y-tecnologia/coronavirus-futuro.html", "https://www.cdc.gov/coronavirus/2019-ncov/hcp/planning-scenarios.html", "https://www.nature.com/articles/s41591-020-0843-2", "https://www.ajicjournal.org/article/S0196-6553(05)00911-9/fulltext#articleInformation", "https://academic.oup.com/annweh/article/54/7/789/202744", "https://www.nytimes.com/2020/04/22/us/politics/social-distancing-coronavirus.html", "https://www.nytimes.com/2020/04/24/business/congress-coronavirus-stimulus-bill.html", "https://www.nytimes.com/2020/05/21/health/coronavirus-vaccine-astrazeneca.html", "https://www.nytimes.com/2020/05/15/us/politics/house-simulus-vote.html", "http://www.crfb.org/blogs/covid-money-tracker-policies-enacted-to-date", "https://www.nytimes.com/2020/03/28/us/testing-coronavirus-pandemic.html", "https://covidtracking.com/data/us-daily", "https://covidtracking.com/data/us-daily", "https://covidtracking.com/data/us-daily", "https://www.washingtonpost.com/health/as-coronavirus-testing-expands-a-new-problem-arises-not-enough-people-to-test/2020/05/17/3f3297de-8bcd-11ea-8ac1-bfb250876b7a_story.html", "https://www.latimes.com/california/story/2020-05-26/los-angeles-opens-largest-coronavirus-testing-site-at-dodger-stadiu", "https://www.nytimes.com/2020/04/21/health/fda-in-home-test-coronavirus.html", "https://www.nytimes.com/interactive/2020/05/12/us/coronavirus-testing-white-house.html?action=click&module=RelatedLinks&pgtype=Article", "https://www.nytimes.com/interactive/2020/05/12/us/coronavirus-testing-white-house.html?action=click&module=RelatedLinks&pgtype=Article", "https://www.nytimes.com/interactive/2020/05/12/us/coronavirus-testing-white-house.html?action=click&module=RelatedLinks&pgtype=Article", "https://www.npr.org/sections/health-shots/2020/05/07/851610771/u-s-coronavirus-testing-still-falls-short-hows-your-state-doing", "https://www.newyorker.com/news/q-and-a/paul-romer-on-how-to-survive-the-chaos-of-the-coronavirus", "https://www.nytimes.com/2020/05/25/health/coronavirus-testing-trump.html", "https://www.nytimes.com/2020/05/22/us/politics/coronavirus-tests-cdc.html", "https://www.nytimes.com/interactive/2020/05/28/upshot/coronavirus-herd-immunity.html", "https://www.nytimes.com/2020/04/27/health/coronavirus-symptoms-cdc.html", "https://www.thelancet.com/journals/lancet/article/PIIS0140-6736(20)30558-4/fulltext", "https://www.nytimes.com/es/2020/03/25/espanol/coronavirus-aire-como-se-transmite.html", "https://wwwnc.cdc.gov/eid/article/26/7/20-0885_article", "https://www.nature.com/articles/s41564-020-0690-4", "https://www.nytimes.com/2020/05/08/health/virus-summer-pandemic.html", "https://www.nytimes.com/es/2020/05/19/espanol/coronavirus-que-hacer-afuera.html", "https://www.nytimes.com/es/2020/05/19/espanol/coronavirus-que-hacer-afuera.html", "https://www.nytimes.com/2020/04/20/health/airflow-coronavirus-restaurants.html", "#after-bottom", "https://help.nytimes.com/hc/en-us/articles/115014792127-Copyright-notice", "https://www.nytco.com/", "https://help.nytimes.com/hc/en-us/articles/115015385887-Contact-Us", "https://help.nytimes.com/hc/en-us/articles/115015727108-Accessibility", "https://www.nytco.com/careers/", "https://nytmediakit.com/", "https://www.tbrandstudio.com/", "https://www.nytimes.com/privacy/cookie-policy#how-do-i-manage-trackers", "https://www.nytimes.com/privacy/privacy-policy", "https://help.nytimes.com/hc/en-us/articles/115014893428-Terms-of-service", "https://help.nytimes.com/hc/en-us/articles/115014893968-Terms-of-sale", "/sitemap/", "https://www.nytimes.com/ca/", "https://www.nytimes.com/international/", "https://help.nytimes.com/hc/en-us", "https://www.nytimes.com/subscription?campaignId=37WXW"]}