{"title": "Fact Check-Desinformaci\u00f3n detectada en un meme sobre la vacuna contra el COVID-19", "author": "Reuters Fact Check", "url": "https://jp.reuters.com/article/factcheck-covid19-vacunas-idUSL1N2RS17R", "hostname": "reuters.com", "description": "Varios usuarios de redes sociales publicaron una plantilla con una serie de afirmaciones sobre los supuestos riesgos de la vacuna contra el COVID-19, como que en realidad es una terapia gen\u00e9tica experimental, que no est\u00e1 aprobada por la FDA de Estados Unidos o que las pruebas...", "sitename": "Reuters", "date": "2021-11-01", "id": null, "license": null, "body": null, "comments": "", "commentsbody": null, "raw_text": null, "text": "CIUDAD DE M\u00c9XICO, 1 nov (Reuters) - Varios usuarios de redes sociales publicaron una plantilla con una serie de afirmaciones sobre los supuestos riesgos de la vacuna contra el COVID-19, como que en realidad es una terapia gen\u00e9tica experimental, que no est\u00e1 aprobada por la FDA de Estados Unidos o que las pruebas previas en animales generaron su esterilizaci\u00f3n masiva. A continuaci\u00f3n, se presentan los datos que desmienten esas informaciones.\nEjemplos de esa publicaci\u00f3n, de septiembre y octubre de 2021, son visibles aqu\u00ed (\n[here](https://www.facebook.com/photo?fbid=3819976294894026&set=a.1620362004855477) ) y aqu\u00ed ( [here](https://www.facebook.com/photo?fbid=857529081581189&set=a.574599579874142) ). La plantilla, que incluye una foto ilustrativa de un menor levantando la mano en se\u00f1al de rechazo a una inyecci\u00f3n, lleva la leyenda: \"Lo que los Mejores Cient\u00edficos del mundo afirman y NO se dice en TV ni en la PRENSA\".\nLa plantilla va acompa\u00f1ada de unos c\u00f3digos QR que, al ser escaneados, conducen a una p\u00e1gina web llamada \u201cUnidos por la Verdad Canc\u00fan\u201d donde aparece una carta abierta dirigida al presidente de M\u00e9xico, Andr\u00e9s Manuel L\u00f3pez Obrador, y a los diputados de ese pa\u00eds pidi\u00e9ndoles que la vacuna no sea obligatoria, y al sitio web \u201cDespertar a la Conciencia\u201d, repleto tambi\u00e9n de posturas contrarias a la inmunizaci\u00f3n contra la enfermedad del coronavirus.\nTERAPIA GEN\u00c9TICA EXPERIMENTAL\nLa primera afirmaci\u00f3n que aparece en la plantilla es que la inyecci\u00f3n \"no es una vacuna, es una terapia gen\u00e9tica experimental\". Reuters ha desmentido anteriormente informaciones que ligaban a las vacunas con ARN mensajero, como las estadounidenses Pfizer/BioNTech y Moderna, a supuestas alteraciones del ADN de las personas aqu\u00ed (\n[here](https://www.reuters.com/article/factcheck-vacunas-adn-idUSL1N2OP1OP) ).\nAlgunas verificaciones en ingl\u00e9s son visibles tambi\u00e9n aqu\u00ed (\n[here](https://www.reuters.com/article/factcheck-coronavirus-vaccines-idUSL1N2PK1DC) ), aqu\u00ed ( [here](https://www.reuters.com/article/uk-factcheck-genetic-idUSKBN29I30V) ), aqu\u00ed ( [here](https://www.reuters.com/article/uk-factcheck-covid-19-vaccine-modify-idUSKBN22U2BZ) ) y aqu\u00ed ( [here](https://www.reuters.com/article/factcheck-vaccine-dna-idUSL2N2L23EM) ).\nDe acuerdo con los Centros para el Control y Prevenci\u00f3n de Enfermedades de Estados Unidos (CDC, por sus siglas en ingl\u00e9s), las vacunas con ARN mensajero \"no afectan ni interact\u00faan con nuestro ADN de ninguna manera\" aqu\u00ed (\n[here](https://www.cdc.gov/coronavirus/2019-ncov/vaccines/different-vaccines/mrna.html) ). \"El ARNm nunca ingresa al n\u00facleo de la c\u00e9lula donde se encuentra nuestro ADN (material gen\u00e9tico), por lo que no puede cambiar ni influir en nuestros genes\", agregan.\nComo explican los CDC, \u201clas vacunas de ARNm utilizan ARNm creado en un laboratorio para ense\u00f1ar a nuestras c\u00e9lulas c\u00f3mo producir una prote\u00edna, o incluso solo una parte de una prote\u00edna, que desencadena una respuesta inmune dentro de nuestro cuerpo. Esa respuesta inmune, que produce anticuerpos, es lo que nos protege de infectarnos si el virus real ingresa a nuestros cuerpos\u201d.\nTampoco hay ninguna evidencia de que las otras vacunas que no usan ARN mensajero funcionen como una terapia gen\u00e9tica experimental ni que ese sea el objetivo por el que fueron creadas.\nAPROBACI\u00d3N DE LA FDA\nDesde su creaci\u00f3n en 2020 en tiempo r\u00e9cord, pocos meses despu\u00e9s del inicio de la pandemia, la Organizaci\u00f3n Mundial de la Salud (OMS) comenz\u00f3 a autorizar la administraci\u00f3n de vacunas contra el COVID-19 para uso de emergencia, aqu\u00ed (\n[here](https://www.who.int/es/news/item/31-12-2020-who-issues-its-first-emergency-use-validation-for-a-covid-19-vaccine-and-emphasizes-need-for-equitable-global-access) ). Al mes de septiembre del 2021, la OMS ha autorizado las vacunas de Pfizer/BioNTech, AstraZeneca/Oxford, Janssen, Moderna, Sinopharm y la de Sinovac aqu\u00ed ( [here](https://www.paho.org/es/vacunas-contra-covid-19/preguntas-frecuentes-vacunas-contra-covid-19) ). El organismo aclara que \"otras vacunas contin\u00faan siendo estudiadas\" y que \"agencias reguladoras nacionales han autorizado otras vacunas contra la COVID-19 en pa\u00edses espec\u00edficos\".\nEste es el caso de la Administraci\u00f3n de Medicamentos y Alimentos de Estados Unidos (FDA, por sus siglas en ingl\u00e9s), que en su p\u00e1gina web explica la forma en que da el visto bueno a esos productos para uso de emergencia aqu\u00ed (\n[here](https://www.fda.gov/vaccines-blood-biologics/vaccines/explicacion-de-la-autorizacion-de-uso-de-emergencia-para-las-vacunas) ).\nEl 23 de agosto pasado, la FDA aprob\u00f3, adem\u00e1s, la autorizaci\u00f3n de la vacuna de Pfizer/BioNTech para todos los efectos aqu\u00ed (\n[here](https://www.fda.gov/news-events/press-announcements/la-fda-aprueba-la-primera-vacuna-contra-el-covid-19) ). Ya la hab\u00eda aprobado para uso de emergencia el 11 de diciembre de 2020 aqu\u00ed ( [here](https://www.fda.gov/news-events/press-announcements/fda-takes-key-action-fight-against-covid-19-issuing-emergency-use-authorization-first-covid-19) ). Tambi\u00e9n han recibido el visto bueno para esos casos las inyecciones de Moderna y Janssen (de Johnson & Johnson) aqu\u00ed ( [here](https://www.fda.gov/consumers/consumer-updates/learn-more-about-covid-19-vaccines-fda) ).\nPor tanto, la afirmaci\u00f3n de la plantilla \u201cNo est\u00e1 aprobado por la FDA\u201d carece de sustento.\nANIMALES ESTERILIZADOS\nTampoco existe evidencia de que a consecuencia de las pruebas que se han realizado en animales de las vacunas contra el COVID-19 estos hayan quedado esterilizados, como apunta la plantilla en otro punto.\nEs cierto que a consecuencia de las investigaciones, fueron sacrificados, por ejemplo, miles de ratones en Estados Unidos y Europa, como relataba el canal de televisi\u00f3n alem\u00e1n Deutsche Welle en julio de 2020, en medio de la carrera por obtener r\u00e1pidamente la inyecci\u00f3n que protegiera a los humanos de la enfermedad del coronavirus aqu\u00ed (\n[here](https://www.dw.com/es/c%C3%B3mo-les-va-a-los-animales-de-laboratorio-en-la-crisis-del-coronavirus/a-54032806) ). Hurones, monos y otros animales tambi\u00e9n fueron usados como conejillos de indias para la experimentaci\u00f3n, como explic\u00f3 la agencia estadounidense Associated Press en un art\u00edculo publicado en el diario de ese pa\u00eds Los Angeles Times, aqu\u00ed ( [here](https://www.latimes.com/espanol/articulo/2020-06-04/como-los-animales-estan-ayudando-a-los-cientificos-a-desarrollar-vacunas-contra-covid-19) ), pero en ninguna de las informaciones sobre esas actividades existen menciones de esterilizaciones.\nEs m\u00e1s, el 31 de marzo de 2021, Deutsche Welle inform\u00f3 que Rusia registr\u00f3 la primera vacuna contra el COVID-19 para animales, Carnivac-Cov aqu\u00ed (\n[here](https://www.dw.com/es/rusia-registra-la-primera-vacuna-contra-el-covid-19-para-animales/a-57068798) ). Sin embargo, el desarrollo de esa inyecci\u00f3n tuvo tambi\u00e9n como meta ayudar a prevenir la mutaci\u00f3n en animales, explicaron los cient\u00edficos rusos, para evitar casos como el de un criadero de hurones en Dinamarca, donde tuvieron que ser sacrificados millones de ejemplares en noviembre de 2020 despu\u00e9s de que se contagiaran de la enfermedad, aqu\u00ed ( [here](https://www.bbc.com/mundo/noticias-54824991) ).\nSUSTANCIAS DE ALTA TOXICIDAD\nEn un texto explicativo sobre los ingredientes que contienen las vacunas aqu\u00ed (\n[here](https://www.who.int/es/emergencies/diseases/novel-coronavirus-2019/covid-19-vaccines/how-are-vaccines-developed) ), la OMS cita en su p\u00e1gina web diferentes elementos como el ant\u00edgeno (un componente activo) que genera una respuesta inmunitaria y que puede ser az\u00facar o una prote\u00edna; conservantes para evitar que el l\u00edquido se contamine cuando se abre un vial; estabilizantes como az\u00facar, amino\u00e1cidos, gelatina y prote\u00ednas; sustancias tensioactivas que mantienen mezclados todos los componentes del producto; sustancias residuales que pueden incluir prote\u00ednas de huevo, levaduras o antibi\u00f3ticos; un diluyente para diluir la vacuna en la concentraci\u00f3n correcta, como por ejemplo agua esterilizada, y un coadyuvante para mejorar su respuesta inmunitaria, que puede ser una \u00ednfima cantidad de sales de aluminio (por ejemplo, fosfato de aluminio, hidr\u00f3xido de aluminio o alumbre pot\u00e1sico).\nNo obstante, no existe evidencia de que una vacuna contra el COVID-19 \"contiene sustancias de alta toxicidad\", como dice la plantilla. Reuters ha desmentido anteriormente la presencia en las inyecciones de sustancias como el grafeno, un material obtenido mediante la oxidaci\u00f3n del grafito, aqu\u00ed (\n[here](https://www.reuters.com/article/factcheck-vacunas-grafenofalso-idUSL1N2Q113C) ).\nAdem\u00e1s, verific\u00f3 otra informaci\u00f3n falsa que aseguraba que las vacunas estaban compuestas de elementos met\u00e1licos que convert\u00edan el punto del brazo donde son administradas en un im\u00e1n, aqu\u00ed (\n[here](https://www.reuters.com/article/factcheck-vacuna-magnetismo-idUSL2N2N62BT) ).\nNinguna de las vacunas contra el COVID-19 aprobadas en el Reino Unido o Estados Unidos contiene ingredientes met\u00e1licos aqu\u00ed (\n[here](https://www.pfizer.com/news/hot-topics/the_facts_about_pfizer_and_biontech_s_covid_19_vaccine) ), aqu\u00ed ( [here](https://www.fda.gov/media/146305/download#page=2) ), aqu\u00ed ( [here](https://www.fda.gov/media/144638/download) ) y aqu\u00ed ( [here](https://www.gov.uk/government/publications/regulatory-approval-of-covid-19-vaccine-astrazeneca/information-for-uk-recipients-on-covid-19-vaccine-astrazeneca) ).\nSISTEMA INMUNE\n\"Tu sistema inmune quedar\u00e1 da\u00f1ado de por vida\", dice tambi\u00e9n la plantilla. En realidad, \"las vacunas contienen partes atenuadas o inactivadas de un organismo espec\u00edfico (ant\u00edgeno) que provoca una respuesta inmunitaria en el cuerpo\", explica la OMS, aqu\u00ed (\n[here](https://www.who.int/es/emergencies/diseases/novel-coronavirus-2019/covid-19-vaccines/how-do-vaccines-work)).\n\u201cLas vacunas m\u00e1s recientes contienen las \u2018instrucciones\u2019 para producir ant\u00edgenos, en lugar del ant\u00edgeno en s\u00ed mismo. Independientemente de que la vacuna contenga el ant\u00edgeno o las instrucciones para que el cuerpo lo produzca, esa versi\u00f3n atenuada no provocar\u00e1 la enfermedad en la persona vacunada, pero inducir\u00e1 al sistema inmunitario a responder como lo hubiese hecho en su primera reacci\u00f3n ante el pat\u00f3geno real. Esto significa que si una persona se ve expuesta al pat\u00f3geno peligroso en el futuro, su sistema inmunitario podr\u00e1 responder inmediatamente y protegerla contra la enfermedad\u201d.\nAs\u00ed, el sistema inmune se ve m\u00e1s bien reforzado con la aplicaci\u00f3n de la vacuna.\nDECENAS DE MILES DE MUERTOS\n\u201cLos sistemas oficiales de denuncia en USA, Inglaterra y Europa han reportado decenas de miles de muertos y millones de secuelados\u201d, dice en el \u00faltimo punto la plantilla.\nAunque seg\u00fan los CDC de Estados Unidos, entre el 14 de diciembre de 2020, cuando comenzaron a aplicarse las vacunas, y el 25 de octubre de 2021, el Sistema de Notificaci\u00f3n de Eventos Adversos de Vacuna (VAERS) del pa\u00eds norteamericano recibi\u00f3 9.143 notificaciones de casos de muerte (casi 0 %) entre personas a las que se les suministr\u00f3 la vacuna, aclararon que \"los informes de reacciones adversas enviados al VAERS despu\u00e9s de la vacunaci\u00f3n, incluidos los casos de muertes, no significan necesariamente que una vacuna haya causado un problema de salud\", aqu\u00ed (\n[here](https://espanol.cdc.gov/coronavirus/2019-ncov/vaccines/safety/adverse-events.html) ).\nArt\u00edculos escritos por Reuters que abordan esa falta de causalidad con las entradas en VAERS pueden leerse aqu\u00ed (\n[here](https://www.reuters.com/article/factcheck-vaers-faers-idUSL2N2OE1ZA)) ( [here](https://www.reuters.com/article/factcheck-vaers-deaths-idUSL1N2MZ2H8)).\nAdem\u00e1s, el 21 de octubre de 2021 la Organizaci\u00f3n Mundial de la Salud (OMS) advirti\u00f3 que la cifra oficial de muertos por COVID-19 en el mundo es actualmente de 4,9 millones, pero sin un reparto equitativo de vacunas en los pa\u00edses donde las tasas de inmunizaci\u00f3n a\u00fan son bajas este n\u00famero puede duplicarse en 2022, en una advertencia para los m\u00e1s ricos y una abierta defensa de la vacunaci\u00f3n generalizada en el planeta como instrumento para derrotar a la pandemia aqu\u00ed (\n[here](https://www.efe.com/efe/america/sociedad/oms-las-muertes-por-covid-pueden-llegar-a-los-10-millones-sin-reparto-de-vacunas/20000013-4657521) ).\n\u201cLa cifra de muertes puede llegar a los 10 millones el pr\u00f3ximo a\u00f1o, por lo que no vacunar al mundo ser\u00eda un fracaso, algo contra nuestros intereses y nuestra seguridad\u201d, declar\u00f3 el embajador de la OMS para Financiaci\u00f3n Sanitaria Mundial y exprimer ministro brit\u00e1nico Gordon Brown, seg\u00fan la Agencia EFE.\nTal es la trascendencia que la OMS da a la vacunaci\u00f3n que en agosto el organismo pidi\u00f3 postergar las dosis de refuerzo que han comenzado a dar algunos pa\u00edses para permitir que decenas de pa\u00edses con bajas tasas de inmunizaci\u00f3n avancen en el proceso aqu\u00ed (\n[here](https://www.bbc.com/mundo/noticias-internacional-58094639) ).\nVEREDICTO\nFalso. La vacuna contra el COVID-19 no es una terapia gen\u00e9tica experimental, est\u00e1 aprobada por la FDA de Estados Unidos y las pruebas previas en animales no generaron su esterilizaci\u00f3n masiva, como asegura una publicaci\u00f3n en redes, entre otras informaciones falsas.\nEste art\u00edculo fue realizado por el equipo de Reuters Fact Check. Lea m\u00e1s sobre nuestro trabajo de verificaci\u00f3n de afirmaciones en las redes sociales aqu\u00ed, (\n[here](https://www.reuters.com/fact-check/about)).\n\u79c1\u305f\u3061\u306e\u884c\u52d5\u898f\u7bc4\uff1a\n[\u30c8\u30e0\u30bd\u30f3\u30fb\u30ed\u30a4\u30bf\u30fc\u300c\u4fe1\u983c\u306e\u539f\u5247\u300d](http://thomsonreuters.com/en/about-us/trust-principles.html)", "language": null, "image": "https://s1.reutersmedia.net/resources_v2/images/rcom-default.png?w=800", "pagetype": "article", "links": ["https://www.thomsonreuters.com/en/global-gateway.html", "https://www.thomsonreuters.com/en/login.html", "https://reuters.zendesk.com/hc/en-us/articles/216467423-Contact-Reuters", "https://reuters.zendesk.com/hc/en-us", "https://jp.reuters.com/news/archive/factCheckSpanishNew", "https://jp.reuters.com/journalists/reuters-fact-check", "https://www.facebook.com/photo?fbid=3819976294894026&set=a.1620362004855477", "https://www.facebook.com/photo?fbid=857529081581189&set=a.574599579874142", "https://www.reuters.com/article/factcheck-vacunas-adn-idUSL1N2OP1OP", "https://www.reuters.com/article/factcheck-coronavirus-vaccines-idUSL1N2PK1DC", "https://www.reuters.com/article/uk-factcheck-genetic-idUSKBN29I30V", "https://www.reuters.com/article/uk-factcheck-covid-19-vaccine-modify-idUSKBN22U2BZ", "https://www.reuters.com/article/factcheck-vaccine-dna-idUSL2N2L23EM", "https://www.cdc.gov/coronavirus/2019-ncov/vaccines/different-vaccines/mrna.html", "https://www.who.int/es/news/item/31-12-2020-who-issues-its-first-emergency-use-validation-for-a-covid-19-vaccine-and-emphasizes-need-for-equitable-global-access", "https://www.paho.org/es/vacunas-contra-covid-19/preguntas-frecuentes-vacunas-contra-covid-19", "https://www.fda.gov/vaccines-blood-biologics/vaccines/explicacion-de-la-autorizacion-de-uso-de-emergencia-para-las-vacunas", "https://www.fda.gov/news-events/press-announcements/la-fda-aprueba-la-primera-vacuna-contra-el-covid-19", "https://www.fda.gov/news-events/press-announcements/fda-takes-key-action-fight-against-covid-19-issuing-emergency-use-authorization-first-covid-19", "https://www.fda.gov/consumers/consumer-updates/learn-more-about-covid-19-vaccines-fda", "https://www.dw.com/es/c%C3%B3mo-les-va-a-los-animales-de-laboratorio-en-la-crisis-del-coronavirus/a-54032806", "https://www.latimes.com/espanol/articulo/2020-06-04/como-los-animales-estan-ayudando-a-los-cientificos-a-desarrollar-vacunas-contra-covid-19", "https://www.dw.com/es/rusia-registra-la-primera-vacuna-contra-el-covid-19-para-animales/a-57068798", "https://www.bbc.com/mundo/noticias-54824991", "https://www.who.int/es/emergencies/diseases/novel-coronavirus-2019/covid-19-vaccines/how-are-vaccines-developed", "https://www.reuters.com/article/factcheck-vacunas-grafenofalso-idUSL1N2Q113C", "https://www.reuters.com/article/factcheck-vacuna-magnetismo-idUSL2N2N62BT", "https://www.pfizer.com/news/hot-topics/the_facts_about_pfizer_and_biontech_s_covid_19_vaccine", "https://www.fda.gov/media/146305/download#page=2", "https://www.fda.gov/media/144638/download", "https://www.gov.uk/government/publications/regulatory-approval-of-covid-19-vaccine-astrazeneca/information-for-uk-recipients-on-covid-19-vaccine-astrazeneca", "https://www.who.int/es/emergencies/diseases/novel-coronavirus-2019/covid-19-vaccines/how-do-vaccines-work", "https://espanol.cdc.gov/coronavirus/2019-ncov/vaccines/safety/adverse-events.html", "https://www.reuters.com/article/factcheck-vaers-faers-idUSL2N2OE1ZA", "https://www.reuters.com/article/factcheck-vaers-deaths-idUSL1N2MZ2H8", "https://www.efe.com/efe/america/sociedad/oms-las-muertes-por-covid-pueden-llegar-a-los-10-millones-sin-reparto-de-vacunas/20000013-4657521", "https://www.bbc.com/mundo/noticias-internacional-58094639", "https://www.reuters.com/fact-check/about", "http://thomsonreuters.com/en/about-us/trust-principles.html", "//jp.reuters.com/tools/mobile", "http://newslink.jp.reuters.com/join/subscribe", "//2290722.polldaddy.com/s/reuters-contactus", "https://www.thomsonreuters.com/en/privacy-statement.html#cookies", "//jp.reuters.com/info/terms", "//jp.reuters.com/info/privacy", "javascript:window.OneTrust.ToggleInfoDisplay();", "https://jp.reuters.com/info/copyright"]}