{"title": "Soy vir\u00f3logo y tengo una petici\u00f3n: hagamos que el estudio de los virus sea m\u00e1s seguro", "author": "Jesse Bloom", "url": "https://www.nytimes.com/es/2022/11/02/espanol/opinion/virus-laboratorio.html", "hostname": "nytimes.com", "description": "Debemos promover una investigaci\u00f3n que salve vidas sin generar nuevos riesgos en el laboratorio.", "sitename": "The New York Times", "date": "2022-11-02", "id": null, "license": null, "body": null, "comments": "", "commentsbody": null, "raw_text": null, "text": "Supported by\n[SKIP ADVERTISEMENT](#after-sponsor)\nEnsayo invitado\nSoy vir\u00f3logo y tengo una petici\u00f3n: hagamos que el estudio de los virus sea m\u00e1s seguro\nBloom estudia la evoluci\u00f3n del virus en el Fred Hutchinson Cancer Center en Seattle.\nA la humanidad la han invadido virus mucho m\u00e1s devastadores que el coronavirus que causa la COVID-19. La viruela, por ejemplo, lleg\u00f3 a matar al\n[30 por ciento](https://www.who.int/teams/health-product-and-policy-standards/standards-and-specifications/vaccine-standardization/smallpox#:~:text=Two%20forms%20of%20the%20disease,most%20prominent%20on%20the%20face) de las personas contagiadas. Gracias a la ciencia, ahora es una plaga del pasado: el \u00faltimo contagio natural se produjo [en 1977](https://www.cdc.gov/smallpox/history/history.html#:~:text=Last%20Cases%20of%20Smallpox).\nSin embargo, los \u00faltimos casos de viruela tuvieron su origen en un\n[laboratorio](https://www.bbc.com/news/uk-england-birmingham-45101091), cuando en 1978 una fot\u00f3grafa m\u00e9dica brit\u00e1nica se contagi\u00f3 por accidente en la Facultad de Medicina de la Universidad de Birmingham. Muri\u00f3 despu\u00e9s de haberle contagiado el virus a su madre, pero, afortunadamente, no se extendi\u00f3 m\u00e1s all\u00e1. El reputado vir\u00f3logo que dirig\u00eda el laboratorio se suicid\u00f3; sus compa\u00f1eros [dijeron](https://history.rcplondon.ac.uk/inspiring-physicians/henry-samuel-bedson) que hab\u00eda muerto por el acoso al que lo sometieron los periodistas, que buscaban a alguien a quien culpar.\nEl a\u00f1o anterior, el mundo hab\u00eda sido azotado por la\n[pandemia de gripe de 1977](https://wwwnc.cdc.gov/eid/article/12/1/05-1254_article), causada por una [cepa anteriormente extinta](https://www.ncbi.nlm.nih.gov/pmc/articles/PMC2887442/). Aunque se ha dicho que lo que provoc\u00f3 esta pandemia fue un accidente de laboratorio, muchos cient\u00edficos ( [incluido yo](https://twitter.com/jbloom_lab/status/1385664869949599744)) piensan que lo m\u00e1s probable es que se debiera a [un ensayo de vacuna](https://www.ncbi.nlm.nih.gov/pmc/articles/PMC4542197/) errado.\nNo parece probable que se repitan esas cat\u00e1strofes. La investigaci\u00f3n sobre el virus de la\n[viruela](https://www.npr.org/sections/goatsandsoda/2019/09/19/762013515/russian-lab-explosion-raises-question-should-smallpox-virus-be-kept-or-destroyed) est\u00e1 ahora muy restringida; nadie realizar\u00eda hoy ensayos de vacuna con cepas de gripe extintas, y la seguridad de los laboratorios ha mejorado desde la d\u00e9cada de 1970.\nSin embargo, los nuevos avances cient\u00edficos hacen que cada vez sea m\u00e1s f\u00e1cil identificar los virus de naturaleza peligrosa, manipularlos en el laboratorio y crearlos artificialmente a partir de las secuencias gen\u00e9ticas. En las \u00faltimas semanas, sin ir m\u00e1s lejos, un grupo de cient\u00edficos de la Universidad de Boston anunci\u00f3 que estaba creando\n[h\u00edbridos](https://www.science.org/content/article/was-study-created-hybrid-covid-19-virus-too-risky) de las variantes del SARS-CoV-2, el virus que causa la COVID-19, mientras que los medios informaron [de la proliferaci\u00f3n de laboratorios](https://www.nature.com/articles/d41586-022-03181-x) que estudian virus peligrosos. Entonces estalla el debate: \u00bfestamos [m\u00e1s protegidos](https://www.scientificamerican.com/article/why-scientists-tweak-lab-viruses-to-make-them-more-contagious1/) con la virolog\u00eda, o [menos](https://www.vox.com/future-perfect/2022/10/19/23412562/covid-omircron-gain-of-function-research-engineered-pandemic-biosafety)?\nSoy vir\u00f3logo, y estudio c\u00f3mo las mutaciones permiten a los virus\n[escapar de los anticuerpos](https://pubmed.ncbi.nlm.nih.gov/33495308/), [resistir a los f\u00e1rmacos](https://www.ncbi.nlm.nih.gov/pmc/articles/PMC2913718/) y [acoplarse](https://www.nature.com/articles/s41586-022-04464-z) a las c\u00e9lulas. S\u00e9 lo mucho que ha hecho la virolog\u00eda por el progreso de la salud p\u00fablica. Sin embargo, algunos aspectos de la virolog\u00eda moderna pueden ser un arma de doble filo, y hemos de promover una investigaci\u00f3n beneficiosa que salve vidas sin generar nuevos riesgos en el laboratorio.\nLos virus provocaban brotes\n[mucho antes](https://pubmed.ncbi.nlm.nih.gov/21067353/) de que existieran los laboratorios. [A lo largo de la historia](https://www.ncbi.nlm.nih.gov/pmc/articles/PMC3180823/), los virus han saltado de los animales a los seres humanos. Una vez que los virus empiezan a extenderse, pueden evolucionar y [ser m\u00e1s contagiosos](https://pubmed.ncbi.nlm.nih.gov/32697968/) o [escapar de la inmunidad](https://www.nature.com/articles/s41586-021-04385-3), como hemos visto con el SARS-CoV-2.\nLa investigaci\u00f3n cient\u00edfica sobre estas amenazas naturales tiene inmensos beneficios. Los conocimientos sobre la gripe aviar han fundamentado los esfuerzos para\n[frenar el contagio entre las aves de corral](https://link.springer.com/chapter/10.1007/82_2012_254), previniendo posiblemente una pandemia. Las vacunas de COVID-19 se basaron en los [estudios](https://www.pnas.org/doi/10.1073/pnas.1707304114) sobre la prote\u00edna espicular de otros coronavirus. Los cient\u00edficos [rastrean](https://www.biorxiv.org/content/10.1101/2022.09.15.507787v3) c\u00f3mo act\u00faan los anticuerpos y las vacunas contra las nuevas variantes de la COVID-19 utilizando virus que no se reproducen, llamados [pseudovirus](https://blog.addgene.org/viral-vectors-101-pseudotyping), que no entra\u00f1an ning\u00fan riesgo para los humanos.\nPara ninguna de estas investigaciones se necesita un virus peligroso en el laboratorio. Se hace mediante la vigilancia, estudiando partes del virus o usando pseudovirus. Sin embargo, algunos experimentos s\u00ed requieren un virus real, como en las pruebas de medicamentos como el\n[Paxlovid](https://www.science.org/doi/10.1126/science.abl4784). \u00bfQu\u00e9 pasa si hay un accidente? Existen [casos documentados](https://www.science.org/doi/10.1126/science.303.5654.26) de cient\u00edficos contagiados del coronavirus incluso en laboratorios modernos de [nivel de bioseguridad 3 y 4](https://consteril.com/biosafety-levels-difference/), los que se utilizan para estudiar pat\u00f3genos peligrosos.\nLa mayor\u00eda de las veces estos riesgos son bastante bajos. Es mucho m\u00e1s probable que un investigador contraiga un virus haciendo la compra que en un laboratorio moderno. Por supuesto, alg\u00fan riesgo hay, pero permitimos que la gente conduzca, a pesar de que cada a\u00f1o su probabilidad de morir en un accidente de coche es\n[de 1 entre 10.000](https://erinjuryattorneys.com/odds-of-dying-in-a-car-crash/).\nPero es distinto cuando la investigaci\u00f3n ata\u00f1e a un virus que s\u00ed podr\u00eda provocar una pandemia, como ocurre cuando puede contagiarse de persona a persona y la mayor\u00eda carece de inmunidad. No me dejar\u00edan conducir si un accidente con mi coche pudiera matar a millones de personas y costar billones de d\u00f3lares en p\u00e9rdidas econ\u00f3micas; sin embargo, los\n[virus potencialmente pand\u00e9micos](https://journals.asm.org/doi/10.1128/mBio.00360-12) plantean ese riesgo.\nLos cient\u00edficos estudian principalmente virus sin potencial pand\u00e9mico. A veces usan virus \u201cseguros\u201d\n[incapaces](https://www.sciencedirect.com/science/article/abs/pii/S0140673671905976) de infectar a los humanos, o que han sido [debilitados](https://www.nature.com/articles/s41467-022-31930-z\u00e7) en el laboratorio. O estudian virus que ya circulan en los humanos, y que es improbable que provoquen una pandemia si hay un accidente. En [mi opini\u00f3n](https://twitter.com/jbloom_lab/status/1583133614749134849), el [estudio](https://www.science.org/content/article/was-study-created-hybrid-covid-19-virus-too-risky) de la Universidad de Boston del que tanto se ha hablado entra en esta categor\u00eda, porque combina dos variantes del SARS-CoV-2 que circularon recientemente entre los humanos.\nSin embargo, a veces los cient\u00edficos estudian virus que han saltado puntualmente de los animales a los humanos. Por ejemplo, una nueva cepa de gripe aviar est\u00e1\n[infectando ahora a muchas aves](https://www.nature.com/articles/d41586-022-03322-2) y otros mam\u00edferos como las [focas](https://www.fisheries.noaa.gov/feature-story/recent-increase-seal-deaths-maine-linked-avian-flu) y los [zorros](https://www.nytimes.com/2022/06/18/health/avian-flu-h5n1-foxes.html), pero a [pocos humanos](https://www.cdc.gov/media/releases/2022/s0428-avian-flu.html) hasta la fecha. A los vir\u00f3logos les preocupa que pudiera [adaptarse](https://www.ncbi.nlm.nih.gov/pmc/articles/PMC2862331/) y ser capaz de transmitirse entre humanos y provocar una pandemia. Como cient\u00edficos, queremos probar la eficacia de los virus para infectar c\u00e9lulas humanas o evadir los contraataques; pero un accidente en el laboratorio podr\u00eda poner en peligro al cient\u00edfico.\nCreo que en esos estudios se deber\u00edan emplear los m\u00e9todos descritos antes, m\u00e1s seguros, siempre que sea posible, pero se pueden hacer excepciones. Por ejemplo, ya hay personas que\n[est\u00e1n entrando en contacto](https://www.smcgov.org/ceo/news/avian-flu-county-health-advises-precautions-backyard-flocks-handling-dead-birds) con aves infectadas con la gripe aviar, y una investigaci\u00f3n juiciosa en un laboratorio de alto nivel de bioseguridad puede ayudar a valorar la amenaza.\nPero algunos cient\u00edficos lo han llevado m\u00e1s lejos, y han a\u00f1adido mutaciones de \u201cnueva adquisici\u00f3n funcional\u201d, que hace que los virus potencialmente pand\u00e9micos sean m\u00e1s contagiosos. Los Institutos Nacionales de Salud financiaron dos grupos de investigaci\u00f3n para aumentar la contagiosidad de una cepa anterior de gripe aviar que mat\u00f3 a\n[cientos de personas](https://en.wikipedia.org/wiki/Human_mortality_from_H5N1), pero ineficiente para la transmisi\u00f3n de persona a persona. Ambos grupos crearon mutantes virales que se pod\u00edan [transmitir a los hurones](https://www.nytimes.com/2011/12/27/science/debate-persists-on-deadly-flu-made-airborne.html). El gobierno de Obama estaba tan alarmado, que [mand\u00f3](https://www.nytimes.com/2014/10/18/us/white-house-to-cut-funding-for-risky-biological-study.html) detener el trabajo sobre la adquisici\u00f3n funcional de virus de la gripe potencialmente pand\u00e9micos en 2014, pero los INS permitieron [reiniciarlo](https://www.science.org/content/article/exclusive-controversial-experiments-make-bird-flu-more-risky-poised-resume) para 2019.\nDesde mi punto de vista, no hay ninguna justificaci\u00f3n para hacer, de forma intencionada, que virus potencialmente pand\u00e9micos sean m\u00e1s contagiosos. Las consecuencias de un accidente podr\u00edan ser demasiado terribles, y para las vacunas no se necesitan esos virus modificados, de todos modos.\nLos virus naturales que no han infectado a\u00fan a los humanos tambi\u00e9n pueden ser un riesgo si los investigadores intentan encontrar a los m\u00e1s peligrosos y llev\u00e1rselos al laboratorio para hacer experimentos.\nLas sospechas de que el SARS-CoV-2 tuvo su origen en un accidente de laboratorio las ha alimentado que el Instituto de Virolog\u00eda de Wuhan (WIV, por su sigla en ingl\u00e9s) hubiese participado en los proyectos\n[chinos](https://journals.plos.org/plospathogens/article?id=10.1371/journal.ppat.1006698) e [internacionales](https://theintercept.com/document/2021/09/08/understanding-the-risk-of-bat-coronavirus-emergence/) para [encontrar](https://theintercept.com/2021/09/06/new-details-emerge-about-coronavirus-research-at-chinese-lab/) nuevos coronavirus de alto riesgo y [experimentar](https://theintercept.com/2021/09/23/coronavirus-research-grant-darpa/) con ellos. El WIV [dice](https://www.science.org/pb-assets/PDF/News%20PDFs/Shi%20Zhengli%20Q&A-1630433861.pdf) que no realiz\u00f3 experimentos con virus similares al SARS-CoV-2 antes de la pandemia de COVID-19. Aun as\u00ed, la pandemia demuestra lo peligrosos que son estos virus. El riesgo de accidentes no lo compensa ning\u00fan beneficio concomitante, porque nadie ha explicado c\u00f3mo se podr\u00eda haber evitado la pandemia si los cient\u00edficos del WIH [hubiesen logrado](https://twitter.com/jbloom_lab/status/1577695523414642688) experimentar con dichos virus de antemano. Tampoco habr\u00eda ayudado con las vacunas: Moderna dise\u00f1\u00f3 la suya solo [dos d\u00edas antes](https://globalnews.ca/news/7492076/moderna-coronavirus-vaccine-technology-how-it-works/) de hacerse p\u00fablica la secuencia gen\u00e9tica del SARS-CoV-2, sin acceso al virus real.\nUna \u00faltima categor\u00eda de riesgo pand\u00e9mico ata\u00f1e a los virus que antes infectaban a los humanos, pero se extinguieron mucho tiempo atr\u00e1s, como el virus de la gripe de 1918. Ese virus fue\n[reconstruido artificialmente](https://www.science.org/doi/10.1126/science.306.5696.591a), y ahora lo estudian una serie de laboratorios para saber [por qu\u00e9](https://www.nature.com/articles/nature05495) fue tan mort\u00edfero. Aunque esta investigaci\u00f3n es fascinante desde el punto de vista cient\u00edfico, \u00faltimamente pienso que el riesgo de experimentar con virus pand\u00e9micos extintos no merece la pena.\nHay tambi\u00e9n algunas zonas grises que no tienen que ver directamente con los virus pand\u00e9micos, pero merecen una mayor deliberaci\u00f3n.\nUna zona gris son los mutantes de virus humanos actuales que escapan de los anticuerpos o los medicamentos. Estudiar esos mutantes es esencial para el desarrollo de las vacunas, y es incluso parte del\n[proceso de revisi\u00f3n de la Administraci\u00f3n de Alimentos y Medicamentos](https://www.fda.gov/media/71223/download) para los f\u00e1rmacos antivirales. Pero los cient\u00edficos deber\u00edan evitar generar m\u00e1s mutaciones de las que cabr\u00eda esperar de una evoluci\u00f3n natural en pocos a\u00f1os.\nOtra zona gris tiene que ver con la informaci\u00f3n. Los avances en la secuenciaci\u00f3n, la computaci\u00f3n y la seguridad de los experimentos permiten realizar\n[unas predicciones cada vez mejores](https://academic.oup.com/ve/article/8/1/veac021/6549895) sobre los efectos de las mutaciones v\u00edricas. Esta informaci\u00f3n ayuda a [rastrear la evoluci\u00f3n](https://pubmed.ncbi.nlm.nih.gov/35361968/), [actualizar las vacunas](https://www.fda.gov/news-events/press-announcements/coronavirus-covid-19-update-fda-authorizes-moderna-pfizer-biontech-bivalent-covid-19-vaccines-use) y [desarrollar f\u00e1rmacos](https://www.nature.com/articles/s41586-021-03807-6); pero tambi\u00e9n se ha vuelto f\u00e1cil transformar la informaci\u00f3n en virus de verdad. \u00bfY si alguien usa la informaci\u00f3n para dise\u00f1ar un experimento bienintencionado pero arriesgado o, a\u00fan peor, un arma biol\u00f3gica?\nLos accidentes bienintencionados se pueden atajar con la regulaci\u00f3n de los experimentos arriesgados, pero esto no sirve para quienes act\u00faan de mala fe. En su mayor parte, no es ning\u00fan secreto, puesto que la informaci\u00f3n sobre c\u00f3mo crear varios virus peligrosos ya es de dominio p\u00fablico. No obstante, deber\u00edamos controlar la informaci\u00f3n de m\u00e1s alto riesgo (como crear la viruela a partir de ADN sint\u00e9tico) sin interrumpir la libre circulaci\u00f3n de los datos, de la cual depende la ciencia.\nEn general, la mayor\u00eda de la investigaci\u00f3n virol\u00f3gica es segura y a menudo beneficiosa. Pero deber\u00edan cesar los experimentos que plantean riesgos pand\u00e9micos, y en otras \u00e1reas se necesita una cuidadosa valoraci\u00f3n continua. Varios grupos est\u00e1n desarrollando\n[marcos de trabajo](https://www.whitehouse.gov/briefing-room/press-briefings/2022/10/18/background-press-call-by-senior-administration-officials-to-preview-the-presidents-national-biodefense-strategy/) para su supervisi\u00f3n y regulaci\u00f3n.\nPero \u00bfqui\u00e9n deber\u00eda decidir, en \u00faltima instancia?\nAlgunos vir\u00f3logos piensan que nosotros deber\u00edamos tener la \u00faltima palabra, puesto que poseemos las debidas competencias t\u00e9cnicas. Discrepo en parte. Soy cient\u00edfico. Mi padre es cient\u00edfico. Mi esposa es cient\u00edfica. La mayor\u00eda de mis amigos son cient\u00edficos. Como es obvio, creo que los cient\u00edficos son geniales. Pero somos tan susceptibles como cualquiera a los sesgos profesionales y personales, y nos puede faltar visi\u00f3n de conjunto.\nEl estadista franc\u00e9s Georges Clemenceau dijo: \u201cLa guerra es demasiado importante para dejarla en manos de los generales\u201d. Asimismo, en lo que respecta a la regulaci\u00f3n de la investigaci\u00f3n de alto riesgo sobre virus potencialmente pand\u00e9micos, necesitamos un enfoque\n[transparente](https://www.washingtonpost.com/nation/interactive/2021/a-science-in-the-shadows/) e [independiente](https://theintercept.com/2021/11/03/coronavirus-research-ecohealth-nih-emails/) que implique tanto a los vir\u00f3logos como al p\u00fablico general, que es quien financia su trabajo y a quien este afecta.\nJesse Bloom es profesor en el Centro Oncol\u00f3gico Fred Hutchinson e investigador del Instituto M\u00e9dico Howard Hughes.", "language": null, "image": "https://static01.nyt.com/images/2022/11/04/opinion/sunday/30Bloom/30Bloom-facebookJumbo.jpg", "pagetype": "article", "links": ["#site-content", "#site-index", "https://www.nytimes.com/es/section/opinion", "/", "https://www.nytimes.com/section/todayspaper", "/es/section/opinion", "/", "/", "#after-top", "/es/section/opinion", "#after-sponsor", "https://www.nytimes.com/2022/10/30/opinion/virology-safety.html", "https://www.who.int/teams/health-product-and-policy-standards/standards-and-specifications/vaccine-standardization/smallpox#:~:text=Two%20forms%20of%20the%20disease,most%20prominent%20on%20the%20face", "https://www.cdc.gov/smallpox/history/history.html#:~:text=Last%20Cases%20of%20Smallpox", "https://www.bbc.com/news/uk-england-birmingham-45101091", "https://history.rcplondon.ac.uk/inspiring-physicians/henry-samuel-bedson", "https://wwwnc.cdc.gov/eid/article/12/1/05-1254_article", "https://www.ncbi.nlm.nih.gov/pmc/articles/PMC2887442/", "https://twitter.com/jbloom_lab/status/1385664869949599744", "https://www.ncbi.nlm.nih.gov/pmc/articles/PMC4542197/", "https://www.npr.org/sections/goatsandsoda/2019/09/19/762013515/russian-lab-explosion-raises-question-should-smallpox-virus-be-kept-or-destroyed", "https://www.science.org/content/article/was-study-created-hybrid-covid-19-virus-too-risky", "https://www.nature.com/articles/d41586-022-03181-x", "https://www.scientificamerican.com/article/why-scientists-tweak-lab-viruses-to-make-them-more-contagious1/", "https://www.vox.com/future-perfect/2022/10/19/23412562/covid-omircron-gain-of-function-research-engineered-pandemic-biosafety", "https://pubmed.ncbi.nlm.nih.gov/33495308/", "https://www.ncbi.nlm.nih.gov/pmc/articles/PMC2913718/", "https://www.nature.com/articles/s41586-022-04464-z", "https://pubmed.ncbi.nlm.nih.gov/21067353/", "https://www.ncbi.nlm.nih.gov/pmc/articles/PMC3180823/", "https://pubmed.ncbi.nlm.nih.gov/32697968/", "https://www.nature.com/articles/s41586-021-04385-3", "https://link.springer.com/chapter/10.1007/82_2012_254", "https://www.pnas.org/doi/10.1073/pnas.1707304114", "https://www.biorxiv.org/content/10.1101/2022.09.15.507787v3", "https://blog.addgene.org/viral-vectors-101-pseudotyping", "https://www.science.org/doi/10.1126/science.abl4784", "https://www.science.org/doi/10.1126/science.303.5654.26", "https://consteril.com/biosafety-levels-difference/", "https://erinjuryattorneys.com/odds-of-dying-in-a-car-crash/", "https://journals.asm.org/doi/10.1128/mBio.00360-12", "https://www.sciencedirect.com/science/article/abs/pii/S0140673671905976", "https://www.nature.com/articles/s41467-022-31930-z\u00e7", "https://twitter.com/jbloom_lab/status/1583133614749134849", "https://www.science.org/content/article/was-study-created-hybrid-covid-19-virus-too-risky", "https://www.nature.com/articles/d41586-022-03322-2", "https://www.fisheries.noaa.gov/feature-story/recent-increase-seal-deaths-maine-linked-avian-flu", "https://www.nytimes.com/2022/06/18/health/avian-flu-h5n1-foxes.html", "https://www.cdc.gov/media/releases/2022/s0428-avian-flu.html", "https://www.ncbi.nlm.nih.gov/pmc/articles/PMC2862331/", "https://www.smcgov.org/ceo/news/avian-flu-county-health-advises-precautions-backyard-flocks-handling-dead-birds", "https://en.wikipedia.org/wiki/Human_mortality_from_H5N1", "https://www.nytimes.com/2011/12/27/science/debate-persists-on-deadly-flu-made-airborne.html", "https://www.nytimes.com/2014/10/18/us/white-house-to-cut-funding-for-risky-biological-study.html", "https://www.science.org/content/article/exclusive-controversial-experiments-make-bird-flu-more-risky-poised-resume", "https://journals.plos.org/plospathogens/article?id=10.1371/journal.ppat.1006698", "https://theintercept.com/document/2021/09/08/understanding-the-risk-of-bat-coronavirus-emergence/", "https://theintercept.com/2021/09/06/new-details-emerge-about-coronavirus-research-at-chinese-lab/", "https://theintercept.com/2021/09/23/coronavirus-research-grant-darpa/", "https://www.science.org/pb-assets/PDF/News%20PDFs/Shi%20Zhengli%20Q&A-1630433861.pdf", "https://twitter.com/jbloom_lab/status/1577695523414642688", "https://globalnews.ca/news/7492076/moderna-coronavirus-vaccine-technology-how-it-works/", "https://www.science.org/doi/10.1126/science.306.5696.591a", "https://www.nature.com/articles/nature05495", "https://www.fda.gov/media/71223/download", "https://academic.oup.com/ve/article/8/1/veac021/6549895", "https://pubmed.ncbi.nlm.nih.gov/35361968/", "https://www.fda.gov/news-events/press-announcements/coronavirus-covid-19-update-fda-authorizes-moderna-pfizer-biontech-bivalent-covid-19-vaccines-use", "https://www.nature.com/articles/s41586-021-03807-6", "https://www.whitehouse.gov/briefing-room/press-briefings/2022/10/18/background-press-call-by-senior-administration-officials-to-preview-the-presidents-national-biodefense-strategy/", "https://www.washingtonpost.com/nation/interactive/2021/a-science-in-the-shadows/", "https://theintercept.com/2021/11/03/coronavirus-research-ecohealth-nih-emails/", "#after-bottom", "https://help.nytimes.com/hc/en-us/articles/115014792127-Copyright-notice", "https://www.nytco.com/", "https://help.nytimes.com/hc/en-us/articles/115015385887-Contact-Us", "https://help.nytimes.com/hc/en-us/articles/115015727108-Accessibility", "https://www.nytco.com/careers/", "https://nytmediakit.com/", "https://www.tbrandstudio.com/", "https://www.nytimes.com/privacy/cookie-policy#how-do-i-manage-trackers", "https://www.nytimes.com/privacy/privacy-policy", "https://help.nytimes.com/hc/en-us/articles/115014893428-Terms-of-service", "https://help.nytimes.com/hc/en-us/articles/115014893968-Terms-of-sale", "/sitemap/", "https://www.nytimes.com/ca/", "https://www.nytimes.com/international/", "https://help.nytimes.com/hc/en-us", "https://www.nytimes.com/subscription?campaignId=37WXW"]}