{"title": "La mentira del di\u00f3xido de cloro como cura de la COVID-19", "author": "Verificado", "url": "https://verificado.com.mx/mentira-dioxido-de-cloro-como-cura-de-covid19/", "hostname": "verificado.com.mx", "description": "Desde que empez\u00f3 la pandemia, se intensific\u00f3 la propaganda digital y el lobby pol\u00edtico en favor del di\u00f3xido de cloro como cura del Covid-19", "sitename": "Verificado", "date": "2022-03-25", "id": null, "license": null, "body": null, "comments": "", "commentsbody": null, "raw_text": null, "text": "- Desde que empez\u00f3 la pandemia, se intensific\u00f3 la propaganda digital y el lobby pol\u00edtico en favor del di\u00f3xido de cloro como cura del Covid-19 y de otros males.\n- Detr\u00e1s est\u00e1n un alquimista alem\u00e1n, dos suizos, sus vol\u00e1tiles empresas y una pl\u00e9yade de seguidores que dicen estar por la salud y la vida, sin reparar en las v\u00edctimas que dejan.\n- Junto con el qu\u00edmico milagroso, venden los aparatos que lo producen, libros, diplomados, videos, congresos y hasta conciertos.\n\u00abVend\u00edan sin escr\u00fapulos supuestas medicinas a las que daban car\u00e1cter de panaceas universales, capaz de curar r\u00e1pidamente todo tipo de dolencias. Y lo hac\u00edan una circular por todos los niveles sociales\u00bb\nEnsayo sobre los charlatanes de los siglos XV al XVII,\nMiguel L\u00f3pez P\u00e9rez, Universidad Complutense de Madrid, 2016\n\u00abTom\u00e9\n[di\u00f3xido de cloro](https://verificado.com.mx/dioxido-de-cloro-no-cura-covid19-riesgo/)\u00ab, [afirm\u00f3](https://www.paginasiete.bo/sociedad/2022/1/3/choquehuanca-dice-que-tomo-dioxido-de-cloro-para-superar-el-coronavirus-319693.html) arrinconado por las c\u00e1maras David Choquehuanca, vicepresidente del Estado Plurinacional de Bolivia. La confesi\u00f3n la hizo al comenzar 2022, casi un a\u00f1o despu\u00e9s de la llegada del primer lote de vacunas al pa\u00eds y despu\u00e9s de haber sido criticado por varios sectores por no haber dado el ejemplo de vacunarse antes.\nA\u00fan as\u00ed, antes de poner el brazo para el pinchazo, se organiz\u00f3 una\n[ceremonia de tres amautas](https://unitel.bo/vacunacion/el-ministro-jeyson-auza-fue-el-encargado-de-vacunar-al-vicepresidente-choquehuanca_164568) (sabios) que armaron un sahumerio con incienso para purificarlo.\nUnos d\u00edas despu\u00e9s, el 9 de enero, Evo Morales, expresidente boliviano, exhort\u00f3 a sus compatriotas a vacunarse, pero tambi\u00e9n les recomend\u00f3 el di\u00f3xido. \u00abHay que acudir a los centros de vacunaci\u00f3n. Es importante esta campa\u00f1a, no puede faltarnos en la casa ivermectina y, con recomendaci\u00f3n m\u00e9dica, di\u00f3xido de cloro y nuestras hierbas medicinales que nos ayudan bastante\u00bb,\n[dijo](https://www.noticiasfides.com/nacional/politica/evo-llama-a-vacunarse-y-sugiere-tener-hierbas-medicinales-ivermectina-y-dioxido-de-cloro-para-prevenir-contagios-413258).\nNo existen estudios cient\u00edficos confiables que recomienden el di\u00f3xido de cloro como cura o prevenci\u00f3n para el infame virus.\nEsta es una sustancia \u2013cuya f\u00f3rmula qu\u00edmica es ClO\u2082\u2013 usada para purificar agua en grandes vol\u00famenes o para blanquear papel, pero en ciertas concentraciones puede ser peligrosa para consumo humano. Hay varios casos documentados de las muertes que la sustancia ha causado.\nEn 2009, una\n[mujer mexicana muri\u00f3 en las Islas Salom\u00f3n](https://www.smh.com.au/national/death-in-paradise-20100109-lz8e.html) tras consumir di\u00f3xido de cloro para intentar prevenir la malaria. En 2020, [un ni\u00f1o de cinco a\u00f1os y un hombre de 50 murieron en Argentina](https://chequeado.com/el-explicador/cuando-la-desinformacion-mata-el-dioxido-de-cloro-ya-habria-provocado-dos-muertes-y-dos-intoxicaciones-en-el-pais/) tras ingerir la p\u00f3cima. Y en 2021 un conocido activista antivacunas austr\u00edaco [muri\u00f3](https://elcomercio.pe/mundo/europa/coronavirus-johann-biacsics-muere-de-covid-19-un-antivacunas-de-austria-que-se-quiso-curar-con-lejia-y-sus-seguidores-denuncian-que-fue-envenenado-historias-ec-noticia/) tras contraer Covid-19 e intentar tratarlo exclusivamente con di\u00f3xido de cloro.\n\u00bfPor qu\u00e9, con toda evidencia en su contra, diversos pol\u00edticos del continente siguen recomendando el di\u00f3xido de cloro?\nDesde hace m\u00e1s de una d\u00e9cada se ha vendido di\u00f3xido de cloro (subrepticia e ilegalmente en algunos pa\u00edses) como supuesta panacea para curar todos los males, incluidos el autismo, el c\u00e1ncer y el sida.\nHasta 2020, su venta se promocionaba entre peque\u00f1os nichos digitales, muchos de ellos vinculados a una iglesia dedicada a su venta. Sin embargo, con la llegada de la pandemia de Covid-19 y de la incertidumbre que trajo, los mercaderes vieron r\u00edo revuelto para sacar ganancias m\u00e1s sustanciosas.\nAhora grandes medios latinoamericanos realizaron entrevistas y programas sobre la sustancia, e incluso fue motivo de debate en los parlamentos de varios pa\u00edses de la regi\u00f3n.\nUna investigaci\u00f3n period\u00edstica colaborativa y transfronteriza encontr\u00f3 que existen v\u00ednculos entre la iglesia que promovi\u00f3 originalmente el ClO\u2082 y una multifac\u00e9tica organizaci\u00f3n llamada Coalici\u00f3n Mundial de Salud y Vida (Comusav), un grupo que aprovech\u00f3 las demoras de las vacunas y los temores que hay entre la gente frente al virus para sacar provecho econ\u00f3mico.\nCon base en estudios cl\u00ednicos cuestionados y m\u00faltiples testimonios lacrim\u00f3genos, Comusav mont\u00f3 una exitosa y relativamente sofisticada campa\u00f1a de desinformaci\u00f3n.\nLa alianza period\u00edstica, conformada por Agencia Ocote en Guatemala, Animal Pol\u00edtico en M\u00e9xico, Aos Fatos en Brasil, Bolivia Verifica, Chequeado en Argentina, Colombiacheck y Cuesti\u00f3n P\u00fablica en Colombia, Efecto Cocuyo en Venezuela y Univisi\u00f3n en Estados Unidos, con la coordinaci\u00f3n del Centro Latinoamericano de Investigaci\u00f3n Period\u00edstica (CLIP), devela los problemas con la justicia de los \u00abarzobispos\u00bb de la iglesia del di\u00f3xido de cloro, las m\u00faltiples sociedades montadas en diversos pa\u00edses por los art\u00edfices de la Comusav.\nLa pesquisa period\u00edstica desarma, pieza por pieza, c\u00f3mo oper\u00f3 la campa\u00f1a de desinformaci\u00f3n virtual que les termin\u00f3 dando credibilidad ante miles de incautos, puso en riesgo la salud de todos porque invitaba a no vacunarse, y lleg\u00f3 hasta abrirles las puertas de varios congresos latinoamericanos, a crearles una ley en Bolivia y conseguir la donaci\u00f3n de un edificio en M\u00e9xico.\nAunque los mercaderes mayores del di\u00f3xido de cloro (entre ellos el m\u00e1s notable, Andreas Ludwig Kalcker, de ciudadan\u00eda alemana) digan que quieren salvar vidas, la evidencia que encontr\u00f3 este equipo muestra que estar\u00edan m\u00e1s interesados en su salvaci\u00f3n econ\u00f3mica personal, hinchando sus arcas con las ventas de la sustancia qu\u00edmica y el material promocional asociado.\nLa iglesia desaf\u00eda a la juez\nDesde 2006 el estadounidense Jim Humble\n[estaba promoviendo el di\u00f3xido de cloro como soluci\u00f3n para todos los males](https://www.bloomberg.com/news/features/2021-06-29/covid-bleach-cure-how-operation-quack-hack-took-down-the-genesis-ii-church).\nHab\u00eda escrito un libro y hab\u00eda montado m\u00faltiples empresas, con diferentes resultados, para impulsarlo. En 2010 se encontr\u00f3 con su compatriota Mark Grenon, a quien tampoco le estaba yendo tan bien en sus emprendimientos de iglesias en Rep\u00fablica Dominicana.\nAh\u00ed fue cuando juntaron sus empresas semifallidas y fundaron una iglesia que distribu\u00eda di\u00f3xido de cloro como sacramento, como si \u00e9ste fuera el equivalente a la comuni\u00f3n en una iglesia cat\u00f3lica. La bautizaron Genesis II Church of Health and Healing (o la Iglesia G\u00e9nesis II de Salud y Sanaci\u00f3n, a veces abreviado como G2C) y montaron su sede fundadora Barahona, Rep\u00fablica Dominicana.\nLa G2C prosper\u00f3, vendi\u00f3 cursos para obispados a 1700 d\u00f3lares. A cambio, los obispos pod\u00edan ordenar a \u00abpastores de la salud\u00bb y usar el nombre de la iglesia para poder difundir el mensaje milagroso del di\u00f3xido de cloro y, por supuesto, participar de las ventas de la iglesia.\nLa iglesia dijo que lleg\u00f3 a abrir 21 cap\u00edtulos y conquistar feligreses en 14 pa\u00edses de tres continentes, seg\u00fan la versi\u00f3n de 2020 de su propia p\u00e1gina, resucitada gracias a la herramienta de consultas\n[WayBack Machine](https://web.archive.org/web/20200525150427/https:/genesis2church.ch/churches-worldwide).\nA los seis a\u00f1os, los dos falsos profetas se separaron comercialmente, al parecer por desavenencias sobre c\u00f3mo repartir las ganancias, que entonces a\u00fan eran relativamente magras. En sus m\u00faltiples libros y conferencias, Humble se identifica como el creador de la f\u00f3rmula original del brebaje qu\u00edmico al que llam\u00f3 Miracle Mineral Solution (MMS, o soluci\u00f3n mineral milagrosa), pero quien se qued\u00f3 con la iglesia al final fue Grenon, quien despu\u00e9s de la pandemia vio c\u00f3mo creci\u00f3 su negocio, seg\u00fan\n[documentos judiciales](https://cdn.arstechnica.net/wp-content/uploads/2020/07/gov.uscourts.flsd_.573491.3.0.pdf) de una acusaci\u00f3n posterior en Estados Unidos, obtenidos por este equipo period\u00edstico.\nEn 2021, Bloomberg public\u00f3\n[una nota](https://www.bloomberg.com/news/features/2021-06-29/covid-bleach-cure-how-operation-quack-hack-took-down-the-genesis-ii-church) sobre el origen y el fin de esta iglesia que les estaba generando miles de d\u00f3lares a sus fundadores.\nLa FDA de Estados Unidos, que autoriza la ventas de medicamentos y alimentos producidos para garantizar que no sean da\u00f1inos, ven\u00eda\n[reiterando desde 2010](https://wayback.archive-it.org/7993/20170111070843/http:/www.fda.gov/ForConsumers/ConsumerUpdates/ucm228052.htm) que la soluci\u00f3n mineral no era milagrosa sino peligrosa y que no estaba aprobada para uso m\u00e9dico.\nTambi\u00e9n advirti\u00f3 que venderla con ese prop\u00f3sito\n[no estaba permitido](https://www.justice.gov/opa/pr/justice-department-seeks-end-illegal-online-sale-industrial-bleach-marketed-miracle-treatment). Al ver el crecimiento en la ventas de la MMS con la pandemia, se prendieron las alarmas. La polic\u00eda de Florida [arrest\u00f3](https://www.sun-sentinel.com/coronavirus/fl-ne-fake-covid-cure-arrests-20200708-zgqiegpblncpxemvdd4f4tghoq-story.html) en julio de 2020 a dos hijos de Grenon que le ayudaban en el negocio, luego de hacer una redada en la sede la iglesia G2C.\nLa acusaci\u00f3n que le hizo la Oficina de la Fiscal\u00eda Federal del Distrito Sur de la Florida a los Grenon revela cu\u00e1nto hab\u00eda crecido el negocio en pandemia. Seg\u00fan\n[ informaci\u00f3n](https://cdn.arstechnica.net/wp-content/uploads/2020/07/gov.uscourts.flsd_.573491.3.0.pdf) que aport\u00f3 el banco Wells Fargo en el juicio, Mark Grenon y sus tres hijos arrestados pasaron de registrar ingresos por 32,000 d\u00f3lares en diciembre de 2019 a 123,000 en marzo de 2020, cuando apenas empezada a conocerse la letalidad del virus.\nJos\u00e9 Rivera, agente de la FDA, dijo en el proceso que gracias a las constantes declaraciones p\u00fablicas de los propios Grenon y Humble sobre c\u00f3mo la creaci\u00f3n de una iglesia era una estratagema para poder vender MMS, fue que pudo abrir un caso legal contra ellos.\nPrimero, en mayo de 2020, la juez Kathleen M. Williams profiri\u00f3 una orden contra los Grenon y la iglesia G\u00e9nesis II prohibi\u00e9ndoles vender o etiquetar como medicina productos con base en di\u00f3xido de cloro.\nEsta alianza contact\u00f3 al abogado de oficio de Mark Grenon en Colombia, Augusto S\u00e1nchez, para obtener la versi\u00f3n de Grenon sobre estos hechos, pero no obtuvo respuesta. Al contactarlo por tel\u00e9fono se rehus\u00f3 a darnos informaci\u00f3n y al contactarlo por correo electr\u00f3nico no obtuvimos respuesta.\nLa iglesia dej\u00f3 de vender MMS en su p\u00e1gina, pero, seg\u00fan dictamin\u00f3 la investigaci\u00f3n de la FDA, lo sigui\u00f3 ofreciendo por otros canales, como videos de YouTube u otras p\u00e1ginas afiliadas.\nAdem\u00e1s, Mark Grenon\n[repet\u00eda desafiante](https://cloud.elclip.org/index.php/s/aAgwjjX7NYWAPsj) en su podcast que estaba violando la orden. Esto culmin\u00f3 con los mencionados arrestos de sus hijos en Florida y, luego, con [el arresto](https://www.fiscalia.gov.co/colombia/noticias/capturados-padre-e-hijo-senalados-de-vender-una-sustancia-toxica-como-una-supuesta-pocima-milagrosa-para-tratar-el-covid-19-y-enfermedades-de-alto-costo/) del mismo Mark y su otro hijo, Joseph en Santa Marta, una ciudad tur\u00edstica sobre el Caribe colombiano en donde viv\u00edan desde hac\u00eda nueve a\u00f1os.\nLa Fiscal\u00eda colombiana los captur\u00f3 por petici\u00f3n del Departamento de Justicia de Estados Unidos, que los\n[acus\u00f3 de fraude](https://cdn.arstechnica.net/wp-content/uploads/2020/07/gov.uscourts.flsd_.573491.3.0.pdf) para evadir regulaciones. Joseph Grenon [fue extraditado](https://www.mysuncoast.com/2021/12/30/member-bradenton-church-that-distributed-miracle-mineral-solution-appears-federal-court/) a Florida en septiembre de 2021, un mes despu\u00e9s de que el diario brit\u00e1nico The Guardian [denunciara](https://www.theguardian.com/us-news/2021/aug/11/coronavirus-miracle-cure-bleach-covid-mark-grenon) que \u00e9l y su padre segu\u00edan vendiendo la milagrosa soluci\u00f3n desde una c\u00e1rcel en Bogot\u00e1.\nEn\n[una decisi\u00f3n](https://recursos.elclip.org/mentiras-contagiosas/order+continuing+trial+Grenon.pdf) del 5 de enero de 2022, la juez del Distrito Federal Sur de Florida Cecilia M. Altonaga orden\u00f3 la continuaci\u00f3n del juicio contra los Grenon y estableci\u00f3 un calendario para el proceso seg\u00fan el cual la fecha l\u00edmite para que los acusados emitan una declaraci\u00f3n de culpabilidad -si as\u00ed lo desean- es el pr\u00f3ximo 5 de agosto. Program\u00f3 el inicio de juicio, con jurado, a partir del 12 de septiembre de este a\u00f1o.\nTras las capturas de los Grenon, el negocio de la iglesia colaps\u00f3. Pr\u00e1cticamente todas las p\u00e1ginas y perfiles de redes sociales asociadas fueron borradas y sus cap\u00edtulos en los distintos pa\u00edses parecen estar inactivos.\nMientras eso suced\u00eda, Andreas Kalcker, \u00abobispo\u00bb de la iglesia G2C, aprovechaba su propia bonanza.\nEl obispo Kalcker se queda con Comusav\nAndres Ludwig Kalcker es un alem\u00e1n que se presenta como biof\u00edsico \u2013 aunque, seg\u00fan medios que hacen parte de esta alianza, como\n[Chequeado](https://chequeado.com/investigaciones/dioxido-de-cloro-quienes-venden-esta-sustancia-ilegal-y-toxica-en-la-argentina-y-otros-paises-de-la-region/) y [Colombiacheck](https://colombiacheck.com/investigaciones/asi-es-el-mercado-ilegal-del-dioxido-de-cloro-en-colombia-y-otros-paises-de-america) el diploma fue obtenido en la Open University of Advanced Sciences, una universidad naturista acusada de vender t\u00edtulos por internet \u2013.\nKalcker trabaj\u00f3 como ingeniero de sonido a comienzos de siglo, llegando incluso a participar en una grabaci\u00f3n de la soprano catalana Montserrat Caball\u00e9, pero cambi\u00f3 de carrera y alcanz\u00f3 algo de notoriedad en 2008, cuando anunci\u00f3, bajo el pseud\u00f3nimo de Aluka, un nuevo invento: un motor a combusti\u00f3n que funcionaba con un h\u00edbrido de gasolina y agua y que supuestamente mejoraba la idea original del inventor Paul Pantone.\nCinco a\u00f1os despu\u00e9s, se volvi\u00f3 a escuchar de \u00e9l por el libro La salud es posible. All\u00ed cuenta que todo comenz\u00f3 cuando lo llam\u00f3 su amigo Josep P\u00e0mies \u2013otro promotor del di\u00f3xido de cloro, oriundo de Lleida, Catalu\u00f1a.\nP\u00e0mies fue\n[sancionado varias veces](https://www.eldiario.es/catalunya/josep-pamies-sancionado-pseudoterapias-coronavirus_1_2259118.html) por las autoridades por violar las regulaciones sobre di\u00f3xido de cloro. Desde 2010 la Agencia Espa\u00f1ola de Medicamentos y Productos Sanitarios [habia advertido](https://www.aemps.gob.es/informa/notasinformativas/medicamentosusohumano-3/medIlegales/2010/ni_muh_ilegales_05-2010/) que la venta del di\u00f3xido de cloro en el pa\u00eds como medicamento era ilegal. P\u00e0mies le pidi\u00f3 a Kalcker que tratara los terneros de un granjero conocido.\nKalcker ensay\u00f3 el MMS y, seg\u00fan su relato, los terneros se curaron. Le escribi\u00f3 a Jim Humble de la G2C con la buena nueva, y as\u00ed se contactaron. Luego Kalcker cuenta que sigui\u00f3 experimentando con la f\u00f3rmula y consigui\u00f3 desarrollar un MMS mejorado, que llam\u00f3 CDS, por chlorine dioxide solution (o soluci\u00f3n de di\u00f3xido de cloro). Tambi\u00e9n lanz\u00f3 una versi\u00f3n inyectable, seg\u00fan \u00e9l m\u00e1s eficaz, al que llam\u00f3 CDI (di\u00f3xido de cloro inyectable).\nYa desde mucho antes Kalcker estaba vendiendo di\u00f3xido de cloro. Un registro de 2009 de la p\u00e1gina mmsmineral.com,\n[archivado en Wayback Machine](https://web.archive.org/web/20091022093534/http:/www.mmsmineral.com/impressum.php), muestra que esta vend\u00eda la sustancia. En la informaci\u00f3n legal de la p\u00e1gina se menciona a la empresa [ Optibolsa SL](https://www.infoempresa.com/es-es/es/directivo/andreas-ludwig-kalcker), de la cual Kalcker ha sido administrador desde 2005. En 2010, el [Ministerio de Sanidad de Espa\u00f1a](https://www.aemps.gob.es/informa/notasinformativas/medicamentosusohumano-3/medIlegales/2010/ni_muh_ilegales_05-2010/) advert\u00eda que esa p\u00e1gina de Kalcker vend\u00eda la sustancia.\nSin embargo, al consultar sobre sus empresas, Kalcker le dijo a esta alianza period\u00edstica: \u00abno tengo empresas que vendan di\u00f3xido de cloro\u00bb, aunque aclar\u00f3 que venderlo como \u00abdesinfectante para agua de consumo\u00bb es \u00ababsolutamente legal\u00bb.\nA finales de octubre de 2012, Kalcker\n[ fue detenido](https://elpais.com/politica/2018/06/30/diario_de_espana/1530310398_543455.html) en la isla mediterr\u00e1nea de Ibiza por la Guardia Civil espa\u00f1ola por organizar una conferencia sobre di\u00f3xido de cloro. Un mes despu\u00e9s, Humble envi\u00f3 [un bolet\u00edn](https://jimhumble.co/newsletter-archive/the-country-of-spain-attacks-mms) apoyando a Kalcker ante la autoridad legal, sin \u00e9xito.\nA pesar de su escaramuza con la autoridad, el supuesto qu\u00edmico comenz\u00f3 a a ganar fama entre los adeptos a la soluci\u00f3n qu\u00edmica. Particip\u00f3 en un congreso llamado Spirit of Health en Hannover, Alemania, en 2014 y su libro se sigui\u00f3 leyendo ampliamente. En su sitio web, Kalcker public\u00f3 un certificado de antecedentes emitido en Espa\u00f1a, en el que dice que no tiene asuntos pendientes con la justicia.\nPor esta \u00e9poca, a\u00fan antes de que el Covid-19 llegara, Kalcker y Humble vend\u00edan sus p\u00f3cimas asegurando que curaba el autismo. Con palabras que imitaba el lenguaje de la medicina \u2013aunque ninguno de los dos hab\u00eda sido entrenado como m\u00e9dico\u2013 aseguraban que el autismo era consecuencia de una \u00abparasitosis\u00bb y la acumulaci\u00f3n de metales pesados, supuestamente causada por las vacunas.\nLos trastornos del espectro autista (TEA) son una discapacidad del desarrollo que puede provocar dificultades cognitivas. Pero no hay evidencia cient\u00edfica s\u00f3lida en los \u00faltimos a\u00f1os que muestre que el di\u00f3xido de cloro puede ser efectivo para tratar esta discapacidad.\nEn\n[PubMed](https://pubmed.ncbi.nlm.nih.gov/?term=chlorine+dioxide+autism+spectrum+disorder+), la m\u00e1s importante base mundial de publicaciones de informaci\u00f3n cient\u00edfica y salud, no hay un solo ensayo cl\u00ednico o reporte de un caso cl\u00ednico aislado que valide su uso. En cambio, s\u00ed hay [numerosos reportes de su toxicidad](https://pubmed.ncbi.nlm.nih.gov/?term=chlorine+dioxide+toxicity), que incluyen \u00falceras esof\u00e1gicas, falla renal, anemia hemol\u00edtica y otras alteraciones sangu\u00edneas graves, efectos mutag\u00e9nicos y aberraciones cromos\u00f3micas.\nLuego, Kalcker pas\u00f3 a crear sus propias p\u00e1ginas digitales en las que vend\u00eda sus libros y videos y, adem\u00e1s, ofrec\u00eda consultas a 100 d\u00f3lares la hora. Para defenderse de las cr\u00edticas que comenzaban a caerle, argumentaba que la industria farmac\u00e9utica conspiraba contra quien le hiciera competencia, ret\u00f3rica que result\u00f3 muy atractiva para los activistas antivacunas. Al entrar en esas redes, su negoci\u00f3 creci\u00f3.\nEn 2013, una familia de Granada, en el sur de Espa\u00f1a,\n[denunci\u00f3 a Kalcker ](https://www.elespanol.com/reportajes/grandes-historias/20170428/211979398_0.html)y a otras personas, pues el remedio inyectado que le hab\u00edan recomendado a su madre para curarse de artritis le hab\u00eda producido, [seg\u00fan ella](https://www.elespanol.com/reportajes/grandes-historias/20170428/211979398_0.html), \u00absequedad de piel, \u00falceras en la c\u00f3rnea de los ojos, v\u00f3mitos, n\u00e1useas, diarreas\u00bb. Kalcker y y otros denunciados fueron absueltos. Despu\u00e9s, el alquimista se fue de Espa\u00f1a.\nSe mud\u00f3 a un peque\u00f1o pueblo suizo llamado Sennwald, en la frontera con Liechtenstein. Unos a\u00f1os despu\u00e9s, con los Grenon tras las rejas y la iglesia en desbandada, el \u00abobispo\u00bb Kalcker busc\u00f3 otra organizaci\u00f3n para impulsar el negocio en un momento perfecto.\nCorr\u00eda mayo de 2020 y la pandemia del Covid-19 se extend\u00eda por el mundo dejando miles de v\u00edctimas. La perplejidad de la gente, sin cura a la vista, era el ambiente perfecto para revivir la venta del CDS. Sus videos se hicieron populares en redes sociales, atrayendo a miles de personas. Sus peroratas plagadas de t\u00e9rminos m\u00e9dicos, dichas sin titubeos, contrastaban con la cautela con la que los cient\u00edficos de verdad contaban lo que iban dejando en claro sobre el virus.\nMilagrosamente, seg\u00fan cont\u00f3 Kalcker, fue en ese momento cuando lo contact\u00f3 un militar retirado ecuatoriano, fundador de la Coalici\u00f3n Mundial de Salud y Vida (Comusav).\nKalcker encuentra nuevos aliados\nEl excoronel Guillermo Tamayo dice que comenz\u00f3 a tomar di\u00f3xido de cloro en enero de 2020, cuando estaba a\u00fan activo y sus tropas estaban en peligro de contraer el nuevo virus, que en Guayaquil estaba matando a miles de personas.\nComo reiter\u00f3 en varios espacios virtuales, Tamayo le escribi\u00f3 a Kalcker para contarle que ni \u00e9l ni sus tropas se hab\u00edan contagiado gracias al di\u00f3xido de cloro \u00c9ste lo puso en contacto con la Aememi, la Asociaci\u00f3n Ecuatoriana de M\u00e9dicos Expertos en Medicina Integrativa, una agrupaci\u00f3n de m\u00e9dicos home\u00f3patas y de terapias alternativas que ya estaban usando la soluci\u00f3n qu\u00edmica para tratar pacientes.\nAs\u00ed reclutaron a varios m\u00e9dicos para su causa. Cinco meses despu\u00e9s, el exmilitar fund\u00f3 la Coalici\u00f3n Mundial de Salud y Vida, Comusav, junto a Tannia Bayas, una ecuatoriana residente en Espa\u00f1a que se describe a s\u00ed misma en redes como \u00abbeauty coach\u00bb (entrenadora de belleza), y a Gonzalo Arcos, un terapeuta alternativo ecuatoriano. Los tres invitaron a Kalcker a ser miembro honorario.\nA la historia del excoronel no le cuadran las fechas porque el pico de la epidemia en Guayaquil fue en marzo de 2020. Adem\u00e1s, Bayas asegura que fue ella, y no Tamayo, la de la iniciativa. En cualquier caso, pronto los ecuatorianos desaparecieron del liderazgo de la Comusav.\nTamayo fund\u00f3 otra organizaci\u00f3n, el Conuvive (Concilio de Naciones Unidas por la Vida y la Verdad) pues,\n[ seg\u00fan dijo en otra entrevista](https://archive.org/details/cnel-tamayo), en la Comusav s\u00f3lo hab\u00eda m\u00e9dicos y \u00e9l \u00abten\u00eda la visi\u00f3n de crear un ej\u00e9rcito de abogados, m\u00e9dicos, comunicadores\u00bb. En su lugar, Kalcker tom\u00f3 el liderazgo de facto de Comusav por su aporte \u00abcient\u00edfico\u00bb, a pesar de que formalmente apenas era \u00abmiembro honorario\u00bb.\nEsta alianza period\u00edstica encontr\u00f3 conexiones entre varios aliados de Comusav en la regi\u00f3n y un entramado empresarial en Europa. Varias de esas empresas registran como direcci\u00f3n la casa de Kalcker en Suiza.\nLa direcci\u00f3n de Andreas Kalcker, como consta en varios registros suizos, es L\u00e4ui 22, Sennwald, Sankt Gallen, 9466, la misma que le sirve de sede a una mara\u00f1a de empresas. All\u00ed est\u00e1 registrada\n[MedaLAB Swiss GmbH](https://www.dnb.com/business-directory/company-profiles.medalab_swiss_gmbh.ec74f5031b1f3e146d8e3dc1f1db0e55.html), que [vende](https://www.medalab.ch/produkte/) aparatos para terapias alternativas, dise\u00f1ados por el mismo Kalcker. Justamente, \u00e9l aparece aqu\u00ed como director administrativo.\nMedaLAB est\u00e1 relacionada, a trav\u00e9s de la URL de contacto registrada, medatech.ch, con otra empresa,\n[MedaTECH](https://www.easymonitoring.ch/fr/registre-du-commerce/medatech-gmbh-1340689), que estaba basada en Wollerau, en el cant\u00f3n suizo de Schwyz, y que [fue liquidada en 2020](https://www.easymonitoring.ch/fr/registre-du-commerce/medatech-gmbh-1340689), pero que buscaba \u00abdesarrollar aparatos electromagn\u00e9ticos\u00bb.\nEn los registros de ambas empresas est\u00e1 Martin Vetsch, socio suizo de Kalcker quien, adem\u00e1s de promocionar las m\u00e1quinas de sus empresas, tambi\u00e9n ha impulsado el di\u00f3xido de cloro como cura para el autismo y el Covid-19.\nUna activista en defensa de los derechos de personas con autismo, la irlandesa Fiona O\u2019Leary, quien adem\u00e1s ha venido batallando en contra de quienes pretenden curar esta condici\u00f3n con el di\u00f3xido de cloro por los da\u00f1os que puede producir,\n[entrevist\u00f3](https://www.youtube.com/watch?v=1wkr7TRnRNQ&ab_channel=CallToActionVideoCampaignAgainstMMS%252FCDasanAutismTreatment) a Vetsch. Ella le dijo a este equipo period\u00edstico que el propio Vetsch le sostuvo que su empresa vende un generador de di\u00f3xido de cloro y que sus m\u00e1quinas pueden curar el autismo.\nEn la\n[p\u00e1gina comusav.de](https://comusav.de/impressum/) se da la misma direcci\u00f3n de Kalcker en Sennwald como la direcci\u00f3n de \u00abComusav International\u00bb.\nEsta es la misma direcci\u00f3n de MedaLAB, la empresa de Martin Vetsch. En esa p\u00e1gina de Comusav, Walter Vetsch aparece como el responsable legal. Un Walter Vetsch tambi\u00e9n aparece como miembro de la junta directiva de la inmobiliaria\n[ blue24immo, AG](https://sg.chregister.ch/cr-portal/auszug/auszug.xhtml?uid=CHE-212.829.667), donde tambi\u00e9n aparece Martin Vetsch. Sobre esto, Kalcker nos dijo que \u00abuna direcci\u00f3n oficial de COMUSAV Mundial de Suiza no existe todav\u00eda ni Walter Vetsch es socio m\u00edo\u00bb.\nPero las evidencias muestran que Kalcker y Martin Vetsch, desde la casa de Kalcker en Sennwald, venden aparatos para crear di\u00f3xido de cloro y para, supuestamente, curar el autismo, aprovech\u00e1ndose de la desinformaci\u00f3n al respecto esparcida por Comusav Internacional, organizaci\u00f3n que est\u00e1 registrada en su misma direcci\u00f3n.\nAh\u00ed no para todo\nEn mayo de 2021, el medio suizo Beobachter\n[visit\u00f3](https://www.beobachter.ch/gesundheit/medizin-krankheit/chlordioxid-das-wunderwasser-der-glaubigen) la direcci\u00f3n en Sennwald y en el buz\u00f3n, adem\u00e1s del nombre de Kalcker, encontr\u00f3 el de Eduardo Insignares Carrione (Carrione es como figura en el registro colombiano de talento humano en salud).\nCarrione fue presidente de Comusav Colombia y ahora es director de investigaci\u00f3n en COMUSAV Mundial. Tambi\u00e9n dijo haber conducido un estudio sobre di\u00f3xido de cloro en Bogot\u00e1, que supuestamente validaba la hip\u00f3tesis sobre utilidad del di\u00f3xido de cloro para tratar el coronavirus.\nInsignares respondi\u00f3 en un cuestionario de esta alianza period\u00edstica que se s\u00f3lo contact\u00f3 con Kalcker tras la llegada de la pandemia y confirm\u00f3 que fue \u00e9l quien propuso \u00abque hici\u00e9ramos una investigaci\u00f3n para verificar si realmente funcionaba\u00bb. Por su parte, Kalcker dijo varias veces (incluido en entrevista con ese medio suizo) que \u00e9l no tuvo nada que ver con el estudio de Insignares, aunque en ese entonces ya eran socios en varias iniciativas.\nEl\n[estudio](https://clinicaltrials.gov/ct2/show/NCT04343742) que lider\u00f3 Insignares dice haber sido financiado por la Fundaci\u00f3n G\u00e9nesis. A pesar de la coincidencia del nombre, la fundaci\u00f3n no tiene relaci\u00f3n con la iglesia G\u00e9nesis II y, de hecho, naci\u00f3 antes que la iglesia.\nApareci\u00f3 en Colombia en 1999, seg\u00fan el\n[registro comercial](https://recursos.elclip.org/mentiras-contagiosas/fund-genesis.pdf) de ese pa\u00eds, con el objetivo de \u00abprestar servicios de apoyo a personas enfermas, en especial cr\u00f3nicas o terminales, en aspectos de salud, educativos, financieros, de vivienda (y) sociales\u00bb.\nEn\n[2006](https://ieaninepoints.com/wp-content/uploads/2019/01/2006_IEA_Global_Conference_Program.pdf), Insignares aparece como representante de la fundaci\u00f3n en un congreso de eneagramas, una pr\u00e1ctica que busca estudiar la personalidad humana. Ahora, la fundaci\u00f3n vende diplomados, hasta por 900 d\u00f3lares por persona, de una academia en la que Insignares, su esposa Blanca Bola\u00f1o y Kalcker ense\u00f1an sobre el uso del di\u00f3xido de cloro.\nLos tres son adem\u00e1s los autores de\n[un art\u00edculo anterior](https://www.rsi.ch/news/mondo/Il-documento-di-Kalcker-%E2%80%9CChlorine-Dioxide-in-COVID-19-Hypothesis-about-the-Possible-Mechanism-of-Molecular-Action-in-SARS-CoV-2%E2%80%9D-13753897.html/BINARY/Il%20documento%20di%20Kalcker%20%E2%80%9CChlorine%20Dioxide%20in%20COVID-19:%20Hypothesis%20about%20the%20Possible%20Mechanism%20of%20Molecular%20Action%20in%20SARS-CoV-2%E2%80%9D), publicado en la misma revista en la que hab\u00eda aparecido el supuesto estudio de Insignares de 2020. En este art\u00edculo (que dice haber sido financiado por sus autores), Bola\u00f1o firma como directora de investigaci\u00f3n de la Fundaci\u00f3n G\u00e9nesis, Insignares como director global de investigaci\u00f3n de la Liechtensteiner Verein f\u00fcr Wissenschaft und Gesundheit (o Asociaci\u00f3n de Liechtenstein de Ciencia y Salud) y Kalcker como el director administrativo de la misma asociaci\u00f3n y e investigador de biof\u00edsica del \u00abSVNB\u00bb.\nAunque el principado de Liechtenstein es un pa\u00eds independiente desde el siglo XVIII, en varios documentos de la asociaci\u00f3n, incluido el estudio de Kalcker, Insignares y Bola\u00f1o, dan su ubicaci\u00f3n como \u00abLiechtenstein, Suiza\u00bb.\nSeg\u00fan\n[su p\u00e1gina](https://archive.is/CKZlN), la direcci\u00f3n verdadera de la asociaci\u00f3n (cuyo nombre es usualmente abreviado como LVWG) era, en septiembre de 2021, Industriering 14, Rugell, 9491. Este es un lugar al que se puede llegar en [ siete minutos](https://www.google.com/maps/dir/L%C3%A4ui+22,+Sennwald,+Switzerland/Industriering+14,+9491+Ruggell,+Liechtenstein/@47.2517396,9.5027842,15z/data=!3m1!4b1!4m14!4m13!1m5!1m1!1s0x479b3b25497bb847:0x51331c98b974ed8!2m2!1d9.5010373!2d47.2607975!1m5!1m1!1s0x479b3afe1f5455ff:0x825ab3aecfa68bf0!2m2!1d9.5279634!2d47.2487317!3e0) en carro desde la direcci\u00f3n de Kalcker en Sennwald y es adem\u00e1s la direcci\u00f3n de un hotel llamado Kommod. Seg\u00fan cita el art\u00edculo period\u00edstico suizo, el \u00fanico signo de la presencia de LVWG all\u00ed es un buz\u00f3n.\nActualmente, la\n[direcci\u00f3n](https://web.archive.org/web/2/https://lvwg.org/contact/) que da la asociaci\u00f3n es Sportfeldstrasse 11, 9493, Mauren, hacia el centro del peque\u00f1o pa\u00eds. Pero en ese mismo lugar est\u00e1 registrada una compa\u00f1\u00eda llamada [Rhetaca Reitsport Anstalt](https://www.moneyhouse.ch/de/company/rhetaca-reitsport-anstalt-4067865789), que se dedica a la h\u00edpica y tiene un [espacio para montar a caballo](https://ride77.com/es/_detail/767).\nAl ser consultado sobre su rol en este entramado, Insignares asegur\u00f3 enf\u00e1tico: \u00abNo soy ni socio ni empleado de ninguna empresa de Andreas Kalcker\u00bb y que al ingresar a Suiza \u00abse necesitaba colocar una direcci\u00f3n temporal y se coloc\u00f3 la de la asociaci\u00f3n suiza de biof\u00edsica para efectos de registrar mis documentos como italiano en Suiza\u00bb.\nEsta asociaci\u00f3n hace referencia al \u00abSVNB\u00bb, la Schweizer Verein f\u00fcr Naturwissenschaftliche Biophysik (o Asociaci\u00f3n Suiza de Biof\u00edsica Cient\u00edfica), del que Kalcker dice ser director administrativo, aunque esta tiene\n[una direcci\u00f3n](https://www.moneyhouse.ch/de/company/schweizer-zentrum-fuer-wissenschaftliche-fors-5567371031) en una ciudad suiza diferente, Buchs. Unos [estatutos de la asociaci\u00f3n](https://www.schweizer-biophysik.ch/es/statuten.html) de octubre de 2019 nombran a tres miembros: Martin Vetsch, Rama Karni (la esposa de Kalcker) y Elisabeth Mariani (una \u00abcoach\u00bb de salud suiza que [se gradu\u00f3](https://www.liz-mariani.ch/de/Gesundheitsberatung) de un diplomado de biof\u00edsica de Kalcker).\nLa SVNB, que ahora\n[est\u00e1 en liquidaci\u00f3n](https://www.moneyhouse.ch/de/company/schweizer-verein-fuer-naturwissenschaftliche--19846914871), podr\u00eda seguir el destino de otra empresa similar: en 2016 Urs Odermatt, un emprendedor suizo al que Kalcker conoci\u00f3 en un seminario, el empresario turco Zeynal Uz y la empresaria b\u00falgara Boyka Angelov crearon otra empresa llamada [ Schweizer Zentrum f\u00fcr Wissenschaftliche Forschung, Innovation und Entwicklung AG](https://www.moneyhouse.ch/de/company/schweizer-zentrum-fuer-wissenschaftliche-fors-5567371031) (SZWFIE, o Centro Suizo para la Investigaci\u00f3n, la Innovaci\u00f3n y el Desarrollo Cient\u00edfico), para hacer investigaci\u00f3n en biof\u00edsica y farmac\u00e9utica. Se les uni\u00f3 el inversionista tambi\u00e9n suizo Samuel Gauro.\nEn febrero de 2019, el canal alem\u00e1n ZDF\n[visit\u00f3](https://www.zdf.de/dokumentation/zdfinfo-doku/pillen-pulver-wunderheiler-das-geschaeft-mit-der-alternativmedizin-102.html) la direcci\u00f3n del supuesto centro de investigaci\u00f3n en Grabs, Suiza, y encontr\u00f3 un edificio de varias oficinas donde nadie conoc\u00eda a Kalcker.\nEn este centro Kalcker ten\u00eda un sueldo de 10,000 francos suizos (unos 11,000 d\u00f3lares) mensuales y recib\u00eda otros fondos para su trabajo, pero no logr\u00f3 mostrar avance alguno, seg\u00fan le dijo Gauro al medio suizo Beobachter. Incluso, Angelov dijo que Kalcker era incapaz de llevar a cabo una investigaci\u00f3n cient\u00edfica seria.\nLos socios entraron en disputas y en 2019 el Centro postul\u00f3 para ser declarado en bancarrota y en 2020 fue\n[liquidado](https://www.moneyhouse.ch/de/company/schweizer-zentrum-fuer-wissenschaftliche-fors-5567371031). Sin embargo, dos de sus miembros alcanzaron a entrar en el entramado de Kalcker y Vetsch. Desde 2018 y hasta su liquidaci\u00f3n, Odermatt y Uz aparecieron como directores administrativos de Medatech, la empresa ya mencionada de Vetsch.\nPor otra parte, la SVNB fue creada tan solo unos d\u00edas despu\u00e9s de declarada la bancarrota del SZWFIE. De todas maneras, Kalcker aplic\u00f3 a tres patentes como parte del centro de investigaci\u00f3n suizo original,\n[una de las cuales](https://patents.google.com/patent/WO2018185346A1/en?inventor=kalcker&oq=kalcker) es de una sustancia farmac\u00e9utica para \u00abtratar enfermedades infecciosas\u00bb a partir del di\u00f3xido de cloro.\nLa patente fue registrada, hecho que no implica que una invenci\u00f3n funcione, y Kalcker la promociona en su p\u00e1gina como una \u00abcomposici\u00f3n farmac\u00e9utica para el tratamiento del Covid-19\u00bb.\nAs\u00ed que Kalcker us\u00f3 sus contactos en Suiza para crear empresas que intentaban legitimar sus estudios sobre el di\u00f3xido de cloro y otras pseudoterapias. Otros socios suyos realizaron estudios que no comprueban nada, pero que sus seguidores consideran leg\u00edtimos.\nAs\u00ed lo consideran porque siguieron la desinformaci\u00f3n de Comusav. Luego, Kalcker les vende a esos mismos seguidores los aparatos de sus empresas y los seminarios, DVDs y libros que explican c\u00f3mo usarlos.\nDe paso, en estos cursos tambi\u00e9n les dice a sus fans que quienes advierten de los grandes riesgos de usar este qu\u00edmico como medicina no son honestos, y as\u00ed se asegura de no perderlos como clientes.\n[(Ver Art\u00edculo La ciencia que s\u00ed dominan los propagadores del di\u00f3xido de cloro)](https://www.elclip.org/distribucion-desinformacion-estudios-dioxido-cloro-covid-19/)\nEsta estrategia de crear una mara\u00f1a de empresas, dando una apariencia de gran conglomerado y de esta manera vender m\u00e1s, Kalcker ya la hab\u00eda usado en Espa\u00f1a.\nEn Alcal\u00e1 de Xivert, un pueblito valenciano, cre\u00f3 la empresa\n[Voicedialogo SL](https://empresite.eleconomista.es/VOICEDIALOGO.html), que tiene la editorial Voedia que publica los libros de Kalcker y otros sobre di\u00f3xido de cloro. Su administradora es Dolores Unzu, la persona que fue denunciada en Granada junto a Kalcker por el caso en el que fue absuelto de una mujer mayor con artritis a la que la sustancia le caus\u00f3 \u00falceras.\nUnzu se presenta como \u00abOrganizadora y Coordinadora de eventos nacionales e internacionales\u00bb de Andreas Kalcker. En esa localidad tambi\u00e9n cre\u00f3 la empresa\n[ Rinc\u00f3n del Eden SL](https://librebor.me/borme/empresa/rincon-del-eden/), de la cual sigue siendo el administrador y cuyo objeto social es realizar actividades en parques de atracciones, as\u00ed como [Kalcker SL](https://www.einforma.com/servlet/app/prod/ETIQUETA_EMPRESA/nif/b07qUbL75fR06Fw9_YDI-w), una empresa de \u00abcomercio al por mayor de aparatos y material radioel\u00e9ctrico y electr\u00f3nicos\u00bb.\nAdem\u00e1s de esto, en la ciudad de Castell\u00f3n est\u00e1 registrada\n[Medalab Research SL](https://www.iberinform.es/empresa/5542493/medalab-research), la versi\u00f3n original de la empresa suiza del mismo nombre que [vende los mismos aparatos para terapias alternativas](https://www.medalab.com/plasmatrohn/), a m\u00e1s o menos 800 euros cada uno.\nComo administradores de esta empresa aparecieron Kalcker, Miriam Carrasco Maceda (su exesposa) y Elena Valladares (Carrasco estuvo en la empresa hasta 2018, mientras que Kalcker asumi\u00f3 el cargo por 13 d\u00edas ese a\u00f1o hasta la llegada de Valladares).\nValladares aparece como coautora con Kalcker de un\n[art\u00edculo acad\u00e9mico](https://cienciadigitaleditorial.com/wp-content/uploads/2020/04/dixido-de-cloro-para-coronavirus1.pdf) de marzo de 2020 del LVWG sobre la toxicidad del di\u00f3xido de cloro. Pero adem\u00e1s es la administradora de otra empresa, [Mydioxi SL](https://www.datoscif.es/empresa/mydioxi-sl), donde tambi\u00e9n es administradora Unzu.\nPor su parte, Carrasco figur\u00f3 hasta noviembre de 2020 como socia \u00fanica\n[Mebenezer Lab Sociedad Limitada](https://www.infocif.es/empresa/mebenezer-lab-sl), cuya actividad es la \u00abproducci\u00f3n de productos qu\u00edmicos y biocidas\u00bb y que vende di\u00f3xido de cloro a trav\u00e9s de su marca [Dioxilife](https://www.dioxilife.com/nosotros/), aunque lo promociona como un desinfectante. Ahora es Odermatt el que figura como socio \u00fanico.\nAl ser consultado sobre esta estrategia empresarial, Andreas Kalcker respondi\u00f3: \u00abtanto usted como yo tenemos libertad de crear empresas y en mi caso no uso mis empresas para promocionar mentiras \u2026 s\u00ed creo en las bondades del di\u00f3xido de cloro y no existir\u00eda una ley espec\u00edfica al CDS en Bolivia, si esto fuera falso\u00bb.\nEl colombiano Insignares, que comparte buz\u00f3n en Suiza con Kalcker, tambi\u00e9n hace parte de este entramado, adem\u00e1s de participar en Comusav y en las dem\u00e1s actividades mencionadas junto a Kalcker.\nEn Colombia tiene una empresa llamada\n[Magnofarma SAS,](https://www.magnofarma.com/holontologia-y-homeopatia/) que ofrece terapias medicinales alternativas. En su p\u00e1gina, Magnofarma menciona brevemente las \u00abterapias oxidativas\u00bb, el nombre disimulado con el que a veces se designa el uso \u00abterap\u00e9utico\u00bb del di\u00f3xido de cloro. Tambi\u00e9n hace referencia a las [terapias vibracionales con altas frecuencias](https://www.magnofarma.com/holontologia-y-homeopatia/), como las que prometen los aparatos que vende Medalab.\nInsignares, adem\u00e1s, abri\u00f3 otras empresas llamadas Magnopharma: una en Estados Unidos y otra en Eslovaquia, igual que dos empresas diferentes llamadas Nutricell en Estados Unidos y\n[un consultorio m\u00e9dico](https://www.datoscif.es/empresa/l-essensa-costa-del-sol-sl) registrado en un edificio de oficinas en Marbella, Espa\u00f1a \u2014 esta \u00faltima es la \u00fanica de todas esas empresas que sigue activa o en la que su participaci\u00f3n est\u00e1 vigente\u2014. En esa ciudad andaluza, seg\u00fan dijo en una entrevista de 2020, estaba planeando abrir una \u00abcl\u00ednica\u00bb junto con Kalcker.\nAl preguntarle si estas conexiones pon\u00edan en duda su confiabilidad como investigador independiente, Insignares nos respondi\u00f3: \u00absoy independiente y lo he hecho adem\u00e1s, para evitar se\u00f1alamientos de ser financiado por intereses empresariales. Es un momento hist\u00f3rico en la humanidad para actuar, ayudar, servir. Muchos, desde la cr\u00edtica, no producen ni un jab\u00f3n para aliviar el dolor humano\u00bb.\nTras los congresos de Am\u00e9rica Latina\nCon sus cables bien conectados a la Comusav, Andreas Kalcker y sus aliados se han hecho la Am\u00e9rica.\nLa cadena que empez\u00f3 el militar retirado ecuatoriano con los m\u00e9dicos alternativos de su pa\u00eds pronto extendi\u00f3 un brazo en Bolivia. En mayo de 2020, cuando el Covid-19 arrasaba en el Beni, un departamento c\u00e1lido y amaz\u00f3nico al noreste de Bolivia, all\u00ed viaj\u00f3 una comitiva de m\u00e9dicos solidarios para reemplazar a los colegas que hab\u00edan ca\u00eddo enfermos. Entre ellos iba Patricia Callisperis. Ella\n[convenci\u00f3](https://www.thinglink.com/scene/1561831775154470913) a otros doctores de que el di\u00f3xido curar\u00eda el fatal virus y empez\u00f3 a administrarlo a diestra y siniestra.\nEntrevistado por este equipo period\u00edstico, Jorge G\u00f3mez, m\u00e9dico que en ese momento era el director del Servicio Departamental de Salud (SEDES) del Beni, cont\u00f3 el costo del experimento:\n\u00abLe pedimos a la doctora que se retirara del hospital porque hab\u00eda mucha gente intoxicada o que mor\u00eda porque abandonaba su tratamiento tras ingerir di\u00f3xido de cloro\u201d, dijo. \u201cNo sabemos cu\u00e1nto impacto caus\u00f3 realmente el CDS porque no se hac\u00edan autopsias (\u2026) \u201cpero sostengo que esa mezcla fue muy perjudicial para la poblaci\u00f3n que entiendo estaba desesperada\u00bb.\nA principios de julio, allegados a Comusav Bolivia presentaron un proyecto de ley para que se autorizara el uso de CDS, y en octubre hab\u00edan conseguido que fuese ley.\nDesde julio de 2020, ya la camarilla del Comusav hab\u00eda comenzado a conseguir aliados pol\u00edticos. El primero fue Eliseo Azuero, entonces vicepresidente de la comisi\u00f3n de control pol\u00edtico de la Asamblea Legislativa de Ecuador.\nUn pol\u00edtico de vieja data que hab\u00eda cambiado de partidos como un camale\u00f3n cambia de piel \u2013el \u00faltimo fue uno de su creaci\u00f3n llamado BADI\u2013, y que promovi\u00f3 en video el di\u00f3xido de cloro. Junto con Kalcker, Azuero les consigui\u00f3 a los presidentes de varios cap\u00edtulos nacionales de Comusav, que ya se hab\u00eda expandido a varios pa\u00edses latinoamericanos, una\n[audiencia virtual ante los diputados ecuatorianos](https://www.flickr.com/photos/asambleanacional/50092367716).\nEsa audiencia, curiosamente, ocurri\u00f3 el mismo d\u00eda en que Grenon fue arrestado en Colombia, el 8 de julio. Aunque Azuero est\u00e1\n[pr\u00f3fugo de la justicia](https://www.elcomercio.com/actualidad/politica/eliseo-azuero-renuncia-asamblea-nacional.html), acusado de haber encabezado una treta para quedarse con el dinero que iba para la construcci\u00f3n de un hospital, cal\u00f3 tanto la propaganda que d\u00edas despu\u00e9s, [diez obispos cat\u00f3licos](https://www.elnorte.ec/obispos-ecuador-piden-renuncia-ministro-salud/) de diversas regiones le pidieron la cabeza del ministro de salud al Presidente Len\u00edn Moreno y que autorizara el uso m\u00e9dico del CDS.\nEntretanto, en Per\u00fa consiguieron a una congresista de Hu\u00e1nuco del partido Acci\u00f3n Popular (un partido de espectro amplio entre el centro y la derecha)\n[les agendara](https://larepublica.pe/politica/2020/07/21/andreas-kalcker-omar-merino-si-invito-a-guru-del-dioxido-de-cloro-a-comision-de-salud/) a los de Comusav, una audiencia en la Comisi\u00f3n de Salud de ese pa\u00eds, pero finalmente se cancel\u00f3 debido al esc\u00e1ndalo que la noticia suscit\u00f3 en medios y entre cient\u00edficos peruanos.\nSin embargo, a instancias del entonces parlamentario Posemoscrowte Chagua, una comisi\u00f3n parlamentaria investig\u00f3 los impactos del qu\u00edmico usado como medicina. Aunque la comisi\u00f3n concluy\u00f3 que no hay evidencia que sustente su uso medicinal, pidi\u00f3 que se suspendieran los procesos disciplinarios a los m\u00e9dicos que lo recetaron a sus pacientes.\nEste frente unido con el que Comusav lleg\u00f3 a estos congresos a principios de la pandemia atraves\u00f3 una crisis en febrero de 2021, cuando los l\u00edderes de la organizaci\u00f3n de Bolivia, Per\u00fa, Argentina, Chile, Costa Rica y Guatemala enviaron\n[una carta](https://es.scribd.com/document/526958652/4-5929042325941520821) anunciando la creaci\u00f3n de una nueva organizaci\u00f3n: la Comusav Am\u00e9rica.\nSeg\u00fan le explic\u00f3 Luis Revollo, presidente de Comusav Bolivia, a esta alianza period\u00edstica, \u00abnosotros est\u00e1bamos buscando hacer ciencia. (Kalcker) se fue con Karla Revollo (ahora directora de comunicaciones del Comusav de Kalcker) para buscar plata. Nosotros cobramos el curso si mal no recuerdo, 100 bolivianos (14 d\u00f3lares). Ellos cobraban 800 o 1000 bolivianos (116 a 145 d\u00f3lares) la charla de Andreas\u00bb.\nAs\u00ed que, tras esa fecha, Comusav es realmente dos organizaciones: Kalcker est\u00e1 detr\u00e1s de la Comusav Mundial, que centr\u00f3 sus operaciones en M\u00e9xico, Colombia, Espa\u00f1a y la comunidad hispanoparlante de Estados Unidos; mientras que los pa\u00edses firmantes de la carta se organizaron en la nueva Comusav Am\u00e9rica, que cuenta con poca presencia en redes.\nDe todas maneras, la nueva Comusav sigue vendiendo el di\u00f3xido de cloro y critica a la Comusav de Kalcker por vender la sustancia como una cura milagrosa y por confiar en el estudio de Insignares, que seg\u00fan ellos \u00abcarece de credibilidad\u00bb. Y ambas organizaciones siguieron buscando entrar a congresos latinoamericanos.\nEn el estado de Nuevo Le\u00f3n en M\u00e9xico, un aspirante a diputado por el PRI en llave con una organizaci\u00f3n antivacunas, present\u00f3 al Congreso estatal\n[una iniciativa](https://recursos.elclip.org/mentiras-contagiosas/cuenta+bancaria+dep%C3%B3sitos+de+CDS.jpeg) para investigar las aplicaciones m\u00e9dicas del di\u00f3xido de cloro e iniciar un di\u00e1logo con Comusav. Esta fue rechazada la primera vez, pero ante la insistencia de los lobistas consiguieron que la aprobara en marzo de 2021.\nDe la mano de otro partido, el PAN, hab\u00edan llegado en diciembre de 2020 al Congreso del estado vecino de Coahuila con una propuesta similar. Y dos meses despu\u00e9s, en febrero de 2021, un empresario l\u00edder del Frente Nacional Anti-Amlo, Pedro Mart\u00edn, invit\u00f3 a Kalcker a la ciudad de Francisco I. Moreno, en ese mismo estado, donde el alcalde Jonathan \u00c1valos ha promocionado el uso de CDS como remedio. Mart\u00edn, adem\u00e1s, prometi\u00f3 donarle un edificio a Kalcker en la ciudad de Torre\u00f3n, tambi\u00e9n en Coahuila.\nEl 13 de noviembre de 2021, otro empresario, Mois\u00e9s Rosado, a trav\u00e9s de su asociaci\u00f3n Obra Libre de Adicciones, le\n[don\u00f3](https://cloud.elclip.org/index.php/s/DAkXWzgCjQe3mHQhttps://recursos.elclip.org/mentiras-contagiosas/Donaci%C3%B3n+Edificio+Coahuila.mp4) a Comusav un edificio en Zapopan, en el estado de Jalisco, con la promesa de que all\u00ed se abrir\u00e1 primer Centro de Investigaci\u00f3n Andreas Kalcker en Am\u00e9rica Latina.\nSeg\u00fan un aviso impreso en una\n[hoja blanca](https://recursos.elclip.org/mentiras-contagiosas/Congreso+NL-marzo2021.doc), la fundaci\u00f3n se encuentra \u00aben remodelaci\u00f3n\u00bb, aunque en el edificio ya una farmacia vende el di\u00f3xido de cloro para uso medicinal. Los pagos van a la [cuenta de la asociaci\u00f3n de Rosado](https://recursos.elclip.org/mentiras-contagiosas/ComusavArgentina.png) como lo comprobaron integrantes de esta alianza period\u00edstica que visitaron el lugar.\nEn Colombia, la llave del Legislativo se las abri\u00f3 un Representante a la C\u00e1mara del partido evang\u00e9lico Colombia Justa Libres, Carlos Eduardo Acosta, que permiti\u00f3 que el 9 de diciembre de 2021 varios representantes de los cap\u00edtulos de Ecuador y Paraguay de Comusav participaran en una sesi\u00f3n que pretend\u00eda cuestionar la iniciativa de exigir certificado de vacunas en lugares p\u00fablicos.\nNinguno mencion\u00f3 al di\u00f3xido de cloro, pero s\u00ed repitieron las consabidas diatribas conspirativas contra las vacunas y defendieron las terapias alternativas.\nEn Argentina, Francisco S\u00e1nchez, un diputado nacional por Neuqu\u00e9n de derecha y activista del PRO (partido de derecha),\n[admirado por Eduardo Bolsonaro](https://www.facebook.com/watch/?v=531906781212519) (hijo del presidente brasile\u00f1o), aparece como [uno de los l\u00edderes](https://recursos.elclip.org/mentiras-contagiosas/Anuncio+del+Centro+de+Investigaci%C3%B3n+Andreas+Kalcker.jpeg) de Comusav en ese pa\u00eds.\nOtros impulsores del Comusav y de los inventos de Kalcker han organizado conferencias en Guatemala (a donde pusieron a dar testimonio de la milagrosa soluci\u00f3n al alcalde de Guastastoga), ofrecieron un gran concierto de Artistas Unidos por la Vida en Guadalajara y la pidieron audiencias y oportunidades para promulgar la riesgosa medicina en Costa Rica.\nHasta en Estados Unidos, con la prohibici\u00f3n que all\u00ed pesa sobre el uso medicinal del di\u00f3xido de cloro, un vendedor de finca ra\u00edz llamado Ricardo Garc\u00eda, que dice haber estudiado qu\u00edmica en la Universidad de La Habana en Cuba, registr\u00f3 la marca del OCLO 3000 bajo\n[su empresa OCLO LLC](https://www.fda.gov/inspections-compliance-enforcement-and-criminal-investigations/warning-letters/oclo-llcoclo-nanotechnology-science-614310-05272021) y comenz\u00f3 a venderlo hasta que las autoridades le ordenaron dejar de hacerlo.\nToda su propaganda se basaba en los hallazgos presuntamente cient\u00edficos de Kalcker. Al tiempo, desafiando la prohibici\u00f3n legal de vender di\u00f3xido de cloro como medicina en Estados Unidos, la propia Comusav cre\u00f3 redes en Telegram en espa\u00f1ol y en ingl\u00e9s destinadas a cautivar estadounidenses y hab\u00edan conseguido enganchar a m\u00e1s de 50 mil hasta diciembre de 2021.\nSobre esta estrategia, Kalcker nos dijo que \u00abson planes globales de muchos miles de m\u00e9dicos de tener un ant\u00eddoto y herramienta universal m\u00e9dica para la poblaci\u00f3n, y los pobres sobre todo, y no son locales\u00bb y que esto era parte de un deseo de \u00abdarle a la humanidad salud, mejor calidad de vida y protecci\u00f3n dejando as\u00ed mi legado\u00bb.\nPero adelante van los falsos hallazgos cient\u00edficos allanando el camino de la legitimidad del di\u00f3xido de cloro. Atr\u00e1s van sus organizaciones, si es que as\u00ed se puede llamar cada grupo que montan con unas cuentas en redes sociales o en chats, una p\u00e1gina web y, a veces, una cara visible como presidente.\nEstas organizaciones, como muestra esta investigaci\u00f3n con m\u00faltiples ejemplos, van abriendo puertas para conseguir gui\u00f1os c\u00f3mplices en la pol\u00edtica, autorizaciones legales para ensanchar el negocios y hasta bendiciones de obispos cat\u00f3licos.\nEquipo de\n[Mentiras Contagiosas](https://www.elclip.org/comusav-negocio-dioxido-cloro-latinoamerica/):\n- Direcci\u00f3n y edici\u00f3n: Pablo Medina Uribe y Mar\u00eda Teresa Ronderos\n- Producci\u00f3n: Luisa Fernanda L\u00f3pez\n- Desarrollo web: Diego Arce\n- An\u00e1lisis y visualizaci\u00f3n de datos: Rigoberto Carvajal y Jos\u00e9 Luis Pe\u00f1arredonda\n- Gerencia: Emiliana Garc\u00eda\n- Grabaci\u00f3n testimonios: \u00c0ngela Cantador\n- Ilustraci\u00f3n para logo: Miguel M\u00e9ndez\n- Caricatura portada: Abecor\nEste trabajo cont\u00f3 con apoyo en Investigaci\u00f3n de Olaya Grueso de Correctiv.\nMentiras Contagiosas es un trabajo coordinado por el\n[Centro Latinoamericano de Investigaci\u00f3n Period\u00edstica \u2013 CLIP](https://www.elclip.org/) en el que participan [Chequeado](https://chequeado.com/) de Argentina, [Bolivia Verifica](https://boliviaverifica.bo/) de Bolivia, [Aos Fatos](https://www.aosfatos.org/) de Brasil, [Colombiacheck](https://colombiacheck.com/) y [Cuesti\u00f3n P\u00fablica](https://cuestionpublica.com/) de Colombia, [Efecto Cocuyo](https://efectococuyo.com/) de Venezuela, [Agencia Ocote](https://www.agenciaocote.com/) de Guatemala, [Animal Pol\u00edtico](https://www.animalpolitico.com/) de M\u00e9xico y [El Detector de Univisi\u00f3n](https://www.univision.com/) de Estados Unidos.", "language": null, "image": "https://i0.wp.com/verificado.com.mx/wp-content/uploads/2022/03/Caricatura-Nota-En-virus-revuelto-FB.jpeg", "pagetype": "article", "links": ["https://verificado.com.mx/verificado/", "https://verificado.com.mx/antiviral/", "https://verificado.com.mx/covid-19/", "https://verificado.com.mx/investigacion/", "https://verificado.com.mx/explicado/", "https://verificado.com.mx/dialogos/", "https://verificado.com.mx/metodologia/", "https://verificado.com.mx/", "https://verificado.com.mx/", "https://verificado.com.mx/", "https://verificado.com.mx/staff/", "https://verificado.com.mx/verificado/", "https://verificado.com.mx/los-otros-datos-del-5-informe-de-gobierno/", "https://verificado.com.mx/los-otros-datos-del-5-informe-de-gobierno/", "https://verificado.com.mx/author/verificado/", "https://verificado.com.mx/datos-falsos-en-spots-5-informe-de-amlo/", "https://verificado.com.mx/datos-falsos-en-spots-5-informe-de-amlo/", "https://verificado.com.mx/author/melina/", "https://verificado.com.mx/circula-desinformacion-pobreza-salud-en-mexico/", "https://verificado.com.mx/circula-desinformacion-pobreza-salud-en-mexico/", "https://verificado.com.mx/author/melina/", "https://verificado.com.mx/falso-casos-aislados-ejecuciones-militares/", "https://verificado.com.mx/falso-casos-aislados-ejecuciones-militares/", "https://verificado.com.mx/author/melina/", "#", "#", "https://verificado.com.mx/antiviral/", "https://verificado.com.mx/covid-19/", "https://verificado.com.mx/investigacion/", "https://verificado.com.mx/simulan-inclusion-gpo-sin-representacion/", "https://verificado.com.mx/simulan-inclusion-gpo-sin-representacion/", "https://verificado.com.mx/author/melina/", "https://verificado.com.mx/pandemia-covid-19-problemas-salud-mental-nl/", "https://verificado.com.mx/pandemia-covid-19-problemas-salud-mental-nl/", "https://verificado.com.mx/author/melina/", "https://verificado.com.mx/mujeres-adultas-mayores-cuidadoras-por-necesidad/", "https://verificado.com.mx/mujeres-adultas-mayores-cuidadoras-por-necesidad/", "https://verificado.com.mx/author/leslieorozco/", "https://verificado.com.mx/crecen-quejas-cedhnl-bajan-recomendaciones/", "https://verificado.com.mx/crecen-quejas-cedhnl-bajan-recomendaciones/", "https://verificado.com.mx/author/verificado/", "#", "#", "https://verificado.com.mx/explicado/", "https://verificado.com.mx/dialogos/", "https://verificado.com.mx/metodologia/", "https://www.facebook.com/VerificadoMX/", "https://www.facebook.com/VerificadoMX/", "https://www.instagram.com/verificado_mx/", "https://www.instagram.com/verificado_mx/", "https://twitter.com/verificado_mx", "https://twitter.com/verificado_mx", "https://www.youtube.com/verificado", "https://www.youtube.com/verificado", "https://verificado.com.mx/", "https://verificado.com.mx/verificado/", "https://verificado.com.mx/verificado/", "https://verificado.com.mx/los-otros-datos-del-5-informe-de-gobierno/", "https://verificado.com.mx/los-otros-datos-del-5-informe-de-gobierno/", "https://verificado.com.mx/verificado/", "https://verificado.com.mx/datos-falsos-en-spots-5-informe-de-amlo/", "https://verificado.com.mx/datos-falsos-en-spots-5-informe-de-amlo/", "https://verificado.com.mx/verificado/", "https://verificado.com.mx/circula-desinformacion-pobreza-salud-en-mexico/", "https://verificado.com.mx/circula-desinformacion-pobreza-salud-en-mexico/", "https://verificado.com.mx/verificado/", "https://verificado.com.mx/falso-casos-aislados-ejecuciones-militares/", "https://verificado.com.mx/falso-casos-aislados-ejecuciones-militares/", "#", "#", "https://verificado.com.mx/antiviral/", "https://verificado.com.mx/covid-19/", "https://verificado.com.mx/investigacion/", "https://verificado.com.mx/investigacion/", "https://verificado.com.mx/simulan-inclusion-gpo-sin-representacion/", "https://verificado.com.mx/simulan-inclusion-gpo-sin-representacion/", "https://verificado.com.mx/investigacion/", "https://verificado.com.mx/pandemia-covid-19-problemas-salud-mental-nl/", "https://verificado.com.mx/pandemia-covid-19-problemas-salud-mental-nl/", "https://verificado.com.mx/investigacion/", "https://verificado.com.mx/mujeres-adultas-mayores-cuidadoras-por-necesidad/", "https://verificado.com.mx/mujeres-adultas-mayores-cuidadoras-por-necesidad/", "https://verificado.com.mx/investigacion/", "https://verificado.com.mx/crecen-quejas-cedhnl-bajan-recomendaciones/", "https://verificado.com.mx/crecen-quejas-cedhnl-bajan-recomendaciones/", "#", "#", "https://verificado.com.mx/explicado/", "https://verificado.com.mx/dialogos/", "https://verificado.com.mx/metodologia/", "#", "https://verificado.com.mx/investigacion/", "https://verificado.com.mx/author/verificado/", "https://www.facebook.com/sharer.php?u=https%3A%2F%2Fverificado.com.mx%2Fmentira-dioxido-de-cloro-como-cura-de-covid19%2F", "https://twitter.com/intent/tweet?text=En+virus+revuelto%2C+ganancia+de+charlatanes%3A+la+mentira+del+di%C3%B3xido+de+cloro+como+cura+de+la+COVID-19&url=https%3A%2F%2Fverificado.com.mx%2Fmentira-dioxido-de-cloro-como-cura-de-covid19%2F&via=verificado_mx", "https://pinterest.com/pin/create/button/?url=https://verificado.com.mx/mentira-dioxido-de-cloro-como-cura-de-covid19/&media=https://verificado.com.mx/wp-content/uploads/2022/03/Caricatura-Nota-En-virus-revuelto-FB.jpeg&description=En+virus+revuelto%2C+ganancia+de+charlatanes%3A+la+mentira+del+di%C3%B3xido+de+cloro+como+cura+de+la+COVID-19", "https://api.whatsapp.com/send?text=En+virus+revuelto%2C+ganancia+de+charlatanes%3A+la+mentira+del+di%C3%B3xido+de+cloro+como+cura+de+la+COVID-19 %0A%0A https://verificado.com.mx/mentira-dioxido-de-cloro-como-cura-de-covid19/", "#", "https://verificado.com.mx/dioxido-de-cloro-no-cura-covid19-riesgo/", "https://www.paginasiete.bo/sociedad/2022/1/3/choquehuanca-dice-que-tomo-dioxido-de-cloro-para-superar-el-coronavirus-319693.html", "https://unitel.bo/vacunacion/el-ministro-jeyson-auza-fue-el-encargado-de-vacunar-al-vicepresidente-choquehuanca_164568", "https://www.noticiasfides.com/nacional/politica/evo-llama-a-vacunarse-y-sugiere-tener-hierbas-medicinales-ivermectina-y-dioxido-de-cloro-para-prevenir-contagios-413258", "https://www.smh.com.au/national/death-in-paradise-20100109-lz8e.html", "https://chequeado.com/el-explicador/cuando-la-desinformacion-mata-el-dioxido-de-cloro-ya-habria-provocado-dos-muertes-y-dos-intoxicaciones-en-el-pais/", "https://elcomercio.pe/mundo/europa/coronavirus-johann-biacsics-muere-de-covid-19-un-antivacunas-de-austria-que-se-quiso-curar-con-lejia-y-sus-seguidores-denuncian-que-fue-envenenado-historias-ec-noticia/", "https://www.bloomberg.com/news/features/2021-06-29/covid-bleach-cure-how-operation-quack-hack-took-down-the-genesis-ii-church", "https://web.archive.org/web/20200525150427/https:/genesis2church.ch/churches-worldwide", "https://cdn.arstechnica.net/wp-content/uploads/2020/07/gov.uscourts.flsd_.573491.3.0.pdf", "https://www.bloomberg.com/news/features/2021-06-29/covid-bleach-cure-how-operation-quack-hack-took-down-the-genesis-ii-church", "https://wayback.archive-it.org/7993/20170111070843/http:/www.fda.gov/ForConsumers/ConsumerUpdates/ucm228052.htm", "https://www.justice.gov/opa/pr/justice-department-seeks-end-illegal-online-sale-industrial-bleach-marketed-miracle-treatment", "https://www.sun-sentinel.com/coronavirus/fl-ne-fake-covid-cure-arrests-20200708-zgqiegpblncpxemvdd4f4tghoq-story.html", "https://cdn.arstechnica.net/wp-content/uploads/2020/07/gov.uscourts.flsd_.573491.3.0.pdf", "https://cloud.elclip.org/index.php/s/aAgwjjX7NYWAPsj", "https://www.fiscalia.gov.co/colombia/noticias/capturados-padre-e-hijo-senalados-de-vender-una-sustancia-toxica-como-una-supuesta-pocima-milagrosa-para-tratar-el-covid-19-y-enfermedades-de-alto-costo/", "https://cdn.arstechnica.net/wp-content/uploads/2020/07/gov.uscourts.flsd_.573491.3.0.pdf", "https://www.mysuncoast.com/2021/12/30/member-bradenton-church-that-distributed-miracle-mineral-solution-appears-federal-court/", "https://www.theguardian.com/us-news/2021/aug/11/coronavirus-miracle-cure-bleach-covid-mark-grenon", "https://recursos.elclip.org/mentiras-contagiosas/order+continuing+trial+Grenon.pdf", "https://chequeado.com/investigaciones/dioxido-de-cloro-quienes-venden-esta-sustancia-ilegal-y-toxica-en-la-argentina-y-otros-paises-de-la-region/", "https://colombiacheck.com/investigaciones/asi-es-el-mercado-ilegal-del-dioxido-de-cloro-en-colombia-y-otros-paises-de-america", "https://www.eldiario.es/catalunya/josep-pamies-sancionado-pseudoterapias-coronavirus_1_2259118.html", "https://www.aemps.gob.es/informa/notasinformativas/medicamentosusohumano-3/medIlegales/2010/ni_muh_ilegales_05-2010/", "https://web.archive.org/web/20091022093534/http:/www.mmsmineral.com/impressum.php", "https://www.infoempresa.com/es-es/es/directivo/andreas-ludwig-kalcker", "https://www.aemps.gob.es/informa/notasinformativas/medicamentosusohumano-3/medIlegales/2010/ni_muh_ilegales_05-2010/", "https://elpais.com/politica/2018/06/30/diario_de_espana/1530310398_543455.html", "https://jimhumble.co/newsletter-archive/the-country-of-spain-attacks-mms", "https://pubmed.ncbi.nlm.nih.gov/?term=chlorine+dioxide+autism+spectrum+disorder+", "https://pubmed.ncbi.nlm.nih.gov/?term=chlorine+dioxide+toxicity", "https://www.elespanol.com/reportajes/grandes-historias/20170428/211979398_0.html", "https://www.elespanol.com/reportajes/grandes-historias/20170428/211979398_0.html", "https://archive.org/details/cnel-tamayo", "https://www.dnb.com/business-directory/company-profiles.medalab_swiss_gmbh.ec74f5031b1f3e146d8e3dc1f1db0e55.html", "https://www.medalab.ch/produkte/", "https://www.easymonitoring.ch/fr/registre-du-commerce/medatech-gmbh-1340689", "https://www.easymonitoring.ch/fr/registre-du-commerce/medatech-gmbh-1340689", "https://www.youtube.com/watch?v=1wkr7TRnRNQ&ab_channel=CallToActionVideoCampaignAgainstMMS%252FCDasanAutismTreatment", "https://comusav.de/impressum/", "https://sg.chregister.ch/cr-portal/auszug/auszug.xhtml?uid=CHE-212.829.667", "https://www.beobachter.ch/gesundheit/medizin-krankheit/chlordioxid-das-wunderwasser-der-glaubigen", "https://clinicaltrials.gov/ct2/show/NCT04343742", "https://recursos.elclip.org/mentiras-contagiosas/fund-genesis.pdf", "https://ieaninepoints.com/wp-content/uploads/2019/01/2006_IEA_Global_Conference_Program.pdf", "https://www.rsi.ch/news/mondo/Il-documento-di-Kalcker-%E2%80%9CChlorine-Dioxide-in-COVID-19-Hypothesis-about-the-Possible-Mechanism-of-Molecular-Action-in-SARS-CoV-2%E2%80%9D-13753897.html/BINARY/Il%20documento%20di%20Kalcker%20%E2%80%9CChlorine%20Dioxide%20in%20COVID-19:%20Hypothesis%20about%20the%20Possible%20Mechanism%20of%20Molecular%20Action%20in%20SARS-CoV-2%E2%80%9D", "https://archive.is/CKZlN", "https://www.google.com/maps/dir/L%C3%A4ui+22,+Sennwald,+Switzerland/Industriering+14,+9491+Ruggell,+Liechtenstein/@47.2517396,9.5027842,15z/data=!3m1!4b1!4m14!4m13!1m5!1m1!1s0x479b3b25497bb847:0x51331c98b974ed8!2m2!1d9.5010373!2d47.2607975!1m5!1m1!1s0x479b3afe1f5455ff:0x825ab3aecfa68bf0!2m2!1d9.5279634!2d47.2487317!3e0", "https://web.archive.org/web/2/https://lvwg.org/contact/", "https://www.moneyhouse.ch/de/company/rhetaca-reitsport-anstalt-4067865789", "https://ride77.com/es/_detail/767", "https://www.moneyhouse.ch/de/company/schweizer-zentrum-fuer-wissenschaftliche-fors-5567371031", "https://www.schweizer-biophysik.ch/es/statuten.html", "https://www.liz-mariani.ch/de/Gesundheitsberatung", "https://www.moneyhouse.ch/de/company/schweizer-verein-fuer-naturwissenschaftliche--19846914871", "https://www.moneyhouse.ch/de/company/schweizer-zentrum-fuer-wissenschaftliche-fors-5567371031", "https://www.zdf.de/dokumentation/zdfinfo-doku/pillen-pulver-wunderheiler-das-geschaeft-mit-der-alternativmedizin-102.html", "https://www.moneyhouse.ch/de/company/schweizer-zentrum-fuer-wissenschaftliche-fors-5567371031", "https://patents.google.com/patent/WO2018185346A1/en?inventor=kalcker&oq=kalcker", "https://www.elclip.org/distribucion-desinformacion-estudios-dioxido-cloro-covid-19/", "https://empresite.eleconomista.es/VOICEDIALOGO.html", "https://librebor.me/borme/empresa/rincon-del-eden/", "https://www.einforma.com/servlet/app/prod/ETIQUETA_EMPRESA/nif/b07qUbL75fR06Fw9_YDI-w", "https://www.iberinform.es/empresa/5542493/medalab-research", "https://www.medalab.com/plasmatrohn/", "https://cienciadigitaleditorial.com/wp-content/uploads/2020/04/dixido-de-cloro-para-coronavirus1.pdf", "https://www.datoscif.es/empresa/mydioxi-sl", "https://www.infocif.es/empresa/mebenezer-lab-sl", "https://www.dioxilife.com/nosotros/", "https://www.magnofarma.com/holontologia-y-homeopatia/", "https://www.magnofarma.com/holontologia-y-homeopatia/", "https://www.datoscif.es/empresa/l-essensa-costa-del-sol-sl", "https://www.thinglink.com/scene/1561831775154470913", "https://www.flickr.com/photos/asambleanacional/50092367716", "https://www.elcomercio.com/actualidad/politica/eliseo-azuero-renuncia-asamblea-nacional.html", "https://www.elnorte.ec/obispos-ecuador-piden-renuncia-ministro-salud/", "https://larepublica.pe/politica/2020/07/21/andreas-kalcker-omar-merino-si-invito-a-guru-del-dioxido-de-cloro-a-comision-de-salud/", "https://es.scribd.com/document/526958652/4-5929042325941520821", "https://recursos.elclip.org/mentiras-contagiosas/cuenta+bancaria+dep%C3%B3sitos+de+CDS.jpeg", "https://cloud.elclip.org/index.php/s/DAkXWzgCjQe3mHQhttps://recursos.elclip.org/mentiras-contagiosas/Donaci%C3%B3n+Edificio+Coahuila.mp4", "https://recursos.elclip.org/mentiras-contagiosas/Congreso+NL-marzo2021.doc", "https://recursos.elclip.org/mentiras-contagiosas/ComusavArgentina.png", "https://www.facebook.com/watch/?v=531906781212519", "https://recursos.elclip.org/mentiras-contagiosas/Anuncio+del+Centro+de+Investigaci%C3%B3n+Andreas+Kalcker.jpeg", "https://www.fda.gov/inspections-compliance-enforcement-and-criminal-investigations/warning-letters/oclo-llcoclo-nanotechnology-science-614310-05272021", "https://www.elclip.org/comusav-negocio-dioxido-cloro-latinoamerica/", "https://www.elclip.org/", "https://chequeado.com/", "https://boliviaverifica.bo/", "https://www.aosfatos.org/", "https://colombiacheck.com/", "https://cuestionpublica.com/", "https://efectococuyo.com/", "https://www.agenciaocote.com/", "https://www.animalpolitico.com/", "https://www.univision.com/", "https://verificado.com.mx/temas/andreas-kalcker/", "https://verificado.com.mx/temas/comusav/", "https://verificado.com.mx/temas/desinformacion/", "https://verificado.com.mx/temas/dioxido-de-cloro/", "https://verificado.com.mx/temas/iglesia-genesis-ii/", "https://verificado.com.mx/temas/salud/", "https://verificado.com.mx/author/verificado/", "https://verificado.com.mx/author/verificado/", "https://www.facebook.com/sharer.php?u=https%3A%2F%2Fverificado.com.mx%2Fmentira-dioxido-de-cloro-como-cura-de-covid19%2F", "https://twitter.com/intent/tweet?text=En+virus+revuelto%2C+ganancia+de+charlatanes%3A+la+mentira+del+di%C3%B3xido+de+cloro+como+cura+de+la+COVID-19&url=https%3A%2F%2Fverificado.com.mx%2Fmentira-dioxido-de-cloro-como-cura-de-covid19%2F&via=verificado_mx", "https://pinterest.com/pin/create/button/?url=https://verificado.com.mx/mentira-dioxido-de-cloro-como-cura-de-covid19/&media=https://verificado.com.mx/wp-content/uploads/2022/03/Caricatura-Nota-En-virus-revuelto-FB.jpeg&description=En+virus+revuelto%2C+ganancia+de+charlatanes%3A+la+mentira+del+di%C3%B3xido+de+cloro+como+cura+de+la+COVID-19", "https://api.whatsapp.com/send?text=En+virus+revuelto%2C+ganancia+de+charlatanes%3A+la+mentira+del+di%C3%B3xido+de+cloro+como+cura+de+la+COVID-19 %0A%0A https://verificado.com.mx/mentira-dioxido-de-cloro-como-cura-de-covid19/", "#", "#", "https://verificado.com.mx/toolbox/", "https://verificado.com.mx/falsos-consejos-redes-app-inmigracion-cbp-one/", "https://verificado.com.mx/antiviral/", "https://verificado.com.mx/falsos-consejos-redes-app-inmigracion-cbp-one/", "https://verificado.com.mx/aliens-congreso-mexico-dudas-y-evidencias/", "https://verificado.com.mx/antiviral/", "https://verificado.com.mx/aliens-congreso-mexico-dudas-y-evidencias/", "https://verificado.com.mx/simulan-inclusion-gpo-sin-representacion/", "https://verificado.com.mx/investigacion/", "https://verificado.com.mx/simulan-inclusion-gpo-sin-representacion/", "https://verificado.com.mx/la-prensa-ya-no-recibe-invitaciones-o-casi-no/", "https://verificado.com.mx/dialogos/", "https://verificado.com.mx/la-prensa-ya-no-recibe-invitaciones-o-casi-no/", "https://verificado.com.mx/beneficiarios-bienestar-sobres-vota-por-claudia/", "https://verificado.com.mx/antiviral/", "https://verificado.com.mx/beneficiarios-bienestar-sobres-vota-por-claudia/", "https://verificado.com.mx/explicador-whatsapp-eliminara-tu-cuenta/", "https://verificado.com.mx/falso-que-rescatista-frida-haya-fallecido/", "https://verificado.com.mx/contacto/", "https://verificado.com.mx/cursos-y-talleres/", "https://verificado.com.mx/metodologia/", "https://verificado.com.mx/staff/", "https://verificado.com.mx/toolbox/"]}